effnetv2/autotvm_log.txt
{"input": ["cuda -keys=cuda,gpu -max_num_threads=1024 -thread_warp_size=32", "conv2d_nhwc.cuda", [["TENSOR", [8, 225, 225, 3], "float16"], ["TENSOR", [3, 3, 3, 24], "float16"], [2, 2], [0, 0, 0, 0], [1, 1], "float16"], {}], "config": {"index": 1242, "code_hash": null, "entity": [["tile_n", "ot", 2], ["tile_c", "ot", 2], ["num_thread_n", "ot", 4], ["num_thread_c", "ot", 8], ["vthread_n", "ot", 2], ["vthread_c", "ot", 2], ["step", "ot", 64]]}, "result": [[7.975791765091863e-05], 0, 1.5364227294921875, 1632196787.0820005], "version": 0.2, "tvm_version": "0.8.dev0"}
{"input": ["cuda -keys=cuda,gpu -max_num_threads=1024 -thread_warp_size=32", "conv2d_nhwc_tensorcore.cuda", [["TENSOR", [8, 114, 114, 32], "float16"], ["TENSOR", [3, 3, 32, 32], "float16"], [1, 1], [0, 0, 0, 0], [1, 1], "float16"], {}], "config": {"index": 2349, "code_hash": null, "entity": [["block_row_warps", "ot", 1], ["block_col_warps", "ot", 1], ["warp_row_tiles", "ot", 1], ["warp_col_tiles", "ot", 1], ["chunk", "ot", 2], ["offset", "ot", 8], ["vector_width", "ot", 8], ["wmma_m", "ot", 8]]}, "result": [[0.00013887463895486936], 0, 1.4175596237182617, 1632197128.3363662], "version": 0.2, "tvm_version": "0.8.dev0"}
{"input": ["cuda -keys=cuda,gpu -max_num_threads=1024 -thread_warp_size=32", "conv2d_nhwc_winograd_tensorcore.cuda", [["TENSOR", [8, 114, 114, 32], "float16"], ["TENSOR", [3, 3, 32, 32], "float16"], [1, 1], [0, 0, 0, 0], [1, 1], "float16"], {}], "config": {"index": 158696332, "code_hash": null, "entity": [["thread_num_inverse", "ot", 64], ["thread_num_data", "ot", 32], ["thread_num_kernel", "ot", 128], ["offset_inverse", "ot", 0], ["offset_data", "ot", 2], ["offset_kernel", "ot", 1], ["inverse_in_vector", "ot", 2], ["block_row_warps", "ot", 4], ["block_col_warps", "ot", 2], ["warp_row_tiles", "ot", 8], ["warp_col_tiles", "ot", 1], ["chunk", "ot", 2], ["offset", "ot", 0], ["offsetCS", "ot", 4], ["vec", "ot", 1], ["wmma_m", "ot", 16]]}, "result": [[0.00044351855619047617], 0, 1.8246278762817383, 1632197226.1283822], "version": 0.2, "tvm_version": "0.8.dev0"}
{"input": ["cuda -keys=cuda,gpu -max_num_threads=1024 -thread_warp_size=32", "conv2d_nhwc_tensorcore.cuda", [["TENSOR", [8, 113, 113, 32], "float16"], ["TENSOR", [3, 3, 32, 96], "float16"], [2, 2], [0, 0, 0, 0], [1, 1], "float16"], {}], "config": {"index": 1620, "code_hash": null, "entity": [["block_row_warps", "ot", 1], ["block_col_warps", "ot", 1], ["warp_row_tiles", "ot", 1], ["warp_col_tiles", "ot", 1], ["chunk", "ot", 1], ["offset", "ot", 8], ["vector_width", "ot", 4], ["wmma_m", "ot", 8]]}, "result": [[0.00012549158426073133], 0, 1.2852575778961182, 1632197422.2946038], "version": 0.2, "tvm_version": "0.8.dev0"}
{"input": ["cuda -keys=cuda,gpu -max_num_threads=1024 -thread_warp_size=32", "conv2d_nhwc_tensorcore.cuda", [["TENSOR", [8, 56, 56, 96], "float16"], ["TENSOR", [1, 1, 96, 64], "float16"], [1, 1], [0, 0, 0, 0], [1, 1], "float16"], {}], "config": {"index": 1728, "code_hash": null, "entity": [["block_row_warps", "ot", 1], ["block_col_warps", "ot", 1], ["warp_row_tiles", "ot", 1], ["warp_col_tiles", "ot", 2], ["chunk", "ot", 2], ["offset", "ot", 8], ["vector_width", "ot", 4], ["wmma_m", "ot", 8]]}, "result": [[2.249438440479562e-05], 0, 1.7166202068328857, 1632197627.7266917], "version": 0.2, "tvm_version": "0.8.dev0"}
{"input": ["cuda -keys=cuda,gpu -max_num_threads=1024 -thread_warp_size=32", "conv2d_nhwc_tensorcore.cuda", [["TENSOR", [8, 58, 58, 48], "float16"], ["TENSOR", [3, 3, 48, 192], "float16"], [1, 1], [0, 0, 0, 0], [1, 1], "float16"], {}], "config": {"index": 1647, "code_hash": null, "entity": [["block_row_warps", "ot", 1], ["block_col_warps", "ot", 1], ["warp_row_tiles", "ot", 1], ["warp_col_tiles", "ot", 2], ["chunk", "ot", 1], ["offset", "ot", 8], ["vector_width", "ot", 4], ["wmma_m", "ot", 8]]}, "result": [[0.0002792301181506849], 0, 1.2436280250549316, 1632197850.2213252], "version": 0.2, "tvm_version": "0.8.dev0"}
{"input": ["cuda -keys=cuda,gpu -max_num_threads=1024 -thread_warp_size=32", "conv2d_nhwc_winograd_tensorcore.cuda", [["TENSOR", [8, 58, 58, 48], "float16"], ["TENSOR", [3, 3, 48, 192], "float16"], [1, 1], [0, 0, 0, 0], [1, 1], "float16"], {}], "config": {"index": 1758191989, "code_hash": null, "entity": [["thread_num_inverse", "ot", 256], ["thread_num_data", "ot", 64], ["thread_num_kernel", "ot", 256], ["offset_inverse", "ot", 4], ["offset_data", "ot", 4], ["offset_kernel", "ot", 4], ["inverse_in_vector", "ot", 1], ["block_row_warps", "ot", 1], ["block_col_warps", "ot", 1], ["warp_row_tiles", "ot", 2], ["warp_col_tiles", "ot", 2], ["chunk", "ot", 4], ["offset", "ot", 8], ["offsetCS", "ot", 4], ["vec", "ot", 4], ["wmma_m", "ot", 8]]}, "result": [[0.0002775737467652495], 0, 1.8435981273651123, 1632198368.2830713], "version": 0.2, "tvm_version": "0.8.dev0"}
{"input": ["cuda -keys=cuda,gpu -max_num_threads=1024 -thread_warp_size=32", "conv2d_nhwc_tensorcore.cuda", [["TENSOR", [8, 56, 56, 192], "float16"], ["TENSOR", [1, 1, 192, 64], "float16"], [1, 1], [0, 0, 0, 0], [1, 1], "float16"], {}], "config": {"index": 2433, "code_hash": null, "entity": [["block_row_warps", "ot", 1], ["block_col_warps", "ot", 2], ["warp_row_tiles", "ot", 1], ["warp_col_tiles", "ot", 1], ["chunk", "ot", 4], ["offset", "ot", 8], ["vector_width", "ot", 8], ["wmma_m", "ot", 8]]}, "result": [[3.7755640866873065e-05], 0, 1.280829668045044, 1632198475.4715931], "version": 0.2, "tvm_version": "0.8.dev0"}
{"input": ["cuda -keys=cuda,gpu -max_num_threads=1024 -thread_warp_size=32", "conv2d_nhwc_tensorcore.cuda", [["TENSOR", [8, 57, 57, 48], "float16"], ["TENSOR", [3, 3, 48, 192], "float16"], [2, 2], [0, 0, 0, 0], [1, 1], "float16"], {}], "config": {"index": 1647, "code_hash": null, "entity": [["block_row_warps", "ot", 1], ["block_col_warps", "ot", 1], ["warp_row_tiles", "ot", 1], ["warp_col_tiles", "ot", 2], ["chunk", "ot", 1], ["offset", "ot", 8], ["vector_width", "ot", 4], ["wmma_m", "ot", 8]]}, "result": [[7.320734227272727e-05], 0, 1.352304458618164, 1632198814.8380086], "version": 0.2, "tvm_version": "0.8.dev0"}
{"input": ["cuda -keys=cuda,gpu -max_num_threads=1024 -thread_warp_size=32", "conv2d_nhwc_tensorcore.cuda", [["TENSOR", [8, 28, 28, 192], "float16"], ["TENSOR", [1, 1, 192, 96], "float16"], [1, 1], [0, 0, 0, 0], [1, 1], "float16"], {}], "config": {"index": 1782, "code_hash": null, "entity": [["block_row_warps", "ot", 1], ["block_col_warps", "ot", 1], ["warp_row_tiles", "ot", 1], ["warp_col_tiles", "ot", 1], ["chunk", "ot", 4], ["offset", "ot", 8], ["vector_width", "ot", 4], ["wmma_m", "ot", 8]]}, "result": [[2.2109049782293178e-05], 0, 1.1737005710601807, 1632198969.2625625], "version": 0.2, "tvm_version": "0.8.dev0"}
{"input": ["cuda -keys=cuda,gpu -max_num_threads=1024 -thread_warp_size=32", "conv2d_nhwc_tensorcore.cuda", [["TENSOR", [8, 30, 30, 80], "float16"], ["TENSOR", [3, 3, 80, 320], "float16"], [1, 1], [0, 0, 0, 0], [1, 1], "float16"], {}], "config": {"index": 1647, "code_hash": null, "entity": [["block_row_warps", "ot", 1], ["block_col_warps", "ot", 1], ["warp_row_tiles", "ot", 1], ["warp_col_tiles", "ot", 2], ["chunk", "ot", 1], ["offset", "ot", 8], ["vector_width", "ot", 4], ["wmma_m", "ot", 8]]}, "result": [[0.0002198615786516854], 0, 1.0196914672851562, 1632199138.9101057], "version": 0.2, "tvm_version": "0.8.dev0"}
{"input": ["cuda -keys=cuda,gpu -max_num_threads=1024 -thread_warp_size=32", "conv2d_nhwc_winograd_tensorcore.cuda", [["TENSOR", [8, 30, 30, 80], "float16"], ["TENSOR", [3, 3, 80, 320], "float16"], [1, 1], [0, 0, 0, 0], [1, 1], "float16"], {}], "config": {"index": 302144919, "code_hash": null, "entity": [["thread_num_inverse", "ot", 256], ["thread_num_data", "ot", 128], ["thread_num_kernel", "ot", 32], ["offset_inverse", "ot", 4], ["offset_data", "ot", 4], ["offset_kernel", "ot", 1], ["inverse_in_vector", "ot", 4], ["block_row_warps", "ot", 1], ["block_col_warps", "ot", 1], ["warp_row_tiles", "ot", 2], ["warp_col_tiles", "ot", 4], ["chunk", "ot", 1], ["offset", "ot", 8], ["offsetCS", "ot", 0], ["vec", "ot", 2], ["wmma_m", "ot", 16]]}, "result": [[0.00013657139729729732], 0, 1.6597156524658203, 1632199539.228533], "version": 0.2, "tvm_version": "0.8.dev0"}
{"input": ["cuda -keys=cuda,gpu -max_num_threads=1024 -thread_warp_size=32", "conv2d_nhwc_tensorcore.cuda", [["TENSOR", [8, 28, 28, 320], "float16"], ["TENSOR", [1, 1, 320, 96], "float16"], [1, 1], [0, 0, 0, 0], [1, 1], "float16"], {}], "config": {"index": 2430, "code_hash": null, "entity": [["block_row_warps", "ot", 1], ["block_col_warps", "ot", 1], ["warp_row_tiles", "ot", 1], ["warp_col_tiles", "ot", 1], ["chunk", "ot", 4], ["offset", "ot", 8], ["vector_width", "ot", 8], ["wmma_m", "ot", 8]]}, "result": [[3.671880863910822e-05], 0, 1.2453436851501465, 1632199603.6279447], "version": 0.2, "tvm_version": "0.8.dev0"}
{"input": ["cuda -keys=cuda,gpu -max_num_threads=1024 -thread_warp_size=32", "conv2d_nhwc_tensorcore.cuda", [["TENSOR", [8, 28, 28, 80], "float16"], ["TENSOR", [1, 1, 80, 320], "float16"], [1, 1], [0, 0, 0, 0], [1, 1], "float16"], {}], "config": {"index": 1647, "code_hash": null, "entity": [["block_row_warps", "ot", 1], ["block_col_warps", "ot", 1], ["warp_row_tiles", "ot", 1], ["warp_col_tiles", "ot", 2], ["chunk", "ot", 1], ["offset", "ot", 8], ["vector_width", "ot", 4], ["wmma_m", "ot", 8]]}, "result": [[2.331097289607667e-05], 0, 0.929621696472168, 1632199702.4803555], "version": 0.2, "tvm_version": "0.8.dev0"}
{"input": ["cuda -keys=cuda,gpu -max_num_threads=1024 -thread_warp_size=32", "conv2d_nhwc_tensorcore.cuda", [["TENSOR", [8, 1, 1, 320], "float16"], ["TENSOR", [1, 1, 320, 32], "float16"], [1, 1], [0, 0, 0, 0], [1, 1], "float16"], {}], "config": {"index": 2430, "code_hash": null, "entity": [["block_row_warps", "ot", 1], ["block_col_warps", "ot", 1], ["warp_row_tiles", "ot", 1], ["warp_col_tiles", "ot", 1], ["chunk", "ot", 4], ["offset", "ot", 8], ["vector_width", "ot", 8], ["wmma_m", "ot", 8]]}, "result": [[2.6736367571822116e-06], 0, 1.4872844219207764, 1632199883.8328683], "version": 0.2, "tvm_version": "0.8.dev0"}
{"input": ["cuda -keys=cuda,gpu -max_num_threads=1024 -thread_warp_size=32", "conv2d_nhwc_tensorcore.cuda", [["TENSOR", [8, 1, 1, 32], "float16"], ["TENSOR", [1, 1, 32, 320], "float16"], [1, 1], [0, 0, 0, 0], [1, 1], "float16"], {}], "config": {"index": 2430, "code_hash": null, "entity": [["block_row_warps", "ot", 1], ["block_col_warps", "ot", 1], ["warp_row_tiles", "ot", 1], ["warp_col_tiles", "ot", 1], ["chunk", "ot", 4], ["offset", "ot", 8], ["vector_width", "ot", 8], ["wmma_m", "ot", 8]]}, "result": [[1.6615687583554094e-06], 0, 1.3182587623596191, 1632199993.1921728], "version": 0.2, "tvm_version": "0.8.dev0"}
{"input": ["cuda -keys=cuda,gpu -max_num_threads=1024 -thread_warp_size=32", "conv2d_nhwc_tensorcore.cuda", [["TENSOR", [8, 14, 14, 320], "float16"], ["TENSOR", [1, 1, 320, 160], "float16"], [1, 1], [0, 0, 0, 0], [1, 1], "float16"], {}], "config": {"index": 1782, "code_hash": null, "entity": [["block_row_warps", "ot", 1], ["block_col_warps", "ot", 1], ["warp_row_tiles", "ot", 1], ["warp_col_tiles", "ot", 1], ["chunk", "ot", 4], ["offset", "ot", 8], ["vector_width", "ot", 4], ["wmma_m", "ot", 8]]}, "result": [[1.6549236301623787e-05], 0, 1.3714258670806885, 1632200267.3523614], "version": 0.2, "tvm_version": "0.8.dev0"}
{"input": ["cuda -keys=cuda,gpu -max_num_threads=1024 -thread_warp_size=32", "conv2d_nhwc_tensorcore.cuda", [["TENSOR", [8, 14, 14, 160], "float16"], ["TENSOR", [1, 1, 160, 640], "float16"], [1, 1], [0, 0, 0, 0], [1, 1], "float16"], {}], "config": {"index": 1647, "code_hash": null, "entity": [["block_row_warps", "ot", 1], ["block_col_warps", "ot", 1], ["warp_row_tiles", "ot", 1], ["warp_col_tiles", "ot", 2], ["chunk", "ot", 1], ["offset", "ot", 8], ["vector_width", "ot", 4], ["wmma_m", "ot", 8]]}, "result": [[2.4098278321678318e-05], 0, 1.1408438682556152, 1632200324.626613], "version": 0.2, "tvm_version": "0.8.dev0"}
{"input": ["cuda -keys=cuda,gpu -max_num_threads=1024 -thread_warp_size=32", "conv2d_nhwc_tensorcore.cuda", [["TENSOR", [8, 1, 1, 640], "float16"], ["TENSOR", [1, 1, 640, 64], "float16"], [1, 1], [0, 0, 0, 0], [1, 1], "float16"], {}], "config": {"index": 2349, "code_hash": null, "entity": [["block_row_warps", "ot", 1], ["block_col_warps", "ot", 1], ["warp_row_tiles", "ot", 1], ["warp_col_tiles", "ot", 1], ["chunk", "ot", 2], ["offset", "ot", 8], ["vector_width", "ot", 8], ["wmma_m", "ot", 8]]}, "result": [[4.461220497809559e-06], 0, 1.5405066013336182, 1632200633.006387], "version": 0.2, "tvm_version": "0.8.dev0"}
{"input": ["cuda -keys=cuda,gpu -max_num_threads=1024 -thread_warp_size=32", "conv2d_nhwc_tensorcore.cuda", [["TENSOR", [8, 1, 1, 48], "float16"], ["TENSOR", [1, 1, 48, 640], "float16"], [1, 1], [0, 0, 0, 0], [1, 1], "float16"], {}], "config": {"index": 1782, "code_hash": null, "entity": [["block_row_warps", "ot", 1], ["block_col_warps", "ot", 1], ["warp_row_tiles", "ot", 1], ["warp_col_tiles", "ot", 1], ["chunk", "ot", 4], ["offset", "ot", 8], ["vector_width", "ot", 4], ["wmma_m", "ot", 8]]}, "result": [[1.8344193249074382e-06], 0, 1.4023351669311523, 1632200868.9884598], "version": 0.2, "tvm_version": "0.8.dev0"}
{"input": ["cuda -keys=cuda,gpu -max_num_threads=1024 -thread_warp_size=32", "conv2d_nhwc_tensorcore.cuda", [["TENSOR", [8, 14, 14, 640], "float16"], ["TENSOR", [1, 1, 640, 160], "float16"], [1, 1], [0, 0, 0, 0], [1, 1], "float16"], {}], "config": {"index": 1620, "code_hash": null, "entity": [["block_row_warps", "ot", 1], ["block_col_warps", "ot", 1], ["warp_row_tiles", "ot", 1], ["warp_col_tiles", "ot", 1], ["chunk", "ot", 1], ["offset", "ot", 8], ["vector_width", "ot", 4], ["wmma_m", "ot", 8]]}, "result": [[3.233825627001067e-05], 0, 1.6931257247924805, 1632201136.2328098], "version": 0.2, "tvm_version": "0.8.dev0"}
{"input": ["cuda -keys=cuda,gpu -max_num_threads=1024 -thread_warp_size=32", "conv2d_nhwc_tensorcore.cuda", [["TENSOR", [8, 14, 14, 160], "float16"], ["TENSOR", [1, 1, 160, 960], "float16"], [1, 1], [0, 0, 0, 0], [1, 1], "float16"], {}], "config": {"index": 1647, "code_hash": null, "entity": [["block_row_warps", "ot", 1], ["block_col_warps", "ot", 1], ["warp_row_tiles", "ot", 1], ["warp_col_tiles", "ot", 2], ["chunk", "ot", 1], ["offset", "ot", 8], ["vector_width", "ot", 4], ["wmma_m", "ot", 8]]}, "result": [[3.8795783904619965e-05], 0, 1.186558485031128, 1632201327.0905828], "version": 0.2, "tvm_version": "0.8.dev0"}
{"input": ["cuda -keys=cuda,gpu -max_num_threads=1024 -thread_warp_size=32", "conv2d_nhwc_tensorcore.cuda", [["TENSOR", [8, 1, 1, 960], "float16"], ["TENSOR", [1, 1, 960, 64], "float16"], [1, 1], [0, 0, 0, 0], [1, 1], "float16"], {}], "config": {"index": 2430, "code_hash": null, "entity": [["block_row_warps", "ot", 1], ["block_col_warps", "ot", 1], ["warp_row_tiles", "ot", 1], ["warp_col_tiles", "ot", 1], ["chunk", "ot", 4], ["offset", "ot", 8], ["vector_width", "ot", 8], ["wmma_m", "ot", 8]]}, "result": [[6.3021573220616305e-06], 0, 1.6420295238494873, 1632201473.2954173], "version": 0.2, "tvm_version": "0.8.dev0"}
{"input": ["cuda -keys=cuda,gpu -max_num_threads=1024 -thread_warp_size=32", "conv2d_nhwc_tensorcore.cuda", [["TENSOR", [8, 1, 1, 48], "float16"], ["TENSOR", [1, 1, 48, 960], "float16"], [1, 1], [0, 0, 0, 0], [1, 1], "float16"], {}], "config": {"index": 1137, "code_hash": null, "entity": [["block_row_warps", "ot", 1], ["block_col_warps", "ot", 2], ["warp_row_tiles", "ot", 1], ["warp_col_tiles", "ot", 1], ["chunk", "ot", 4], ["offset", "ot", 8], ["vector_width", "ot", 2], ["wmma_m", "ot", 8]]}, "result": [[1.8557979543287865e-06], 0, 1.4810585975646973, 1632201703.9451623], "version": 0.2, "tvm_version": "0.8.dev0"}
{"input": ["cuda -keys=cuda,gpu -max_num_threads=1024 -thread_warp_size=32", "conv2d_nhwc_tensorcore.cuda", [["TENSOR", [8, 14, 14, 960], "float16"], ["TENSOR", [1, 1, 960, 192], "float16"], [1, 1], [0, 0, 0, 0], [1, 1], "float16"], {}], "config": {"index": 1647, "code_hash": null, "entity": [["block_row_warps", "ot", 1], ["block_col_warps", "ot", 1], ["warp_row_tiles", "ot", 1], ["warp_col_tiles", "ot", 2], ["chunk", "ot", 1], ["offset", "ot", 8], ["vector_width", "ot", 4], ["wmma_m", "ot", 8]]}, "result": [[3.788303081438004e-05], 0, 0.9080657958984375, 1632201973.706181], "version": 0.2, "tvm_version": "0.8.dev0"}
{"input": ["cuda -keys=cuda,gpu -max_num_threads=1024 -thread_warp_size=32", "conv2d_nhwc_tensorcore.cuda", [["TENSOR", [8, 14, 14, 1056], "float16"], ["TENSOR", [1, 1, 1056, 192], "float16"], [1, 1], [0, 0, 0, 0], [1, 1], "float16"], {}], "config": {"index": 1647, "code_hash": null, "entity": [["block_row_warps", "ot", 1], ["block_col_warps", "ot", 1], ["warp_row_tiles", "ot", 1], ["warp_col_tiles", "ot", 2], ["chunk", "ot", 1], ["offset", "ot", 8], ["vector_width", "ot", 4], ["wmma_m", "ot", 8]]}, "result": [[4.3531523028739866e-05], 0, 1.280745029449463, 1632202118.913576], "version": 0.2, "tvm_version": "0.8.dev0"}
{"input": ["cuda -keys=cuda,gpu -max_num_threads=1024 -thread_warp_size=32", "conv2d_nhwc_tensorcore.cuda", [["TENSOR", [8, 1, 1, 1056], "float16"], ["TENSOR", [1, 1, 1056, 64], "float16"], [1, 1], [0, 0, 0, 0], [1, 1], "float16"], {}], "config": {"index": 2349, "code_hash": null, "entity": [["block_row_warps", "ot", 1], ["block_col_warps", "ot", 1], ["warp_row_tiles", "ot", 1], ["warp_col_tiles", "ot", 1], ["chunk", "ot", 2], ["offset", "ot", 8], ["vector_width", "ot", 8], ["wmma_m", "ot", 8]]}, "result": [[6.5916954619541905e-06], 0, 1.6095035076141357, 1632202398.2843742], "version": 0.2, "tvm_version": "0.8.dev0"}
{"input": ["cuda -keys=cuda,gpu -max_num_threads=1024 -thread_warp_size=32", "conv2d_nhwc_tensorcore.cuda", [["TENSOR", [8, 1, 1, 48], "float16"], ["TENSOR", [1, 1, 48, 1056], "float16"], [1, 1], [0, 0, 0, 0], [1, 1], "float16"], {}], "config": {"index": 1863, "code_hash": null, "entity": [["block_row_warps", "ot", 1], ["block_col_warps", "ot", 1], ["warp_row_tiles", "ot", 1], ["warp_col_tiles", "ot", 1], ["chunk", "ot", 8], ["offset", "ot", 8], ["vector_width", "ot", 4], ["wmma_m", "ot", 8]]}, "result": [[1.8491555895865237e-06], 0, 1.121215581893921, 1632202519.104164], "version": 0.2, "tvm_version": "0.8.dev0"}
{"input": ["cuda -keys=cuda,gpu -max_num_threads=1024 -thread_warp_size=32", "conv2d_nhwc_tensorcore.cuda", [["TENSOR", [8, 7, 7, 1056], "float16"], ["TENSOR", [1, 1, 1056, 320], "float16"], [1, 1], [0, 0, 0, 0], [1, 1], "float16"], {}], "config": {"index": 1647, "code_hash": null, "entity": [["block_row_warps", "ot", 1], ["block_col_warps", "ot", 1], ["warp_row_tiles", "ot", 1], ["warp_col_tiles", "ot", 2], ["chunk", "ot", 1], ["offset", "ot", 8], ["vector_width", "ot", 4], ["wmma_m", "ot", 8]]}, "result": [[2.2101988349868026e-05], 0, 1.2991704940795898, 1632202655.689005], "version": 0.2, "tvm_version": "0.8.dev0"}
{"input": ["cuda -keys=cuda,gpu -max_num_threads=1024 -thread_warp_size=32", "conv2d_nhwc_tensorcore.cuda", [["TENSOR", [8, 7, 7, 1824], "float16"], ["TENSOR", [1, 1, 1824, 320], "float16"], [1, 1], [0, 0, 0, 0], [1, 1], "float16"], {}], "config": {"index": 1647, "code_hash": null, "entity": [["block_row_warps", "ot", 1], ["block_col_warps", "ot", 1], ["warp_row_tiles", "ot", 1], ["warp_col_tiles", "ot", 2], ["chunk", "ot", 1], ["offset", "ot", 8], ["vector_width", "ot", 4], ["wmma_m", "ot", 8]]}, "result": [[3.6093005493193216e-05], 0, 0.9961068630218506, 1632202778.7135618], "version": 0.2, "tvm_version": "0.8.dev0"}
{"input": ["cuda -keys=cuda,gpu -max_num_threads=1024 -thread_warp_size=32", "conv2d_nhwc_tensorcore.cuda", [["TENSOR", [8, 1, 1, 1824], "float16"], ["TENSOR", [1, 1, 1824, 96], "float16"], [1, 1], [0, 0, 0, 0], [1, 1], "float16"], {}], "config": {"index": 2349, "code_hash": null, "entity": [["block_row_warps", "ot", 1], ["block_col_warps", "ot", 1], ["warp_row_tiles", "ot", 1], ["warp_col_tiles", "ot", 1], ["chunk", "ot", 2], ["offset", "ot", 8], ["vector_width", "ot", 8], ["wmma_m", "ot", 8]]}, "result": [[1.0390068115814486e-05], 0, 1.283151388168335, 1632202993.3497012], "version": 0.2, "tvm_version": "0.8.dev0"}
{"input": ["cuda -keys=cuda,gpu -max_num_threads=1024 -thread_warp_size=32", "conv2d_nhwc_tensorcore.cuda", [["TENSOR", [8, 1, 1, 80], "float16"], ["TENSOR", [1, 1, 80, 1824], "float16"], [1, 1], [0, 0, 0, 0], [1, 1], "float16"], {}], "config": {"index": 1215, "code_hash": null, "entity": [["block_row_warps", "ot", 1], ["block_col_warps", "ot", 1], ["warp_row_tiles", "ot", 1], ["warp_col_tiles", "ot", 1], ["chunk", "ot", 8], ["offset", "ot", 8], ["vector_width", "ot", 2], ["wmma_m", "ot", 8]]}, "result": [[2.3070195967610456e-06], 0, 1.2691128253936768, 1632203031.237336], "version": 0.2, "tvm_version": "0.8.dev0"}
{"input": ["cuda -keys=cuda,gpu -max_num_threads=1024 -thread_warp_size=32", "conv2d_nhwc_tensorcore.cuda", [["TENSOR", [8, 7, 7, 1824], "float16"], ["TENSOR", [1, 1, 1824, 512], "float16"], [1, 1], [0, 0, 0, 0], [1, 1], "float16"], {}], "config": {"index": 1647, "code_hash": null, "entity": [["block_row_warps", "ot", 1], ["block_col_warps", "ot", 1], ["warp_row_tiles", "ot", 1], ["warp_col_tiles", "ot", 2], ["chunk", "ot", 1], ["offset", "ot", 8], ["vector_width", "ot", 4], ["wmma_m", "ot", 8]]}, "result": [[4.83968178427106e-05], 0, 1.200622797012329, 1632203178.8019516], "version": 0.2, "tvm_version": "0.8.dev0"}
{"input": ["cuda -keys=cuda,gpu -max_num_threads=1024 -thread_warp_size=32", "conv2d_nhwc_tensorcore.cuda", [["TENSOR", [8, 7, 7, 512], "float16"], ["TENSOR", [1, 1, 512, 3072], "float16"], [1, 1], [0, 0, 0, 0], [1, 1], "float16"], {}], "config": {"index": 2382, "code_hash": null, "entity": [["block_row_warps", "ot", 1], ["block_col_warps", "ot", 4], ["warp_row_tiles", "ot", 1], ["warp_col_tiles", "ot", 2], ["chunk", "ot", 2], ["offset", "ot", 8], ["vector_width", "ot", 8], ["wmma_m", "ot", 8]]}, "result": [[0.00010053733831168832], 0, 1.215590476989746, 1632203593.486027], "version": 0.2, "tvm_version": "0.8.dev0"}
{"input": ["cuda -keys=cuda,gpu -max_num_threads=1024 -thread_warp_size=32", "conv2d_nhwc_tensorcore.cuda", [["TENSOR", [8, 1, 1, 3072], "float16"], ["TENSOR", [1, 1, 3072, 128], "float16"], [1, 1], [0, 0, 0, 0], [1, 1], "float16"], {}], "config": {"index": 2349, "code_hash": null, "entity": [["block_row_warps", "ot", 1], ["block_col_warps", "ot", 1], ["warp_row_tiles", "ot", 1], ["warp_col_tiles", "ot", 1], ["chunk", "ot", 2], ["offset", "ot", 8], ["vector_width", "ot", 8], ["wmma_m", "ot", 8]]}, "result": [[1.5861165478648992e-05], 0, 1.6556169986724854, 1632203870.6385133], "version": 0.2, "tvm_version": "0.8.dev0"}
{"input": ["cuda -keys=cuda,gpu -max_num_threads=1024 -thread_warp_size=32", "conv2d_nhwc_tensorcore.cuda", [["TENSOR", [8, 1, 1, 128], "float16"], ["TENSOR", [1, 1, 128, 3072], "float16"], [1, 1], [0, 0, 0, 0], [1, 1], "float16"], {}], "config": {"index": 1869, "code_hash": null, "entity": [["block_row_warps", "ot", 1], ["block_col_warps", "ot", 4], ["warp_row_tiles", "ot", 1], ["warp_col_tiles", "ot", 1], ["chunk", "ot", 8], ["offset", "ot", 8], ["vector_width", "ot", 4], ["wmma_m", "ot", 8]]}, "result": [[2.563556088825215e-06], 0, 1.477504014968872, 1632204246.0076592], "version": 0.2, "tvm_version": "0.8.dev0"}
{"input": ["cuda -keys=cuda,gpu -max_num_threads=1024 -thread_warp_size=32", "conv2d_nhwc_tensorcore.cuda", [["TENSOR", [8, 7, 7, 3072], "float16"], ["TENSOR", [1, 1, 3072, 512], "float16"], [1, 1], [0, 0, 0, 0], [1, 1], "float16"], {}], "config": {"index": 1647, "code_hash": null, "entity": [["block_row_warps", "ot", 1], ["block_col_warps", "ot", 1], ["warp_row_tiles", "ot", 1], ["warp_col_tiles", "ot", 2], ["chunk", "ot", 1], ["offset", "ot", 8], ["vector_width", "ot", 4], ["wmma_m", "ot", 8]]}, "result": [[8.163948526422764e-05], 0, 1.2949674129486084, 1632204808.7231789], "version": 0.2, "tvm_version": "0.8.dev0"}
{"input": ["cuda -keys=cuda,gpu -max_num_threads=1024 -thread_warp_size=32", "conv2d_nhwc_tensorcore.cuda", [["TENSOR", [8, 7, 7, 512], "float16"], ["TENSOR", [1, 1, 512, 1280], "float16"], [1, 1], [0, 0, 0, 0], [1, 1], "float16"], {}], "config": {"index": 1653, "code_hash": null, "entity": [["block_row_warps", "ot", 1], ["block_col_warps", "ot", 4], ["warp_row_tiles", "ot", 1], ["warp_col_tiles", "ot", 2], ["chunk", "ot", 1], ["offset", "ot", 8], ["vector_width", "ot", 4], ["wmma_m", "ot", 8]]}, "result": [[3.9664830932129843e-05], 0, 1.6042394638061523, 1632205056.2682884], "version": 0.2, "tvm_version": "0.8.dev0"}
{"input": ["cuda -keys=cuda,gpu -max_num_threads=1024 -thread_warp_size=32", "dense_tensorcore.cuda", [["TENSOR", [8, 1280], "float16"], ["TENSOR", [1024, 1280], "float16"], null, "float16"], {}], "config": {"index": 5103, "code_hash": null, "entity": [["block_row_warps", "ot", 1], ["block_col_warps", "ot", 1], ["warp_row_tiles", "ot", 1], ["warp_col_tiles", "ot", 1], ["chunk", "ot", 8], ["offset", "ot", 8], ["offsetCS", "ot", 8], ["vec", "ot", 8], ["wmma_m", "ot", 8]]}, "result": [[7.751342335450827e-06], 0, 1.681457281112671, 1632205434.3144815], "version": 0.2, "tvm_version": "0.8.dev0"}
{"input": ["cuda -keys=cuda,gpu -max_num_threads=1024 -thread_warp_size=32", "dense_small_batch.gpu", [["TENSOR", [8, 1280], "float16"], ["TENSOR", [1024, 1280], "float16"], null, "float16"], {}], "config": {"index": 8, "code_hash": null, "entity": [["tile_k", "sp", [-1, 32]]]}, "result": [[1.900512386071512e-05], 0, 1.433976173400879, 1632205712.1424181], "version": 0.2, "tvm_version": "0.8.dev0"}
{"input": ["cuda -keys=cuda,gpu -max_num_threads=1024 -thread_warp_size=32", "conv2d_nhwc.cuda", [["TENSOR", [8, 7, 7, 304], "float16"], ["TENSOR", [1, 1, 304, 1824], "float16"], [1, 1], [0, 0, 0, 0], [1, 1], "float16"], {}], "config": {"index": 30, "code_hash": null, "entity": [["tile_n", "ot", 2], ["tile_c", "ot", 4], ["num_thread_n", "ot", 4], ["num_thread_c", "ot", 8], ["vthread_n", "ot", 1], ["vthread_c", "ot", 1], ["step", "ot", 16]]}, "result": [[8.866719894366197e-05], 0, 1.1462936401367188, 1632381605.8558104], "version": 0.2, "tvm_version": "0.8.dev0"}
{"input": ["cuda -keys=cuda,gpu -max_num_threads=1024 -thread_warp_size=32", "conv2d_nhwc.cuda", [["TENSOR", [8, 14, 14, 176], "float16"], ["TENSOR", [1, 1, 176, 1056], "float16"], [1, 1], [0, 0, 0, 0], [1, 1], "float16"], {}], "config": {"index": 111, "code_hash": null, "entity": [["tile_n", "ot", 2], ["tile_c", "ot", 4], ["num_thread_n", "ot", 4], ["num_thread_c", "ot", 8], ["vthread_n", "ot", 2], ["vthread_c", "ot", 1], ["step", "ot", 16]]}, "result": [[0.00011877569242779078], 0, 1.1657288074493408, 1632381950.5693133], "version": 0.2, "tvm_version": "0.8.dev0"}
