conv2d/cutlass_result_grad.csv
Problem,Provider,OperationKind,Operation,Disposition,Status,conv_kind,n,h,w,c,k,r,s,p,q,pad_h,pad_w,stride_h,stride_w,dilation_h,dilation_w,Activation,Filter,Output,conv_mode,iterator_algorithm,alpha,beta,split_k_mode,split_k_slices,eq_gemm_provider,op_class,accum,cta_m,cta_n,cta_k,stages,warps_m,warps_n,warps_k,inst_m,inst_n,inst_k,min_cc,max_cc,Bytes,Flops,Flops/Byte,Runtime,GB/s,GFLOPs
1,CUTLASS,conv2d,cutlass_tensorop_s1688dgrad_optimized_f16_256x128_32x2_nhwc_unity_stride_align8,passed,success,dgrad,256,56,56,64,256,1,1,56,56,0,0,1,1,1,1,f32:nhwc,f16:nhwc,f16:nhwc,cross,optimized,1,0,serial,1,none,tensorop,f32,256,128,32,2,4,2,1,16,8,8,75,1024,616595456,26409435136,42,1.92094,298.941,13748.2
1,CUTLASS,conv2d,cutlass_tensorop_s1688wgrad_optimized_f16_256x128_32x2_nhwc_align8,passed,success,wgrad,256,56,56,64,256,1,1,56,56,0,0,1,1,1,1,f16:nhwc,f32:nhwc,f16:nhwc,cross,optimized,1,0,serial,1,none,tensorop,f32,256,128,32,2,4,2,1,16,8,8,75,1024,513867776,26306707456,51,67.7741,7.06135,388.153
1,CUTLASS,conv2d,cutlass_tensorop_s1688dgrad_optimized_f16_256x128_32x2_nhwc_unity_stride_align4,passed,success,dgrad,256,56,56,64,256,1,1,56,56,0,0,1,1,1,1,f32:nhwc,f16:nhwc,f16:nhwc,cross,optimized,1,0,serial,1,none,tensorop,f32,256,128,32,2,4,2,1,16,8,8,75,1024,616595456,26409435136,42,1.8998,302.268,13901.2
1,CUTLASS,conv2d,cutlass_tensorop_s1688wgrad_optimized_f16_256x128_32x2_nhwc_align4,passed,success,wgrad,256,56,56,64,256,1,1,56,56,0,0,1,1,1,1,f16:nhwc,f32:nhwc,f16:nhwc,cross,optimized,1,0,serial,1,none,tensorop,f32,256,128,32,2,4,2,1,16,8,8,75,1024,513867776,26306707456,51,60.6367,7.89252,433.841
1,CUTLASS,conv2d,cutlass_tensorop_s1688dgrad_optimized_f16_256x128_32x2_nhwc_unity_stride_align2,passed,success,dgrad,256,56,56,64,256,1,1,56,56,0,0,1,1,1,1,f32:nhwc,f16:nhwc,f16:nhwc,cross,optimized,1,0,serial,1,none,tensorop,f32,256,128,32,2,4,2,1,16,8,8,75,1024,616595456,26409435136,42,1.75796,326.656,15022.8
1,CUTLASS,conv2d,cutlass_tensorop_s1688wgrad_optimized_f16_256x128_32x2_nhwc_align2,passed,success,wgrad,256,56,56,64,256,1,1,56,56,0,0,1,1,1,1,f16:nhwc,f32:nhwc,f16:nhwc,cross,optimized,1,0,serial,1,none,tensorop,f32,256,128,32,2,4,2,1,16,8,8,75,1024,513867776,26306707456,51,106.292,4.50246,247.494
1,CUTLASS,conv2d,cutlass_tensorop_s1688dgrad_optimized_f16_256x128_32x2_nhwc_unity_stride_align1,passed,success,dgrad,256,56,56,64,256,1,1,56,56,0,0,1,1,1,1,f32:nhwc,f16:nhwc,f16:nhwc,cross,optimized,1,0,serial,1,none,tensorop,f32,256,128,32,2,4,2,1,16,8,8,75,1024,616595456,26409435136,42,5.69929,100.758,4633.81
1,CUTLASS,conv2d,cutlass_tensorop_s1688wgrad_optimized_f16_256x128_32x2_nhwc_align1,passed,success,wgrad,256,56,56,64,256,1,1,56,56,0,0,1,1,1,1,f16:nhwc,f32:nhwc,f16:nhwc,cross,optimized,1,0,serial,1,none,tensorop,f32,256,128,32,2,4,2,1,16,8,8,75,1024,513867776,26306707456,51,124.769,3.8357,210.843
1,CUTLASS,conv2d,cutlass_tensorop_s1688dgrad_optimized_f16_128x256_32x2_nhwc_unity_stride_align8,passed,success,dgrad,256,56,56,64,256,1,1,56,56,0,0,1,1,1,1,f32:nhwc,f16:nhwc,f16:nhwc,cross,optimized,1,0,serial,1,none,tensorop,f32,128,256,32,2,2,4,1,16,8,8,75,1024,616595456,26409435136,42,3.16827,181.25,8335.61
1,CUTLASS,conv2d,cutlass_tensorop_s1688wgrad_optimized_f16_128x256_32x2_nhwc_align8,passed,success,wgrad,256,56,56,64,256,1,1,56,56,0,0,1,1,1,1,f16:nhwc,f32:nhwc,f16:nhwc,cross,optimized,1,0,serial,1,none,tensorop,f32,128,256,32,2,2,4,1,16,8,8,75,1024,513867776,26306707456,51,68.1994,7.01731,385.732
1,CUTLASS,conv2d,cutlass_tensorop_s1688dgrad_optimized_f16_128x256_32x2_nhwc_unity_stride_align4,passed,success,dgrad,256,56,56,64,256,1,1,56,56,0,0,1,1,1,1,f32:nhwc,f16:nhwc,f16:nhwc,cross,optimized,1,0,serial,1,none,tensorop,f32,128,256,32,2,2,4,1,16,8,8,75,1024,616595456,26409435136,42,3.16453,181.464,8345.46
1,CUTLASS,conv2d,cutlass_tensorop_s1688wgrad_optimized_f16_128x256_32x2_nhwc_align4,passed,success,wgrad,256,56,56,64,256,1,1,56,56,0,0,1,1,1,1,f16:nhwc,f32:nhwc,f16:nhwc,cross,optimized,1,0,serial,1,none,tensorop,f32,128,256,32,2,2,4,1,16,8,8,75,1024,513867776,26306707456,51,101.077,4.73479,260.265
1,CUTLASS,conv2d,cutlass_tensorop_s1688dgrad_optimized_f16_128x256_32x2_nhwc_unity_stride_align2,passed,success,dgrad,256,56,56,64,256,1,1,56,56,0,0,1,1,1,1,f32:nhwc,f16:nhwc,f16:nhwc,cross,optimized,1,0,serial,1,none,tensorop,f32,128,256,32,2,2,4,1,16,8,8,75,1024,616595456,26409435136,42,3.37327,170.235,7829.03
1,CUTLASS,conv2d,cutlass_tensorop_s1688wgrad_optimized_f16_128x256_32x2_nhwc_align2,passed,success,wgrad,256,56,56,64,256,1,1,56,56,0,0,1,1,1,1,f16:nhwc,f32:nhwc,f16:nhwc,cross,optimized,1,0,serial,1,none,tensorop,f32,128,256,32,2,2,4,1,16,8,8,75,1024,513867776,26306707456,51,111.787,4.28114,235.328
1,CUTLASS,conv2d,cutlass_tensorop_s1688dgrad_optimized_f16_128x256_32x2_nhwc_unity_stride_align1,passed,success,dgrad,256,56,56,64,256,1,1,56,56,0,0,1,1,1,1,f32:nhwc,f16:nhwc,f16:nhwc,cross,optimized,1,0,serial,1,none,tensorop,f32,128,256,32,2,2,4,1,16,8,8,75,1024,616595456,26409435136,42,3.79204,151.436,6964.44
1,CUTLASS,conv2d,cutlass_tensorop_s1688wgrad_optimized_f16_128x256_32x2_nhwc_align1,passed,success,wgrad,256,56,56,64,256,1,1,56,56,0,0,1,1,1,1,f16:nhwc,f32:nhwc,f16:nhwc,cross,optimized,1,0,serial,1,none,tensorop,f32,128,256,32,2,2,4,1,16,8,8,75,1024,513867776,26306707456,51,419.93,1.13966,62.6455
1,CUTLASS,conv2d,cutlass_tensorop_s1688dgrad_optimized_f16_128x128_32x2_nhwc_unity_stride_align8,passed,success,dgrad,256,56,56,64,256,1,1,56,56,0,0,1,1,1,1,f32:nhwc,f16:nhwc,f16:nhwc,cross,optimized,1,0,serial,1,none,tensorop,f32,128,128,32,2,2,2,1,16,8,8,75,1024,616595456,26409435136,42,1.50383,381.859,17561.5
1,CUTLASS,conv2d,cutlass_tensorop_s1688wgrad_optimized_f16_128x128_32x2_nhwc_align8,passed,success,wgrad,256,56,56,64,256,1,1,56,56,0,0,1,1,1,1,f16:nhwc,f32:nhwc,f16:nhwc,cross,optimized,1,0,serial,1,none,tensorop,f32,128,128,32,2,2,2,1,16,8,8,75,1024,513867776,26306707456,51,40.7577,11.742,645.441
1,CUTLASS,conv2d,cutlass_tensorop_s1688dgrad_optimized_f16_128x128_32x2_nhwc_unity_stride_align4,passed,success,dgrad,256,56,56,64,256,1,1,56,56,0,0,1,1,1,1,f32:nhwc,f16:nhwc,f16:nhwc,cross,optimized,1,0,serial,1,none,tensorop,f32,128,128,32,2,2,2,1,16,8,8,75,1024,616595456,26409435136,42,1.52083,377.588,17365.1
1,CUTLASS,conv2d,cutlass_tensorop_s1688wgrad_optimized_f16_128x128_32x2_nhwc_align4,passed,success,wgrad,256,56,56,64,256,1,1,56,56,0,0,1,1,1,1,f16:nhwc,f32:nhwc,f16:nhwc,cross,optimized,1,0,serial,1,none,tensorop,f32,128,128,32,2,2,2,1,16,8,8,75,1024,513867776,26306707456,51,73.82,6.48302,356.363
1,CUTLASS,conv2d,cutlass_tensorop_s1688dgrad_optimized_f16_128x128_32x2_nhwc_unity_stride_align2,passed,success,dgrad,256,56,56,64,256,1,1,56,56,0,0,1,1,1,1,f32:nhwc,f16:nhwc,f16:nhwc,cross,optimized,1,0,serial,1,none,tensorop,f32,128,128,32,2,2,2,1,16,8,8,75,1024,616595456,26409435136,42,1.55322,369.714,17003
1,CUTLASS,conv2d,cutlass_tensorop_s1688wgrad_optimized_f16_128x128_32x2_nhwc_align2,passed,success,wgrad,256,56,56,64,256,1,1,56,56,0,0,1,1,1,1,f16:nhwc,f32:nhwc,f16:nhwc,cross,optimized,1,0,serial,1,none,tensorop,f32,128,128,32,2,2,2,1,16,8,8,75,1024,513867776,26306707456,51,82.9039,5.77267,317.316
1,CUTLASS,conv2d,cutlass_tensorop_s1688dgrad_optimized_f16_128x128_32x2_nhwc_unity_stride_align1,passed,success,dgrad,256,56,56,64,256,1,1,56,56,0,0,1,1,1,1,f32:nhwc,f16:nhwc,f16:nhwc,cross,optimized,1,0,serial,1,none,tensorop,f32,128,128,32,2,2,2,1,16,8,8,75,1024,616595456,26409435136,42,12.3417,46.529,2139.85
1,CUTLASS,conv2d,cutlass_tensorop_s1688wgrad_optimized_f16_128x128_32x2_nhwc_align1,passed,success,wgrad,256,56,56,64,256,1,1,56,56,0,0,1,1,1,1,f16:nhwc,f32:nhwc,f16:nhwc,cross,optimized,1,0,serial,1,none,tensorop,f32,128,128,32,2,2,2,1,16,8,8,75,1024,513867776,26306707456,51,474.395,1.00882,55.4532
1,CUTLASS,conv2d,cutlass_tensorop_s1688dgrad_optimized_f16_64x128_32x2_nhwc_unity_stride_align8,passed,success,dgrad,256,56,56,64,256,1,1,56,56,0,0,1,1,1,1,f32:nhwc,f16:nhwc,f16:nhwc,cross,optimized,1,0,serial,1,none,tensorop,f32,64,128,32,2,2,2,1,16,8,8,75,1024,616595456,26409435136,42,1.49879,383.142,17620.5
1,CUTLASS,conv2d,cutlass_tensorop_s1688wgrad_optimized_f16_64x128_32x2_nhwc_align8,passed,success,wgrad,256,56,56,64,256,1,1,56,56,0,0,1,1,1,1,f16:nhwc,f32:nhwc,f16:nhwc,cross,optimized,1,0,serial,1,none,tensorop,f32,64,128,32,2,2,2,1,16,8,8,75,1024,513867776,26306707456,51,25.8144,18.5391,1019.07
1,CUTLASS,conv2d,cutlass_tensorop_s1688dgrad_optimized_f16_64x128_32x2_nhwc_unity_stride_align4,passed,success,dgrad,256,56,56,64,256,1,1,56,56,0,0,1,1,1,1,f32:nhwc,f16:nhwc,f16:nhwc,cross,optimized,1,0,serial,1,none,tensorop,f32,64,128,32,2,2,2,1,16,8,8,75,1024,616595456,26409435136,42,1.49396,384.379,17677.4
1,CUTLASS,conv2d,cutlass_tensorop_s1688wgrad_optimized_f16_64x128_32x2_nhwc_align4,passed,success,wgrad,256,56,56,64,256,1,1,56,56,0,0,1,1,1,1,f16:nhwc,f32:nhwc,f16:nhwc,cross,optimized,1,0,serial,1,none,tensorop,f32,64,128,32,2,2,2,1,16,8,8,75,1024,513867776,26306707456,51,34.0466,14.0565,772.669
1,CUTLASS,conv2d,cutlass_tensorop_s1688dgrad_optimized_f16_64x128_32x2_nhwc_unity_stride_align2,passed,success,dgrad,256,56,56,64,256,1,1,56,56,0,0,1,1,1,1,f32:nhwc,f16:nhwc,f16:nhwc,cross,optimized,1,0,serial,1,none,tensorop,f32,64,128,32,2,2,2,1,16,8,8,75,1024,616595456,26409435136,42,1.51246,379.679,17461.3
1,CUTLASS,conv2d,cutlass_tensorop_s1688wgrad_optimized_f16_64x128_32x2_nhwc_align2,passed,success,wgrad,256,56,56,64,256,1,1,56,56,0,0,1,1,1,1,f16:nhwc,f32:nhwc,f16:nhwc,cross,optimized,1,0,serial,1,none,tensorop,f32,64,128,32,2,2,2,1,16,8,8,75,1024,513867776,26306707456,51,65.342,7.32418,402.6
1,CUTLASS,conv2d,cutlass_tensorop_s1688dgrad_optimized_f16_64x128_32x2_nhwc_unity_stride_align1,passed,success,dgrad,256,56,56,64,256,1,1,56,56,0,0,1,1,1,1,f32:nhwc,f16:nhwc,f16:nhwc,cross,optimized,1,0,serial,1,none,tensorop,f32,64,128,32,2,2,2,1,16,8,8,75,1024,616595456,26409435136,42,2.33874,245.538,11292.2
1,CUTLASS,conv2d,cutlass_tensorop_s1688wgrad_optimized_f16_64x128_32x2_nhwc_align1,passed,success,wgrad,256,56,56,64,256,1,1,56,56,0,0,1,1,1,1,f16:nhwc,f32:nhwc,f16:nhwc,cross,optimized,1,0,serial,1,none,tensorop,f32,64,128,32,2,2,2,1,16,8,8,75,1024,513867776,26306707456,51,286.865,1.6683,91.7043
1,CUTLASS,conv2d,cutlass_tensorop_s1688dgrad_optimized_f16_128x64_32x2_nhwc_unity_stride_align8,passed,success,dgrad,256,56,56,64,256,1,1,56,56,0,0,1,1,1,1,f32:nhwc,f16:nhwc,f16:nhwc,cross,optimized,1,0,serial,1,none,tensorop,f32,128,64,32,2,2,2,1,16,8,8,75,1024,616595456,26409435136,42,1.49579,383.911,17655.9
1,CUTLASS,conv2d,cutlass_tensorop_s1688wgrad_optimized_f16_128x64_32x2_nhwc_align8,passed,success,wgrad,256,56,56,64,256,1,1,56,56,0,0,1,1,1,1,f16:nhwc,f32:nhwc,f16:nhwc,cross,optimized,1,0,serial,1,none,tensorop,f32,128,64,32,2,2,2,1,16,8,8,75,1024,513867776,26306707456,51,25.2266,18.9711,1042.82
1,CUTLASS,conv2d,cutlass_tensorop_s1688dgrad_optimized_f16_128x64_32x2_nhwc_unity_stride_align4,passed,success,dgrad,256,56,56,64,256,1,1,56,56,0,0,1,1,1,1,f32:nhwc,f16:nhwc,f16:nhwc,cross,optimized,1,0,serial,1,none,tensorop,f32,128,64,32,2,2,2,1,16,8,8,75,1024,616595456,26409435136,42,1.49677,383.658,17644.3
1,CUTLASS,conv2d,cutlass_tensorop_s1688wgrad_optimized_f16_128x64_32x2_nhwc_align4,passed,success,wgrad,256,56,56,64,256,1,1,56,56,0,0,1,1,1,1,f16:nhwc,f32:nhwc,f16:nhwc,cross,optimized,1,0,serial,1,none,tensorop,f32,128,64,32,2,2,2,1,16,8,8,75,1024,513867776,26306707456,51,35.1838,13.6022,747.693
1,CUTLASS,conv2d,cutlass_tensorop_s1688dgrad_optimized_f16_128x64_32x2_nhwc_unity_stride_align2,passed,success,dgrad,256,56,56,64,256,1,1,56,56,0,0,1,1,1,1,f32:nhwc,f16:nhwc,f16:nhwc,cross,optimized,1,0,serial,1,none,tensorop,f32,128,64,32,2,2,2,1,16,8,8,75,1024,616595456,26409435136,42,1.49825,383.281,17626.9
1,CUTLASS,conv2d,cutlass_tensorop_s1688wgrad_optimized_f16_128x64_32x2_nhwc_align2,passed,success,wgrad,256,56,56,64,256,1,1,56,56,0,0,1,1,1,1,f16:nhwc,f32:nhwc,f16:nhwc,cross,optimized,1,0,serial,1,none,tensorop,f32,128,64,32,2,2,2,1,16,8,8,75,1024,513867776,26306707456,51,33.5406,14.2686,784.325
1,CUTLASS,conv2d,cutlass_tensorop_s1688dgrad_optimized_f16_128x64_32x2_nhwc_unity_stride_align1,passed,success,dgrad,256,56,56,64,256,1,1,56,56,0,0,1,1,1,1,f32:nhwc,f16:nhwc,f16:nhwc,cross,optimized,1,0,serial,1,none,tensorop,f32,128,64,32,2,2,2,1,16,8,8,75,1024,616595456,26409435136,42,1.56441,367.072,16881.4
1,CUTLASS,conv2d,cutlass_tensorop_s1688wgrad_optimized_f16_128x64_32x2_nhwc_align1,passed,success,wgrad,256,56,56,64,256,1,1,56,56,0,0,1,1,1,1,f16:nhwc,f32:nhwc,f16:nhwc,cross,optimized,1,0,serial,1,none,tensorop,f32,128,64,32,2,2,2,1,16,8,8,75,1024,513867776,26306707456,51,108.36,4.41652,242.77
1,CUTLASS,conv2d,cutlass_tensorop_s1688dgrad_optimized_f16_64x64_32x2_nhwc_unity_stride_align8,passed,success,dgrad,256,56,56,64,256,1,1,56,56,0,0,1,1,1,1,f32:nhwc,f16:nhwc,f16:nhwc,cross,optimized,1,0,serial,1,none,tensorop,f32,64,64,32,2,2,2,1,16,8,8,75,1024,616595456,26409435136,42,1.4976,383.446,17634.5
1,CUTLASS,conv2d,cutlass_tensorop_s1688wgrad_optimized_f16_64x64_32x2_nhwc_align8,passed,success,wgrad,256,56,56,64,256,1,1,56,56,0,0,1,1,1,1,f16:nhwc,f32:nhwc,f16:nhwc,cross,optimized,1,0,serial,1,none,tensorop,f32,64,64,32,2,2,2,1,16,8,8,75,1024,513867776,26306707456,51,15.1462,31.5972,1736.86
1,CUTLASS,conv2d,cutlass_tensorop_s1688dgrad_optimized_f16_64x64_32x2_nhwc_unity_stride_align4,passed,success,dgrad,256,56,56,64,256,1,1,56,56,0,0,1,1,1,1,f32:nhwc,f16:nhwc,f16:nhwc,cross,optimized,1,0,serial,1,none,tensorop,f32,64,64,32,2,2,2,1,16,8,8,75,1024,616595456,26409435136,42,1.4941,384.345,17675.8
1,CUTLASS,conv2d,cutlass_tensorop_s1688wgrad_optimized_f16_64x64_32x2_nhwc_align4,passed,success,wgrad,256,56,56,64,256,1,1,56,56,0,0,1,1,1,1,f16:nhwc,f32:nhwc,f16:nhwc,cross,optimized,1,0,serial,1,none,tensorop,f32,64,64,32,2,2,2,1,16,8,8,75,1024,513867776,26306707456,51,22.0146,21.739,1194.96
1,CUTLASS,conv2d,cutlass_tensorop_s1688dgrad_optimized_f16_64x64_32x2_nhwc_unity_stride_align2,passed,success,dgrad,256,56,56,64,256,1,1,56,56,0,0,1,1,1,1,f32:nhwc,f16:nhwc,f16:nhwc,cross,optimized,1,0,serial,1,none,tensorop,f32,64,64,32,2,2,2,1,16,8,8,75,1024,616595456,26409435136,42,1.49447,384.25,17671.5
1,CUTLASS,conv2d,cutlass_tensorop_s1688wgrad_optimized_f16_64x64_32x2_nhwc_align2,passed,success,wgrad,256,56,56,64,256,1,1,56,56,0,0,1,1,1,1,f16:nhwc,f32:nhwc,f16:nhwc,cross,optimized,1,0,serial,1,none,tensorop,f32,64,64,32,2,2,2,1,16,8,8,75,1024,513867776,26306707456,51,27.1948,17.5981,967.344
1,CUTLASS,conv2d,cutlass_tensorop_s1688dgrad_optimized_f16_64x64_32x2_nhwc_unity_stride_align1,passed,success,dgrad,256,56,56,64,256,1,1,56,56,0,0,1,1,1,1,f32:nhwc,f16:nhwc,f16:nhwc,cross,optimized,1,0,serial,1,none,tensorop,f32,64,64,32,2,2,2,1,16,8,8,75,1024,616595456,26409435136,42,1.58742,361.749,16636.7
1,CUTLASS,conv2d,cutlass_tensorop_s1688wgrad_optimized_f16_64x64_32x2_nhwc_align1,passed,success,wgrad,256,56,56,64,256,1,1,56,56,0,0,1,1,1,1,f16:nhwc,f32:nhwc,f16:nhwc,cross,optimized,1,0,serial,1,none,tensorop,f32,64,64,32,2,2,2,1,16,8,8,75,1024,513867776,26306707456,51,50.9893,9.38582,515.926
1,CUTLASS,conv2d,cutlass_tensorop_s1688dgrad_optimized_f16_64x128_64x2_nhwc_unity_stride_align8,passed,success,dgrad,256,56,56,64,256,1,1,56,56,0,0,1,1,1,1,f32:nhwc,f16:nhwc,f16:nhwc,cross,optimized,1,0,serial,1,none,tensorop,f32,64,128,64,2,1,2,2,16,8,8,75,1024,616595456,26409435136,42,1.5266,376.162,17299.5
1,CUTLASS,conv2d,cutlass_tensorop_s1688wgrad_optimized_f16_64x128_64x2_nhwc_align8,passed,success,wgrad,256,56,56,64,256,1,1,56,56,0,0,1,1,1,1,f16:nhwc,f32:nhwc,f16:nhwc,cross,optimized,1,0,serial,1,none,tensorop,f32,64,128,64,2,1,2,2,16,8,8,75,1024,513867776,26306707456,51,18.2804,26.1798,1439.07
1,CUTLASS,conv2d,cutlass_tensorop_s1688dgrad_optimized_f16_64x128_64x2_nhwc_unity_stride_align4,passed,success,dgrad,256,56,56,64,256,1,1,56,56,0,0,1,1,1,1,f32:nhwc,f16:nhwc,f16:nhwc,cross,optimized,1,0,serial,1,none,tensorop,f32,64,128,64,2,1,2,2,16,8,8,75,1024,616595456,26409435136,42,1.66219,345.477,15888.3
1,CUTLASS,conv2d,cutlass_tensorop_s1688wgrad_optimized_f16_64x128_64x2_nhwc_align4,passed,success,wgrad,256,56,56,64,256,1,1,56,56,0,0,1,1,1,1,f16:nhwc,f32:nhwc,f16:nhwc,cross,optimized,1,0,serial,1,none,tensorop,f32,64,128,64,2,1,2,2,16,8,8,75,1024,513867776,26306707456,51,72.2401,6.62481,364.157
1,CUTLASS,conv2d,cutlass_tensorop_s1688dgrad_optimized_f16_64x128_64x2_nhwc_unity_stride_align2,passed,success,dgrad,256,56,56,64,256,1,1,56,56,0,0,1,1,1,1,f32:nhwc,f16:nhwc,f16:nhwc,cross,optimized,1,0,serial,1,none,tensorop,f32,64,128,64,2,1,2,2,16,8,8,75,1024,616595456,26409435136,42,1.89644,302.804,13925.8
1,CUTLASS,conv2d,cutlass_tensorop_s1688wgrad_optimized_f16_64x128_64x2_nhwc_align2,passed,success,wgrad,256,56,56,64,256,1,1,56,56,0,0,1,1,1,1,f16:nhwc,f32:nhwc,f16:nhwc,cross,optimized,1,0,serial,1,none,tensorop,f32,64,128,64,2,1,2,2,16,8,8,75,1024,513867776,26306707456,51,236.844,2.02064,111.072
1,CUTLASS,conv2d,cutlass_tensorop_s1688dgrad_optimized_f16_64x128_64x2_nhwc_unity_stride_align1,passed,success,dgrad,256,56,56,64,256,1,1,56,56,0,0,1,1,1,1,f32:nhwc,f16:nhwc,f16:nhwc,cross,optimized,1,0,serial,1,none,tensorop,f32,64,128,64,2,1,2,2,16,8,8,75,1024,616595456,26409435136,42,18.1215,31.6889,1457.36
1,CUTLASS,conv2d,cutlass_tensorop_s1688wgrad_optimized_f16_64x128_64x2_nhwc_align1,passed,success,wgrad,256,56,56,64,256,1,1,56,56,0,0,1,1,1,1,f16:nhwc,f32:nhwc,f16:nhwc,cross,optimized,1,0,serial,1,none,tensorop,f32,64,128,64,2,1,2,2,16,8,8,75,1024,513867776,26306707456,51,421.643,1.13503,62.3909
1,CUTLASS,conv2d,cutlass_tensorop_s16816dgrad_optimized_f16_256x128_32x3_nhwc_unity_stride_align8,passed,success,dgrad,256,56,56,64,256,1,1,56,56,0,0,1,1,1,1,f32:nhwc,f16:nhwc,f16:nhwc,cross,optimized,1,0,serial,1,none,tensorop,f32,256,128,32,3,4,2,1,16,8,16,80,1024,616595456,26409435136,42,1.5525,369.887,17010.9
1,CUTLASS,conv2d,cutlass_tensorop_s16816wgrad_optimized_f16_256x128_32x3_nhwc_align8,passed,success,wgrad,256,56,56,64,256,1,1,56,56,0,0,1,1,1,1,f16:nhwc,f32:nhwc,f16:nhwc,cross,optimized,1,0,serial,1,none,tensorop,f32,256,128,32,3,4,2,1,16,8,16,80,1024,513867776,26306707456,51,56.5132,8.4684,465.497
1,CUTLASS,conv2d,cutlass_tensorop_s16816dgrad_optimized_f16_256x128_32x3_nhwc_unity_stride_align4,passed,success,dgrad,256,56,56,64,256,1,1,56,56,0,0,1,1,1,1,f32:nhwc,f16:nhwc,f16:nhwc,cross,optimized,1,0,serial,1,none,tensorop,f32,256,128,32,3,4,2,1,16,8,16,80,1024,616595456,26409435136,42,1.56736,366.38,16849.6
1,CUTLASS,conv2d,cutlass_tensorop_s16816wgrad_optimized_f16_256x128_32x3_nhwc_align4,passed,success,wgrad,256,56,56,64,256,1,1,56,56,0,0,1,1,1,1,f16:nhwc,f32:nhwc,f16:nhwc,cross,optimized,1,0,serial,1,none,tensorop,f32,256,128,32,3,4,2,1,16,8,16,80,1024,513867776,26306707456,51,59.126,8.09418,444.926
1,CUTLASS,conv2d,cutlass_tensorop_s16816dgrad_optimized_f16_256x128_32x3_nhwc_unity_stride_align2,passed,success,dgrad,256,56,56,64,256,1,1,56,56,0,0,1,1,1,1,f32:nhwc,f16:nhwc,f16:nhwc,cross,optimized,1,0,serial,1,none,tensorop,f32,256,128,32,3,4,2,1,16,8,16,80,1024,616595456,26409435136,42,1.73147,331.654,15252.6
1,CUTLASS,conv2d,cutlass_tensorop_s16816wgrad_optimized_f16_256x128_32x3_nhwc_align2,passed,success,wgrad,256,56,56,64,256,1,1,56,56,0,0,1,1,1,1,f16:nhwc,f32:nhwc,f16:nhwc,cross,optimized,1,0,serial,1,none,tensorop,f32,256,128,32,3,4,2,1,16,8,16,80,1024,513867776,26306707456,51,115.905,4.12903,226.967
1,CUTLASS,conv2d,cutlass_tensorop_s16816dgrad_optimized_f16_128x256_32x3_nhwc_unity_stride_align8,passed,success,dgrad,256,56,56,64,256,1,1,56,56,0,0,1,1,1,1,f32:nhwc,f16:nhwc,f16:nhwc,cross,optimized,1,0,serial,1,none,tensorop,f32,128,256,32,3,2,4,1,16,8,16,80,1024,616595456,26409435136,42,2.87298,199.88,9192.36
1,CUTLASS,conv2d,cutlass_tensorop_s16816wgrad_optimized_f16_128x256_32x3_nhwc_align8,passed,success,wgrad,256,56,56,64,256,1,1,56,56,0,0,1,1,1,1,f16:nhwc,f32:nhwc,f16:nhwc,cross,optimized,1,0,serial,1,none,tensorop,f32,128,256,32,3,2,4,1,16,8,16,80,1024,513867776,26306707456,51,57.7675,8.28453,455.389
1,CUTLASS,conv2d,cutlass_tensorop_s16816dgrad_optimized_f16_128x256_32x3_nhwc_unity_stride_align4,passed,success,dgrad,256,56,56,64,256,1,1,56,56,0,0,1,1,1,1,f32:nhwc,f16:nhwc,f16:nhwc,cross,optimized,1,0,serial,1,none,tensorop,f32,128,256,32,3,2,4,1,16,8,16,80,1024,616595456,26409435136,42,2.90783,197.484,9082.17
1,CUTLASS,conv2d,cutlass_tensorop_s16816wgrad_optimized_f16_128x256_32x3_nhwc_align4,passed,success,wgrad,256,56,56,64,256,1,1,56,56,0,0,1,1,1,1,f16:nhwc,f32:nhwc,f16:nhwc,cross,optimized,1,0,serial,1,none,tensorop,f32,128,256,32,3,2,4,1,16,8,16,80,1024,513867776,26306707456,51,74.1546,6.45377,354.755
1,CUTLASS,conv2d,cutlass_tensorop_s16816dgrad_optimized_f16_128x256_32x3_nhwc_unity_stride_align2,passed,success,dgrad,256,56,56,64,256,1,1,56,56,0,0,1,1,1,1,f32:nhwc,f16:nhwc,f16:nhwc,cross,optimized,1,0,serial,1,none,tensorop,f32,128,256,32,3,2,4,1,16,8,16,80,1024,616595456,26409435136,42,3.09275,185.676,8539.15
1,CUTLASS,conv2d,cutlass_tensorop_s16816wgrad_optimized_f16_128x256_32x3_nhwc_align2,passed,success,wgrad,256,56,56,64,256,1,1,56,56,0,0,1,1,1,1,f16:nhwc,f32:nhwc,f16:nhwc,cross,optimized,1,0,serial,1,none,tensorop,f32,128,256,32,3,2,4,1,16,8,16,80,1024,513867776,26306707456,51,101.116,4.73296,260.165
1,CUTLASS,conv2d,cutlass_tensorop_s16816dgrad_optimized_f16_256x64_32x4_nhwc_unity_stride_align8,passed,success,dgrad,256,56,56,64,256,1,1,56,56,0,0,1,1,1,1,f32:nhwc,f16:nhwc,f16:nhwc,cross,optimized,1,0,serial,1,none,tensorop,f32,256,64,32,4,4,1,1,16,8,16,80,1024,616595456,26409435136,42,1.58023,363.397,16712.4
1,CUTLASS,conv2d,cutlass_tensorop_s16816wgrad_optimized_f16_256x64_32x4_nhwc_align8,passed,success,wgrad,256,56,56,64,256,1,1,56,56,0,0,1,1,1,1,f16:nhwc,f32:nhwc,f16:nhwc,cross,optimized,1,0,serial,1,none,tensorop,f32,256,64,32,4,4,1,1,16,8,16,80,1024,513867776,26306707456,51,31.062,15.4072,846.91
1,CUTLASS,conv2d,cutlass_tensorop_s16816dgrad_optimized_f16_256x64_32x4_nhwc_unity_stride_align4,passed,success,dgrad,256,56,56,64,256,1,1,56,56,0,0,1,1,1,1,f32:nhwc,f16:nhwc,f16:nhwc,cross,optimized,1,0,serial,1,none,tensorop,f32,256,64,32,4,4,1,1,16,8,16,80,1024,616595456,26409435136,42,2.22329,258.288,11878.5
1,CUTLASS,conv2d,cutlass_tensorop_s16816wgrad_optimized_f16_256x64_32x4_nhwc_align4,passed,success,wgrad,256,56,56,64,256,1,1,56,56,0,0,1,1,1,1,f16:nhwc,f32:nhwc,f16:nhwc,cross,optimized,1,0,serial,1,none,tensorop,f32,256,64,32,4,4,1,1,16,8,16,80,1024,513867776,26306707456,51,39.0484,12.256,673.695
1,CUTLASS,conv2d,cutlass_tensorop_s16816dgrad_optimized_f16_256x64_32x4_nhwc_unity_stride_align2,passed,success,dgrad,256,56,56,64,256,1,1,56,56,0,0,1,1,1,1,f32:nhwc,f16:nhwc,f16:nhwc,cross,optimized,1,0,serial,1,none,tensorop,f32,256,64,32,4,4,1,1,16,8,16,80,1024,616595456,26409435136,42,10.5507,54.4275,2503.09
1,CUTLASS,conv2d,cutlass_tensorop_s16816wgrad_optimized_f16_256x64_32x4_nhwc_align2,passed,success,wgrad,256,56,56,64,256,1,1,56,56,0,0,1,1,1,1,f16:nhwc,f32:nhwc,f16:nhwc,cross,optimized,1,0,serial,1,none,tensorop,f32,256,64,32,4,4,1,1,16,8,16,80,1024,513867776,26306707456,51,55.4111,8.63683,474.755
1,CUTLASS,conv2d,cutlass_tensorop_s16816dgrad_optimized_f16_64x256_32x4_nhwc_unity_stride_align8,passed,success,dgrad,256,56,56,64,256,1,1,56,56,0,0,1,1,1,1,f32:nhwc,f16:nhwc,f16:nhwc,cross,optimized,1,0,serial,1,none,tensorop,f32,64,256,32,4,1,4,1,16,8,16,80,1024,616595456,26409435136,42,3.05646,187.881,8640.54
1,CUTLASS,conv2d,cutlass_tensorop_s16816wgrad_optimized_f16_64x256_32x4_nhwc_align8,passed,success,wgrad,256,56,56,64,256,1,1,56,56,0,0,1,1,1,1,f16:nhwc,f32:nhwc,f16:nhwc,cross,optimized,1,0,serial,1,none,tensorop,f32,64,256,32,4,1,4,1,16,8,16,80,1024,513867776,26306707456,51,37.9316,12.6168,693.53
1,CUTLASS,conv2d,cutlass_tensorop_s16816dgrad_optimized_f16_64x256_32x4_nhwc_unity_stride_align4,passed,success,dgrad,256,56,56,64,256,1,1,56,56,0,0,1,1,1,1,f32:nhwc,f16:nhwc,f16:nhwc,cross,optimized,1,0,serial,1,none,tensorop,f32,64,256,32,4,1,4,1,16,8,16,80,1024,616595456,26409435136,42,3.15596,181.957,8368.12
1,CUTLASS,conv2d,cutlass_tensorop_s16816wgrad_optimized_f16_64x256_32x4_nhwc_align4,passed,success,wgrad,256,56,56,64,256,1,1,56,56,0,0,1,1,1,1,f16:nhwc,f32:nhwc,f16:nhwc,cross,optimized,1,0,serial,1,none,tensorop,f32,64,256,32,4,1,4,1,16,8,16,80,1024,513867776,26306707456,51,76.5629,6.25076,343.596
1,CUTLASS,conv2d,cutlass_tensorop_s16816dgrad_optimized_f16_64x256_32x4_nhwc_unity_stride_align2,passed,success,dgrad,256,56,56,64,256,1,1,56,56,0,0,1,1,1,1,f32:nhwc,f16:nhwc,f16:nhwc,cross,optimized,1,0,serial,1,none,tensorop,f32,64,256,32,4,1,4,1,16,8,16,80,1024,616595456,26409435136,42,3.71846,154.432,7102.25
1,CUTLASS,conv2d,cutlass_tensorop_s16816wgrad_optimized_f16_64x256_32x4_nhwc_align2,passed,success,wgrad,256,56,56,64,256,1,1,56,56,0,0,1,1,1,1,f16:nhwc,f32:nhwc,f16:nhwc,cross,optimized,1,0,serial,1,none,tensorop,f32,64,256,32,4,1,4,1,16,8,16,80,1024,513867776,26306707456,51,423.304,1.13058,62.1462
1,CUTLASS,conv2d,cutlass_tensorop_s16816dgrad_optimized_f16_128x128_32x3_nhwc_unity_stride_align8,passed,success,dgrad,256,56,56,64,256,1,1,56,56,0,0,1,1,1,1,f32:nhwc,f16:nhwc,f16:nhwc,cross,optimized,1,0,serial,1,none,tensorop,f32,128,128,32,3,2,2,1,16,8,16,80,1024,616595456,26409435136,42,1.54417,371.882,17102.6
1,CUTLASS,conv2d,cutlass_tensorop_s16816wgrad_optimized_f16_128x128_32x3_nhwc_align8,passed,success,wgrad,256,56,56,64,256,1,1,56,56,0,0,1,1,1,1,f16:nhwc,f32:nhwc,f16:nhwc,cross,optimized,1,0,serial,1,none,tensorop,f32,128,128,32,3,2,2,1,16,8,16,80,1024,513867776,26306707456,51,34.637,13.8169,759.496
1,CUTLASS,conv2d,cutlass_tensorop_s16816dgrad_optimized_f16_128x128_32x3_nhwc_unity_stride_align4,passed,success,dgrad,256,56,56,64,256,1,1,56,56,0,0,1,1,1,1,f32:nhwc,f16:nhwc,f16:nhwc,cross,optimized,1,0,serial,1,none,tensorop,f32,128,128,32,3,2,2,1,16,8,16,80,1024,616595456,26409435136,42,1.56495,366.945,16875.6
1,CUTLASS,conv2d,cutlass_tensorop_s16816wgrad_optimized_f16_128x128_32x3_nhwc_align4,passed,success,wgrad,256,56,56,64,256,1,1,56,56,0,0,1,1,1,1,f16:nhwc,f32:nhwc,f16:nhwc,cross,optimized,1,0,serial,1,none,tensorop,f32,128,128,32,3,2,2,1,16,8,16,80,1024,513867776,26306707456,51,52.9174,9.04385,497.128
1,CUTLASS,conv2d,cutlass_tensorop_s16816dgrad_optimized_f16_128x128_32x3_nhwc_unity_stride_align2,passed,success,dgrad,256,56,56,64,256,1,1,56,56,0,0,1,1,1,1,f32:nhwc,f16:nhwc,f16:nhwc,cross,optimized,1,0,serial,1,none,tensorop,f32,128,128,32,3,2,2,1,16,8,16,80,1024,616595456,26409435136,42,1.52088,377.578,17364.6
1,CUTLASS,conv2d,cutlass_tensorop_s16816wgrad_optimized_f16_128x128_32x3_nhwc_align2,passed,success,wgrad,256,56,56,64,256,1,1,56,56,0,0,1,1,1,1,f16:nhwc,f32:nhwc,f16:nhwc,cross,optimized,1,0,serial,1,none,tensorop,f32,128,128,32,3,2,2,1,16,8,16,80,1024,513867776,26306707456,51,75.2766,6.35758,349.467
1,CUTLASS,conv2d,cutlass_tensorop_s16816dgrad_optimized_f16_128x128_32x4_nhwc_unity_stride_align8,passed,success,dgrad,256,56,56,64,256,1,1,56,56,0,0,1,1,1,1,f32:nhwc,f16:nhwc,f16:nhwc,cross,optimized,1,0,serial,1,none,tensorop,f32,128,128,32,4,2,2,1,16,8,16,80,1024,616595456,26409435136,42,1.59613,359.776,16545.9
1,CUTLASS,conv2d,cutlass_tensorop_s16816wgrad_optimized_f16_128x128_32x4_nhwc_align8,passed,success,wgrad,256,56,56,64,256,1,1,56,56,0,0,1,1,1,1,f16:nhwc,f32:nhwc,f16:nhwc,cross,optimized,1,0,serial,1,none,tensorop,f32,128,128,32,4,2,2,1,16,8,16,80,1024,513867776,26306707456,51,34.6351,13.8177,759.538
1,CUTLASS,conv2d,cutlass_tensorop_s16816dgrad_optimized_f16_128x128_32x4_nhwc_unity_stride_align4,passed,success,dgrad,256,56,56,64,256,1,1,56,56,0,0,1,1,1,1,f32:nhwc,f16:nhwc,f16:nhwc,cross,optimized,1,0,serial,1,none,tensorop,f32,128,128,32,4,2,2,1,16,8,16,80,1024,616595456,26409435136,42,1.63629,350.945,16139.8
1,CUTLASS,conv2d,cutlass_tensorop_s16816wgrad_optimized_f16_128x128_32x4_nhwc_align4,passed,success,wgrad,256,56,56,64,256,1,1,56,56,0,0,1,1,1,1,f16:nhwc,f32:nhwc,f16:nhwc,cross,optimized,1,0,serial,1,none,tensorop,f32,128,128,32,4,2,2,1,16,8,16,80,1024,513867776,26306707456,51,81.4271,5.87737,323.071
1,CUTLASS,conv2d,cutlass_tensorop_s16816dgrad_optimized_f16_128x128_32x4_nhwc_unity_stride_align2,passed,success,dgrad,256,56,56,64,256,1,1,56,56,0,0,1,1,1,1,f32:nhwc,f16:nhwc,f16:nhwc,cross,optimized,1,0,serial,1,none,tensorop,f32,128,128,32,4,2,2,1,16,8,16,80,1024,616595456,26409435136,42,2.00123,286.948,13196.6
1,CUTLASS,conv2d,cutlass_tensorop_s16816wgrad_optimized_f16_128x128_32x4_nhwc_align2,passed,success,wgrad,256,56,56,64,256,1,1,56,56,0,0,1,1,1,1,f16:nhwc,f32:nhwc,f16:nhwc,cross,optimized,1,0,serial,1,none,tensorop,f32,128,128,32,4,2,2,1,16,8,16,80,1024,513867776,26306707456,51,75.0543,6.3764,350.502
1,CUTLASS,conv2d,cutlass_tensorop_s16816dgrad_optimized_f16_128x128_32x5_nhwc_unity_stride_align8,passed,success,dgrad,256,56,56,64,256,1,1,56,56,0,0,1,1,1,1,f32:nhwc,f16:nhwc,f16:nhwc,cross,optimized,1,0,serial,1,none,tensorop,f32,128,128,32,5,2,2,1,16,8,16,80,1024,616595456,26409435136,42,1.61275,356.069,16375.4
1,CUTLASS,conv2d,cutlass_tensorop_s16816wgrad_optimized_f16_128x128_32x5_nhwc_align8,passed,success,wgrad,256,56,56,64,256,1,1,56,56,0,0,1,1,1,1,f16:nhwc,f32:nhwc,f16:nhwc,cross,optimized,1,0,serial,1,none,tensorop,f32,128,128,32,5,2,2,1,16,8,16,80,1024,513867776,26306707456,51,34.6651,13.8057,758.881
1,CUTLASS,conv2d,cutlass_tensorop_s16816dgrad_optimized_f16_128x128_32x5_nhwc_unity_stride_align4,passed,success,dgrad,256,56,56,64,256,1,1,56,56,0,0,1,1,1,1,f32:nhwc,f16:nhwc,f16:nhwc,cross,optimized,1,0,serial,1,none,tensorop,f32,128,128,32,5,2,2,1,16,8,16,80,1024,616595456,26409435136,42,1.69,339.793,15626.9
1,CUTLASS,conv2d,cutlass_tensorop_s16816wgrad_optimized_f16_128x128_32x5_nhwc_align4,passed,success,wgrad,256,56,56,64,256,1,1,56,56,0,0,1,1,1,1,f16:nhwc,f32:nhwc,f16:nhwc,cross,optimized,1,0,serial,1,none,tensorop,f32,128,128,32,5,2,2,1,16,8,16,80,1024,513867776,26306707456,51,52.035,9.19721,505.558
1,CUTLASS,conv2d,cutlass_tensorop_s16816dgrad_optimized_f16_128x128_32x5_nhwc_unity_stride_align2,passed,success,dgrad,256,56,56,64,256,1,1,56,56,0,0,1,1,1,1,f32:nhwc,f16:nhwc,f16:nhwc,cross,optimized,1,0,serial,1,none,tensorop,f32,128,128,32,5,2,2,1,16,8,16,80,1024,616595456,26409435136,42,2.07047,277.353,12755.3
1,CUTLASS,conv2d,cutlass_tensorop_s16816wgrad_optimized_f16_128x128_32x5_nhwc_align2,passed,success,wgrad,256,56,56,64,256,1,1,56,56,0,0,1,1,1,1,f16:nhwc,f32:nhwc,f16:nhwc,cross,optimized,1,0,serial,1,none,tensorop,f32,128,128,32,5,2,2,1,16,8,16,80,1024,513867776,26306707456,51,75.3539,6.35105,349.109
1,CUTLASS,conv2d,cutlass_tensorop_s16816dgrad_optimized_f16_128x64_32x6_nhwc_unity_stride_align8,passed,success,dgrad,256,56,56,64,256,1,1,56,56,0,0,1,1,1,1,f32:nhwc,f16:nhwc,f16:nhwc,cross,optimized,1,0,serial,1,none,tensorop,f32,128,64,32,6,2,2,1,16,8,16,80,1024,616595456,26409435136,42,1.51751,378.416,17403.2
1,CUTLASS,conv2d,cutlass_tensorop_s16816wgrad_optimized_f16_128x64_32x6_nhwc_align8,passed,success,wgrad,256,56,56,64,256,1,1,56,56,0,0,1,1,1,1,f16:nhwc,f32:nhwc,f16:nhwc,cross,optimized,1,0,serial,1,none,tensorop,f32,128,64,32,6,2,2,1,16,8,16,80,1024,513867776,26306707456,51,17.2263,27.7818,1527.13
1,CUTLASS,conv2d,cutlass_tensorop_s16816dgrad_optimized_f16_128x64_32x6_nhwc_unity_stride_align4,passed,success,dgrad,256,56,56,64,256,1,1,56,56,0,0,1,1,1,1,f32:nhwc,f16:nhwc,f16:nhwc,cross,optimized,1,0,serial,1,none,tensorop,f32,128,64,32,6,2,2,1,16,8,16,80,1024,616595456,26409435136,42,1.50722,381,17522
1,CUTLASS,conv2d,cutlass_tensorop_s16816wgrad_optimized_f16_128x64_32x6_nhwc_align4,passed,success,wgrad,256,56,56,64,256,1,1,56,56,0,0,1,1,1,1,f16:nhwc,f32:nhwc,f16:nhwc,cross,optimized,1,0,serial,1,none,tensorop,f32,128,64,32,6,2,2,1,16,8,16,80,1024,513867776,26306707456,51,27.7721,17.2323,947.234
1,CUTLASS,conv2d,cutlass_tensorop_s16816dgrad_optimized_f16_128x64_32x6_nhwc_unity_stride_align2,passed,success,dgrad,256,56,56,64,256,1,1,56,56,0,0,1,1,1,1,f32:nhwc,f16:nhwc,f16:nhwc,cross,optimized,1,0,serial,1,none,tensorop,f32,128,64,32,6,2,2,1,16,8,16,80,1024,616595456,26409435136,42,1.51002,380.292,17489.4
1,CUTLASS,conv2d,cutlass_tensorop_s16816wgrad_optimized_f16_128x64_32x6_nhwc_align2,passed,success,wgrad,256,56,56,64,256,1,1,56,56,0,0,1,1,1,1,f16:nhwc,f32:nhwc,f16:nhwc,cross,optimized,1,0,serial,1,none,tensorop,f32,128,64,32,6,2,2,1,16,8,16,80,1024,513867776,26306707456,51,84.7242,5.64865,310.498
1,CUTLASS,conv2d,cutlass_tensorop_s16816dgrad_optimized_f16_64x128_32x6_nhwc_unity_stride_align8,passed,success,dgrad,256,56,56,64,256,1,1,56,56,0,0,1,1,1,1,f32:nhwc,f16:nhwc,f16:nhwc,cross,optimized,1,0,serial,1,none,tensorop,f32,64,128,32,6,2,2,1,16,8,16,80,1024,616595456,26409435136,42,1.75798,326.652,15022.6
1,CUTLASS,conv2d,cutlass_tensorop_s16816wgrad_optimized_f16_64x128_32x6_nhwc_align8,passed,success,wgrad,256,56,56,64,256,1,1,56,56,0,0,1,1,1,1,f16:nhwc,f32:nhwc,f16:nhwc,cross,optimized,1,0,serial,1,none,tensorop,f32,64,128,32,6,2,2,1,16,8,16,80,1024,513867776,26306707456,51,20.5802,23.2542,1278.25
1,CUTLASS,conv2d,cutlass_tensorop_s16816dgrad_optimized_f16_64x128_32x6_nhwc_unity_stride_align4,passed,success,dgrad,256,56,56,64,256,1,1,56,56,0,0,1,1,1,1,f32:nhwc,f16:nhwc,f16:nhwc,cross,optimized,1,0,serial,1,none,tensorop,f32,64,128,32,6,2,2,1,16,8,16,80,1024,616595456,26409435136,42,1.90159,301.984,13888.1
1,CUTLASS,conv2d,cutlass_tensorop_s16816wgrad_optimized_f16_64x128_32x6_nhwc_align4,passed,success,wgrad,256,56,56,64,256,1,1,56,56,0,0,1,1,1,1,f16:nhwc,f32:nhwc,f16:nhwc,cross,optimized,1,0,serial,1,none,tensorop,f32,64,128,32,6,2,2,1,16,8,16,80,1024,513867776,26306707456,51,100.368,4.76823,262.103
1,CUTLASS,conv2d,cutlass_tensorop_s16816dgrad_optimized_f16_64x128_32x6_nhwc_unity_stride_align2,passed,success,dgrad,256,56,56,64,256,1,1,56,56,0,0,1,1,1,1,f32:nhwc,f16:nhwc,f16:nhwc,cross,optimized,1,0,serial,1,none,tensorop,f32,64,128,32,6,2,2,1,16,8,16,80,1024,616595456,26409435136,42,2.28181,251.664,11573.9
1,CUTLASS,conv2d,cutlass_tensorop_s16816wgrad_optimized_f16_64x128_32x6_nhwc_align2,passed,success,wgrad,256,56,56,64,256,1,1,56,56,0,0,1,1,1,1,f16:nhwc,f32:nhwc,f16:nhwc,cross,optimized,1,0,serial,1,none,tensorop,f32,64,128,32,6,2,2,1,16,8,16,80,1024,513867776,26306707456,51,65.4945,7.30713,401.663
1,CUTLASS,conv2d,cutlass_tensorop_s16816dgrad_optimized_f16_64x64_32x10_nhwc_unity_stride_align8,passed,success,dgrad,256,56,56,64,256,1,1,56,56,0,0,1,1,1,1,f32:nhwc,f16:nhwc,f16:nhwc,cross,optimized,1,0,serial,1,none,tensorop,f32,64,64,32,10,2,2,1,16,8,16,80,1024,616595456,26409435136,42,1.51766,378.378,17401.4
1,CUTLASS,conv2d,cutlass_tensorop_s16816wgrad_optimized_f16_64x64_32x10_nhwc_align8,passed,success,wgrad,256,56,56,64,256,1,1,56,56,0,0,1,1,1,1,f16:nhwc,f32:nhwc,f16:nhwc,cross,optimized,1,0,serial,1,none,tensorop,f32,64,64,32,10,2,2,1,16,8,16,80,1024,513867776,26306707456,51,10.3384,46.2912,2544.57
1,CUTLASS,conv2d,cutlass_tensorop_s16816dgrad_optimized_f16_64x64_32x10_nhwc_unity_stride_align4,passed,success,dgrad,256,56,56,64,256,1,1,56,56,0,0,1,1,1,1,f32:nhwc,f16:nhwc,f16:nhwc,cross,optimized,1,0,serial,1,none,tensorop,f32,64,64,32,10,2,2,1,16,8,16,80,1024,616595456,26409435136,42,1.54028,372.821,17145.8
1,CUTLASS,conv2d,cutlass_tensorop_s16816wgrad_optimized_f16_64x64_32x10_nhwc_align4,passed,success,wgrad,256,56,56,64,256,1,1,56,56,0,0,1,1,1,1,f16:nhwc,f32:nhwc,f16:nhwc,cross,optimized,1,0,serial,1,none,tensorop,f32,64,64,32,10,2,2,1,16,8,16,80,1024,513867776,26306707456,51,21.1872,22.588,1241.63
1,CUTLASS,conv2d,cutlass_tensorop_s16816dgrad_optimized_f16_64x64_32x10_nhwc_unity_stride_align2,passed,success,dgrad,256,56,56,64,256,1,1,56,56,0,0,1,1,1,1,f32:nhwc,f16:nhwc,f16:nhwc,cross,optimized,1,0,serial,1,none,tensorop,f32,64,64,32,10,2,2,1,16,8,16,80,1024,616595456,26409435136,42,1.94347,295.476,13588.8
1,CUTLASS,conv2d,cutlass_tensorop_s16816wgrad_optimized_f16_64x64_32x10_nhwc_align2,passed,success,wgrad,256,56,56,64,256,1,1,56,56,0,0,1,1,1,1,f16:nhwc,f32:nhwc,f16:nhwc,cross,optimized,1,0,serial,1,none,tensorop,f32,64,64,32,10,2,2,1,16,8,16,80,1024,513867776,26306707456,51,34.1135,14.029,771.153
1,CUTLASS,conv2d,cutlass_tensorop_s16816dgrad_optimized_f16_128x64_64x3_nhwc_unity_stride_align8,passed,success,dgrad,256,56,56,64,256,1,1,56,56,0,0,1,1,1,1,f32:nhwc,f16:nhwc,f16:nhwc,cross,optimized,1,0,serial,1,none,tensorop,f32,128,64,64,3,2,2,1,16,8,16,80,1024,616595456,26409435136,42,1.52781,375.865,17285.8
1,CUTLASS,conv2d,cutlass_tensorop_s16816wgrad_optimized_f16_128x64_64x3_nhwc_align8,passed,success,wgrad,256,56,56,64,256,1,1,56,56,0,0,1,1,1,1,f16:nhwc,f32:nhwc,f16:nhwc,cross,optimized,1,0,serial,1,none,tensorop,f32,128,64,64,3,2,2,1,16,8,16,80,1024,513867776,26306707456,51,17.0818,28.0168,1540.05
1,CUTLASS,conv2d,cutlass_tensorop_s16816dgrad_optimized_f16_128x64_64x3_nhwc_unity_stride_align4,passed,success,dgrad,256,56,56,64,256,1,1,56,56,0,0,1,1,1,1,f32:nhwc,f16:nhwc,f16:nhwc,cross,optimized,1,0,serial,1,none,tensorop,f32,128,64,64,3,2,2,1,16,8,16,80,1024,616595456,26409435136,42,1.50784,380.842,17514.7
1,CUTLASS,conv2d,cutlass_tensorop_s16816wgrad_optimized_f16_128x64_64x3_nhwc_align4,passed,success,wgrad,256,56,56,64,256,1,1,56,56,0,0,1,1,1,1,f16:nhwc,f32:nhwc,f16:nhwc,cross,optimized,1,0,serial,1,none,tensorop,f32,128,64,64,3,2,2,1,16,8,16,80,1024,513867776,26306707456,51,45.7316,10.4649,575.241
1,CUTLASS,conv2d,cutlass_tensorop_s16816dgrad_optimized_f16_128x64_64x3_nhwc_unity_stride_align2,passed,success,dgrad,256,56,56,64,256,1,1,56,56,0,0,1,1,1,1,f32:nhwc,f16:nhwc,f16:nhwc,cross,optimized,1,0,serial,1,none,tensorop,f32,128,64,64,3,2,2,1,16,8,16,80,1024,616595456,26409435136,42,4.3293,132.643,6100.17
1,CUTLASS,conv2d,cutlass_tensorop_s16816wgrad_optimized_f16_128x64_64x3_nhwc_align2,passed,success,wgrad,256,56,56,64,256,1,1,56,56,0,0,1,1,1,1,f16:nhwc,f32:nhwc,f16:nhwc,cross,optimized,1,0,serial,1,none,tensorop,f32,128,64,64,3,2,2,1,16,8,16,80,1024,513867776,26306707456,51,42.4001,11.2871,620.439
1,CUTLASS,conv2d,cutlass_tensorop_s16816dgrad_optimized_f16_64x128_64x3_nhwc_unity_stride_align8,passed,success,dgrad,256,56,56,64,256,1,1,56,56,0,0,1,1,1,1,f32:nhwc,f16:nhwc,f16:nhwc,cross,optimized,1,0,serial,1,none,tensorop,f32,64,128,64,3,2,2,1,16,8,16,80,1024,616595456,26409435136,42,1.74566,328.959,15128.7
1,CUTLASS,conv2d,cutlass_tensorop_s16816wgrad_optimized_f16_64x128_64x3_nhwc_align8,passed,success,wgrad,256,56,56,64,256,1,1,56,56,0,0,1,1,1,1,f16:nhwc,f32:nhwc,f16:nhwc,cross,optimized,1,0,serial,1,none,tensorop,f32,64,128,64,3,2,2,1,16,8,16,80,1024,513867776,26306707456,51,19.0975,25.0596,1377.49
1,CUTLASS,conv2d,cutlass_tensorop_s16816dgrad_optimized_f16_64x128_64x3_nhwc_unity_stride_align4,passed,success,dgrad,256,56,56,64,256,1,1,56,56,0,0,1,1,1,1,f32:nhwc,f16:nhwc,f16:nhwc,cross,optimized,1,0,serial,1,none,tensorop,f32,64,128,64,3,2,2,1,16,8,16,80,1024,616595456,26409435136,42,1.85937,308.841,14203.4
1,CUTLASS,conv2d,cutlass_tensorop_s16816wgrad_optimized_f16_64x128_64x3_nhwc_align4,passed,success,wgrad,256,56,56,64,256,1,1,56,56,0,0,1,1,1,1,f16:nhwc,f32:nhwc,f16:nhwc,cross,optimized,1,0,serial,1,none,tensorop,f32,64,128,64,3,2,2,1,16,8,16,80,1024,513867776,26306707456,51,39.0714,12.2488,673.298
1,CUTLASS,conv2d,cutlass_tensorop_s16816dgrad_optimized_f16_64x128_64x3_nhwc_unity_stride_align2,passed,success,dgrad,256,56,56,64,256,1,1,56,56,0,0,1,1,1,1,f32:nhwc,f16:nhwc,f16:nhwc,cross,optimized,1,0,serial,1,none,tensorop,f32,64,128,64,3,2,2,1,16,8,16,80,1024,616595456,26409435136,42,2.09431,274.194,12610.1
1,CUTLASS,conv2d,cutlass_tensorop_s16816wgrad_optimized_f16_64x128_64x3_nhwc_align2,passed,success,wgrad,256,56,56,64,256,1,1,56,56,0,0,1,1,1,1,f16:nhwc,f32:nhwc,f16:nhwc,cross,optimized,1,0,serial,1,none,tensorop,f32,64,128,64,3,2,2,1,16,8,16,80,1024,513867776,26306707456,51,223.325,2.14297,117.796
1,CUTLASS,conv2d,cutlass_tensorop_s16816dgrad_optimized_f16_64x64_64x5_nhwc_unity_stride_align8,passed,success,dgrad,256,56,56,64,256,1,1,56,56,0,0,1,1,1,1,f32:nhwc,f16:nhwc,f16:nhwc,cross,optimized,1,0,serial,1,none,tensorop,f32,64,64,64,5,2,2,1,16,8,16,80,1024,616595456,26409435136,42,1.51991,377.817,17375.6
1,CUTLASS,conv2d,cutlass_tensorop_s16816wgrad_optimized_f16_64x64_64x5_nhwc_align8,passed,success,wgrad,256,56,56,64,256,1,1,56,56,0,0,1,1,1,1,f16:nhwc,f32:nhwc,f16:nhwc,cross,optimized,1,0,serial,1,none,tensorop,f32,64,64,64,5,2,2,1,16,8,16,80,1024,513867776,26306707456,51,10.6277,45.0309,2475.29
1,CUTLASS,conv2d,cutlass_tensorop_s16816dgrad_optimized_f16_64x64_64x5_nhwc_unity_stride_align4,passed,success,dgrad,256,56,56,64,256,1,1,56,56,0,0,1,1,1,1,f32:nhwc,f16:nhwc,f16:nhwc,cross,optimized,1,0,serial,1,none,tensorop,f32,64,64,64,5,2,2,1,16,8,16,80,1024,616595456,26409435136,42,1.51683,378.585,17410.9
1,CUTLASS,conv2d,cutlass_tensorop_s16816wgrad_optimized_f16_64x64_64x5_nhwc_align4,passed,success,wgrad,256,56,56,64,256,1,1,56,56,0,0,1,1,1,1,f16:nhwc,f32:nhwc,f16:nhwc,cross,optimized,1,0,serial,1,none,tensorop,f32,64,64,64,5,2,2,1,16,8,16,80,1024,513867776,26306707456,51,20.0201,23.9048,1314.02
1,CUTLASS,conv2d,cutlass_tensorop_s16816dgrad_optimized_f16_64x64_64x5_nhwc_unity_stride_align2,passed,success,dgrad,256,56,56,64,256,1,1,56,56,0,0,1,1,1,1,f32:nhwc,f16:nhwc,f16:nhwc,cross,optimized,1,0,serial,1,none,tensorop,f32,64,64,64,5,2,2,1,16,8,16,80,1024,616595456,26409435136,42,1.67432,342.975,15773.2
1,CUTLASS,conv2d,cutlass_tensorop_s16816wgrad_optimized_f16_64x64_64x5_nhwc_align2,passed,success,wgrad,256,56,56,64,256,1,1,56,56,0,0,1,1,1,1,f16:nhwc,f32:nhwc,f16:nhwc,cross,optimized,1,0,serial,1,none,tensorop,f32,64,64,64,5,2,2,1,16,8,16,80,1024,513867776,26306707456,51,31.6913,15.1012,830.092
1,CUTLASS,conv2d,cutlass_tensorop_s1688dgrad_optimized_f16_256x128_32x2_nhwc_unity_stride_align8,passed,success,dgrad,256,56,56,64,64,1,1,56,56,0,0,1,1,1,1,f32:nhwc,f16:nhwc,f16:nhwc,cross,optimized,1,0,serial,1,none,tensorop,f32,256,128,32,2,4,2,1,16,8,8,75,1024,308289536,6679429120,21,0.773437,371.222,8636.03
1,CUTLASS,conv2d,cutlass_tensorop_s1688wgrad_optimized_f16_256x128_32x2_nhwc_align8,passed,success,wgrad,256,56,56,64,64,1,1,56,56,0,0,1,1,1,1,f16:nhwc,f32:nhwc,f16:nhwc,cross,optimized,1,0,serial,1,none,tensorop,f32,256,128,32,2,4,2,1,16,8,8,75,1024,205537280,6576676864,31,66.8827,2.86205,98.3315
1,CUTLASS,conv2d,cutlass_tensorop_s1688dgrad_optimized_f16_256x128_32x2_nhwc_unity_stride_align4,passed,success,dgrad,256,56,56,64,64,1,1,56,56,0,0,1,1,1,1,f32:nhwc,f16:nhwc,f16:nhwc,cross,optimized,1,0,serial,1,none,tensorop,f32,256,128,32,2,4,2,1,16,8,8,75,1024,308289536,6679429120,21,0.774052,370.927,8629.18
1,CUTLASS,conv2d,cutlass_tensorop_s1688wgrad_optimized_f16_256x128_32x2_nhwc_align4,passed,success,wgrad,256,56,56,64,64,1,1,56,56,0,0,1,1,1,1,f16:nhwc,f32:nhwc,f16:nhwc,cross,optimized,1,0,serial,1,none,tensorop,f32,256,128,32,2,4,2,1,16,8,8,75,1024,205537280,6576676864,31,60.2367,3.17782,109.181
1,CUTLASS,conv2d,cutlass_tensorop_s1688dgrad_optimized_f16_256x128_32x2_nhwc_unity_stride_align2,passed,success,dgrad,256,56,56,64,64,1,1,56,56,0,0,1,1,1,1,f32:nhwc,f16:nhwc,f16:nhwc,cross,optimized,1,0,serial,1,none,tensorop,f32,256,128,32,2,4,2,1,16,8,8,75,1024,308289536,6679429120,21,0.776896,369.569,8597.58
1,CUTLASS,conv2d,cutlass_tensorop_s1688wgrad_optimized_f16_256x128_32x2_nhwc_align2,passed,success,wgrad,256,56,56,64,64,1,1,56,56,0,0,1,1,1,1,f16:nhwc,f32:nhwc,f16:nhwc,cross,optimized,1,0,serial,1,none,tensorop,f32,256,128,32,2,4,2,1,16,8,8,75,1024,205537280,6576676864,31,101.479,1.88631,64.8081
1,CUTLASS,conv2d,cutlass_tensorop_s1688dgrad_optimized_f16_256x128_32x2_nhwc_unity_stride_align1,passed,success,dgrad,256,56,56,64,64,1,1,56,56,0,0,1,1,1,1,f32:nhwc,f16:nhwc,f16:nhwc,cross,optimized,1,0,serial,1,none,tensorop,f32,256,128,32,2,4,2,1,16,8,8,75,1024,308289536,6679429120,21,2.15343,133.33,3101.76
1,CUTLASS,conv2d,cutlass_tensorop_s1688wgrad_optimized_f16_256x128_32x2_nhwc_align1,passed,success,wgrad,256,56,56,64,64,1,1,56,56,0,0,1,1,1,1,f16:nhwc,f32:nhwc,f16:nhwc,cross,optimized,1,0,serial,1,none,tensorop,f32,256,128,32,2,4,2,1,16,8,8,75,1024,205537280,6576676864,31,124.72,1.53482,52.7317
1,CUTLASS,conv2d,cutlass_tensorop_s1688dgrad_optimized_f16_128x256_32x2_nhwc_unity_stride_align8,passed,success,dgrad,256,56,56,64,64,1,1,56,56,0,0,1,1,1,1,f32:nhwc,f16:nhwc,f16:nhwc,cross,optimized,1,0,serial,1,none,tensorop,f32,128,256,32,2,2,4,1,16,8,8,75,1024,308289536,6679429120,21,1.21059,237.171,5517.5
1,CUTLASS,conv2d,cutlass_tensorop_s1688wgrad_optimized_f16_128x256_32x2_nhwc_align8,passed,success,wgrad,256,56,56,64,64,1,1,56,56,0,0,1,1,1,1,f16:nhwc,f32:nhwc,f16:nhwc,cross,optimized,1,0,serial,1,none,tensorop,f32,128,256,32,2,2,4,1,16,8,8,75,1024,205537280,6576676864,31,68.6487,2.78842,95.8019
1,CUTLASS,conv2d,cutlass_tensorop_s1688dgrad_optimized_f16_128x256_32x2_nhwc_unity_stride_align4,passed,success,dgrad,256,56,56,64,64,1,1,56,56,0,0,1,1,1,1,f32:nhwc,f16:nhwc,f16:nhwc,cross,optimized,1,0,serial,1,none,tensorop,f32,128,256,32,2,2,4,1,16,8,8,75,1024,308289536,6679429120,21,1.2177,235.786,5485.28
1,CUTLASS,conv2d,cutlass_tensorop_s1688wgrad_optimized_f16_128x256_32x2_nhwc_align4,passed,success,wgrad,256,56,56,64,64,1,1,56,56,0,0,1,1,1,1,f16:nhwc,f32:nhwc,f16:nhwc,cross,optimized,1,0,serial,1,none,tensorop,f32,128,256,32,2,2,4,1,16,8,8,75,1024,205537280,6576676864,31,98.7913,1.93763,66.5714
1,CUTLASS,conv2d,cutlass_tensorop_s1688dgrad_optimized_f16_128x256_32x2_nhwc_unity_stride_align2,passed,success,dgrad,256,56,56,64,64,1,1,56,56,0,0,1,1,1,1,f32:nhwc,f16:nhwc,f16:nhwc,cross,optimized,1,0,serial,1,none,tensorop,f32,128,256,32,2,2,4,1,16,8,8,75,1024,308289536,6679429120,21,1.32364,216.914,5046.25
1,CUTLASS,conv2d,cutlass_tensorop_s1688wgrad_optimized_f16_128x256_32x2_nhwc_align2,passed,success,wgrad,256,56,56,64,64,1,1,56,56,0,0,1,1,1,1,f16:nhwc,f32:nhwc,f16:nhwc,cross,optimized,1,0,serial,1,none,tensorop,f32,128,256,32,2,2,4,1,16,8,8,75,1024,205537280,6576676864,31,111.12,1.72266,59.1855
1,CUTLASS,conv2d,cutlass_tensorop_s1688dgrad_optimized_f16_128x256_32x2_nhwc_unity_stride_align1,passed,success,dgrad,256,56,56,64,64,1,1,56,56,0,0,1,1,1,1,f32:nhwc,f16:nhwc,f16:nhwc,cross,optimized,1,0,serial,1,none,tensorop,f32,128,256,32,2,2,4,1,16,8,8,75,1024,308289536,6679429120,21,1.67566,171.345,3986.14
1,CUTLASS,conv2d,cutlass_tensorop_s1688wgrad_optimized_f16_128x256_32x2_nhwc_align1,passed,success,wgrad,256,56,56,64,64,1,1,56,56,0,0,1,1,1,1,f16:nhwc,f32:nhwc,f16:nhwc,cross,optimized,1,0,serial,1,none,tensorop,f32,128,256,32,2,2,4,1,16,8,8,75,1024,205537280,6576676864,31,416.485,0.459612,15.7909
1,CUTLASS,conv2d,cutlass_tensorop_s1688dgrad_optimized_f16_128x128_32x2_nhwc_unity_stride_align8,passed,success,dgrad,256,56,56,64,64,1,1,56,56,0,0,1,1,1,1,f32:nhwc,f16:nhwc,f16:nhwc,cross,optimized,1,0,serial,1,none,tensorop,f32,128,128,32,2,2,2,1,16,8,8,75,1024,308289536,6679429120,21,0.762122,376.734,8764.26
1,CUTLASS,conv2d,cutlass_tensorop_s1688wgrad_optimized_f16_128x128_32x2_nhwc_align8,passed,success,wgrad,256,56,56,64,64,1,1,56,56,0,0,1,1,1,1,f16:nhwc,f32:nhwc,f16:nhwc,cross,optimized,1,0,serial,1,none,tensorop,f32,128,128,32,2,2,2,1,16,8,8,75,1024,205537280,6576676864,31,40.8359,4.68758,161.051
1,CUTLASS,conv2d,cutlass_tensorop_s1688dgrad_optimized_f16_128x128_32x2_nhwc_unity_stride_align4,passed,success,dgrad,256,56,56,64,64,1,1,56,56,0,0,1,1,1,1,f32:nhwc,f16:nhwc,f16:nhwc,cross,optimized,1,0,serial,1,none,tensorop,f32,128,128,32,2,2,2,1,16,8,8,75,1024,308289536,6679429120,21,0.76384,375.886,8744.54
1,CUTLASS,conv2d,cutlass_tensorop_s1688wgrad_optimized_f16_128x128_32x2_nhwc_align4,passed,success,wgrad,256,56,56,64,64,1,1,56,56,0,0,1,1,1,1,f16:nhwc,f32:nhwc,f16:nhwc,cross,optimized,1,0,serial,1,none,tensorop,f32,128,128,32,2,2,2,1,16,8,8,75,1024,205537280,6576676864,31,66.8215,2.86467,98.4216
1,CUTLASS,conv2d,cutlass_tensorop_s1688dgrad_optimized_f16_128x128_32x2_nhwc_unity_stride_align2,passed,success,dgrad,256,56,56,64,64,1,1,56,56,0,0,1,1,1,1,f32:nhwc,f16:nhwc,f16:nhwc,cross,optimized,1,0,serial,1,none,tensorop,f32,128,128,32,2,2,2,1,16,8,8,75,1024,308289536,6679429120,21,0.774001,370.952,8629.75
1,CUTLASS,conv2d,cutlass_tensorop_s1688wgrad_optimized_f16_128x128_32x2_nhwc_align2,passed,success,wgrad,256,56,56,64,64,1,1,56,56,0,0,1,1,1,1,f16:nhwc,f32:nhwc,f16:nhwc,cross,optimized,1,0,serial,1,none,tensorop,f32,128,128,32,2,2,2,1,16,8,8,75,1024,205537280,6576676864,31,82.8148,2.31144,79.4143
1,CUTLASS,conv2d,cutlass_tensorop_s1688dgrad_optimized_f16_128x128_32x2_nhwc_unity_stride_align1,passed,success,dgrad,256,56,56,64,64,1,1,56,56,0,0,1,1,1,1,f32:nhwc,f16:nhwc,f16:nhwc,cross,optimized,1,0,serial,1,none,tensorop,f32,128,128,32,2,2,2,1,16,8,8,75,1024,308289536,6679429120,21,3.73212,76.9313,1789.71
1,CUTLASS,conv2d,cutlass_tensorop_s1688wgrad_optimized_f16_128x128_32x2_nhwc_align1,passed,success,wgrad,256,56,56,64,64,1,1,56,56,0,0,1,1,1,1,f16:nhwc,f32:nhwc,f16:nhwc,cross,optimized,1,0,serial,1,none,tensorop,f32,128,128,32,2,2,2,1,16,8,8,75,1024,205537280,6576676864,31,463.406,0.413075,14.192
1,CUTLASS,conv2d,cutlass_tensorop_s1688dgrad_optimized_f16_64x128_32x2_nhwc_unity_stride_align8,passed,success,dgrad,256,56,56,64,64,1,1,56,56,0,0,1,1,1,1,f32:nhwc,f16:nhwc,f16:nhwc,cross,optimized,1,0,serial,1,none,tensorop,f32,64,128,32,2,2,2,1,16,8,8,75,1024,308289536,6679429120,21,0.760699,377.438,8780.65
1,CUTLASS,conv2d,cutlass_tensorop_s1688wgrad_optimized_f16_64x128_32x2_nhwc_align8,passed,success,wgrad,256,56,56,64,64,1,1,56,56,0,0,1,1,1,1,f16:nhwc,f32:nhwc,f16:nhwc,cross,optimized,1,0,serial,1,none,tensorop,f32,64,128,32,2,2,2,1,16,8,8,75,1024,205537280,6576676864,31,26.0792,7.34,252.181
1,CUTLASS,conv2d,cutlass_tensorop_s1688dgrad_optimized_f16_64x128_32x2_nhwc_unity_stride_align4,passed,success,dgrad,256,56,56,64,64,1,1,56,56,0,0,1,1,1,1,f32:nhwc,f16:nhwc,f16:nhwc,cross,optimized,1,0,serial,1,none,tensorop,f32,64,128,32,2,2,2,1,16,8,8,75,1024,308289536,6679429120,21,0.760433,377.571,8783.72
1,CUTLASS,conv2d,cutlass_tensorop_s1688wgrad_optimized_f16_64x128_32x2_nhwc_align4,passed,success,wgrad,256,56,56,64,64,1,1,56,56,0,0,1,1,1,1,f16:nhwc,f32:nhwc,f16:nhwc,cross,optimized,1,0,serial,1,none,tensorop,f32,64,128,32,2,2,2,1,16,8,8,75,1024,205537280,6576676864,31,34.2023,5.59674,192.287
1,CUTLASS,conv2d,cutlass_tensorop_s1688dgrad_optimized_f16_64x128_32x2_nhwc_unity_stride_align2,passed,success,dgrad,256,56,56,64,64,1,1,56,56,0,0,1,1,1,1,f32:nhwc,f16:nhwc,f16:nhwc,cross,optimized,1,0,serial,1,none,tensorop,f32,64,128,32,2,2,2,1,16,8,8,75,1024,308289536,6679429120,21,0.760842,377.367,8778.99
1,CUTLASS,conv2d,cutlass_tensorop_s1688wgrad_optimized_f16_64x128_32x2_nhwc_align2,passed,success,wgrad,256,56,56,64,64,1,1,56,56,0,0,1,1,1,1,f16:nhwc,f32:nhwc,f16:nhwc,cross,optimized,1,0,serial,1,none,tensorop,f32,64,128,32,2,2,2,1,16,8,8,75,1024,205537280,6576676864,31,65.3544,2.92898,100.631
1,CUTLASS,conv2d,cutlass_tensorop_s1688dgrad_optimized_f16_64x128_32x2_nhwc_unity_stride_align1,passed,success,dgrad,256,56,56,64,64,1,1,56,56,0,0,1,1,1,1,f32:nhwc,f16:nhwc,f16:nhwc,cross,optimized,1,0,serial,1,none,tensorop,f32,64,128,32,2,2,2,1,16,8,8,75,1024,308289536,6679429120,21,0.988928,290.332,6754.21
1,CUTLASS,conv2d,cutlass_tensorop_s1688wgrad_optimized_f16_64x128_32x2_nhwc_align1,passed,success,wgrad,256,56,56,64,64,1,1,56,56,0,0,1,1,1,1,f16:nhwc,f32:nhwc,f16:nhwc,cross,optimized,1,0,serial,1,none,tensorop,f32,64,128,32,2,2,2,1,16,8,8,75,1024,205537280,6576676864,31,284.829,0.672058,23.0899
1,CUTLASS,conv2d,cutlass_tensorop_s1688dgrad_optimized_f16_128x64_32x2_nhwc_unity_stride_align8,passed,success,dgrad,256,56,56,64,64,1,1,56,56,0,0,1,1,1,1,f32:nhwc,f16:nhwc,f16:nhwc,cross,optimized,1,0,serial,1,none,tensorop,f32,128,64,32,2,2,2,1,16,8,8,75,1024,308289536,6679429120,21,0.760043,377.764,8788.22
1,CUTLASS,conv2d,cutlass_tensorop_s1688wgrad_optimized_f16_128x64_32x2_nhwc_align8,passed,success,wgrad,256,56,56,64,64,1,1,56,56,0,0,1,1,1,1,f16:nhwc,f32:nhwc,f16:nhwc,cross,optimized,1,0,serial,1,none,tensorop,f32,128,64,32,2,2,2,1,16,8,8,75,1024,205537280,6576676864,31,24.6876,7.75374,266.396
1,CUTLASS,conv2d,cutlass_tensorop_s1688dgrad_optimized_f16_128x64_32x2_nhwc_unity_stride_align4,passed,success,dgrad,256,56,56,64,64,1,1,56,56,0,0,1,1,1,1,f32:nhwc,f16:nhwc,f16:nhwc,cross,optimized,1,0,serial,1,none,tensorop,f32,128,64,32,2,2,2,1,16,8,8,75,1024,308289536,6679429120,21,0.760156,377.708,8786.92
1,CUTLASS,conv2d,cutlass_tensorop_s1688wgrad_optimized_f16_128x64_32x2_nhwc_align4,passed,success,wgrad,256,56,56,64,64,1,1,56,56,0,0,1,1,1,1,f16:nhwc,f32:nhwc,f16:nhwc,cross,optimized,1,0,serial,1,none,tensorop,f32,128,64,32,2,2,2,1,16,8,8,75,1024,205537280,6576676864,31,28.7985,6.64692,228.369
1,CUTLASS,conv2d,cutlass_tensorop_s1688dgrad_optimized_f16_128x64_32x2_nhwc_unity_stride_align2,passed,success,dgrad,256,56,56,64,64,1,1,56,56,0,0,1,1,1,1,f32:nhwc,f16:nhwc,f16:nhwc,cross,optimized,1,0,serial,1,none,tensorop,f32,128,64,32,2,2,2,1,16,8,8,75,1024,308289536,6679429120,21,0.761324,377.129,8773.44
1,CUTLASS,conv2d,cutlass_tensorop_s1688wgrad_optimized_f16_128x64_32x2_nhwc_align2,passed,success,wgrad,256,56,56,64,64,1,1,56,56,0,0,1,1,1,1,f16:nhwc,f32:nhwc,f16:nhwc,cross,optimized,1,0,serial,1,none,tensorop,f32,128,64,32,2,2,2,1,16,8,8,75,1024,205537280,6576676864,31,33.4358,5.72505,196.696
1,CUTLASS,conv2d,cutlass_tensorop_s1688dgrad_optimized_f16_128x64_32x2_nhwc_unity_stride_align1,passed,success,dgrad,256,56,56,64,64,1,1,56,56,0,0,1,1,1,1,f32:nhwc,f16:nhwc,f16:nhwc,cross,optimized,1,0,serial,1,none,tensorop,f32,128,64,32,2,2,2,1,16,8,8,75,1024,308289536,6679429120,21,0.765542,375.05,8725.09
1,CUTLASS,conv2d,cutlass_tensorop_s1688wgrad_optimized_f16_128x64_32x2_nhwc_align1,passed,success,wgrad,256,56,56,64,64,1,1,56,56,0,0,1,1,1,1,f16:nhwc,f32:nhwc,f16:nhwc,cross,optimized,1,0,serial,1,none,tensorop,f32,128,64,32,2,2,2,1,16,8,8,75,1024,205537280,6576676864,31,105.823,1.80889,62.148
1,CUTLASS,conv2d,cutlass_tensorop_s1688dgrad_optimized_f16_64x64_32x2_nhwc_unity_stride_align8,passed,success,dgrad,256,56,56,64,64,1,1,56,56,0,0,1,1,1,1,f32:nhwc,f16:nhwc,f16:nhwc,cross,optimized,1,0,serial,1,none,tensorop,f32,64,64,32,2,2,2,1,16,8,8,75,1024,308289536,6679429120,21,0.759757,377.906,8791.54
1,CUTLASS,conv2d,cutlass_tensorop_s1688wgrad_optimized_f16_64x64_32x2_nhwc_align8,passed,success,wgrad,256,56,56,64,64,1,1,56,56,0,0,1,1,1,1,f16:nhwc,f32:nhwc,f16:nhwc,cross,optimized,1,0,serial,1,none,tensorop,f32,64,64,32,2,2,2,1,16,8,8,75,1024,205537280,6576676864,31,15.213,12.5828,432.307
1,CUTLASS,conv2d,cutlass_tensorop_s1688dgrad_optimized_f16_64x64_32x2_nhwc_unity_stride_align4,passed,success,dgrad,256,56,56,64,64,1,1,56,56,0,0,1,1,1,1,f32:nhwc,f16:nhwc,f16:nhwc,cross,optimized,1,0,serial,1,none,tensorop,f32,64,64,32,2,2,2,1,16,8,8,75,1024,308289536,6679429120,21,0.759921,377.825,8789.64
1,CUTLASS,conv2d,cutlass_tensorop_s1688wgrad_optimized_f16_64x64_32x2_nhwc_align4,passed,success,wgrad,256,56,56,64,64,1,1,56,56,0,0,1,1,1,1,f16:nhwc,f32:nhwc,f16:nhwc,cross,optimized,1,0,serial,1,none,tensorop,f32,64,64,32,2,2,2,1,16,8,8,75,1024,205537280,6576676864,31,21.8972,8.74182,300.343
1,CUTLASS,conv2d,cutlass_tensorop_s1688dgrad_optimized_f16_64x64_32x2_nhwc_unity_stride_align2,passed,success,dgrad,256,56,56,64,64,1,1,56,56,0,0,1,1,1,1,f32:nhwc,f16:nhwc,f16:nhwc,cross,optimized,1,0,serial,1,none,tensorop,f32,64,64,32,2,2,2,1,16,8,8,75,1024,308289536,6679429120,21,0.760023,377.774,8788.46
1,CUTLASS,conv2d,cutlass_tensorop_s1688wgrad_optimized_f16_64x64_32x2_nhwc_align2,passed,success,wgrad,256,56,56,64,64,1,1,56,56,0,0,1,1,1,1,f16:nhwc,f32:nhwc,f16:nhwc,cross,optimized,1,0,serial,1,none,tensorop,f32,64,64,32,2,2,2,1,16,8,8,75,1024,205537280,6576676864,31,27.1651,7.04659,242.1
1,CUTLASS,conv2d,cutlass_tensorop_s1688dgrad_optimized_f16_64x64_32x2_nhwc_unity_stride_align1,passed,success,dgrad,256,56,56,64,64,1,1,56,56,0,0,1,1,1,1,f32:nhwc,f16:nhwc,f16:nhwc,cross,optimized,1,0,serial,1,none,tensorop,f32,64,64,32,2,2,2,1,16,8,8,75,1024,308289536,6679429120,21,0.76245,376.572,8760.48
1,CUTLASS,conv2d,cutlass_tensorop_s1688wgrad_optimized_f16_64x64_32x2_nhwc_align1,passed,success,wgrad,256,56,56,64,64,1,1,56,56,0,0,1,1,1,1,f16:nhwc,f32:nhwc,f16:nhwc,cross,optimized,1,0,serial,1,none,tensorop,f32,64,64,32,2,2,2,1,16,8,8,75,1024,205537280,6576676864,31,50.9068,3.76023,129.19
1,CUTLASS,conv2d,cutlass_tensorop_s1688dgrad_optimized_f16_64x128_64x2_nhwc_unity_stride_align8,passed,success,dgrad,256,56,56,64,64,1,1,56,56,0,0,1,1,1,1,f32:nhwc,f16:nhwc,f16:nhwc,cross,optimized,1,0,serial,1,none,tensorop,f32,64,128,64,2,1,2,2,16,8,8,75,1024,308289536,6679429120,21,0.766085,374.785,8718.91
1,CUTLASS,conv2d,cutlass_tensorop_s1688wgrad_optimized_f16_64x128_64x2_nhwc_align8,passed,success,wgrad,256,56,56,64,64,1,1,56,56,0,0,1,1,1,1,f16:nhwc,f32:nhwc,f16:nhwc,cross,optimized,1,0,serial,1,none,tensorop,f32,64,128,64,2,1,2,2,16,8,8,75,1024,205537280,6576676864,31,18.2391,10.4951,360.581
1,CUTLASS,conv2d,cutlass_tensorop_s1688dgrad_optimized_f16_64x128_64x2_nhwc_unity_stride_align4,passed,success,dgrad,256,56,56,64,64,1,1,56,56,0,0,1,1,1,1,f32:nhwc,f16:nhwc,f16:nhwc,cross,optimized,1,0,serial,1,none,tensorop,f32,64,128,64,2,1,2,2,16,8,8,75,1024,308289536,6679429120,21,0.76329,376.157,8750.85
1,CUTLASS,conv2d,cutlass_tensorop_s1688wgrad_optimized_f16_64x128_64x2_nhwc_align4,passed,success,wgrad,256,56,56,64,64,1,1,56,56,0,0,1,1,1,1,f16:nhwc,f32:nhwc,f16:nhwc,cross,optimized,1,0,serial,1,none,tensorop,f32,64,128,64,2,1,2,2,16,8,8,75,1024,205537280,6576676864,31,73.7222,2.59652,89.2089
1,CUTLASS,conv2d,cutlass_tensorop_s1688dgrad_optimized_f16_64x128_64x2_nhwc_unity_stride_align2,passed,success,dgrad,256,56,56,64,64,1,1,56,56,0,0,1,1,1,1,f32:nhwc,f16:nhwc,f16:nhwc,cross,optimized,1,0,serial,1,none,tensorop,f32,64,128,64,2,1,2,2,16,8,8,75,1024,308289536,6679429120,21,0.967926,296.631,6900.77
1,CUTLASS,conv2d,cutlass_tensorop_s1688wgrad_optimized_f16_64x128_64x2_nhwc_align2,passed,success,wgrad,256,56,56,64,64,1,1,56,56,0,0,1,1,1,1,f16:nhwc,f32:nhwc,f16:nhwc,cross,optimized,1,0,serial,1,none,tensorop,f32,64,128,64,2,1,2,2,16,8,8,75,1024,205537280,6576676864,31,236.198,0.810428,27.8439
1,CUTLASS,conv2d,cutlass_tensorop_s1688dgrad_optimized_f16_64x128_64x2_nhwc_unity_stride_align1,passed,success,dgrad,256,56,56,64,64,1,1,56,56,0,0,1,1,1,1,f32:nhwc,f16:nhwc,f16:nhwc,cross,optimized,1,0,serial,1,none,tensorop,f32,64,128,64,2,1,2,2,16,8,8,75,1024,308289536,6679429120,21,5.13144,55.9525,1301.67
1,CUTLASS,conv2d,cutlass_tensorop_s1688wgrad_optimized_f16_64x128_64x2_nhwc_align1,passed,success,wgrad,256,56,56,64,64,1,1,56,56,0,0,1,1,1,1,f16:nhwc,f32:nhwc,f16:nhwc,cross,optimized,1,0,serial,1,none,tensorop,f32,64,128,64,2,1,2,2,16,8,8,75,1024,205537280,6576676864,31,411.847,0.464788,15.9687
1,CUTLASS,conv2d,cutlass_tensorop_s16816dgrad_optimized_f16_256x128_32x3_nhwc_unity_stride_align8,passed,success,dgrad,256,56,56,64,64,1,1,56,56,0,0,1,1,1,1,f32:nhwc,f16:nhwc,f16:nhwc,cross,optimized,1,0,serial,1,none,tensorop,f32,256,128,32,3,4,2,1,16,8,16,80,1024,308289536,6679429120,21,0.787773,364.466,8478.87
1,CUTLASS,conv2d,cutlass_tensorop_s16816wgrad_optimized_f16_256x128_32x3_nhwc_align8,passed,success,wgrad,256,56,56,64,64,1,1,56,56,0,0,1,1,1,1,f16:nhwc,f32:nhwc,f16:nhwc,cross,optimized,1,0,serial,1,none,tensorop,f32,256,128,32,3,4,2,1,16,8,16,80,1024,205537280,6576676864,31,56.4098,3.39341,116.587
1,CUTLASS,conv2d,cutlass_tensorop_s16816dgrad_optimized_f16_256x128_32x3_nhwc_unity_stride_align4,passed,success,dgrad,256,56,56,64,64,1,1,56,56,0,0,1,1,1,1,f32:nhwc,f16:nhwc,f16:nhwc,cross,optimized,1,0,serial,1,none,tensorop,f32,256,128,32,3,4,2,1,16,8,16,80,1024,308289536,6679429120,21,0.787395,364.642,8482.95
1,CUTLASS,conv2d,cutlass_tensorop_s16816wgrad_optimized_f16_256x128_32x3_nhwc_align4,passed,success,wgrad,256,56,56,64,64,1,1,56,56,0,0,1,1,1,1,f16:nhwc,f32:nhwc,f16:nhwc,cross,optimized,1,0,serial,1,none,tensorop,f32,256,128,32,3,4,2,1,16,8,16,80,1024,205537280,6576676864,31,59.1087,3.23847,111.264
1,CUTLASS,conv2d,cutlass_tensorop_s16816dgrad_optimized_f16_256x128_32x3_nhwc_unity_stride_align2,passed,success,dgrad,256,56,56,64,64,1,1,56,56,0,0,1,1,1,1,f32:nhwc,f16:nhwc,f16:nhwc,cross,optimized,1,0,serial,1,none,tensorop,f32,256,128,32,3,4,2,1,16,8,16,80,1024,308289536,6679429120,21,0.805673,356.369,8290.5
1,CUTLASS,conv2d,cutlass_tensorop_s16816wgrad_optimized_f16_256x128_32x3_nhwc_align2,passed,success,wgrad,256,56,56,64,64,1,1,56,56,0,0,1,1,1,1,f16:nhwc,f32:nhwc,f16:nhwc,cross,optimized,1,0,serial,1,none,tensorop,f32,256,128,32,3,4,2,1,16,8,16,80,1024,205537280,6576676864,31,104.725,1.82785,62.7995
1,CUTLASS,conv2d,cutlass_tensorop_s16816dgrad_optimized_f16_128x256_32x3_nhwc_unity_stride_align8,passed,success,dgrad,256,56,56,64,64,1,1,56,56,0,0,1,1,1,1,f32:nhwc,f16:nhwc,f16:nhwc,cross,optimized,1,0,serial,1,none,tensorop,f32,128,256,32,3,2,4,1,16,8,16,80,1024,308289536,6679429120,21,1.18258,242.789,5648.2
1,CUTLASS,conv2d,cutlass_tensorop_s16816wgrad_optimized_f16_128x256_32x3_nhwc_align8,passed,success,wgrad,256,56,56,64,64,1,1,56,56,0,0,1,1,1,1,f16:nhwc,f32:nhwc,f16:nhwc,cross,optimized,1,0,serial,1,none,tensorop,f32,128,256,32,3,2,4,1,16,8,16,80,1024,205537280,6576676864,31,57.9703,3.30206,113.449
1,CUTLASS,conv2d,cutlass_tensorop_s16816dgrad_optimized_f16_128x256_32x3_nhwc_unity_stride_align4,passed,success,dgrad,256,56,56,64,64,1,1,56,56,0,0,1,1,1,1,f32:nhwc,f16:nhwc,f16:nhwc,cross,optimized,1,0,serial,1,none,tensorop,f32,128,256,32,3,2,4,1,16,8,16,80,1024,308289536,6679429120,21,1.18433,242.43,5639.85
1,CUTLASS,conv2d,cutlass_tensorop_s16816wgrad_optimized_f16_128x256_32x3_nhwc_align4,passed,success,wgrad,256,56,56,64,64,1,1,56,56,0,0,1,1,1,1,f16:nhwc,f32:nhwc,f16:nhwc,cross,optimized,1,0,serial,1,none,tensorop,f32,128,256,32,3,2,4,1,16,8,16,80,1024,205537280,6576676864,31,74.3925,2.57313,88.4052
1,CUTLASS,conv2d,cutlass_tensorop_s16816dgrad_optimized_f16_128x256_32x3_nhwc_unity_stride_align2,passed,success,dgrad,256,56,56,64,64,1,1,56,56,0,0,1,1,1,1,f32:nhwc,f16:nhwc,f16:nhwc,cross,optimized,1,0,serial,1,none,tensorop,f32,128,256,32,3,2,4,1,16,8,16,80,1024,308289536,6679429120,21,1.32259,217.087,5050.27
1,CUTLASS,conv2d,cutlass_tensorop_s16816wgrad_optimized_f16_128x256_32x3_nhwc_align2,passed,success,wgrad,256,56,56,64,64,1,1,56,56,0,0,1,1,1,1,f16:nhwc,f32:nhwc,f16:nhwc,cross,optimized,1,0,serial,1,none,tensorop,f32,128,256,32,3,2,4,1,16,8,16,80,1024,205537280,6576676864,31,101.531,1.88535,64.7749
1,CUTLASS,conv2d,cutlass_tensorop_s16816dgrad_optimized_f16_256x64_32x4_nhwc_unity_stride_align8,passed,success,dgrad,256,56,56,64,64,1,1,56,56,0,0,1,1,1,1,f32:nhwc,f16:nhwc,f16:nhwc,cross,optimized,1,0,serial,1,none,tensorop,f32,256,64,32,4,4,1,1,16,8,16,80,1024,308289536,6679429120,21,0.777984,369.053,8585.56
1,CUTLASS,conv2d,cutlass_tensorop_s16816wgrad_optimized_f16_256x64_32x4_nhwc_align8,passed,success,wgrad,256,56,56,64,64,1,1,56,56,0,0,1,1,1,1,f16:nhwc,f32:nhwc,f16:nhwc,cross,optimized,1,0,serial,1,none,tensorop,f32,256,64,32,4,4,1,1,16,8,16,80,1024,205537280,6576676864,31,31.2629,6.12296,210.367
1,CUTLASS,conv2d,cutlass_tensorop_s16816dgrad_optimized_f16_256x64_32x4_nhwc_unity_stride_align4,passed,success,dgrad,256,56,56,64,64,1,1,56,56,0,0,1,1,1,1,f32:nhwc,f16:nhwc,f16:nhwc,cross,optimized,1,0,serial,1,none,tensorop,f32,256,64,32,4,4,1,1,16,8,16,80,1024,308289536,6679429120,21,0.864983,331.934,7722.03
1,CUTLASS,conv2d,cutlass_tensorop_s16816wgrad_optimized_f16_256x64_32x4_nhwc_align4,passed,success,wgrad,256,56,56,64,64,1,1,56,56,0,0,1,1,1,1,f16:nhwc,f32:nhwc,f16:nhwc,cross,optimized,1,0,serial,1,none,tensorop,f32,256,64,32,4,4,1,1,16,8,16,80,1024,205537280,6576676864,31,39.7179,4.81952,165.585
1,CUTLASS,conv2d,cutlass_tensorop_s16816dgrad_optimized_f16_256x64_32x4_nhwc_unity_stride_align2,passed,success,dgrad,256,56,56,64,64,1,1,56,56,0,0,1,1,1,1,f32:nhwc,f16:nhwc,f16:nhwc,cross,optimized,1,0,serial,1,none,tensorop,f32,256,64,32,4,4,1,1,16,8,16,80,1024,308289536,6679429120,21,3.85305,74.5168,1733.54
