conv2d/resnet50_cutlass_profiler_result_fp16_fp32_accum.csv
Problem,Provider,OperationKind,Operation,Disposition,Status,conv_kind,n,h,w,c,k,r,s,p,q,pad_h,pad_w,stride_h,stride_w,dilation_h,dilation_w,Activation,Filter,Output,conv_mode,iterator_algorithm,alpha,beta,split_k_mode,split_k_slices,eq_gemm_provider,op_class,accum,cta_m,cta_n,cta_k,stages,warps_m,warps_n,warps_k,inst_m,inst_n,inst_k,min_cc,max_cc,Bytes,Flops,Flops/Byte,Runtime,GB/s,GFLOPs
1,CUTLASS,conv2d,cutlass_tensorop_s1688fprop_optimized_f16_256x128_32x2_nhwc_align8,passed,success,fprop,256,56,56,64,256,1,1,56,56,0,0,1,1,1,1,f16:nhwc,f16:nhwc,f32:nhwc,cross,optimized,1,0,serial,1,none,tensorop,f32,256,128,32,2,4,2,1,16,8,8,75,1024,924876800,26717716480,28,2.32669,370.208,11483.2
1,CUTLASS,conv2d,cutlass_tensorop_s1688fprop_optimized_f16_256x128_32x2_nhwc_align4,passed,success,fprop,256,56,56,64,256,1,1,56,56,0,0,1,1,1,1,f16:nhwc,f16:nhwc,f32:nhwc,cross,optimized,1,0,serial,1,none,tensorop,f32,256,128,32,2,4,2,1,16,8,8,75,1024,924876800,26717716480,28,2.3196,371.34,11518.3
1,CUTLASS,conv2d,cutlass_tensorop_s1688fprop_optimized_f16_256x128_32x2_nhwc_align2,passed,success,fprop,256,56,56,64,256,1,1,56,56,0,0,1,1,1,1,f16:nhwc,f16:nhwc,f32:nhwc,cross,optimized,1,0,serial,1,none,tensorop,f32,256,128,32,2,4,2,1,16,8,8,75,1024,924876800,26717716480,28,2.31981,371.306,11517.2
1,CUTLASS,conv2d,cutlass_tensorop_s1688fprop_optimized_f16_256x128_32x2_nhwc_align8,passed,success,fprop,256,56,56,64,256,1,1,56,56,0,0,1,1,1,1,f16:nhwc,f16:nhwc,f32:nhwc,cross,optimized,1,0,serial,1,none,tensorop,f32,256,128,32,2,4,2,1,16,8,8,75,1024,924876800,26717716480,28,2.32324,370.758,11500.2
1,CUTLASS,conv2d,cutlass_tensorop_s1688fprop_optimized_f16_256x128_32x2_nhwc_align4,passed,success,fprop,256,56,56,64,256,1,1,56,56,0,0,1,1,1,1,f16:nhwc,f16:nhwc,f32:nhwc,cross,optimized,1,0,serial,1,none,tensorop,f32,256,128,32,2,4,2,1,16,8,8,75,1024,924876800,26717716480,28,2.3198,371.307,11517.2
1,CUTLASS,conv2d,cutlass_tensorop_s1688fprop_optimized_f16_256x128_32x2_nhwc_align2,passed,success,fprop,256,56,56,64,256,1,1,56,56,0,0,1,1,1,1,f16:nhwc,f16:nhwc,f32:nhwc,cross,optimized,1,0,serial,1,none,tensorop,f32,256,128,32,2,4,2,1,16,8,8,75,1024,924876800,26717716480,28,2.32003,371.271,11516.1
1,CUTLASS,conv2d,cutlass_tensorop_s1688fprop_optimized_f16_256x128_32x2_nhwc_align1,passed,success,fprop,256,56,56,64,256,1,1,56,56,0,0,1,1,1,1,f16:nhwc,f16:nhwc,f32:nhwc,cross,optimized,1,0,serial,1,none,tensorop,f32,256,128,32,2,4,2,1,16,8,8,75,1024,924876800,26717716480,28,6.00943,143.335,4445.97
1,CUTLASS,conv2d,cutlass_tensorop_s1688fprop_optimized_f16_128x256_32x2_nhwc_align8,passed,success,fprop,256,56,56,64,256,1,1,56,56,0,0,1,1,1,1,f16:nhwc,f16:nhwc,f32:nhwc,cross,optimized,1,0,serial,1,none,tensorop,f32,128,256,32,2,2,4,1,16,8,8,75,1024,924876800,26717716480,28,2.31671,371.803,11532.6
1,CUTLASS,conv2d,cutlass_tensorop_s1688fprop_optimized_f16_128x256_32x2_nhwc_align4,passed,success,fprop,256,56,56,64,256,1,1,56,56,0,0,1,1,1,1,f16:nhwc,f16:nhwc,f32:nhwc,cross,optimized,1,0,serial,1,none,tensorop,f32,128,256,32,2,2,4,1,16,8,8,75,1024,924876800,26717716480,28,2.31719,371.726,11530.2
1,CUTLASS,conv2d,cutlass_tensorop_s1688fprop_optimized_f16_128x256_32x2_nhwc_align2,passed,success,fprop,256,56,56,64,256,1,1,56,56,0,0,1,1,1,1,f16:nhwc,f16:nhwc,f32:nhwc,cross,optimized,1,0,serial,1,none,tensorop,f32,128,256,32,2,2,4,1,16,8,8,75,1024,924876800,26717716480,28,2.32084,371.14,11512.1
1,CUTLASS,conv2d,cutlass_tensorop_s1688fprop_optimized_f16_128x256_32x2_nhwc_align1,passed,success,fprop,256,56,56,64,256,1,1,56,56,0,0,1,1,1,1,f16:nhwc,f16:nhwc,f32:nhwc,cross,optimized,1,0,serial,1,none,tensorop,f32,128,256,32,2,2,4,1,16,8,8,75,1024,924876800,26717716480,28,2.71102,317.725,9855.23
1,CUTLASS,conv2d,cutlass_tensorop_s1688fprop_optimized_f16_128x128_32x2_nhwc_align8,passed,success,fprop,256,56,56,64,256,1,1,56,56,0,0,1,1,1,1,f16:nhwc,f16:nhwc,f32:nhwc,cross,optimized,1,0,serial,1,none,tensorop,f32,128,128,32,2,2,2,1,16,8,8,75,1024,924876800,26717716480,28,2.30692,373.381,11581.6
1,CUTLASS,conv2d,cutlass_tensorop_s1688fprop_optimized_f16_128x128_32x2_nhwc_align4,passed,success,fprop,256,56,56,64,256,1,1,56,56,0,0,1,1,1,1,f16:nhwc,f16:nhwc,f32:nhwc,cross,optimized,1,0,serial,1,none,tensorop,f32,128,128,32,2,2,2,1,16,8,8,75,1024,924876800,26717716480,28,2.3077,373.255,11577.7
1,CUTLASS,conv2d,cutlass_tensorop_s1688fprop_optimized_f16_128x128_32x2_nhwc_align2,passed,success,fprop,256,56,56,64,256,1,1,56,56,0,0,1,1,1,1,f16:nhwc,f16:nhwc,f32:nhwc,cross,optimized,1,0,serial,1,none,tensorop,f32,128,128,32,2,2,2,1,16,8,8,75,1024,924876800,26717716480,28,2.30906,373.035,11570.8
1,CUTLASS,conv2d,cutlass_tensorop_s1688fprop_optimized_f16_128x128_32x2_nhwc_align1,passed,success,fprop,256,56,56,64,256,1,1,56,56,0,0,1,1,1,1,f16:nhwc,f16:nhwc,f32:nhwc,cross,optimized,1,0,serial,1,none,tensorop,f32,128,128,32,2,2,2,1,16,8,8,75,1024,924876800,26717716480,28,6.42559,134.051,4158.02
1,CUTLASS,conv2d,cutlass_tensorop_s1688fprop_optimized_f16_64x128_32x2_nhwc_align8,passed,success,fprop,256,56,56,64,256,1,1,56,56,0,0,1,1,1,1,f16:nhwc,f16:nhwc,f32:nhwc,cross,optimized,1,0,serial,1,none,tensorop,f32,64,128,32,2,2,2,1,16,8,8,75,1024,924876800,26717716480,28,2.30265,374.073,11603
1,CUTLASS,conv2d,cutlass_tensorop_s1688fprop_optimized_f16_64x128_32x2_nhwc_align4,passed,success,fprop,256,56,56,64,256,1,1,56,56,0,0,1,1,1,1,f16:nhwc,f16:nhwc,f32:nhwc,cross,optimized,1,0,serial,1,none,tensorop,f32,64,128,32,2,2,2,1,16,8,8,75,1024,924876800,26717716480,28,2.30299,374.017,11601.3
1,CUTLASS,conv2d,cutlass_tensorop_s1688fprop_optimized_f16_64x128_32x2_nhwc_align2,passed,success,fprop,256,56,56,64,256,1,1,56,56,0,0,1,1,1,1,f16:nhwc,f16:nhwc,f32:nhwc,cross,optimized,1,0,serial,1,none,tensorop,f32,64,128,32,2,2,2,1,16,8,8,75,1024,924876800,26717716480,28,2.30405,373.845,11596
1,CUTLASS,conv2d,cutlass_tensorop_s1688fprop_optimized_f16_64x128_32x2_nhwc_align1,passed,success,fprop,256,56,56,64,256,1,1,56,56,0,0,1,1,1,1,f16:nhwc,f16:nhwc,f32:nhwc,cross,optimized,1,0,serial,1,none,tensorop,f32,64,128,32,2,2,2,1,16,8,8,75,1024,924876800,26717716480,28,2.46893,348.88,10821.6
1,CUTLASS,conv2d,cutlass_tensorop_s1688fprop_optimized_f16_128x64_32x2_nhwc_align8,passed,success,fprop,256,56,56,64,256,1,1,56,56,0,0,1,1,1,1,f16:nhwc,f16:nhwc,f32:nhwc,cross,optimized,1,0,serial,1,none,tensorop,f32,128,64,32,2,2,2,1,16,8,8,75,1024,924876800,26717716480,28,2.3039,373.87,11596.7
1,CUTLASS,conv2d,cutlass_tensorop_s1688fprop_optimized_f16_128x64_32x2_nhwc_align4,passed,success,fprop,256,56,56,64,256,1,1,56,56,0,0,1,1,1,1,f16:nhwc,f16:nhwc,f32:nhwc,cross,optimized,1,0,serial,1,none,tensorop,f32,128,64,32,2,2,2,1,16,8,8,75,1024,924876800,26717716480,28,2.30458,373.759,11593.3
1,CUTLASS,conv2d,cutlass_tensorop_s1688fprop_optimized_f16_128x64_32x2_nhwc_align2,passed,success,fprop,256,56,56,64,256,1,1,56,56,0,0,1,1,1,1,f16:nhwc,f16:nhwc,f32:nhwc,cross,optimized,1,0,serial,1,none,tensorop,f32,128,64,32,2,2,2,1,16,8,8,75,1024,924876800,26717716480,28,2.31129,372.674,11559.7
1,CUTLASS,conv2d,cutlass_tensorop_s1688fprop_optimized_f16_128x64_32x2_nhwc_align1,passed,success,fprop,256,56,56,64,256,1,1,56,56,0,0,1,1,1,1,f16:nhwc,f16:nhwc,f32:nhwc,cross,optimized,1,0,serial,1,none,tensorop,f32,128,64,32,2,2,2,1,16,8,8,75,1024,924876800,26717716480,28,2.65524,324.399,10062.3
1,CUTLASS,conv2d,cutlass_tensorop_s1688fprop_optimized_f16_64x64_32x2_nhwc_align8,passed,success,fprop,256,56,56,64,256,1,1,56,56,0,0,1,1,1,1,f16:nhwc,f16:nhwc,f32:nhwc,cross,optimized,1,0,serial,1,none,tensorop,f32,64,64,32,2,2,2,1,16,8,8,75,1024,924876800,26717716480,28,2.30148,374.263,11608.9
1,CUTLASS,conv2d,cutlass_tensorop_s1688fprop_optimized_f16_64x64_32x2_nhwc_align4,passed,success,fprop,256,56,56,64,256,1,1,56,56,0,0,1,1,1,1,f16:nhwc,f16:nhwc,f32:nhwc,cross,optimized,1,0,serial,1,none,tensorop,f32,64,64,32,2,2,2,1,16,8,8,75,1024,924876800,26717716480,28,2.30192,374.191,11606.7
1,CUTLASS,conv2d,cutlass_tensorop_s1688fprop_optimized_f16_64x64_32x2_nhwc_align2,passed,success,fprop,256,56,56,64,256,1,1,56,56,0,0,1,1,1,1,f16:nhwc,f16:nhwc,f32:nhwc,cross,optimized,1,0,serial,1,none,tensorop,f32,64,64,32,2,2,2,1,16,8,8,75,1024,924876800,26717716480,28,2.30412,373.833,11595.6
1,CUTLASS,conv2d,cutlass_tensorop_s1688fprop_optimized_f16_64x64_32x2_nhwc_align1,passed,success,fprop,256,56,56,64,256,1,1,56,56,0,0,1,1,1,1,f16:nhwc,f16:nhwc,f32:nhwc,cross,optimized,1,0,serial,1,none,tensorop,f32,64,64,32,2,2,2,1,16,8,8,75,1024,924876800,26717716480,28,2.60388,330.798,10260.7
1,CUTLASS,conv2d,cutlass_tensorop_s1688fprop_optimized_f16_64x128_64x2_nhwc_align8,passed,success,fprop,256,56,56,64,256,1,1,56,56,0,0,1,1,1,1,f16:nhwc,f16:nhwc,f32:nhwc,cross,optimized,1,0,serial,1,none,tensorop,f32,64,128,64,2,1,2,2,16,8,8,75,1024,924876800,26717716480,28,2.30604,373.523,11586
1,CUTLASS,conv2d,cutlass_tensorop_s1688fprop_optimized_f16_64x128_64x2_nhwc_align4,passed,success,fprop,256,56,56,64,256,1,1,56,56,0,0,1,1,1,1,f16:nhwc,f16:nhwc,f32:nhwc,cross,optimized,1,0,serial,1,none,tensorop,f32,64,128,64,2,1,2,2,16,8,8,75,1024,924876800,26717716480,28,2.30594,373.54,11586.5
1,CUTLASS,conv2d,cutlass_tensorop_s1688fprop_optimized_f16_64x128_64x2_nhwc_align2,passed,success,fprop,256,56,56,64,256,1,1,56,56,0,0,1,1,1,1,f16:nhwc,f16:nhwc,f32:nhwc,cross,optimized,1,0,serial,1,none,tensorop,f32,64,128,64,2,1,2,2,16,8,8,75,1024,924876800,26717716480,28,2.81791,305.672,9481.38
1,CUTLASS,conv2d,cutlass_tensorop_s1688fprop_optimized_f16_64x128_64x2_nhwc_align1,passed,success,fprop,256,56,56,64,256,1,1,56,56,0,0,1,1,1,1,f16:nhwc,f16:nhwc,f32:nhwc,cross,optimized,1,0,serial,1,none,tensorop,f32,64,128,64,2,1,2,2,16,8,8,75,1024,924876800,26717716480,28,9.66572,89.1148,2764.17
1,CUTLASS,conv2d,cutlass_tensorop_s16816fprop_optimized_f16_256x128_32x3_nhwc_align8,passed,success,fprop,256,56,56,64,256,1,1,56,56,0,0,1,1,1,1,f16:nhwc,f16:nhwc,f32:nhwc,cross,optimized,1,0,serial,1,none,tensorop,f32,256,128,32,3,4,2,1,16,8,16,80,1024,924876800,26717716480,28,2.35003,366.531,11369.1
1,CUTLASS,conv2d,cutlass_tensorop_s16816fprop_optimized_f16_256x128_32x3_nhwc_align4,passed,success,fprop,256,56,56,64,256,1,1,56,56,0,0,1,1,1,1,f16:nhwc,f16:nhwc,f32:nhwc,cross,optimized,1,0,serial,1,none,tensorop,f32,256,128,32,3,4,2,1,16,8,16,80,1024,924876800,26717716480,28,2.34211,367.77,11407.5
1,CUTLASS,conv2d,cutlass_tensorop_s16816fprop_optimized_f16_256x128_32x3_nhwc_align2,passed,success,fprop,256,56,56,64,256,1,1,56,56,0,0,1,1,1,1,f16:nhwc,f16:nhwc,f32:nhwc,cross,optimized,1,0,serial,1,none,tensorop,f32,256,128,32,3,4,2,1,16,8,16,80,1024,924876800,26717716480,28,2.33447,368.973,11444.9
1,CUTLASS,conv2d,cutlass_tensorop_s16816fprop_optimized_f16_128x256_32x3_nhwc_align8,passed,success,fprop,256,56,56,64,256,1,1,56,56,0,0,1,1,1,1,f16:nhwc,f16:nhwc,f32:nhwc,cross,optimized,1,0,serial,1,none,tensorop,f32,128,256,32,3,2,4,1,16,8,16,80,1024,924876800,26717716480,28,2.31824,371.557,11525
1,CUTLASS,conv2d,cutlass_tensorop_s16816fprop_optimized_f16_128x256_32x3_nhwc_align4,passed,success,fprop,256,56,56,64,256,1,1,56,56,0,0,1,1,1,1,f16:nhwc,f16:nhwc,f32:nhwc,cross,optimized,1,0,serial,1,none,tensorop,f32,128,256,32,3,2,4,1,16,8,16,80,1024,924876800,26717716480,28,2.32367,370.689,11498.1
1,CUTLASS,conv2d,cutlass_tensorop_s16816fprop_optimized_f16_128x256_32x3_nhwc_align2,passed,success,fprop,256,56,56,64,256,1,1,56,56,0,0,1,1,1,1,f16:nhwc,f16:nhwc,f32:nhwc,cross,optimized,1,0,serial,1,none,tensorop,f32,128,256,32,3,2,4,1,16,8,16,80,1024,924876800,26717716480,28,2.32387,370.656,11497.1
1,CUTLASS,conv2d,cutlass_tensorop_s16816fprop_optimized_f16_256x64_32x4_nhwc_align8,passed,success,fprop,256,56,56,64,256,1,1,56,56,0,0,1,1,1,1,f16:nhwc,f16:nhwc,f32:nhwc,cross,optimized,1,0,serial,1,none,tensorop,f32,256,64,32,4,4,1,1,16,8,16,80,1024,924876800,26717716480,28,2.35762,365.351,11332.5
1,CUTLASS,conv2d,cutlass_tensorop_s16816fprop_optimized_f16_256x64_32x4_nhwc_align4,passed,success,fprop,256,56,56,64,256,1,1,56,56,0,0,1,1,1,1,f16:nhwc,f16:nhwc,f32:nhwc,cross,optimized,1,0,serial,1,none,tensorop,f32,256,64,32,4,4,1,1,16,8,16,80,1024,924876800,26717716480,28,2.6483,325.25,10088.6
1,CUTLASS,conv2d,cutlass_tensorop_s16816fprop_optimized_f16_256x64_32x4_nhwc_align2,passed,success,fprop,256,56,56,64,256,1,1,56,56,0,0,1,1,1,1,f16:nhwc,f16:nhwc,f32:nhwc,cross,optimized,1,0,serial,1,none,tensorop,f32,256,64,32,4,4,1,1,16,8,16,80,1024,924876800,26717716480,28,14.3131,60.1797,1866.66
1,CUTLASS,conv2d,cutlass_tensorop_s16816fprop_optimized_f16_64x256_32x4_nhwc_align8,passed,success,fprop,256,56,56,64,256,1,1,56,56,0,0,1,1,1,1,f16:nhwc,f16:nhwc,f32:nhwc,cross,optimized,1,0,serial,1,none,tensorop,f32,64,256,32,4,1,4,1,16,8,16,80,1024,924876800,26717716480,28,2.31013,372.861,11565.4
1,CUTLASS,conv2d,cutlass_tensorop_s16816fprop_optimized_f16_64x256_32x4_nhwc_align4,passed,success,fprop,256,56,56,64,256,1,1,56,56,0,0,1,1,1,1,f16:nhwc,f16:nhwc,f32:nhwc,cross,optimized,1,0,serial,1,none,tensorop,f32,64,256,32,4,1,4,1,16,8,16,80,1024,924876800,26717716480,28,2.50633,343.673,10660.1
1,CUTLASS,conv2d,cutlass_tensorop_s16816fprop_optimized_f16_64x256_32x4_nhwc_align2,passed,success,fprop,256,56,56,64,256,1,1,56,56,0,0,1,1,1,1,f16:nhwc,f16:nhwc,f32:nhwc,cross,optimized,1,0,serial,1,none,tensorop,f32,64,256,32,4,1,4,1,16,8,16,80,1024,924876800,26717716480,28,2.36027,364.941,11319.8
1,CUTLASS,conv2d,cutlass_tensorop_s16816fprop_optimized_f16_128x128_32x3_nhwc_align8,passed,success,fprop,256,56,56,64,256,1,1,56,56,0,0,1,1,1,1,f16:nhwc,f16:nhwc,f32:nhwc,cross,optimized,1,0,serial,1,none,tensorop,f32,128,128,32,3,2,2,1,16,8,16,80,1024,924876800,26717716480,28,2.31083,372.749,11562
1,CUTLASS,conv2d,cutlass_tensorop_s16816fprop_optimized_f16_128x128_32x3_nhwc_align4,passed,success,fprop,256,56,56,64,256,1,1,56,56,0,0,1,1,1,1,f16:nhwc,f16:nhwc,f32:nhwc,cross,optimized,1,0,serial,1,none,tensorop,f32,128,128,32,3,2,2,1,16,8,16,80,1024,924876800,26717716480,28,2.30947,372.969,11568.8
1,CUTLASS,conv2d,cutlass_tensorop_s16816fprop_optimized_f16_128x128_32x3_nhwc_align2,passed,success,fprop,256,56,56,64,256,1,1,56,56,0,0,1,1,1,1,f16:nhwc,f16:nhwc,f32:nhwc,cross,optimized,1,0,serial,1,none,tensorop,f32,128,128,32,3,2,2,1,16,8,16,80,1024,924876800,26717716480,28,2.3155,371.997,11538.6
1,CUTLASS,conv2d,cutlass_tensorop_s16816fprop_optimized_f16_128x128_32x4_nhwc_align8,passed,success,fprop,256,56,56,64,256,1,1,56,56,0,0,1,1,1,1,f16:nhwc,f16:nhwc,f32:nhwc,cross,optimized,1,0,serial,1,none,tensorop,f32,128,128,32,4,2,2,1,16,8,16,80,1024,924876800,26717716480,28,2.31165,372.617,11557.9
1,CUTLASS,conv2d,cutlass_tensorop_s16816fprop_optimized_f16_128x128_32x4_nhwc_align4,passed,success,fprop,256,56,56,64,256,1,1,56,56,0,0,1,1,1,1,f16:nhwc,f16:nhwc,f32:nhwc,cross,optimized,1,0,serial,1,none,tensorop,f32,128,128,32,4,2,2,1,16,8,16,80,1024,924876800,26717716480,28,2.31531,372.027,11539.6
1,CUTLASS,conv2d,cutlass_tensorop_s16816fprop_optimized_f16_128x128_32x4_nhwc_align2,passed,success,fprop,256,56,56,64,256,1,1,56,56,0,0,1,1,1,1,f16:nhwc,f16:nhwc,f32:nhwc,cross,optimized,1,0,serial,1,none,tensorop,f32,128,128,32,4,2,2,1,16,8,16,80,1024,924876800,26717716480,28,2.42029,355.891,11039.1
1,CUTLASS,conv2d,cutlass_tensorop_s16816fprop_optimized_f16_128x128_32x5_nhwc_align8,passed,success,fprop,256,56,56,64,256,1,1,56,56,0,0,1,1,1,1,f16:nhwc,f16:nhwc,f32:nhwc,cross,optimized,1,0,serial,1,none,tensorop,f32,128,128,32,5,2,2,1,16,8,16,80,1024,924876800,26717716480,28,2.31265,372.455,11552.8
1,CUTLASS,conv2d,cutlass_tensorop_s16816fprop_optimized_f16_128x128_32x5_nhwc_align4,passed,success,fprop,256,56,56,64,256,1,1,56,56,0,0,1,1,1,1,f16:nhwc,f16:nhwc,f32:nhwc,cross,optimized,1,0,serial,1,none,tensorop,f32,128,128,32,5,2,2,1,16,8,16,80,1024,924876800,26717716480,28,2.31149,372.643,11558.7
1,CUTLASS,conv2d,cutlass_tensorop_s16816fprop_optimized_f16_128x128_32x5_nhwc_align2,passed,success,fprop,256,56,56,64,256,1,1,56,56,0,0,1,1,1,1,f16:nhwc,f16:nhwc,f32:nhwc,cross,optimized,1,0,serial,1,none,tensorop,f32,128,128,32,5,2,2,1,16,8,16,80,1024,924876800,26717716480,28,2.61395,329.523,10221.2
1,CUTLASS,conv2d,cutlass_tensorop_s16816fprop_optimized_f16_128x64_32x6_nhwc_align8,passed,success,fprop,256,56,56,64,256,1,1,56,56,0,0,1,1,1,1,f16:nhwc,f16:nhwc,f32:nhwc,cross,optimized,1,0,serial,1,none,tensorop,f32,128,64,32,6,2,2,1,16,8,16,80,1024,924876800,26717716480,28,2.28941,376.235,11670.1
1,CUTLASS,conv2d,cutlass_tensorop_s16816fprop_optimized_f16_128x64_32x6_nhwc_align4,passed,success,fprop,256,56,56,64,256,1,1,56,56,0,0,1,1,1,1,f16:nhwc,f16:nhwc,f32:nhwc,cross,optimized,1,0,serial,1,none,tensorop,f32,128,64,32,6,2,2,1,16,8,16,80,1024,924876800,26717716480,28,2.43639,353.538,10966.1
1,CUTLASS,conv2d,cutlass_tensorop_s16816fprop_optimized_f16_128x64_32x6_nhwc_align2,passed,success,fprop,256,56,56,64,256,1,1,56,56,0,0,1,1,1,1,f16:nhwc,f16:nhwc,f32:nhwc,cross,optimized,1,0,serial,1,none,tensorop,f32,128,64,32,6,2,2,1,16,8,16,80,1024,924876800,26717716480,28,3.61922,237.995,7382.17
1,CUTLASS,conv2d,cutlass_tensorop_s16816fprop_optimized_f16_64x128_32x6_nhwc_align8,passed,success,fprop,256,56,56,64,256,1,1,56,56,0,0,1,1,1,1,f16:nhwc,f16:nhwc,f32:nhwc,cross,optimized,1,0,serial,1,none,tensorop,f32,64,128,32,6,2,2,1,16,8,16,80,1024,924876800,26717716480,28,2.29627,375.112,11635.3
1,CUTLASS,conv2d,cutlass_tensorop_s16816fprop_optimized_f16_64x128_32x6_nhwc_align4,passed,success,fprop,256,56,56,64,256,1,1,56,56,0,0,1,1,1,1,f16:nhwc,f16:nhwc,f32:nhwc,cross,optimized,1,0,serial,1,none,tensorop,f32,64,128,32,6,2,2,1,16,8,16,80,1024,924876800,26717716480,28,2.34551,367.237,11391
1,CUTLASS,conv2d,cutlass_tensorop_s16816fprop_optimized_f16_64x128_32x6_nhwc_align2,passed,success,fprop,256,56,56,64,256,1,1,56,56,0,0,1,1,1,1,f16:nhwc,f16:nhwc,f32:nhwc,cross,optimized,1,0,serial,1,none,tensorop,f32,64,128,32,6,2,2,1,16,8,16,80,1024,924876800,26717716480,28,3.45944,248.988,7723.13
1,CUTLASS,conv2d,cutlass_tensorop_s16816fprop_optimized_f16_64x64_32x10_nhwc_align8,passed,success,fprop,256,56,56,64,256,1,1,56,56,0,0,1,1,1,1,f16:nhwc,f16:nhwc,f32:nhwc,cross,optimized,1,0,serial,1,none,tensorop,f32,64,64,32,10,2,2,1,16,8,16,80,1024,924876800,26717716480,28,2.88506,298.558,9260.72
1,CUTLASS,conv2d,cutlass_tensorop_s16816fprop_optimized_f16_64x64_32x10_nhwc_align4,passed,success,fprop,256,56,56,64,256,1,1,56,56,0,0,1,1,1,1,f16:nhwc,f16:nhwc,f32:nhwc,cross,optimized,1,0,serial,1,none,tensorop,f32,64,64,32,10,2,2,1,16,8,16,80,1024,924876800,26717716480,28,3.5838,240.348,7455.13
1,CUTLASS,conv2d,cutlass_tensorop_s16816fprop_optimized_f16_64x64_32x10_nhwc_align2,passed,success,fprop,256,56,56,64,256,1,1,56,56,0,0,1,1,1,1,f16:nhwc,f16:nhwc,f32:nhwc,cross,optimized,1,0,serial,1,none,tensorop,f32,64,64,32,10,2,2,1,16,8,16,80,1024,924876800,26717716480,28,5.77071,149.264,4629.88
1,CUTLASS,conv2d,cutlass_tensorop_s16816fprop_optimized_f16_128x64_64x3_nhwc_align8,passed,success,fprop,256,56,56,64,256,1,1,56,56,0,0,1,1,1,1,f16:nhwc,f16:nhwc,f32:nhwc,cross,optimized,1,0,serial,1,none,tensorop,f32,128,64,64,3,2,2,1,16,8,16,80,1024,924876800,26717716480,28,2.29303,375.642,11651.7
1,CUTLASS,conv2d,cutlass_tensorop_s16816fprop_optimized_f16_128x64_64x3_nhwc_align4,passed,success,fprop,256,56,56,64,256,1,1,56,56,0,0,1,1,1,1,f16:nhwc,f16:nhwc,f32:nhwc,cross,optimized,1,0,serial,1,none,tensorop,f32,128,64,64,3,2,2,1,16,8,16,80,1024,924876800,26717716480,28,2.41055,357.329,11083.7
1,CUTLASS,conv2d,cutlass_tensorop_s16816fprop_optimized_f16_128x64_64x3_nhwc_align2,passed,success,fprop,256,56,56,64,256,1,1,56,56,0,0,1,1,1,1,f16:nhwc,f16:nhwc,f32:nhwc,cross,optimized,1,0,serial,1,none,tensorop,f32,128,64,64,3,2,2,1,16,8,16,80,1024,924876800,26717716480,28,11.6211,74.1203,2299.07
1,CUTLASS,conv2d,cutlass_tensorop_s16816fprop_optimized_f16_64x128_64x3_nhwc_align8,passed,success,fprop,256,56,56,64,256,1,1,56,56,0,0,1,1,1,1,f16:nhwc,f16:nhwc,f32:nhwc,cross,optimized,1,0,serial,1,none,tensorop,f32,64,128,64,3,2,2,1,16,8,16,80,1024,924876800,26717716480,28,2.29554,375.232,11639
1,CUTLASS,conv2d,cutlass_tensorop_s16816fprop_optimized_f16_64x128_64x3_nhwc_align4,passed,success,fprop,256,56,56,64,256,1,1,56,56,0,0,1,1,1,1,f16:nhwc,f16:nhwc,f32:nhwc,cross,optimized,1,0,serial,1,none,tensorop,f32,64,128,64,3,2,2,1,16,8,16,80,1024,924876800,26717716480,28,2.30741,373.301,11579.1
1,CUTLASS,conv2d,cutlass_tensorop_s16816fprop_optimized_f16_64x128_64x3_nhwc_align2,passed,success,fprop,256,56,56,64,256,1,1,56,56,0,0,1,1,1,1,f16:nhwc,f16:nhwc,f32:nhwc,cross,optimized,1,0,serial,1,none,tensorop,f32,64,128,64,3,2,2,1,16,8,16,80,1024,924876800,26717716480,28,2.542,338.851,10510.5
1,CUTLASS,conv2d,cutlass_tensorop_s16816fprop_optimized_f16_64x64_64x5_nhwc_align8,passed,success,fprop,256,56,56,64,256,1,1,56,56,0,0,1,1,1,1,f16:nhwc,f16:nhwc,f32:nhwc,cross,optimized,1,0,serial,1,none,tensorop,f32,64,64,64,5,2,2,1,16,8,16,80,1024,924876800,26717716480,28,3.08847,278.895,8650.81
1,CUTLASS,conv2d,cutlass_tensorop_s16816fprop_optimized_f16_64x64_64x5_nhwc_align4,passed,success,fprop,256,56,56,64,256,1,1,56,56,0,0,1,1,1,1,f16:nhwc,f16:nhwc,f32:nhwc,cross,optimized,1,0,serial,1,none,tensorop,f32,64,64,64,5,2,2,1,16,8,16,80,1024,924876800,26717716480,28,3.19153,269.889,8371.44
1,CUTLASS,conv2d,cutlass_tensorop_s16816fprop_optimized_f16_64x64_64x5_nhwc_align2,passed,success,fprop,256,56,56,64,256,1,1,56,56,0,0,1,1,1,1,f16:nhwc,f16:nhwc,f32:nhwc,cross,optimized,1,0,serial,1,none,tensorop,f32,64,64,64,5,2,2,1,16,8,16,80,1024,924876800,26717716480,28,4.41303,195.185,6054.28
1,CUTLASS,conv2d,cutlass_tensorop_s1688fprop_optimized_f16_256x128_32x2_nhwc_align8,passed,success,fprop,256,56,56,64,64,1,1,56,56,0,0,1,1,1,1,f16:nhwc,f16:nhwc,f32:nhwc,cross,optimized,1,0,serial,1,none,tensorop,f32,256,128,32,2,4,2,1,16,8,8,75,1024,308289536,6679429120,21,0.77398,370.962,8629.97
1,CUTLASS,conv2d,cutlass_tensorop_s1688fprop_optimized_f16_256x128_32x2_nhwc_align4,passed,success,fprop,256,56,56,64,64,1,1,56,56,0,0,1,1,1,1,f16:nhwc,f16:nhwc,f32:nhwc,cross,optimized,1,0,serial,1,none,tensorop,f32,256,128,32,2,4,2,1,16,8,8,75,1024,308289536,6679429120,21,0.773448,371.217,8635.92
1,CUTLASS,conv2d,cutlass_tensorop_s1688fprop_optimized_f16_256x128_32x2_nhwc_align2,passed,success,fprop,256,56,56,64,64,1,1,56,56,0,0,1,1,1,1,f16:nhwc,f16:nhwc,f32:nhwc,cross,optimized,1,0,serial,1,none,tensorop,f32,256,128,32,2,4,2,1,16,8,8,75,1024,308289536,6679429120,21,0.775424,370.271,8613.91
1,CUTLASS,conv2d,cutlass_tensorop_s1688fprop_optimized_f16_256x128_32x2_nhwc_align1,passed,success,fprop,256,56,56,64,64,1,1,56,56,0,0,1,1,1,1,f16:nhwc,f16:nhwc,f32:nhwc,cross,optimized,1,0,serial,1,none,tensorop,f32,256,128,32,2,4,2,1,16,8,8,75,1024,308289536,6679429120,21,2.51876,113.991,2651.87
1,CUTLASS,conv2d,cutlass_tensorop_s1688fprop_optimized_f16_128x256_32x2_nhwc_align8,passed,success,fprop,256,56,56,64,64,1,1,56,56,0,0,1,1,1,1,f16:nhwc,f16:nhwc,f32:nhwc,cross,optimized,1,0,serial,1,none,tensorop,f32,128,256,32,2,2,4,1,16,8,8,75,1024,308289536,6679429120,21,1.22069,235.208,5471.83
1,CUTLASS,conv2d,cutlass_tensorop_s1688fprop_optimized_f16_128x256_32x2_nhwc_align4,passed,success,fprop,256,56,56,64,64,1,1,56,56,0,0,1,1,1,1,f16:nhwc,f16:nhwc,f32:nhwc,cross,optimized,1,0,serial,1,none,tensorop,f32,128,256,32,2,2,4,1,16,8,8,75,1024,308289536,6679429120,21,1.24401,230.8,5369.29
1,CUTLASS,conv2d,cutlass_tensorop_s1688fprop_optimized_f16_128x256_32x2_nhwc_align2,passed,success,fprop,256,56,56,64,64,1,1,56,56,0,0,1,1,1,1,f16:nhwc,f16:nhwc,f32:nhwc,cross,optimized,1,0,serial,1,none,tensorop,f32,128,256,32,2,2,4,1,16,8,8,75,1024,308289536,6679429120,21,1.29784,221.227,5146.58
1,CUTLASS,conv2d,cutlass_tensorop_s1688fprop_optimized_f16_128x256_32x2_nhwc_align1,passed,success,fprop,256,56,56,64,64,1,1,56,56,0,0,1,1,1,1,f16:nhwc,f16:nhwc,f32:nhwc,cross,optimized,1,0,serial,1,none,tensorop,f32,128,256,32,2,2,4,1,16,8,8,75,1024,308289536,6679429120,21,1.65473,173.513,4036.56
1,CUTLASS,conv2d,cutlass_tensorop_s1688fprop_optimized_f16_128x128_32x2_nhwc_align8,passed,success,fprop,256,56,56,64,64,1,1,56,56,0,0,1,1,1,1,f16:nhwc,f16:nhwc,f32:nhwc,cross,optimized,1,0,serial,1,none,tensorop,f32,128,128,32,2,2,2,1,16,8,8,75,1024,308289536,6679429120,21,0.762901,376.349,8755.31
1,CUTLASS,conv2d,cutlass_tensorop_s1688fprop_optimized_f16_128x128_32x2_nhwc_align4,passed,success,fprop,256,56,56,64,64,1,1,56,56,0,0,1,1,1,1,f16:nhwc,f16:nhwc,f32:nhwc,cross,optimized,1,0,serial,1,none,tensorop,f32,128,128,32,2,2,2,1,16,8,8,75,1024,308289536,6679429120,21,0.763279,376.163,8750.97
1,CUTLASS,conv2d,cutlass_tensorop_s1688fprop_optimized_f16_128x128_32x2_nhwc_align2,passed,success,fprop,256,56,56,64,64,1,1,56,56,0,0,1,1,1,1,f16:nhwc,f16:nhwc,f32:nhwc,cross,optimized,1,0,serial,1,none,tensorop,f32,128,128,32,2,2,2,1,16,8,8,75,1024,308289536,6679429120,21,0.777718,369.179,8588.5
1,CUTLASS,conv2d,cutlass_tensorop_s1688fprop_optimized_f16_128x128_32x2_nhwc_align1,passed,success,fprop,256,56,56,64,64,1,1,56,56,0,0,1,1,1,1,f16:nhwc,f16:nhwc,f32:nhwc,cross,optimized,1,0,serial,1,none,tensorop,f32,128,128,32,2,2,2,1,16,8,8,75,1024,308289536,6679429120,21,2.5765,111.437,2592.45
1,CUTLASS,conv2d,cutlass_tensorop_s1688fprop_optimized_f16_64x128_32x2_nhwc_align8,passed,success,fprop,256,56,56,64,64,1,1,56,56,0,0,1,1,1,1,f16:nhwc,f16:nhwc,f32:nhwc,cross,optimized,1,0,serial,1,none,tensorop,f32,64,128,32,2,2,2,1,16,8,8,75,1024,308289536,6679429120,21,0.760023,377.774,8788.46
1,CUTLASS,conv2d,cutlass_tensorop_s1688fprop_optimized_f16_64x128_32x2_nhwc_align4,passed,success,fprop,256,56,56,64,64,1,1,56,56,0,0,1,1,1,1,f16:nhwc,f16:nhwc,f32:nhwc,cross,optimized,1,0,serial,1,none,tensorop,f32,64,128,32,2,2,2,1,16,8,8,75,1024,308289536,6679429120,21,0.760474,377.55,8783.25
1,CUTLASS,conv2d,cutlass_tensorop_s1688fprop_optimized_f16_64x128_32x2_nhwc_align2,passed,success,fprop,256,56,56,64,64,1,1,56,56,0,0,1,1,1,1,f16:nhwc,f16:nhwc,f32:nhwc,cross,optimized,1,0,serial,1,none,tensorop,f32,64,128,32,2,2,2,1,16,8,8,75,1024,308289536,6679429120,21,0.76119,377.195,8774.98
1,CUTLASS,conv2d,cutlass_tensorop_s1688fprop_optimized_f16_64x128_32x2_nhwc_align1,passed,success,fprop,256,56,56,64,64,1,1,56,56,0,0,1,1,1,1,f16:nhwc,f16:nhwc,f32:nhwc,cross,optimized,1,0,serial,1,none,tensorop,f32,64,128,32,2,2,2,1,16,8,8,75,1024,308289536,6679429120,21,1.02732,279.482,6501.81
1,CUTLASS,conv2d,cutlass_tensorop_s1688fprop_optimized_f16_128x64_32x2_nhwc_align8,passed,success,fprop,256,56,56,64,64,1,1,56,56,0,0,1,1,1,1,f16:nhwc,f16:nhwc,f32:nhwc,cross,optimized,1,0,serial,1,none,tensorop,f32,128,64,32,2,2,2,1,16,8,8,75,1024,308289536,6679429120,21,0.759716,377.927,8792.01
1,CUTLASS,conv2d,cutlass_tensorop_s1688fprop_optimized_f16_128x64_32x2_nhwc_align4,passed,success,fprop,256,56,56,64,64,1,1,56,56,0,0,1,1,1,1,f16:nhwc,f16:nhwc,f32:nhwc,cross,optimized,1,0,serial,1,none,tensorop,f32,128,64,32,2,2,2,1,16,8,8,75,1024,308289536,6679429120,21,0.760095,377.738,8787.63
1,CUTLASS,conv2d,cutlass_tensorop_s1688fprop_optimized_f16_128x64_32x2_nhwc_align2,passed,success,fprop,256,56,56,64,64,1,1,56,56,0,0,1,1,1,1,f16:nhwc,f16:nhwc,f32:nhwc,cross,optimized,1,0,serial,1,none,tensorop,f32,128,64,32,2,2,2,1,16,8,8,75,1024,308289536,6679429120,21,0.761252,377.164,8774.27
1,CUTLASS,conv2d,cutlass_tensorop_s1688fprop_optimized_f16_128x64_32x2_nhwc_align1,passed,success,fprop,256,56,56,64,64,1,1,56,56,0,0,1,1,1,1,f16:nhwc,f16:nhwc,f32:nhwc,cross,optimized,1,0,serial,1,none,tensorop,f32,128,64,32,2,2,2,1,16,8,8,75,1024,308289536,6679429120,21,0.765952,374.85,8720.43
1,CUTLASS,conv2d,cutlass_tensorop_s1688fprop_optimized_f16_64x64_32x2_nhwc_align8,passed,success,fprop,256,56,56,64,64,1,1,56,56,0,0,1,1,1,1,f16:nhwc,f16:nhwc,f32:nhwc,cross,optimized,1,0,serial,1,none,tensorop,f32,64,64,32,2,2,2,1,16,8,8,75,1024,308289536,6679429120,21,0.759798,377.886,8791.06
1,CUTLASS,conv2d,cutlass_tensorop_s1688fprop_optimized_f16_64x64_32x2_nhwc_align4,passed,success,fprop,256,56,56,64,64,1,1,56,56,0,0,1,1,1,1,f16:nhwc,f16:nhwc,f32:nhwc,cross,optimized,1,0,serial,1,none,tensorop,f32,64,64,32,2,2,2,1,16,8,8,75,1024,308289536,6679429120,21,0.759798,377.886,8791.06
1,CUTLASS,conv2d,cutlass_tensorop_s1688fprop_optimized_f16_64x64_32x2_nhwc_align2,passed,success,fprop,256,56,56,64,64,1,1,56,56,0,0,1,1,1,1,f16:nhwc,f16:nhwc,f32:nhwc,cross,optimized,1,0,serial,1,none,tensorop,f32,64,64,32,2,2,2,1,16,8,8,75,1024,308289536,6679429120,21,0.759992,377.789,8788.81
1,CUTLASS,conv2d,cutlass_tensorop_s1688fprop_optimized_f16_64x64_32x2_nhwc_align1,passed,success,fprop,256,56,56,64,64,1,1,56,56,0,0,1,1,1,1,f16:nhwc,f16:nhwc,f32:nhwc,cross,optimized,1,0,serial,1,none,tensorop,f32,64,64,32,2,2,2,1,16,8,8,75,1024,308289536,6679429120,21,0.763914,375.85,8743.69
1,CUTLASS,conv2d,cutlass_tensorop_s1688fprop_optimized_f16_64x128_64x2_nhwc_align8,passed,success,fprop,256,56,56,64,64,1,1,56,56,0,0,1,1,1,1,f16:nhwc,f16:nhwc,f32:nhwc,cross,optimized,1,0,serial,1,none,tensorop,f32,64,128,64,2,1,2,2,16,8,8,75,1024,308289536,6679429120,21,0.76588,374.885,8721.24
1,CUTLASS,conv2d,cutlass_tensorop_s1688fprop_optimized_f16_64x128_64x2_nhwc_align4,passed,success,fprop,256,56,56,64,64,1,1,56,56,0,0,1,1,1,1,f16:nhwc,f16:nhwc,f32:nhwc,cross,optimized,1,0,serial,1,none,tensorop,f32,64,128,64,2,1,2,2,16,8,8,75,1024,308289536,6679429120,21,0.762481,376.556,8760.13
1,CUTLASS,conv2d,cutlass_tensorop_s1688fprop_optimized_f16_64x128_64x2_nhwc_align2,passed,success,fprop,256,56,56,64,64,1,1,56,56,0,0,1,1,1,1,f16:nhwc,f16:nhwc,f32:nhwc,cross,optimized,1,0,serial,1,none,tensorop,f32,64,128,64,2,1,2,2,16,8,8,75,1024,308289536,6679429120,21,0.891988,321.884,7488.25
1,CUTLASS,conv2d,cutlass_tensorop_s1688fprop_optimized_f16_64x128_64x2_nhwc_align1,passed,success,fprop,256,56,56,64,64,1,1,56,56,0,0,1,1,1,1,f16:nhwc,f16:nhwc,f32:nhwc,cross,optimized,1,0,serial,1,none,tensorop,f32,64,128,64,2,1,2,2,16,8,8,75,1024,308289536,6679429120,21,4.18749,68.5655,1595.09
1,CUTLASS,conv2d,cutlass_tensorop_s16816fprop_optimized_f16_256x128_32x3_nhwc_align8,passed,success,fprop,256,56,56,64,64,1,1,56,56,0,0,1,1,1,1,f16:nhwc,f16:nhwc,f32:nhwc,cross,optimized,1,0,serial,1,none,tensorop,f32,256,128,32,3,4,2,1,16,8,16,80,1024,308289536,6679429120,21,0.786524,365.045,8492.34
1,CUTLASS,conv2d,cutlass_tensorop_s16816fprop_optimized_f16_256x128_32x3_nhwc_align4,passed,success,fprop,256,56,56,64,64,1,1,56,56,0,0,1,1,1,1,f16:nhwc,f16:nhwc,f32:nhwc,cross,optimized,1,0,serial,1,none,tensorop,f32,256,128,32,3,4,2,1,16,8,16,80,1024,308289536,6679429120,21,0.789742,363.558,8457.74
1,CUTLASS,conv2d,cutlass_tensorop_s16816fprop_optimized_f16_256x128_32x3_nhwc_align2,passed,success,fprop,256,56,56,64,64,1,1,56,56,0,0,1,1,1,1,f16:nhwc,f16:nhwc,f32:nhwc,cross,optimized,1,0,serial,1,none,tensorop,f32,256,128,32,3,4,2,1,16,8,16,80,1024,308289536,6679429120,21,0.824159,348.376,8104.54
1,CUTLASS,conv2d,cutlass_tensorop_s16816fprop_optimized_f16_128x256_32x3_nhwc_align8,passed,success,fprop,256,56,56,64,64,1,1,56,56,0,0,1,1,1,1,f16:nhwc,f16:nhwc,f32:nhwc,cross,optimized,1,0,serial,1,none,tensorop,f32,128,256,32,3,2,4,1,16,8,16,80,1024,308289536,6679429120,21,1.1705,245.294,5706.46
1,CUTLASS,conv2d,cutlass_tensorop_s16816fprop_optimized_f16_128x256_32x3_nhwc_align4,passed,success,fprop,256,56,56,64,64,1,1,56,56,0,0,1,1,1,1,f16:nhwc,f16:nhwc,f32:nhwc,cross,optimized,1,0,serial,1,none,tensorop,f32,128,256,32,3,2,4,1,16,8,16,80,1024,308289536,6679429120,21,1.19971,239.322,5567.54
1,CUTLASS,conv2d,cutlass_tensorop_s16816fprop_optimized_f16_128x256_32x3_nhwc_align2,passed,success,fprop,256,56,56,64,64,1,1,56,56,0,0,1,1,1,1,f16:nhwc,f16:nhwc,f32:nhwc,cross,optimized,1,0,serial,1,none,tensorop,f32,128,256,32,3,2,4,1,16,8,16,80,1024,308289536,6679429120,21,1.39465,205.871,4789.33
1,CUTLASS,conv2d,cutlass_tensorop_s16816fprop_optimized_f16_256x64_32x4_nhwc_align8,passed,success,fprop,256,56,56,64,64,1,1,56,56,0,0,1,1,1,1,f16:nhwc,f16:nhwc,f32:nhwc,cross,optimized,1,0,serial,1,none,tensorop,f32,256,64,32,4,4,1,1,16,8,16,80,1024,308289536,6679429120,21,0.776612,369.705,8600.73
1,CUTLASS,conv2d,cutlass_tensorop_s16816fprop_optimized_f16_256x64_32x4_nhwc_align4,passed,success,fprop,256,56,56,64,64,1,1,56,56,0,0,1,1,1,1,f16:nhwc,f16:nhwc,f32:nhwc,cross,optimized,1,0,serial,1,none,tensorop,f32,256,64,32,4,4,1,1,16,8,16,80,1024,308289536,6679429120,21,0.847872,338.632,7877.87
1,CUTLASS,conv2d,cutlass_tensorop_s16816fprop_optimized_f16_256x64_32x4_nhwc_align2,passed,success,fprop,256,56,56,64,64,1,1,56,56,0,0,1,1,1,1,f16:nhwc,f16:nhwc,f32:nhwc,cross,optimized,1,0,serial,1,none,tensorop,f32,256,64,32,4,4,1,1,16,8,16,80,1024,308289536,6679429120,21,3.86077,74.3679,1730.08
1,CUTLASS,conv2d,cutlass_tensorop_s16816fprop_optimized_f16_64x256_32x4_nhwc_align8,passed,success,fprop,256,56,56,64,64,1,1,56,56,0,0,1,1,1,1,f16:nhwc,f16:nhwc,f32:nhwc,cross,optimized,1,0,serial,1,none,tensorop,f32,64,256,32,4,1,4,1,16,8,16,80,1024,308289536,6679429120,21,1.3195,217.595,5062.07
1,CUTLASS,conv2d,cutlass_tensorop_s16816fprop_optimized_f16_64x256_32x4_nhwc_align4,passed,success,fprop,256,56,56,64,64,1,1,56,56,0,0,1,1,1,1,f16:nhwc,f16:nhwc,f32:nhwc,cross,optimized,1,0,serial,1,none,tensorop,f32,64,256,32,4,1,4,1,16,8,16,80,1024,308289536,6679429120,21,1.51052,190.078,4421.93
1,CUTLASS,conv2d,cutlass_tensorop_s16816fprop_optimized_f16_64x256_32x4_nhwc_align2,passed,success,fprop,256,56,56,64,64,1,1,56,56,0,0,1,1,1,1,f16:nhwc,f16:nhwc,f32:nhwc,cross,optimized,1,0,serial,1,none,tensorop,f32,64,256,32,4,1,4,1,16,8,16,80,1024,308289536,6679429120,21,2.07517,138.359,3218.74
1,CUTLASS,conv2d,cutlass_tensorop_s16816fprop_optimized_f16_128x128_32x3_nhwc_align8,passed,success,fprop,256,56,56,64,64,1,1,56,56,0,0,1,1,1,1,f16:nhwc,f16:nhwc,f32:nhwc,cross,optimized,1,0,serial,1,none,tensorop,f32,128,128,32,3,2,2,1,16,8,16,80,1024,308289536,6679429120,21,0.769526,373.109,8679.93
1,CUTLASS,conv2d,cutlass_tensorop_s16816fprop_optimized_f16_128x128_32x3_nhwc_align4,passed,success,fprop,256,56,56,64,64,1,1,56,56,0,0,1,1,1,1,f16:nhwc,f16:nhwc,f32:nhwc,cross,optimized,1,0,serial,1,none,tensorop,f32,128,128,32,3,2,2,1,16,8,16,80,1024,308289536,6679429120,21,0.769238,373.249,8683.18
1,CUTLASS,conv2d,cutlass_tensorop_s16816fprop_optimized_f16_128x128_32x3_nhwc_align2,passed,success,fprop,256,56,56,64,64,1,1,56,56,0,0,1,1,1,1,f16:nhwc,f16:nhwc,f32:nhwc,cross,optimized,1,0,serial,1,none,tensorop,f32,128,128,32,3,2,2,1,16,8,16,80,1024,308289536,6679429120,21,0.775209,370.374,8616.29
1,CUTLASS,conv2d,cutlass_tensorop_s16816fprop_optimized_f16_128x128_32x4_nhwc_align8,passed,success,fprop,256,56,56,64,64,1,1,56,56,0,0,1,1,1,1,f16:nhwc,f16:nhwc,f32:nhwc,cross,optimized,1,0,serial,1,none,tensorop,f32,128,128,32,4,2,2,1,16,8,16,80,1024,308289536,6679429120,21,0.773048,371.409,8640.38
1,CUTLASS,conv2d,cutlass_tensorop_s16816fprop_optimized_f16_128x128_32x4_nhwc_align4,passed,success,fprop,256,56,56,64,64,1,1,56,56,0,0,1,1,1,1,f16:nhwc,f16:nhwc,f32:nhwc,cross,optimized,1,0,serial,1,none,tensorop,f32,128,128,32,4,2,2,1,16,8,16,80,1024,308289536,6679429120,21,0.788511,364.126,8470.94
1,CUTLASS,conv2d,cutlass_tensorop_s16816fprop_optimized_f16_128x128_32x4_nhwc_align2,passed,success,fprop,256,56,56,64,64,1,1,56,56,0,0,1,1,1,1,f16:nhwc,f16:nhwc,f32:nhwc,cross,optimized,1,0,serial,1,none,tensorop,f32,128,128,32,4,2,2,1,16,8,16,80,1024,308289536,6679429120,21,1.12044,256.254,5961.43
1,CUTLASS,conv2d,cutlass_tensorop_s16816fprop_optimized_f16_128x128_32x5_nhwc_align8,passed,success,fprop,256,56,56,64,64,1,1,56,56,0,0,1,1,1,1,f16:nhwc,f16:nhwc,f32:nhwc,cross,optimized,1,0,serial,1,none,tensorop,f32,128,128,32,5,2,2,1,16,8,16,80,1024,308289536,6679429120,21,0.77576,370.111,8610.18
1,CUTLASS,conv2d,cutlass_tensorop_s16816fprop_optimized_f16_128x128_32x5_nhwc_align4,passed,success,fprop,256,56,56,64,64,1,1,56,56,0,0,1,1,1,1,f16:nhwc,f16:nhwc,f32:nhwc,cross,optimized,1,0,serial,1,none,tensorop,f32,128,128,32,5,2,2,1,16,8,16,80,1024,308289536,6679429120,21,0.803496,357.335,8312.96
1,CUTLASS,conv2d,cutlass_tensorop_s16816fprop_optimized_f16_128x128_32x5_nhwc_align2,passed,success,fprop,256,56,56,64,64,1,1,56,56,0,0,1,1,1,1,f16:nhwc,f16:nhwc,f32:nhwc,cross,optimized,1,0,serial,1,none,tensorop,f32,128,128,32,5,2,2,1,16,8,16,80,1024,308289536,6679429120,21,1.25002,229.69,5343.46
1,CUTLASS,conv2d,cutlass_tensorop_s16816fprop_optimized_f16_128x64_32x6_nhwc_align8,passed,success,fprop,256,56,56,64,64,1,1,56,56,0,0,1,1,1,1,f16:nhwc,f16:nhwc,f32:nhwc,cross,optimized,1,0,serial,1,none,tensorop,f32,128,64,32,6,2,2,1,16,8,16,80,1024,308289536,6679429120,21,0.766034,374.81,8719.5
1,CUTLASS,conv2d,cutlass_tensorop_s16816fprop_optimized_f16_128x64_32x6_nhwc_align4,passed,success,fprop,256,56,56,64,64,1,1,56,56,0,0,1,1,1,1,f16:nhwc,f16:nhwc,f32:nhwc,cross,optimized,1,0,serial,1,none,tensorop,f32,128,64,32,6,2,2,1,16,8,16,80,1024,308289536,6679429120,21,0.766147,374.755,8718.21
1,CUTLASS,conv2d,cutlass_tensorop_s16816fprop_optimized_f16_128x64_32x6_nhwc_align2,passed,success,fprop,256,56,56,64,64,1,1,56,56,0,0,1,1,1,1,f16:nhwc,f16:nhwc,f32:nhwc,cross,optimized,1,0,serial,1,none,tensorop,f32,128,64,32,6,2,2,1,16,8,16,80,1024,308289536,6679429120,21,0.901724,318.409,7407.4
1,CUTLASS,conv2d,cutlass_tensorop_s16816fprop_optimized_f16_64x128_32x6_nhwc_align8,passed,success,fprop,256,56,56,64,64,1,1,56,56,0,0,1,1,1,1,f16:nhwc,f16:nhwc,f32:nhwc,cross,optimized,1,0,serial,1,none,tensorop,f32,64,128,32,6,2,2,1,16,8,16,80,1024,308289536,6679429120,21,0.946452,303.361,7057.33
1,CUTLASS,conv2d,cutlass_tensorop_s16816fprop_optimized_f16_64x128_32x6_nhwc_align4,passed,success,fprop,256,56,56,64,64,1,1,56,56,0,0,1,1,1,1,f16:nhwc,f16:nhwc,f32:nhwc,cross,optimized,1,0,serial,1,none,tensorop,f32,64,128,32,6,2,2,1,16,8,16,80,1024,308289536,6679429120,21,1.04613,274.457,6384.9
1,CUTLASS,conv2d,cutlass_tensorop_s16816fprop_optimized_f16_64x128_32x6_nhwc_align2,passed,success,fprop,256,56,56,64,64,1,1,56,56,0,0,1,1,1,1,f16:nhwc,f16:nhwc,f32:nhwc,cross,optimized,1,0,serial,1,none,tensorop,f32,64,128,32,6,2,2,1,16,8,16,80,1024,308289536,6679429120,21,1.55984,184.068,4282.13
1,CUTLASS,conv2d,cutlass_tensorop_s16816fprop_optimized_f16_64x64_32x10_nhwc_align8,passed,success,fprop,256,56,56,64,64,1,1,56,56,0,0,1,1,1,1,f16:nhwc,f16:nhwc,f32:nhwc,cross,optimized,1,0,serial,1,none,tensorop,f32,64,64,32,10,2,2,1,16,8,16,80,1024,308289536,6679429120,21,0.779438,368.364,8569.54
1,CUTLASS,conv2d,cutlass_tensorop_s16816fprop_optimized_f16_64x64_32x10_nhwc_align4,passed,success,fprop,256,56,56,64,64,1,1,56,56,0,0,1,1,1,1,f16:nhwc,f16:nhwc,f32:nhwc,cross,optimized,1,0,serial,1,none,tensorop,f32,64,64,32,10,2,2,1,16,8,16,80,1024,308289536,6679429120,21,0.886292,323.953,7536.37
1,CUTLASS,conv2d,cutlass_tensorop_s16816fprop_optimized_f16_64x64_32x10_nhwc_align2,passed,success,fprop,256,56,56,64,64,1,1,56,56,0,0,1,1,1,1,f16:nhwc,f16:nhwc,f32:nhwc,cross,optimized,1,0,serial,1,none,tensorop,f32,64,64,32,10,2,2,1,16,8,16,80,1024,308289536,6679429120,21,1.46016,196.634,4574.44
1,CUTLASS,conv2d,cutlass_tensorop_s16816fprop_optimized_f16_128x64_64x3_nhwc_align8,passed,success,fprop,256,56,56,64,64,1,1,56,56,0,0,1,1,1,1,f16:nhwc,f16:nhwc,f32:nhwc,cross,optimized,1,0,serial,1,none,tensorop,f32,128,64,64,3,2,2,1,16,8,16,80,1024,308289536,6679429120,21,0.790712,363.112,8447.36
1,CUTLASS,conv2d,cutlass_tensorop_s16816fprop_optimized_f16_128x64_64x3_nhwc_align4,passed,success,fprop,256,56,56,64,64,1,1,56,56,0,0,1,1,1,1,f16:nhwc,f16:nhwc,f32:nhwc,cross,optimized,1,0,serial,1,none,tensorop,f32,128,64,64,3,2,2,1,16,8,16,80,1024,308289536,6679429120,21,0.768758,373.482,8688.6
1,CUTLASS,conv2d,cutlass_tensorop_s16816fprop_optimized_f16_128x64_64x3_nhwc_align2,passed,success,fprop,256,56,56,64,64,1,1,56,56,0,0,1,1,1,1,f16:nhwc,f16:nhwc,f32:nhwc,cross,optimized,1,0,serial,1,none,tensorop,f32,128,64,64,3,2,2,1,16,8,16,80,1024,308289536,6679429120,21,3.21652,89.2634,2076.6
1,CUTLASS,conv2d,cutlass_tensorop_s16816fprop_optimized_f16_64x128_64x3_nhwc_align8,passed,success,fprop,256,56,56,64,64,1,1,56,56,0,0,1,1,1,1,f16:nhwc,f16:nhwc,f32:nhwc,cross,optimized,1,0,serial,1,none,tensorop,f32,64,128,64,3,2,2,1,16,8,16,80,1024,308289536,6679429120,21,0.972575,295.213,6867.78
1,CUTLASS,conv2d,cutlass_tensorop_s16816fprop_optimized_f16_64x128_64x3_nhwc_align4,passed,success,fprop,256,56,56,64,64,1,1,56,56,0,0,1,1,1,1,f16:nhwc,f16:nhwc,f32:nhwc,cross,optimized,1,0,serial,1,none,tensorop,f32,64,128,64,3,2,2,1,16,8,16,80,1024,308289536,6679429120,21,1.01888,281.797,6555.66
1,CUTLASS,conv2d,cutlass_tensorop_s16816fprop_optimized_f16_64x128_64x3_nhwc_align2,passed,success,fprop,256,56,56,64,64,1,1,56,56,0,0,1,1,1,1,f16:nhwc,f16:nhwc,f32:nhwc,cross,optimized,1,0,serial,1,none,tensorop,f32,64,128,64,3,2,2,1,16,8,16,80,1024,308289536,6679429120,21,1.16772,245.879,5720.07
1,CUTLASS,conv2d,cutlass_tensorop_s16816fprop_optimized_f16_64x64_64x5_nhwc_align8,passed,success,fprop,256,56,56,64,64,1,1,56,56,0,0,1,1,1,1,f16:nhwc,f16:nhwc,f32:nhwc,cross,optimized,1,0,serial,1,none,tensorop,f32,64,64,64,5,2,2,1,16,8,16,80,1024,308289536,6679429120,21,0.783882,366.276,8520.96
1,CUTLASS,conv2d,cutlass_tensorop_s16816fprop_optimized_f16_64x64_64x5_nhwc_align4,passed,success,fprop,256,56,56,64,64,1,1,56,56,0,0,1,1,1,1,f16:nhwc,f16:nhwc,f32:nhwc,cross,optimized,1,0,serial,1,none,tensorop,f32,64,64,64,5,2,2,1,16,8,16,80,1024,308289536,6679429120,21,0.811633,353.752,8229.62
1,CUTLASS,conv2d,cutlass_tensorop_s16816fprop_optimized_f16_64x64_64x5_nhwc_align2,passed,success,fprop,256,56,56,64,64,1,1,56,56,0,0,1,1,1,1,f16:nhwc,f16:nhwc,f32:nhwc,cross,optimized,1,0,serial,1,none,tensorop,f32,64,64,64,5,2,2,1,16,8,16,80,1024,308289536,6679429120,21,1.04884,273.746,6368.37
1,CUTLASS,conv2d,cutlass_tensorop_s1688fprop_optimized_f16_256x128_32x2_nhwc_align8,passed,success,fprop,256,56,56,64,64,3,3,56,56,1,1,1,1,1,1,f16:nhwc,f16:nhwc,f32:nhwc,cross,optimized,1,0,serial,1,none,tensorop,f32,256,128,32,2,4,2,1,16,8,8,75,1024,1130438656,59292778496,52,3.50105,300.711,16935.7
1,CUTLASS,conv2d,cutlass_tensorop_s1688fprop_optimized_f16_256x128_32x2_nhwc_align4,passed,success,fprop,256,56,56,64,64,3,3,56,56,1,1,1,1,1,1,f16:nhwc,f16:nhwc,f32:nhwc,cross,optimized,1,0,serial,1,none,tensorop,f32,256,128,32,2,4,2,1,16,8,8,75,1024,1130438656,59292778496,52,3.47905,302.612,17042.8
1,CUTLASS,conv2d,cutlass_tensorop_s1688fprop_optimized_f16_256x128_32x2_nhwc_align2,passed,success,fprop,256,56,56,64,64,3,3,56,56,1,1,1,1,1,1,f16:nhwc,f16:nhwc,f32:nhwc,cross,optimized,1,0,serial,1,none,tensorop,f32,256,128,32,2,4,2,1,16,8,8,75,1024,1130438656,59292778496,52,3.41059,308.687,17384.9
1,CUTLASS,conv2d,cutlass_tensorop_s1688fprop_optimized_f16_256x128_32x2_nhwc_align1,passed,success,fprop,256,56,56,64,64,3,3,56,56,1,1,1,1,1,1,f16:nhwc,f16:nhwc,f32:nhwc,cross,optimized,1,0,serial,1,none,tensorop,f32,256,128,32,2,4,2,1,16,8,8,75,1024,1130438656,59292778496,52,13.3495,78.8644,4441.56
1,CUTLASS,conv2d,cutlass_tensorop_s1688fprop_optimized_f16_128x256_32x2_nhwc_align8,passed,success,fprop,256,56,56,64,64,3,3,56,56,1,1,1,1,1,1,f16:nhwc,f16:nhwc,f32:nhwc,cross,optimized,1,0,serial,1,none,tensorop,f32,128,256,32,2,2,4,1,16,8,8,75,1024,1130438656,59292778496,52,6.29178,167.33,9423.84
1,CUTLASS,conv2d,cutlass_tensorop_s1688fprop_optimized_f16_128x256_32x2_nhwc_align4,passed,success,fprop,256,56,56,64,64,3,3,56,56,1,1,1,1,1,1,f16:nhwc,f16:nhwc,f32:nhwc,cross,optimized,1,0,serial,1,none,tensorop,f32,128,256,32,2,2,4,1,16,8,8,75,1024,1130438656,59292778496,52,6.37927,165.035,9294.61
1,CUTLASS,conv2d,cutlass_tensorop_s1688fprop_optimized_f16_128x256_32x2_nhwc_align2,passed,success,fprop,256,56,56,64,64,3,3,56,56,1,1,1,1,1,1,f16:nhwc,f16:nhwc,f32:nhwc,cross,optimized,1,0,serial,1,none,tensorop,f32,128,256,32,2,2,4,1,16,8,8,75,1024,1130438656,59292778496,52,6.46761,162.781,9167.64
1,CUTLASS,conv2d,cutlass_tensorop_s1688fprop_optimized_f16_128x256_32x2_nhwc_align1,passed,success,fprop,256,56,56,64,64,3,3,56,56,1,1,1,1,1,1,f16:nhwc,f16:nhwc,f32:nhwc,cross,optimized,1,0,serial,1,none,tensorop,f32,128,256,32,2,2,4,1,16,8,8,75,1024,1130438656,59292778496,52,7.83922,134.299,7563.61
1,CUTLASS,conv2d,cutlass_tensorop_s1688fprop_optimized_f16_128x128_32x2_nhwc_align8,passed,success,fprop,256,56,56,64,64,3,3,56,56,1,1,1,1,1,1,f16:nhwc,f16:nhwc,f32:nhwc,cross,optimized,1,0,serial,1,none,tensorop,f32,128,128,32,2,2,2,1,16,8,8,75,1024,1130438656,59292778496,52,3.02223,348.353,19618.9
1,CUTLASS,conv2d,cutlass_tensorop_s1688fprop_optimized_f16_128x128_32x2_nhwc_align4,passed,success,fprop,256,56,56,64,64,3,3,56,56,1,1,1,1,1,1,f16:nhwc,f16:nhwc,f32:nhwc,cross,optimized,1,0,serial,1,none,tensorop,f32,128,128,32,2,2,2,1,16,8,8,75,1024,1130438656,59292778496,52,2.89822,363.259,20458.4
1,CUTLASS,conv2d,cutlass_tensorop_s1688fprop_optimized_f16_128x128_32x2_nhwc_align2,passed,success,fprop,256,56,56,64,64,3,3,56,56,1,1,1,1,1,1,f16:nhwc,f16:nhwc,f32:nhwc,cross,optimized,1,0,serial,1,none,tensorop,f32,128,128,32,2,2,2,1,16,8,8,75,1024,1130438656,59292778496,52,3.04356,345.911,19481.4
1,CUTLASS,conv2d,cutlass_tensorop_s1688fprop_optimized_f16_128x128_32x2_nhwc_align1,passed,success,fprop,256,56,56,64,64,3,3,56,56,1,1,1,1,1,1,f16:nhwc,f16:nhwc,f32:nhwc,cross,optimized,1,0,serial,1,none,tensorop,f32,128,128,32,2,2,2,1,16,8,8,75,1024,1130438656,59292778496,52,11.8842,88.5885,4989.21
1,CUTLASS,conv2d,cutlass_tensorop_s1688fprop_optimized_f16_64x128_32x2_nhwc_align8,passed,success,fprop,256,56,56,64,64,3,3,56,56,1,1,1,1,1,1,f16:nhwc,f16:nhwc,f32:nhwc,cross,optimized,1,0,serial,1,none,tensorop,f32,64,128,32,2,2,2,1,16,8,8,75,1024,1130438656,59292778496,52,2.81143,374.472,21089.9
1,CUTLASS,conv2d,cutlass_tensorop_s1688fprop_optimized_f16_64x128_32x2_nhwc_align4,passed,success,fprop,256,56,56,64,64,3,3,56,56,1,1,1,1,1,1,f16:nhwc,f16:nhwc,f32:nhwc,cross,optimized,1,0,serial,1,none,tensorop,f32,64,128,32,2,2,2,1,16,8,8,75,1024,1130438656,59292778496,52,2.84616,369.903,20832.6
1,CUTLASS,conv2d,cutlass_tensorop_s1688fprop_optimized_f16_64x128_32x2_nhwc_align2,passed,success,fprop,256,56,56,64,64,3,3,56,56,1,1,1,1,1,1,f16:nhwc,f16:nhwc,f32:nhwc,cross,optimized,1,0,serial,1,none,tensorop,f32,64,128,32,2,2,2,1,16,8,8,75,1024,1130438656,59292778496,52,2.96808,354.708,19976.8
1,CUTLASS,conv2d,cutlass_tensorop_s1688fprop_optimized_f16_64x128_32x2_nhwc_align1,passed,success,fprop,256,56,56,64,64,3,3,56,56,1,1,1,1,1,1,f16:nhwc,f16:nhwc,f32:nhwc,cross,optimized,1,0,serial,1,none,tensorop,f32,64,128,32,2,2,2,1,16,8,8,75,1024,1130438656,59292778496,52,4.79389,219.614,12368.4
1,CUTLASS,conv2d,cutlass_tensorop_s1688fprop_optimized_f16_128x64_32x2_nhwc_align8,passed,success,fprop,256,56,56,64,64,3,3,56,56,1,1,1,1,1,1,f16:nhwc,f16:nhwc,f32:nhwc,cross,optimized,1,0,serial,1,none,tensorop,f32,128,64,32,2,2,2,1,16,8,8,75,1024,1130438656,59292778496,52,1.52897,688.572,38779.7
1,CUTLASS,conv2d,cutlass_tensorop_s1688fprop_optimized_f16_128x64_32x2_nhwc_align4,passed,success,fprop,256,56,56,64,64,3,3,56,56,1,1,1,1,1,1,f16:nhwc,f16:nhwc,f32:nhwc,cross,optimized,1,0,serial,1,none,tensorop,f32,128,64,32,2,2,2,1,16,8,8,75,1024,1130438656,59292778496,52,1.5626,673.749,37944.9
1,CUTLASS,conv2d,cutlass_tensorop_s1688fprop_optimized_f16_128x64_32x2_nhwc_align2,passed,success,fprop,256,56,56,64,64,3,3,56,56,1,1,1,1,1,1,f16:nhwc,f16:nhwc,f32:nhwc,cross,optimized,1,0,serial,1,none,tensorop,f32,128,64,32,2,2,2,1,16,8,8,75,1024,1130438656,59292778496,52,2.19863,478.846,26968.1
1,CUTLASS,conv2d,cutlass_tensorop_s1688fprop_optimized_f16_128x64_32x2_nhwc_align1,passed,success,fprop,256,56,56,64,64,3,3,56,56,1,1,1,1,1,1,f16:nhwc,f16:nhwc,f32:nhwc,cross,optimized,1,0,serial,1,none,tensorop,f32,128,64,32,2,2,2,1,16,8,8,75,1024,1130438656,59292778496,52,3.05171,344.987,19429.3
1,CUTLASS,conv2d,cutlass_tensorop_s1688fprop_optimized_f16_64x64_32x2_nhwc_align8,passed,success,fprop,256,56,56,64,64,3,3,56,56,1,1,1,1,1,1,f16:nhwc,f16:nhwc,f32:nhwc,cross,optimized,1,0,serial,1,none,tensorop,f32,64,64,32,2,2,2,1,16,8,8,75,1024,1130438656,59292778496,52,1.55473,677.162,38137.1
1,CUTLASS,conv2d,cutlass_tensorop_s1688fprop_optimized_f16_64x64_32x2_nhwc_align4,passed,success,fprop,256,56,56,64,64,3,3,56,56,1,1,1,1,1,1,f16:nhwc,f16:nhwc,f32:nhwc,cross,optimized,1,0,serial,1,none,tensorop,f32,64,64,32,2,2,2,1,16,8,8,75,1024,1130438656,59292778496,52,1.61132,653.381,36797.8
1,CUTLASS,conv2d,cutlass_tensorop_s1688fprop_optimized_f16_64x64_32x2_nhwc_align2,passed,success,fprop,256,56,56,64,64,3,3,56,56,1,1,1,1,1,1,f16:nhwc,f16:nhwc,f32:nhwc,cross,optimized,1,0,serial,1,none,tensorop,f32,64,64,32,2,2,2,1,16,8,8,75,1024,1130438656,59292778496,52,2.08633,504.62,28419.7
1,CUTLASS,conv2d,cutlass_tensorop_s1688fprop_optimized_f16_64x64_32x2_nhwc_align1,passed,success,fprop,256,56,56,64,64,3,3,56,56,1,1,1,1,1,1,f16:nhwc,f16:nhwc,f32:nhwc,cross,optimized,1,0,serial,1,none,tensorop,f32,64,64,32,2,2,2,1,16,8,8,75,1024,1130438656,59292778496,52,3.44034,306.017,17234.6
1,CUTLASS,conv2d,cutlass_tensorop_s1688fprop_optimized_f16_64x128_64x2_nhwc_align8,passed,success,fprop,256,56,56,64,64,3,3,56,56,1,1,1,1,1,1,f16:nhwc,f16:nhwc,f32:nhwc,cross,optimized,1,0,serial,1,none,tensorop,f32,64,128,64,2,1,2,2,16,8,8,75,1024,1130438656,59292778496,52,2.85671,368.536,20755.6
1,CUTLASS,conv2d,cutlass_tensorop_s1688fprop_optimized_f16_64x128_64x2_nhwc_align4,passed,success,fprop,256,56,56,64,64,3,3,56,56,1,1,1,1,1,1,f16:nhwc,f16:nhwc,f32:nhwc,cross,optimized,1,0,serial,1,none,tensorop,f32,64,128,64,2,1,2,2,16,8,8,75,1024,1130438656,59292778496,52,3.01729,348.924,19651
1,CUTLASS,conv2d,cutlass_tensorop_s1688fprop_optimized_f16_64x128_64x2_nhwc_align2,passed,success,fprop,256,56,56,64,64,3,3,56,56,1,1,1,1,1,1,f16:nhwc,f16:nhwc,f32:nhwc,cross,optimized,1,0,serial,1,none,tensorop,f32,64,128,64,2,1,2,2,16,8,8,75,1024,1130438656,59292778496,52,3.46557,303.789,17109.1
1,CUTLASS,conv2d,cutlass_tensorop_s1688fprop_optimized_f16_64x128_64x2_nhwc_align1,passed,success,fprop,256,56,56,64,64,3,3,56,56,1,1,1,1,1,1,f16:nhwc,f16:nhwc,f32:nhwc,cross,optimized,1,0,serial,1,none,tensorop,f32,64,128,64,2,1,2,2,16,8,8,75,1024,1130438656,59292778496,52,23.6638,44.49,2505.63
1,CUTLASS,conv2d,cutlass_tensorop_s16816fprop_optimized_f16_256x128_32x3_nhwc_align8,passed,success,fprop,256,56,56,64,64,3,3,56,56,1,1,1,1,1,1,f16:nhwc,f16:nhwc,f32:nhwc,cross,optimized,1,0,serial,1,none,tensorop,f32,256,128,32,3,4,2,1,16,8,16,80,1024,1130438656,59292778496,52,3.05769,344.313,19391.3
1,CUTLASS,conv2d,cutlass_tensorop_s16816fprop_optimized_f16_256x128_32x3_nhwc_align4,passed,success,fprop,256,56,56,64,64,3,3,56,56,1,1,1,1,1,1,f16:nhwc,f16:nhwc,f32:nhwc,cross,optimized,1,0,serial,1,none,tensorop,f32,256,128,32,3,4,2,1,16,8,16,80,1024,1130438656,59292778496,52,3.13534,335.785,18911.1
1,CUTLASS,conv2d,cutlass_tensorop_s16816fprop_optimized_f16_256x128_32x3_nhwc_align2,passed,success,fprop,256,56,56,64,64,3,3,56,56,1,1,1,1,1,1,f16:nhwc,f16:nhwc,f32:nhwc,cross,optimized,1,0,serial,1,none,tensorop,f32,256,128,32,3,4,2,1,16,8,16,80,1024,1130438656,59292778496,52,3.31869,317.234,17866.3
1,CUTLASS,conv2d,cutlass_tensorop_s16816fprop_optimized_f16_128x256_32x3_nhwc_align8,passed,success,fprop,256,56,56,64,64,3,3,56,56,1,1,1,1,1,1,f16:nhwc,f16:nhwc,f32:nhwc,cross,optimized,1,0,serial,1,none,tensorop,f32,128,256,32,3,2,4,1,16,8,16,80,1024,1130438656,59292778496,52,5.87687,179.144,10089.2
1,CUTLASS,conv2d,cutlass_tensorop_s16816fprop_optimized_f16_128x256_32x3_nhwc_align4,passed,success,fprop,256,56,56,64,64,3,3,56,56,1,1,1,1,1,1,f16:nhwc,f16:nhwc,f32:nhwc,cross,optimized,1,0,serial,1,none,tensorop,f32,128,256,32,3,2,4,1,16,8,16,80,1024,1130438656,59292778496,52,5.96562,176.478,9939.08
1,CUTLASS,conv2d,cutlass_tensorop_s16816fprop_optimized_f16_128x256_32x3_nhwc_align2,passed,success,fprop,256,56,56,64,64,3,3,56,56,1,1,1,1,1,1,f16:nhwc,f16:nhwc,f32:nhwc,cross,optimized,1,0,serial,1,none,tensorop,f32,128,256,32,3,2,4,1,16,8,16,80,1024,1130438656,59292778496,52,6.23926,168.738,9503.17
1,CUTLASS,conv2d,cutlass_tensorop_s16816fprop_optimized_f16_256x64_32x4_nhwc_align8,passed,success,fprop,256,56,56,64,64,3,3,56,56,1,1,1,1,1,1,f16:nhwc,f16:nhwc,f32:nhwc,cross,optimized,1,0,serial,1,none,tensorop,f32,256,64,32,4,4,1,1,16,8,16,80,1024,1130438656,59292778496,52,1.75128,601.164,33856.9
1,CUTLASS,conv2d,cutlass_tensorop_s16816fprop_optimized_f16_256x64_32x4_nhwc_align4,passed,success,fprop,256,56,56,64,64,3,3,56,56,1,1,1,1,1,1,f16:nhwc,f16:nhwc,f32:nhwc,cross,optimized,1,0,serial,1,none,tensorop,f32,256,64,32,4,4,1,1,16,8,16,80,1024,1130438656,59292778496,52,2.81969,373.376,21028.1
1,CUTLASS,conv2d,cutlass_tensorop_s16816fprop_optimized_f16_256x64_32x4_nhwc_align2,passed,success,fprop,256,56,56,64,64,3,3,56,56,1,1,1,1,1,1,f16:nhwc,f16:nhwc,f32:nhwc,cross,optimized,1,0,serial,1,none,tensorop,f32,256,64,32,4,4,1,1,16,8,16,80,1024,1130438656,59292778496,52,19.8423,53.0586,2988.21
1,CUTLASS,conv2d,cutlass_tensorop_s16816fprop_optimized_f16_64x256_32x4_nhwc_align8,passed,success,fprop,256,56,56,64,64,3,3,56,56,1,1,1,1,1,1,f16:nhwc,f16:nhwc,f32:nhwc,cross,optimized,1,0,serial,1,none,tensorop,f32,64,256,32,4,1,4,1,16,8,16,80,1024,1130438656,59292778496,52,6.10062,172.573,9719.13
1,CUTLASS,conv2d,cutlass_tensorop_s16816fprop_optimized_f16_64x256_32x4_nhwc_align4,passed,success,fprop,256,56,56,64,64,3,3,56,56,1,1,1,1,1,1,f16:nhwc,f16:nhwc,f32:nhwc,cross,optimized,1,0,serial,1,none,tensorop,f32,64,256,32,4,1,4,1,16,8,16,80,1024,1130438656,59292778496,52,6.3038,167.011,9405.89
1,CUTLASS,conv2d,cutlass_tensorop_s16816fprop_optimized_f16_64x256_32x4_nhwc_align2,passed,success,fprop,256,56,56,64,64,3,3,56,56,1,1,1,1,1,1,f16:nhwc,f16:nhwc,f32:nhwc,cross,optimized,1,0,serial,1,none,tensorop,f32,64,256,32,4,1,4,1,16,8,16,80,1024,1130438656,59292778496,52,7.75625,135.736,7644.52
1,CUTLASS,conv2d,cutlass_tensorop_s16816fprop_optimized_f16_128x128_32x3_nhwc_align8,passed,success,fprop,256,56,56,64,64,3,3,56,56,1,1,1,1,1,1,f16:nhwc,f16:nhwc,f32:nhwc,cross,optimized,1,0,serial,1,none,tensorop,f32,128,128,32,3,2,2,1,16,8,16,80,1024,1130438656,59292778496,52,2.7477,383.158,21579.1
1,CUTLASS,conv2d,cutlass_tensorop_s16816fprop_optimized_f16_128x128_32x3_nhwc_align4,passed,success,fprop,256,56,56,64,64,3,3,56,56,1,1,1,1,1,1,f16:nhwc,f16:nhwc,f32:nhwc,cross,optimized,1,0,serial,1,none,tensorop,f32,128,128,32,3,2,2,1,16,8,16,80,1024,1130438656,59292778496,52,2.82289,372.952,21004.3
1,CUTLASS,conv2d,cutlass_tensorop_s16816fprop_optimized_f16_128x128_32x3_nhwc_align2,passed,success,fprop,256,56,56,64,64,3,3,56,56,1,1,1,1,1,1,f16:nhwc,f16:nhwc,f32:nhwc,cross,optimized,1,0,serial,1,none,tensorop,f32,128,128,32,3,2,2,1,16,8,16,80,1024,1130438656,59292778496,52,3.09408,340.264,19163.3
1,CUTLASS,conv2d,cutlass_tensorop_s16816fprop_optimized_f16_128x128_32x4_nhwc_align8,passed,success,fprop,256,56,56,64,64,3,3,56,56,1,1,1,1,1,1,f16:nhwc,f16:nhwc,f32:nhwc,cross,optimized,1,0,serial,1,none,tensorop,f32,128,128,32,4,2,2,1,16,8,16,80,1024,1130438656,59292778496,52,3.10904,338.627,19071.1
1,CUTLASS,conv2d,cutlass_tensorop_s16816fprop_optimized_f16_128x128_32x4_nhwc_align4,passed,success,fprop,256,56,56,64,64,3,3,56,56,1,1,1,1,1,1,f16:nhwc,f16:nhwc,f32:nhwc,cross,optimized,1,0,serial,1,none,tensorop,f32,128,128,32,4,2,2,1,16,8,16,80,1024,1130438656,59292778496,52,3.23747,325.193,18314.6
1,CUTLASS,conv2d,cutlass_tensorop_s16816fprop_optimized_f16_128x128_32x4_nhwc_align2,passed,success,fprop,256,56,56,64,64,3,3,56,56,1,1,1,1,1,1,f16:nhwc,f16:nhwc,f32:nhwc,cross,optimized,1,0,serial,1,none,tensorop,f32,128,128,32,4,2,2,1,16,8,16,80,1024,1130438656,59292778496,52,3.87532,271.669,15300.1
1,CUTLASS,conv2d,cutlass_tensorop_s16816fprop_optimized_f16_128x128_32x5_nhwc_align8,passed,success,fprop,256,56,56,64,64,3,3,56,56,1,1,1,1,1,1,f16:nhwc,f16:nhwc,f32:nhwc,cross,optimized,1,0,serial,1,none,tensorop,f32,128,128,32,5,2,2,1,16,8,16,80,1024,1130438656,59292778496,52,3.10602,338.956,19089.6
1,CUTLASS,conv2d,cutlass_tensorop_s16816fprop_optimized_f16_128x128_32x5_nhwc_align4,passed,success,fprop,256,56,56,64,64,3,3,56,56,1,1,1,1,1,1,f16:nhwc,f16:nhwc,f32:nhwc,cross,optimized,1,0,serial,1,none,tensorop,f32,128,128,32,5,2,2,1,16,8,16,80,1024,1130438656,59292778496,52,3.28804,320.191,18032.8
1,CUTLASS,conv2d,cutlass_tensorop_s16816fprop_optimized_f16_128x128_32x5_nhwc_align2,passed,success,fprop,256,56,56,64,64,3,3,56,56,1,1,1,1,1,1,f16:nhwc,f16:nhwc,f32:nhwc,cross,optimized,1,0,serial,1,none,tensorop,f32,128,128,32,5,2,2,1,16,8,16,80,1024,1130438656,59292778496,52,3.99254,263.693,14850.9
1,CUTLASS,conv2d,cutlass_tensorop_s16816fprop_optimized_f16_128x64_32x6_nhwc_align8,passed,success,fprop,256,56,56,64,64,3,3,56,56,1,1,1,1,1,1,f16:nhwc,f16:nhwc,f32:nhwc,cross,optimized,1,0,serial,1,none,tensorop,f32,128,64,32,6,2,2,1,16,8,16,80,1024,1130438656,59292778496,52,1.75036,601.477,33874.6
1,CUTLASS,conv2d,cutlass_tensorop_s16816fprop_optimized_f16_128x64_32x6_nhwc_align4,passed,success,fprop,256,56,56,64,64,3,3,56,56,1,1,1,1,1,1,f16:nhwc,f16:nhwc,f32:nhwc,cross,optimized,1,0,serial,1,none,tensorop,f32,128,64,32,6,2,2,1,16,8,16,80,1024,1130438656,59292778496,52,2.1281,494.716,27861.9
1,CUTLASS,conv2d,cutlass_tensorop_s16816fprop_optimized_f16_128x64_32x6_nhwc_align2,passed,success,fprop,256,56,56,64,64,3,3,56,56,1,1,1,1,1,1,f16:nhwc,f16:nhwc,f32:nhwc,cross,optimized,1,0,serial,1,none,tensorop,f32,128,64,32,6,2,2,1,16,8,16,80,1024,1130438656,59292778496,52,2.51899,417.947,23538.3
1,CUTLASS,conv2d,cutlass_tensorop_s16816fprop_optimized_f16_64x128_32x6_nhwc_align8,passed,success,fprop,256,56,56,64,64,3,3,56,56,1,1,1,1,1,1,f16:nhwc,f16:nhwc,f32:nhwc,cross,optimized,1,0,serial,1,none,tensorop,f32,64,128,32,6,2,2,1,16,8,16,80,1024,1130438656,59292778496,52,3.27231,321.73,18119.5
1,CUTLASS,conv2d,cutlass_tensorop_s16816fprop_optimized_f16_64x128_32x6_nhwc_align4,passed,success,fprop,256,56,56,64,64,3,3,56,56,1,1,1,1,1,1,f16:nhwc,f16:nhwc,f32:nhwc,cross,optimized,1,0,serial,1,none,tensorop,f32,64,128,32,6,2,2,1,16,8,16,80,1024,1130438656,59292778496,52,3.58634,293.559,16533
1,CUTLASS,conv2d,cutlass_tensorop_s16816fprop_optimized_f16_64x128_32x6_nhwc_align2,passed,success,fprop,256,56,56,64,64,3,3,56,56,1,1,1,1,1,1,f16:nhwc,f16:nhwc,f32:nhwc,cross,optimized,1,0,serial,1,none,tensorop,f32,64,128,32,6,2,2,1,16,8,16,80,1024,1130438656,59292778496,52,4.75774,221.282,12462.4
1,CUTLASS,conv2d,cutlass_tensorop_s16816fprop_optimized_f16_64x64_32x10_nhwc_align8,passed,success,fprop,256,56,56,64,64,3,3,56,56,1,1,1,1,1,1,f16:nhwc,f16:nhwc,f32:nhwc,cross,optimized,1,0,serial,1,none,tensorop,f32,64,64,32,10,2,2,1,16,8,16,80,1024,1130438656,59292778496,52,1.97268,533.69,30056.9
1,CUTLASS,conv2d,cutlass_tensorop_s16816fprop_optimized_f16_64x64_32x10_nhwc_align4,passed,success,fprop,256,56,56,64,64,3,3,56,56,1,1,1,1,1,1,f16:nhwc,f16:nhwc,f32:nhwc,cross,optimized,1,0,serial,1,none,tensorop,f32,64,64,32,10,2,2,1,16,8,16,80,1024,1130438656,59292778496,52,2.40784,437.239,24624.8
1,CUTLASS,conv2d,cutlass_tensorop_s16816fprop_optimized_f16_64x64_32x10_nhwc_align2,passed,success,fprop,256,56,56,64,64,3,3,56,56,1,1,1,1,1,1,f16:nhwc,f16:nhwc,f32:nhwc,cross,optimized,1,0,serial,1,none,tensorop,f32,64,64,32,10,2,2,1,16,8,16,80,1024,1130438656,59292778496,52,3.64958,288.473,16246.5
1,CUTLASS,conv2d,cutlass_tensorop_s16816fprop_optimized_f16_128x64_64x3_nhwc_align8,passed,success,fprop,256,56,56,64,64,3,3,56,56,1,1,1,1,1,1,f16:nhwc,f16:nhwc,f32:nhwc,cross,optimized,1,0,serial,1,none,tensorop,f32,128,64,64,3,2,2,1,16,8,16,80,1024,1130438656,59292778496,52,1.7687,595.24,33523.3
1,CUTLASS,conv2d,cutlass_tensorop_s16816fprop_optimized_f16_128x64_64x3_nhwc_align4,passed,success,fprop,256,56,56,64,64,3,3,56,56,1,1,1,1,1,1,f16:nhwc,f16:nhwc,f32:nhwc,cross,optimized,1,0,serial,1,none,tensorop,f32,128,64,64,3,2,2,1,16,8,16,80,1024,1130438656,59292778496,52,1.92098,548.055,30865.9
1,CUTLASS,conv2d,cutlass_tensorop_s16816fprop_optimized_f16_128x64_64x3_nhwc_align2,passed,success,fprop,256,56,56,64,64,3,3,56,56,1,1,1,1,1,1,f16:nhwc,f16:nhwc,f32:nhwc,cross,optimized,1,0,serial,1,none,tensorop,f32,128,64,64,3,2,2,1,16,8,16,80,1024,1130438656,59292778496,52,4.1341,254.663,14342.4
1,CUTLASS,conv2d,cutlass_tensorop_s16816fprop_optimized_f16_64x128_64x3_nhwc_align8,passed,success,fprop,256,56,56,64,64,3,3,56,56,1,1,1,1,1,1,f16:nhwc,f16:nhwc,f32:nhwc,cross,optimized,1,0,serial,1,none,tensorop,f32,64,128,64,3,2,2,1,16,8,16,80,1024,1130438656,59292778496,52,3.29503,319.513,17994.6
1,CUTLASS,conv2d,cutlass_tensorop_s16816fprop_optimized_f16_64x128_64x3_nhwc_align4,passed,success,fprop,256,56,56,64,64,3,3,56,56,1,1,1,1,1,1,f16:nhwc,f16:nhwc,f32:nhwc,cross,optimized,1,0,serial,1,none,tensorop,f32,64,128,64,3,2,2,1,16,8,16,80,1024,1130438656,59292778496,52,3.428,307.118,17296.6
1,CUTLASS,conv2d,cutlass_tensorop_s16816fprop_optimized_f16_64x128_64x3_nhwc_align2,passed,success,fprop,256,56,56,64,64,3,3,56,56,1,1,1,1,1,1,f16:nhwc,f16:nhwc,f32:nhwc,cross,optimized,1,0,serial,1,none,tensorop,f32,64,128,64,3,2,2,1,16,8,16,80,1024,1130438656,59292778496,52,3.79913,277.117,15606.9
1,CUTLASS,conv2d,cutlass_tensorop_s16816fprop_optimized_f16_64x64_64x5_nhwc_align8,passed,success,fprop,256,56,56,64,64,3,3,56,56,1,1,1,1,1,1,f16:nhwc,f16:nhwc,f32:nhwc,cross,optimized,1,0,serial,1,none,tensorop,f32,64,64,64,5,2,2,1,16,8,16,80,1024,1130438656,59292778496,52,2.00094,526.155,29632.5
1,CUTLASS,conv2d,cutlass_tensorop_s16816fprop_optimized_f16_64x64_64x5_nhwc_align4,passed,success,fprop,256,56,56,64,64,3,3,56,56,1,1,1,1,1,1,f16:nhwc,f16:nhwc,f32:nhwc,cross,optimized,1,0,serial,1,none,tensorop,f32,64,64,64,5,2,2,1,16,8,16,80,1024,1130438656,59292778496,52,2.07753,506.757,28540
1,CUTLASS,conv2d,cutlass_tensorop_s16816fprop_optimized_f16_64x64_64x5_nhwc_align2,passed,success,fprop,256,56,56,64,64,3,3,56,56,1,1,1,1,1,1,f16:nhwc,f16:nhwc,f32:nhwc,cross,optimized,1,0,serial,1,none,tensorop,f32,64,64,64,5,2,2,1,16,8,16,80,1024,1130438656,59292778496,52,2.7602,381.422,21481.3
1,CUTLASS,conv2d,cutlass_tensorop_s1688fprop_optimized_f16_256x128_32x2_nhwc_align8,passed,success,fprop,256,56,56,256,64,1,1,56,56,0,0,1,1,1,1,f16:nhwc,f16:nhwc,f32:nhwc,cross,optimized,1,0,serial,1,none,tensorop,f32,256,128,32,2,4,2,1,16,8,8,75,1024,616595456,26409435136,42,1.89779,302.589,13915.9
1,CUTLASS,conv2d,cutlass_tensorop_s1688fprop_optimized_f16_256x128_32x2_nhwc_align4,passed,success,fprop,256,56,56,256,64,1,1,56,56,0,0,1,1,1,1,f16:nhwc,f16:nhwc,f32:nhwc,cross,optimized,1,0,serial,1,none,tensorop,f32,256,128,32,2,4,2,1,16,8,8,75,1024,616595456,26409435136,42,1.91862,299.304,13764.8
1,CUTLASS,conv2d,cutlass_tensorop_s1688fprop_optimized_f16_256x128_32x2_nhwc_align2,passed,success,fprop,256,56,56,256,64,1,1,56,56,0,0,1,1,1,1,f16:nhwc,f16:nhwc,f32:nhwc,cross,optimized,1,0,serial,1,none,tensorop,f32,256,128,32,2,4,2,1,16,8,8,75,1024,616595456,26409435136,42,1.78465,321.772,14798.1
1,CUTLASS,conv2d,cutlass_tensorop_s1688fprop_optimized_f16_256x128_32x2_nhwc_align1,passed,success,fprop,256,56,56,256,64,1,1,56,56,0,0,1,1,1,1,f16:nhwc,f16:nhwc,f32:nhwc,cross,optimized,1,0,serial,1,none,tensorop,f32,256,128,32,2,4,2,1,16,8,8,75,1024,616595456,26409435136,42,7.43527,77.2332,3551.91
1,CUTLASS,conv2d,cutlass_tensorop_s1688fprop_optimized_f16_128x256_32x2_nhwc_align8,passed,success,fprop,256,56,56,256,64,1,1,56,56,0,0,1,1,1,1,f16:nhwc,f16:nhwc,f32:nhwc,cross,optimized,1,0,serial,1,none,tensorop,f32,128,256,32,2,2,4,1,16,8,8,75,1024,616595456,26409435136,42,3.21714,178.497,8208.97
1,CUTLASS,conv2d,cutlass_tensorop_s1688fprop_optimized_f16_128x256_32x2_nhwc_align4,passed,success,fprop,256,56,56,256,64,1,1,56,56,0,0,1,1,1,1,f16:nhwc,f16:nhwc,f32:nhwc,cross,optimized,1,0,serial,1,none,tensorop,f32,128,256,32,2,2,4,1,16,8,8,75,1024,616595456,26409435136,42,3.27254,175.475,8070.01
1,CUTLASS,conv2d,cutlass_tensorop_s1688fprop_optimized_f16_128x256_32x2_nhwc_align2,passed,success,fprop,256,56,56,256,64,1,1,56,56,0,0,1,1,1,1,f16:nhwc,f16:nhwc,f32:nhwc,cross,optimized,1,0,serial,1,none,tensorop,f32,128,256,32,2,2,4,1,16,8,8,75,1024,616595456,26409435136,42,3.82661,150.068,6901.53
1,CUTLASS,conv2d,cutlass_tensorop_s1688fprop_optimized_f16_128x256_32x2_nhwc_align1,passed,success,fprop,256,56,56,256,64,1,1,56,56,0,0,1,1,1,1,f16:nhwc,f16:nhwc,f32:nhwc,cross,optimized,1,0,serial,1,none,tensorop,f32,128,256,32,2,2,4,1,16,8,8,75,1024,616595456,26409435136,42,3.75535,152.915,7032.49
