conv2d/resnet50_cutlass_profiler_result.csv
Problem,Provider,OperationKind,Operation,Disposition,Status,conv_kind,n,h,w,c,k,r,s,p,q,pad_h,pad_w,stride_h,stride_w,dilation_h,dilation_w,Activation,Filter,Output,conv_mode,iterator_algorithm,alpha,beta,split_k_mode,split_k_slices,eq_gemm_provider,op_class,accum,cta_m,cta_n,cta_k,stages,warps_m,warps_n,warps_k,inst_m,inst_n,inst_k,min_cc,max_cc,Bytes,Flops,Runtime,GB/s,GFLOPs
1,CUTLASS,conv2d,cutlass_tensorop_h1688fprop_optimized_256x128_32x2_nhwc_align8,passed,success,fprop,256,56,56,64,256,1,1,56,56,0,0,1,1,1,1,f16:nhwc,f16:nhwc,f16:nhwc,cross,optimized,1,0,serial,1,none,tensorop,f16,256,128,32,2,4,2,1,16,8,8,75,1024,513835008,26717716480,1.51285,316.32,17660.5
1,CUTLASS,conv2d,cutlass_tensorop_h1688fprop_optimized_256x128_32x2_nhwc_align4,passed,success,fprop,256,56,56,64,256,1,1,56,56,0,0,1,1,1,1,f16:nhwc,f16:nhwc,f16:nhwc,cross,optimized,1,0,serial,1,none,tensorop,f16,256,128,32,2,4,2,1,16,8,8,75,1024,513835008,26717716480,1.31464,364.014,20323.2
1,CUTLASS,conv2d,cutlass_tensorop_h1688fprop_optimized_256x128_32x2_nhwc_align2,passed,success,fprop,256,56,56,64,256,1,1,56,56,0,0,1,1,1,1,f16:nhwc,f16:nhwc,f16:nhwc,cross,optimized,1,0,serial,1,none,tensorop,f16,256,128,32,2,4,2,1,16,8,8,75,1024,513835008,26717716480,1.4807,323.19,18044
1,CUTLASS,conv2d,cutlass_tensorop_h1688fprop_optimized_256x128_32x2_nhwc_align1,passed,success,fprop,256,56,56,64,256,1,1,56,56,0,0,1,1,1,1,f16:nhwc,f16:nhwc,f16:nhwc,cross,optimized,1,0,serial,1,none,tensorop,f16,256,128,32,2,4,2,1,16,8,8,75,1024,513835008,26717716480,1.80778,264.714,14779.3
1,CUTLASS,conv2d,cutlass_tensorop_h1688fprop_optimized_128x256_32x2_nhwc_align8,passed,success,fprop,256,56,56,64,256,1,1,56,56,0,0,1,1,1,1,f16:nhwc,f16:nhwc,f16:nhwc,cross,optimized,1,0,serial,1,none,tensorop,f16,128,256,32,2,2,4,1,16,8,8,75,1024,513835008,26717716480,1.28608,372.097,20774.5
1,CUTLASS,conv2d,cutlass_tensorop_h1688fprop_optimized_128x256_32x2_nhwc_align4,passed,success,fprop,256,56,56,64,256,1,1,56,56,0,0,1,1,1,1,f16:nhwc,f16:nhwc,f16:nhwc,cross,optimized,1,0,serial,1,none,tensorop,f16,128,256,32,2,2,4,1,16,8,8,75,1024,513835008,26717716480,1.29019,370.912,20708.4
1,CUTLASS,conv2d,cutlass_tensorop_h1688fprop_optimized_128x256_32x2_nhwc_align2,passed,success,fprop,256,56,56,64,256,1,1,56,56,0,0,1,1,1,1,f16:nhwc,f16:nhwc,f16:nhwc,cross,optimized,1,0,serial,1,none,tensorop,f16,128,256,32,2,2,4,1,16,8,8,75,1024,513835008,26717716480,1.35027,354.407,19786.9
1,CUTLASS,conv2d,cutlass_tensorop_h1688fprop_optimized_128x256_32x2_nhwc_align1,passed,success,fprop,256,56,56,64,256,1,1,56,56,0,0,1,1,1,1,f16:nhwc,f16:nhwc,f16:nhwc,cross,optimized,1,0,serial,1,none,tensorop,f16,128,256,32,2,2,4,1,16,8,8,75,1024,513835008,26717716480,1.71076,279.727,15617.4
1,CUTLASS,conv2d,cutlass_tensorop_h1688fprop_optimized_128x128_32x2_nhwc_align8,passed,success,fprop,256,56,56,64,256,1,1,56,56,0,0,1,1,1,1,f16:nhwc,f16:nhwc,f16:nhwc,cross,optimized,1,0,serial,1,none,tensorop,f16,128,128,32,2,2,2,1,16,8,8,75,1024,513835008,26717716480,1.27705,374.728,20921.5
1,CUTLASS,conv2d,cutlass_tensorop_h1688fprop_optimized_128x128_32x2_nhwc_align4,passed,success,fprop,256,56,56,64,256,1,1,56,56,0,0,1,1,1,1,f16:nhwc,f16:nhwc,f16:nhwc,cross,optimized,1,0,serial,1,none,tensorop,f16,128,128,32,2,2,2,1,16,8,8,75,1024,513835008,26717716480,1.27842,374.325,20899
1,CUTLASS,conv2d,cutlass_tensorop_h1688fprop_optimized_128x128_32x2_nhwc_align2,passed,success,fprop,256,56,56,64,256,1,1,56,56,0,0,1,1,1,1,f16:nhwc,f16:nhwc,f16:nhwc,cross,optimized,1,0,serial,1,none,tensorop,f16,128,128,32,2,2,2,1,16,8,8,75,1024,513835008,26717716480,1.47525,324.383,18110.6
1,CUTLASS,conv2d,cutlass_tensorop_h1688fprop_optimized_128x128_32x2_nhwc_align1,passed,success,fprop,256,56,56,64,256,1,1,56,56,0,0,1,1,1,1,f16:nhwc,f16:nhwc,f16:nhwc,cross,optimized,1,0,serial,1,none,tensorop,f16,128,128,32,2,2,2,1,16,8,8,75,1024,513835008,26717716480,1.72116,278.038,15523.1
1,CUTLASS,conv2d,cutlass_tensorop_h1688fprop_optimized_64x128_32x2_nhwc_align8,passed,success,fprop,256,56,56,64,256,1,1,56,56,0,0,1,1,1,1,f16:nhwc,f16:nhwc,f16:nhwc,cross,optimized,1,0,serial,1,none,tensorop,f16,64,128,32,2,2,2,1,16,8,8,75,1024,513835008,26717716480,1.27584,375.084,20941.3
1,CUTLASS,conv2d,cutlass_tensorop_h1688fprop_optimized_64x128_32x2_nhwc_align4,passed,success,fprop,256,56,56,64,256,1,1,56,56,0,0,1,1,1,1,f16:nhwc,f16:nhwc,f16:nhwc,cross,optimized,1,0,serial,1,none,tensorop,f16,64,128,32,2,2,2,1,16,8,8,75,1024,513835008,26717716480,1.27771,374.534,20910.6
1,CUTLASS,conv2d,cutlass_tensorop_h1688fprop_optimized_64x128_32x2_nhwc_align2,passed,success,fprop,256,56,56,64,256,1,1,56,56,0,0,1,1,1,1,f16:nhwc,f16:nhwc,f16:nhwc,cross,optimized,1,0,serial,1,none,tensorop,f16,64,128,32,2,2,2,1,16,8,8,75,1024,513835008,26717716480,1.28075,373.644,20860.9
1,CUTLASS,conv2d,cutlass_tensorop_h1688fprop_optimized_64x128_32x2_nhwc_align1,passed,success,fprop,256,56,56,64,256,1,1,56,56,0,0,1,1,1,1,f16:nhwc,f16:nhwc,f16:nhwc,cross,optimized,1,0,serial,1,none,tensorop,f16,64,128,32,2,2,2,1,16,8,8,75,1024,513835008,26717716480,1.76505,271.123,15137.1
1,CUTLASS,conv2d,cutlass_tensorop_h1688fprop_optimized_128x64_32x2_nhwc_align8,passed,success,fprop,256,56,56,64,256,1,1,56,56,0,0,1,1,1,1,f16:nhwc,f16:nhwc,f16:nhwc,cross,optimized,1,0,serial,1,none,tensorop,f16,128,64,32,2,2,2,1,16,8,8,75,1024,513835008,26717716480,1.27711,374.709,20920.4
1,CUTLASS,conv2d,cutlass_tensorop_h1688fprop_optimized_128x64_32x2_nhwc_align4,passed,success,fprop,256,56,56,64,256,1,1,56,56,0,0,1,1,1,1,f16:nhwc,f16:nhwc,f16:nhwc,cross,optimized,1,0,serial,1,none,tensorop,f16,128,64,32,2,2,2,1,16,8,8,75,1024,513835008,26717716480,1.28568,372.214,20781.1
1,CUTLASS,conv2d,cutlass_tensorop_h1688fprop_optimized_128x64_32x2_nhwc_align2,passed,success,fprop,256,56,56,64,256,1,1,56,56,0,0,1,1,1,1,f16:nhwc,f16:nhwc,f16:nhwc,cross,optimized,1,0,serial,1,none,tensorop,f16,128,64,32,2,2,2,1,16,8,8,75,1024,513835008,26717716480,1.50187,318.635,17789.7
1,CUTLASS,conv2d,cutlass_tensorop_h1688fprop_optimized_128x64_32x2_nhwc_align1,passed,success,fprop,256,56,56,64,256,1,1,56,56,0,0,1,1,1,1,f16:nhwc,f16:nhwc,f16:nhwc,cross,optimized,1,0,serial,1,none,tensorop,f16,128,64,32,2,2,2,1,16,8,8,75,1024,513835008,26717716480,2.15393,222.173,12404.2
1,CUTLASS,conv2d,cutlass_tensorop_h1688fprop_optimized_64x64_32x2_nhwc_align8,passed,success,fprop,256,56,56,64,256,1,1,56,56,0,0,1,1,1,1,f16:nhwc,f16:nhwc,f16:nhwc,cross,optimized,1,0,serial,1,none,tensorop,f16,64,64,32,2,2,2,1,16,8,8,75,1024,513835008,26717716480,1.27324,375.849,20984
1,CUTLASS,conv2d,cutlass_tensorop_h1688fprop_optimized_64x64_32x2_nhwc_align4,passed,success,fprop,256,56,56,64,256,1,1,56,56,0,0,1,1,1,1,f16:nhwc,f16:nhwc,f16:nhwc,cross,optimized,1,0,serial,1,none,tensorop,f16,64,64,32,2,2,2,1,16,8,8,75,1024,513835008,26717716480,1.29573,369.325,20619.8
1,CUTLASS,conv2d,cutlass_tensorop_h1688fprop_optimized_64x64_32x2_nhwc_align2,passed,success,fprop,256,56,56,64,256,1,1,56,56,0,0,1,1,1,1,f16:nhwc,f16:nhwc,f16:nhwc,cross,optimized,1,0,serial,1,none,tensorop,f16,64,64,32,2,2,2,1,16,8,8,75,1024,513835008,26717716480,1.4661,326.408,18223.7
1,CUTLASS,conv2d,cutlass_tensorop_h1688fprop_optimized_64x64_32x2_nhwc_align1,passed,success,fprop,256,56,56,64,256,1,1,56,56,0,0,1,1,1,1,f16:nhwc,f16:nhwc,f16:nhwc,cross,optimized,1,0,serial,1,none,tensorop,f16,64,64,32,2,2,2,1,16,8,8,75,1024,513835008,26717716480,2.16476,221.062,12342.1
1,CUTLASS,conv2d,cutlass_tensorop_h1688fprop_optimized_64x128_64x2_nhwc_align8,passed,success,fprop,256,56,56,64,256,1,1,56,56,0,0,1,1,1,1,f16:nhwc,f16:nhwc,f16:nhwc,cross,optimized,1,0,serial,1,none,tensorop,f16,64,128,64,2,1,2,2,16,8,8,75,1024,513835008,26717716480,1.28191,373.307,20842.1
1,CUTLASS,conv2d,cutlass_tensorop_h1688fprop_optimized_64x128_64x2_nhwc_align4,passed,success,fprop,256,56,56,64,256,1,1,56,56,0,0,1,1,1,1,f16:nhwc,f16:nhwc,f16:nhwc,cross,optimized,1,0,serial,1,none,tensorop,f16,64,128,64,2,1,2,2,16,8,8,75,1024,513835008,26717716480,1.27438,375.514,20965.3
1,CUTLASS,conv2d,cutlass_tensorop_h1688fprop_optimized_64x128_64x2_nhwc_align2,passed,success,fprop,256,56,56,64,256,1,1,56,56,0,0,1,1,1,1,f16:nhwc,f16:nhwc,f16:nhwc,cross,optimized,1,0,serial,1,none,tensorop,f16,64,128,64,2,1,2,2,16,8,8,75,1024,513835008,26717716480,1.38062,346.617,19352
1,CUTLASS,conv2d,cutlass_tensorop_h1688fprop_optimized_64x128_64x2_nhwc_align1,passed,success,fprop,256,56,56,64,256,1,1,56,56,0,0,1,1,1,1,f16:nhwc,f16:nhwc,f16:nhwc,cross,optimized,1,0,serial,1,none,tensorop,f16,64,128,64,2,1,2,2,16,8,8,75,1024,513835008,26717716480,3.23662,147.854,8254.83
1,CUTLASS,conv2d,cutlass_tensorop_h16816fprop_optimized_256x128_32x3_nhwc_align8,passed,success,fprop,256,56,56,64,256,1,1,56,56,0,0,1,1,1,1,f16:nhwc,f16:nhwc,f16:nhwc,cross,optimized,1,0,serial,1,none,tensorop,f16,256,128,32,3,4,2,1,16,8,16,80,1024,513835008,26717716480,1.29738,368.856,20593.6
1,CUTLASS,conv2d,cutlass_tensorop_h16816fprop_optimized_256x128_32x3_nhwc_align4,passed,success,fprop,256,56,56,64,256,1,1,56,56,0,0,1,1,1,1,f16:nhwc,f16:nhwc,f16:nhwc,cross,optimized,1,0,serial,1,none,tensorop,f16,256,128,32,3,4,2,1,16,8,16,80,1024,513835008,26717716480,1.45218,329.536,18398.3
1,CUTLASS,conv2d,cutlass_tensorop_h16816fprop_optimized_256x128_32x3_nhwc_align2,passed,success,fprop,256,56,56,64,256,1,1,56,56,0,0,1,1,1,1,f16:nhwc,f16:nhwc,f16:nhwc,cross,optimized,1,0,serial,1,none,tensorop,f16,256,128,32,3,4,2,1,16,8,16,80,1024,513835008,26717716480,1.56175,306.417,17107.6
1,CUTLASS,conv2d,cutlass_tensorop_h16816fprop_optimized_128x256_32x3_nhwc_align8,passed,success,fprop,256,56,56,64,256,1,1,56,56,0,0,1,1,1,1,f16:nhwc,f16:nhwc,f16:nhwc,cross,optimized,1,0,serial,1,none,tensorop,f16,128,256,32,3,2,4,1,16,8,16,80,1024,513835008,26717716480,1.29023,370.901,20707.8
1,CUTLASS,conv2d,cutlass_tensorop_h16816fprop_optimized_128x256_32x3_nhwc_align4,passed,success,fprop,256,56,56,64,256,1,1,56,56,0,0,1,1,1,1,f16:nhwc,f16:nhwc,f16:nhwc,cross,optimized,1,0,serial,1,none,tensorop,f16,128,256,32,3,2,4,1,16,8,16,80,1024,513835008,26717716480,1.40151,341.449,19063.5
1,CUTLASS,conv2d,cutlass_tensorop_h16816fprop_optimized_128x256_32x3_nhwc_align2,passed,success,fprop,256,56,56,64,256,1,1,56,56,0,0,1,1,1,1,f16:nhwc,f16:nhwc,f16:nhwc,cross,optimized,1,0,serial,1,none,tensorop,f16,128,256,32,3,2,4,1,16,8,16,80,1024,513835008,26717716480,1.32138,362.157,20219.6
1,CUTLASS,conv2d,cutlass_tensorop_h16816fprop_optimized_256x64_32x4_nhwc_align8,passed,success,fprop,256,56,56,64,256,1,1,56,56,0,0,1,1,1,1,f16:nhwc,f16:nhwc,f16:nhwc,cross,optimized,1,0,serial,1,none,tensorop,f16,256,64,32,4,4,1,1,16,8,16,80,1024,513835008,26717716480,1.46594,326.444,18225.7
1,CUTLASS,conv2d,cutlass_tensorop_h16816fprop_optimized_256x64_32x4_nhwc_align4,passed,success,fprop,256,56,56,64,256,1,1,56,56,0,0,1,1,1,1,f16:nhwc,f16:nhwc,f16:nhwc,cross,optimized,1,0,serial,1,none,tensorop,f16,256,64,32,4,4,1,1,16,8,16,80,1024,513835008,26717716480,1.68304,284.334,15874.7
1,CUTLASS,conv2d,cutlass_tensorop_h16816fprop_optimized_256x64_32x4_nhwc_align2,passed,success,fprop,256,56,56,64,256,1,1,56,56,0,0,1,1,1,1,f16:nhwc,f16:nhwc,f16:nhwc,cross,optimized,1,0,serial,1,none,tensorop,f16,256,64,32,4,4,1,1,16,8,16,80,1024,513835008,26717716480,6.82052,70.1627,3917.25
1,CUTLASS,conv2d,cutlass_tensorop_h16816fprop_optimized_64x256_32x4_nhwc_align8,passed,success,fprop,256,56,56,64,256,1,1,56,56,0,0,1,1,1,1,f16:nhwc,f16:nhwc,f16:nhwc,cross,optimized,1,0,serial,1,none,tensorop,f16,64,256,32,4,1,4,1,16,8,16,80,1024,513835008,26717716480,1.27942,374.034,20882.7
1,CUTLASS,conv2d,cutlass_tensorop_h16816fprop_optimized_64x256_32x4_nhwc_align4,passed,success,fprop,256,56,56,64,256,1,1,56,56,0,0,1,1,1,1,f16:nhwc,f16:nhwc,f16:nhwc,cross,optimized,1,0,serial,1,none,tensorop,f16,64,256,32,4,1,4,1,16,8,16,80,1024,513835008,26717716480,1.39337,343.444,19174.9
1,CUTLASS,conv2d,cutlass_tensorop_h16816fprop_optimized_64x256_32x4_nhwc_align2,passed,success,fprop,256,56,56,64,256,1,1,56,56,0,0,1,1,1,1,f16:nhwc,f16:nhwc,f16:nhwc,cross,optimized,1,0,serial,1,none,tensorop,f16,64,256,32,4,1,4,1,16,8,16,80,1024,513835008,26717716480,2.01075,237.994,13287.4
1,CUTLASS,conv2d,cutlass_tensorop_h16816fprop_optimized_128x128_32x3_nhwc_align8,passed,success,fprop,256,56,56,64,256,1,1,56,56,0,0,1,1,1,1,f16:nhwc,f16:nhwc,f16:nhwc,cross,optimized,1,0,serial,1,none,tensorop,f16,128,128,32,3,2,2,1,16,8,16,80,1024,513835008,26717716480,1.28556,372.246,20782.9
1,CUTLASS,conv2d,cutlass_tensorop_h16816fprop_optimized_128x128_32x3_nhwc_align4,passed,success,fprop,256,56,56,64,256,1,1,56,56,0,0,1,1,1,1,f16:nhwc,f16:nhwc,f16:nhwc,cross,optimized,1,0,serial,1,none,tensorop,f16,128,128,32,3,2,2,1,16,8,16,80,1024,513835008,26717716480,1.2867,371.917,20764.5
1,CUTLASS,conv2d,cutlass_tensorop_h16816fprop_optimized_128x128_32x3_nhwc_align2,passed,success,fprop,256,56,56,64,256,1,1,56,56,0,0,1,1,1,1,f16:nhwc,f16:nhwc,f16:nhwc,cross,optimized,1,0,serial,1,none,tensorop,f16,128,128,32,3,2,2,1,16,8,16,80,1024,513835008,26717716480,1.30137,367.724,20530.4
1,CUTLASS,conv2d,cutlass_tensorop_h16816fprop_optimized_128x128_32x4_nhwc_align8,passed,success,fprop,256,56,56,64,256,1,1,56,56,0,0,1,1,1,1,f16:nhwc,f16:nhwc,f16:nhwc,cross,optimized,1,0,serial,1,none,tensorop,f16,128,128,32,4,2,2,1,16,8,16,80,1024,513835008,26717716480,1.27501,375.327,20954.9
1,CUTLASS,conv2d,cutlass_tensorop_h16816fprop_optimized_128x128_32x4_nhwc_align4,passed,success,fprop,256,56,56,64,256,1,1,56,56,0,0,1,1,1,1,f16:nhwc,f16:nhwc,f16:nhwc,cross,optimized,1,0,serial,1,none,tensorop,f16,128,128,32,4,2,2,1,16,8,16,80,1024,513835008,26717716480,1.34219,356.541,19906
1,CUTLASS,conv2d,cutlass_tensorop_h16816fprop_optimized_128x128_32x4_nhwc_align2,passed,success,fprop,256,56,56,64,256,1,1,56,56,0,0,1,1,1,1,f16:nhwc,f16:nhwc,f16:nhwc,cross,optimized,1,0,serial,1,none,tensorop,f16,128,128,32,4,2,2,1,16,8,16,80,1024,513835008,26717716480,1.91885,249.392,13923.8
1,CUTLASS,conv2d,cutlass_tensorop_h16816fprop_optimized_128x128_32x5_nhwc_align8,passed,success,fprop,256,56,56,64,256,1,1,56,56,0,0,1,1,1,1,f16:nhwc,f16:nhwc,f16:nhwc,cross,optimized,1,0,serial,1,none,tensorop,f16,128,128,32,5,2,2,1,16,8,16,80,1024,513835008,26717716480,1.27668,374.835,20927.4
1,CUTLASS,conv2d,cutlass_tensorop_h16816fprop_optimized_128x128_32x5_nhwc_align4,passed,success,fprop,256,56,56,64,256,1,1,56,56,0,0,1,1,1,1,f16:nhwc,f16:nhwc,f16:nhwc,cross,optimized,1,0,serial,1,none,tensorop,f16,128,128,32,5,2,2,1,16,8,16,80,1024,513835008,26717716480,1.42195,336.542,18789.5
1,CUTLASS,conv2d,cutlass_tensorop_h16816fprop_optimized_128x128_32x5_nhwc_align2,passed,success,fprop,256,56,56,64,256,1,1,56,56,0,0,1,1,1,1,f16:nhwc,f16:nhwc,f16:nhwc,cross,optimized,1,0,serial,1,none,tensorop,f16,128,128,32,5,2,2,1,16,8,16,80,1024,513835008,26717716480,2.10592,227.238,12686.9
1,CUTLASS,conv2d,cutlass_tensorop_h16816fprop_optimized_128x64_32x6_nhwc_align8,passed,success,fprop,256,56,56,64,256,1,1,56,56,0,0,1,1,1,1,f16:nhwc,f16:nhwc,f16:nhwc,cross,optimized,1,0,serial,1,none,tensorop,f16,128,64,32,6,2,2,1,16,8,16,80,1024,513835008,26717716480,1.76741,270.761,15116.8
1,CUTLASS,conv2d,cutlass_tensorop_h16816fprop_optimized_128x64_32x6_nhwc_align4,passed,success,fprop,256,56,56,64,256,1,1,56,56,0,0,1,1,1,1,f16:nhwc,f16:nhwc,f16:nhwc,cross,optimized,1,0,serial,1,none,tensorop,f16,128,64,32,6,2,2,1,16,8,16,80,1024,513835008,26717716480,2.07288,230.861,12889.2
1,CUTLASS,conv2d,cutlass_tensorop_h16816fprop_optimized_128x64_32x6_nhwc_align2,passed,success,fprop,256,56,56,64,256,1,1,56,56,0,0,1,1,1,1,f16:nhwc,f16:nhwc,f16:nhwc,cross,optimized,1,0,serial,1,none,tensorop,f16,128,64,32,6,2,2,1,16,8,16,80,1024,513835008,26717716480,3.27179,146.265,8166.1
1,CUTLASS,conv2d,cutlass_tensorop_h16816fprop_optimized_64x128_32x6_nhwc_align8,passed,success,fprop,256,56,56,64,256,1,1,56,56,0,0,1,1,1,1,f16:nhwc,f16:nhwc,f16:nhwc,cross,optimized,1,0,serial,1,none,tensorop,f16,64,128,32,6,2,2,1,16,8,16,80,1024,513835008,26717716480,1.67426,285.826,15958
1,CUTLASS,conv2d,cutlass_tensorop_h16816fprop_optimized_64x128_32x6_nhwc_align4,passed,success,fprop,256,56,56,64,256,1,1,56,56,0,0,1,1,1,1,f16:nhwc,f16:nhwc,f16:nhwc,cross,optimized,1,0,serial,1,none,tensorop,f16,64,128,32,6,2,2,1,16,8,16,80,1024,513835008,26717716480,1.93022,247.923,13841.8
1,CUTLASS,conv2d,cutlass_tensorop_h16816fprop_optimized_64x128_32x6_nhwc_align2,passed,success,fprop,256,56,56,64,256,1,1,56,56,0,0,1,1,1,1,f16:nhwc,f16:nhwc,f16:nhwc,cross,optimized,1,0,serial,1,none,tensorop,f16,64,128,32,6,2,2,1,16,8,16,80,1024,513835008,26717716480,3.28958,145.473,8121.93
1,CUTLASS,conv2d,cutlass_tensorop_h16816fprop_optimized_64x64_32x10_nhwc_align8,passed,success,fprop,256,56,56,64,256,1,1,56,56,0,0,1,1,1,1,f16:nhwc,f16:nhwc,f16:nhwc,cross,optimized,1,0,serial,1,none,tensorop,f16,64,64,32,10,2,2,1,16,8,16,80,1024,513835008,26717716480,2.31268,206.923,11552.7
1,CUTLASS,conv2d,cutlass_tensorop_h16816fprop_optimized_64x64_32x10_nhwc_align4,passed,success,fprop,256,56,56,64,256,1,1,56,56,0,0,1,1,1,1,f16:nhwc,f16:nhwc,f16:nhwc,cross,optimized,1,0,serial,1,none,tensorop,f16,64,64,32,10,2,2,1,16,8,16,80,1024,513835008,26717716480,3.51691,136.07,7596.93
1,CUTLASS,conv2d,cutlass_tensorop_h16816fprop_optimized_64x64_32x10_nhwc_align2,passed,success,fprop,256,56,56,64,256,1,1,56,56,0,0,1,1,1,1,f16:nhwc,f16:nhwc,f16:nhwc,cross,optimized,1,0,serial,1,none,tensorop,f16,64,64,32,10,2,2,1,16,8,16,80,1024,513835008,26717716480,5.51561,86.7621,4844.02
1,CUTLASS,conv2d,cutlass_tensorop_h1688fprop_optimized_256x128_32x2_nhwc_align8,passed,success,fprop,256,56,56,64,64,1,1,56,56,0,0,1,1,1,1,f16:nhwc,f16:nhwc,f16:nhwc,cross,optimized,1,0,serial,1,none,tensorop,f16,256,128,32,2,4,2,1,16,8,8,75,1024,205529088,6679429120,0.505888,378.372,13203.4
1,CUTLASS,conv2d,cutlass_tensorop_h1688fprop_optimized_256x128_32x2_nhwc_align4,passed,success,fprop,256,56,56,64,64,1,1,56,56,0,0,1,1,1,1,f16:nhwc,f16:nhwc,f16:nhwc,cross,optimized,1,0,serial,1,none,tensorop,f16,256,128,32,2,4,2,1,16,8,8,75,1024,205529088,6679429120,0.510651,374.843,13080.2
1,CUTLASS,conv2d,cutlass_tensorop_h1688fprop_optimized_256x128_32x2_nhwc_align2,passed,success,fprop,256,56,56,64,64,1,1,56,56,0,0,1,1,1,1,f16:nhwc,f16:nhwc,f16:nhwc,cross,optimized,1,0,serial,1,none,tensorop,f16,256,128,32,2,4,2,1,16,8,8,75,1024,205529088,6679429120,0.601125,318.426,11111.5
1,CUTLASS,conv2d,cutlass_tensorop_h1688fprop_optimized_256x128_32x2_nhwc_align1,passed,success,fprop,256,56,56,64,64,1,1,56,56,0,0,1,1,1,1,f16:nhwc,f16:nhwc,f16:nhwc,cross,optimized,1,0,serial,1,none,tensorop,f16,256,128,32,2,4,2,1,16,8,8,75,1024,205529088,6679429120,0.789557,242.432,8459.72
1,CUTLASS,conv2d,cutlass_tensorop_h1688fprop_optimized_128x256_32x2_nhwc_align8,passed,success,fprop,256,56,56,64,64,1,1,56,56,0,0,1,1,1,1,f16:nhwc,f16:nhwc,f16:nhwc,cross,optimized,1,0,serial,1,none,tensorop,f16,128,256,32,2,2,4,1,16,8,8,75,1024,205529088,6679429120,0.812897,235.471,8216.82
1,CUTLASS,conv2d,cutlass_tensorop_h1688fprop_optimized_128x256_32x2_nhwc_align4,passed,success,fprop,256,56,56,64,64,1,1,56,56,0,0,1,1,1,1,f16:nhwc,f16:nhwc,f16:nhwc,cross,optimized,1,0,serial,1,none,tensorop,f16,128,256,32,2,2,4,1,16,8,8,75,1024,205529088,6679429120,0.864442,221.431,7726.87
1,CUTLASS,conv2d,cutlass_tensorop_h1688fprop_optimized_128x256_32x2_nhwc_align2,passed,success,fprop,256,56,56,64,64,1,1,56,56,0,0,1,1,1,1,f16:nhwc,f16:nhwc,f16:nhwc,cross,optimized,1,0,serial,1,none,tensorop,f16,128,256,32,2,2,4,1,16,8,8,75,1024,205529088,6679429120,0.964075,198.547,6928.33
1,CUTLASS,conv2d,cutlass_tensorop_h1688fprop_optimized_128x256_32x2_nhwc_align1,passed,success,fprop,256,56,56,64,64,1,1,56,56,0,0,1,1,1,1,f16:nhwc,f16:nhwc,f16:nhwc,cross,optimized,1,0,serial,1,none,tensorop,f16,128,256,32,2,2,4,1,16,8,8,75,1024,205529088,6679429120,1.30437,146.748,5120.8
1,CUTLASS,conv2d,cutlass_tensorop_h1688fprop_optimized_128x128_32x2_nhwc_align8,passed,success,fprop,256,56,56,64,64,1,1,56,56,0,0,1,1,1,1,f16:nhwc,f16:nhwc,f16:nhwc,cross,optimized,1,0,serial,1,none,tensorop,f16,128,128,32,2,2,2,1,16,8,8,75,1024,205529088,6679429120,0.505599,378.589,13210.9
1,CUTLASS,conv2d,cutlass_tensorop_h1688fprop_optimized_128x128_32x2_nhwc_align4,passed,success,fprop,256,56,56,64,64,1,1,56,56,0,0,1,1,1,1,f16:nhwc,f16:nhwc,f16:nhwc,cross,optimized,1,0,serial,1,none,tensorop,f16,128,128,32,2,2,2,1,16,8,8,75,1024,205529088,6679429120,0.50569,378.52,13208.5
1,CUTLASS,conv2d,cutlass_tensorop_h1688fprop_optimized_128x128_32x2_nhwc_align2,passed,success,fprop,256,56,56,64,64,1,1,56,56,0,0,1,1,1,1,f16:nhwc,f16:nhwc,f16:nhwc,cross,optimized,1,0,serial,1,none,tensorop,f16,128,128,32,2,2,2,1,16,8,8,75,1024,205529088,6679429120,0.514732,371.871,12976.5
1,CUTLASS,conv2d,cutlass_tensorop_h1688fprop_optimized_128x128_32x2_nhwc_align1,passed,success,fprop,256,56,56,64,64,1,1,56,56,0,0,1,1,1,1,f16:nhwc,f16:nhwc,f16:nhwc,cross,optimized,1,0,serial,1,none,tensorop,f16,128,128,32,2,2,2,1,16,8,8,75,1024,205529088,6679429120,0.749638,255.342,8910.2
1,CUTLASS,conv2d,cutlass_tensorop_h1688fprop_optimized_64x128_32x2_nhwc_align8,passed,success,fprop,256,56,56,64,64,1,1,56,56,0,0,1,1,1,1,f16:nhwc,f16:nhwc,f16:nhwc,cross,optimized,1,0,serial,1,none,tensorop,f16,64,128,32,2,2,2,1,16,8,8,75,1024,205529088,6679429120,0.504787,379.197,13232.2
1,CUTLASS,conv2d,cutlass_tensorop_h1688fprop_optimized_64x128_32x2_nhwc_align4,passed,success,fprop,256,56,56,64,64,1,1,56,56,0,0,1,1,1,1,f16:nhwc,f16:nhwc,f16:nhwc,cross,optimized,1,0,serial,1,none,tensorop,f16,64,128,32,2,2,2,1,16,8,8,75,1024,205529088,6679429120,0.505323,378.795,13218.1
1,CUTLASS,conv2d,cutlass_tensorop_h1688fprop_optimized_64x128_32x2_nhwc_align2,passed,success,fprop,256,56,56,64,64,1,1,56,56,0,0,1,1,1,1,f16:nhwc,f16:nhwc,f16:nhwc,cross,optimized,1,0,serial,1,none,tensorop,f16,64,128,32,2,2,2,1,16,8,8,75,1024,205529088,6679429120,0.505932,378.339,13202.2
1,CUTLASS,conv2d,cutlass_tensorop_h1688fprop_optimized_64x128_32x2_nhwc_align1,passed,success,fprop,256,56,56,64,64,1,1,56,56,0,0,1,1,1,1,f16:nhwc,f16:nhwc,f16:nhwc,cross,optimized,1,0,serial,1,none,tensorop,f16,64,128,32,2,2,2,1,16,8,8,75,1024,205529088,6679429120,0.749308,255.454,8914.14
1,CUTLASS,conv2d,cutlass_tensorop_h1688fprop_optimized_128x64_32x2_nhwc_align8,passed,success,fprop,256,56,56,64,64,1,1,56,56,0,0,1,1,1,1,f16:nhwc,f16:nhwc,f16:nhwc,cross,optimized,1,0,serial,1,none,tensorop,f16,128,64,32,2,2,2,1,16,8,8,75,1024,205529088,6679429120,0.504476,379.431,13240.3
1,CUTLASS,conv2d,cutlass_tensorop_h1688fprop_optimized_128x64_32x2_nhwc_align4,passed,success,fprop,256,56,56,64,64,1,1,56,56,0,0,1,1,1,1,f16:nhwc,f16:nhwc,f16:nhwc,cross,optimized,1,0,serial,1,none,tensorop,f16,128,64,32,2,2,2,1,16,8,8,75,1024,205529088,6679429120,0.504731,379.24,13233.7
1,CUTLASS,conv2d,cutlass_tensorop_h1688fprop_optimized_128x64_32x2_nhwc_align2,passed,success,fprop,256,56,56,64,64,1,1,56,56,0,0,1,1,1,1,f16:nhwc,f16:nhwc,f16:nhwc,cross,optimized,1,0,serial,1,none,tensorop,f16,128,64,32,2,2,2,1,16,8,8,75,1024,205529088,6679429120,0.50573,378.491,13207.5
1,CUTLASS,conv2d,cutlass_tensorop_h1688fprop_optimized_128x64_32x2_nhwc_align1,passed,success,fprop,256,56,56,64,64,1,1,56,56,0,0,1,1,1,1,f16:nhwc,f16:nhwc,f16:nhwc,cross,optimized,1,0,serial,1,none,tensorop,f16,128,64,32,2,2,2,1,16,8,8,75,1024,205529088,6679429120,0.541301,353.618,12339.6
1,CUTLASS,conv2d,cutlass_tensorop_h1688fprop_optimized_64x64_32x2_nhwc_align8,passed,success,fprop,256,56,56,64,64,1,1,56,56,0,0,1,1,1,1,f16:nhwc,f16:nhwc,f16:nhwc,cross,optimized,1,0,serial,1,none,tensorop,f16,64,64,32,2,2,2,1,16,8,8,75,1024,205529088,6679429120,0.504588,379.347,13237.4
1,CUTLASS,conv2d,cutlass_tensorop_h1688fprop_optimized_64x64_32x2_nhwc_align4,passed,success,fprop,256,56,56,64,64,1,1,56,56,0,0,1,1,1,1,f16:nhwc,f16:nhwc,f16:nhwc,cross,optimized,1,0,serial,1,none,tensorop,f16,64,64,32,2,2,2,1,16,8,8,75,1024,205529088,6679429120,0.504537,379.385,13238.7
1,CUTLASS,conv2d,cutlass_tensorop_h1688fprop_optimized_64x64_32x2_nhwc_align2,passed,success,fprop,256,56,56,64,64,1,1,56,56,0,0,1,1,1,1,f16:nhwc,f16:nhwc,f16:nhwc,cross,optimized,1,0,serial,1,none,tensorop,f16,64,64,32,2,2,2,1,16,8,8,75,1024,205529088,6679429120,0.504532,379.389,13238.9
1,CUTLASS,conv2d,cutlass_tensorop_h1688fprop_optimized_64x64_32x2_nhwc_align1,passed,success,fprop,256,56,56,64,64,1,1,56,56,0,0,1,1,1,1,f16:nhwc,f16:nhwc,f16:nhwc,cross,optimized,1,0,serial,1,none,tensorop,f16,64,64,32,2,2,2,1,16,8,8,75,1024,205529088,6679429120,0.554282,345.337,12050.6
1,CUTLASS,conv2d,cutlass_tensorop_h1688fprop_optimized_64x128_64x2_nhwc_align8,passed,success,fprop,256,56,56,64,64,1,1,56,56,0,0,1,1,1,1,f16:nhwc,f16:nhwc,f16:nhwc,cross,optimized,1,0,serial,1,none,tensorop,f16,64,128,64,2,1,2,2,16,8,8,75,1024,205529088,6679429120,0.520565,367.704,12831.1
1,CUTLASS,conv2d,cutlass_tensorop_h1688fprop_optimized_64x128_64x2_nhwc_align4,passed,success,fprop,256,56,56,64,64,1,1,56,56,0,0,1,1,1,1,f16:nhwc,f16:nhwc,f16:nhwc,cross,optimized,1,0,serial,1,none,tensorop,f16,64,128,64,2,1,2,2,16,8,8,75,1024,205529088,6679429120,0.543044,352.483,12300
1,CUTLASS,conv2d,cutlass_tensorop_h1688fprop_optimized_64x128_64x2_nhwc_align2,passed,success,fprop,256,56,56,64,64,1,1,56,56,0,0,1,1,1,1,f16:nhwc,f16:nhwc,f16:nhwc,cross,optimized,1,0,serial,1,none,tensorop,f16,64,128,64,2,1,2,2,16,8,8,75,1024,205529088,6679429120,0.613732,311.885,10883.3
1,CUTLASS,conv2d,cutlass_tensorop_h1688fprop_optimized_64x128_64x2_nhwc_align1,passed,success,fprop,256,56,56,64,64,1,1,56,56,0,0,1,1,1,1,f16:nhwc,f16:nhwc,f16:nhwc,cross,optimized,1,0,serial,1,none,tensorop,f16,64,128,64,2,1,2,2,16,8,8,75,1024,205529088,6679429120,1.27377,150.274,5243.83
1,CUTLASS,conv2d,cutlass_tensorop_h16816fprop_optimized_256x128_32x3_nhwc_align8,passed,success,fprop,256,56,56,64,64,1,1,56,56,0,0,1,1,1,1,f16:nhwc,f16:nhwc,f16:nhwc,cross,optimized,1,0,serial,1,none,tensorop,f16,256,128,32,3,4,2,1,16,8,16,80,1024,205529088,6679429120,0.518578,369.113,12880.3
1,CUTLASS,conv2d,cutlass_tensorop_h16816fprop_optimized_256x128_32x3_nhwc_align4,passed,success,fprop,256,56,56,64,64,1,1,56,56,0,0,1,1,1,1,f16:nhwc,f16:nhwc,f16:nhwc,cross,optimized,1,0,serial,1,none,tensorop,f16,256,128,32,3,4,2,1,16,8,16,80,1024,205529088,6679429120,0.525341,364.361,12714.5
1,CUTLASS,conv2d,cutlass_tensorop_h16816fprop_optimized_256x128_32x3_nhwc_align2,passed,success,fprop,256,56,56,64,64,1,1,56,56,0,0,1,1,1,1,f16:nhwc,f16:nhwc,f16:nhwc,cross,optimized,1,0,serial,1,none,tensorop,f16,256,128,32,3,4,2,1,16,8,16,80,1024,205529088,6679429120,0.640893,298.667,10422.1
1,CUTLASS,conv2d,cutlass_tensorop_h16816fprop_optimized_128x256_32x3_nhwc_align8,passed,success,fprop,256,56,56,64,64,1,1,56,56,0,0,1,1,1,1,f16:nhwc,f16:nhwc,f16:nhwc,cross,optimized,1,0,serial,1,none,tensorop,f16,128,256,32,3,2,4,1,16,8,16,80,1024,205529088,6679429120,0.753837,253.92,8860.58
1,CUTLASS,conv2d,cutlass_tensorop_h16816fprop_optimized_128x256_32x3_nhwc_align4,passed,success,fprop,256,56,56,64,64,1,1,56,56,0,0,1,1,1,1,f16:nhwc,f16:nhwc,f16:nhwc,cross,optimized,1,0,serial,1,none,tensorop,f16,128,256,32,3,2,4,1,16,8,16,80,1024,205529088,6679429120,0.835426,229.121,7995.24
1,CUTLASS,conv2d,cutlass_tensorop_h16816fprop_optimized_128x256_32x3_nhwc_align2,passed,success,fprop,256,56,56,64,64,1,1,56,56,0,0,1,1,1,1,f16:nhwc,f16:nhwc,f16:nhwc,cross,optimized,1,0,serial,1,none,tensorop,f16,128,256,32,3,2,4,1,16,8,16,80,1024,205529088,6679429120,1.11703,171.36,5979.64
1,CUTLASS,conv2d,cutlass_tensorop_h16816fprop_optimized_256x64_32x4_nhwc_align8,passed,success,fprop,256,56,56,64,64,1,1,56,56,0,0,1,1,1,1,f16:nhwc,f16:nhwc,f16:nhwc,cross,optimized,1,0,serial,1,none,tensorop,f16,256,64,32,4,4,1,1,16,8,16,80,1024,205529088,6679429120,0.525627,364.163,12707.5
1,CUTLASS,conv2d,cutlass_tensorop_h16816fprop_optimized_256x64_32x4_nhwc_align4,passed,success,fprop,256,56,56,64,64,1,1,56,56,0,0,1,1,1,1,f16:nhwc,f16:nhwc,f16:nhwc,cross,optimized,1,0,serial,1,none,tensorop,f16,256,64,32,4,4,1,1,16,8,16,80,1024,205529088,6679429120,0.526924,363.267,12676.3
1,CUTLASS,conv2d,cutlass_tensorop_h16816fprop_optimized_256x64_32x4_nhwc_align2,passed,success,fprop,256,56,56,64,64,1,1,56,56,0,0,1,1,1,1,f16:nhwc,f16:nhwc,f16:nhwc,cross,optimized,1,0,serial,1,none,tensorop,f16,256,64,32,4,4,1,1,16,8,16,80,1024,205529088,6679429120,1.98454,96.4525,3365.73
1,CUTLASS,conv2d,cutlass_tensorop_h16816fprop_optimized_64x256_32x4_nhwc_align8,passed,success,fprop,256,56,56,64,64,1,1,56,56,0,0,1,1,1,1,f16:nhwc,f16:nhwc,f16:nhwc,cross,optimized,1,0,serial,1,none,tensorop,f16,64,256,32,4,1,4,1,16,8,16,80,1024,205529088,6679429120,0.929106,206.02,7189.1
1,CUTLASS,conv2d,cutlass_tensorop_h16816fprop_optimized_64x256_32x4_nhwc_align4,passed,success,fprop,256,56,56,64,64,1,1,56,56,0,0,1,1,1,1,f16:nhwc,f16:nhwc,f16:nhwc,cross,optimized,1,0,serial,1,none,tensorop,f16,64,256,32,4,1,4,1,16,8,16,80,1024,205529088,6679429120,1.18836,161.074,5620.7
1,CUTLASS,conv2d,cutlass_tensorop_h16816fprop_optimized_64x256_32x4_nhwc_align2,passed,success,fprop,256,56,56,64,64,1,1,56,56,0,0,1,1,1,1,f16:nhwc,f16:nhwc,f16:nhwc,cross,optimized,1,0,serial,1,none,tensorop,f16,64,256,32,4,1,4,1,16,8,16,80,1024,205529088,6679429120,1.81811,105.282,3673.83
1,CUTLASS,conv2d,cutlass_tensorop_h16816fprop_optimized_128x128_32x3_nhwc_align8,passed,success,fprop,256,56,56,64,64,1,1,56,56,0,0,1,1,1,1,f16:nhwc,f16:nhwc,f16:nhwc,cross,optimized,1,0,serial,1,none,tensorop,f16,128,128,32,3,2,2,1,16,8,16,80,1024,205529088,6679429120,0.512823,373.255,13024.8
1,CUTLASS,conv2d,cutlass_tensorop_h16816fprop_optimized_128x128_32x3_nhwc_align4,passed,success,fprop,256,56,56,64,64,1,1,56,56,0,0,1,1,1,1,f16:nhwc,f16:nhwc,f16:nhwc,cross,optimized,1,0,serial,1,none,tensorop,f16,128,128,32,3,2,2,1,16,8,16,80,1024,205529088,6679429120,0.514583,371.978,12980.3
1,CUTLASS,conv2d,cutlass_tensorop_h16816fprop_optimized_128x128_32x3_nhwc_align2,passed,success,fprop,256,56,56,64,64,1,1,56,56,0,0,1,1,1,1,f16:nhwc,f16:nhwc,f16:nhwc,cross,optimized,1,0,serial,1,none,tensorop,f16,128,128,32,3,2,2,1,16,8,16,80,1024,205529088,6679429120,0.587291,325.927,11373.3
1,CUTLASS,conv2d,cutlass_tensorop_h16816fprop_optimized_128x128_32x4_nhwc_align8,passed,success,fprop,256,56,56,64,64,1,1,56,56,0,0,1,1,1,1,f16:nhwc,f16:nhwc,f16:nhwc,cross,optimized,1,0,serial,1,none,tensorop,f16,128,128,32,4,2,2,1,16,8,16,80,1024,205529088,6679429120,0.546044,350.547,12232.4
1,CUTLASS,conv2d,cutlass_tensorop_h16816fprop_optimized_128x128_32x4_nhwc_align4,passed,success,fprop,256,56,56,64,64,1,1,56,56,0,0,1,1,1,1,f16:nhwc,f16:nhwc,f16:nhwc,cross,optimized,1,0,serial,1,none,tensorop,f16,128,128,32,4,2,2,1,16,8,16,80,1024,205529088,6679429120,0.577884,331.233,11558.4
1,CUTLASS,conv2d,cutlass_tensorop_h16816fprop_optimized_128x128_32x4_nhwc_align2,passed,success,fprop,256,56,56,64,64,1,1,56,56,0,0,1,1,1,1,f16:nhwc,f16:nhwc,f16:nhwc,cross,optimized,1,0,serial,1,none,tensorop,f16,128,128,32,4,2,2,1,16,8,16,80,1024,205529088,6679429120,0.8809,217.293,7582.5
1,CUTLASS,conv2d,cutlass_tensorop_h16816fprop_optimized_128x128_32x5_nhwc_align8,passed,success,fprop,256,56,56,64,64,1,1,56,56,0,0,1,1,1,1,f16:nhwc,f16:nhwc,f16:nhwc,cross,optimized,1,0,serial,1,none,tensorop,f16,128,128,32,5,2,2,1,16,8,16,80,1024,205529088,6679429120,0.542119,353.085,12321
1,CUTLASS,conv2d,cutlass_tensorop_h16816fprop_optimized_128x128_32x5_nhwc_align4,passed,success,fprop,256,56,56,64,64,1,1,56,56,0,0,1,1,1,1,f16:nhwc,f16:nhwc,f16:nhwc,cross,optimized,1,0,serial,1,none,tensorop,f16,128,128,32,5,2,2,1,16,8,16,80,1024,205529088,6679429120,0.621598,307.938,10745.6
1,CUTLASS,conv2d,cutlass_tensorop_h16816fprop_optimized_128x128_32x5_nhwc_align2,passed,success,fprop,256,56,56,64,64,1,1,56,56,0,0,1,1,1,1,f16:nhwc,f16:nhwc,f16:nhwc,cross,optimized,1,0,serial,1,none,tensorop,f16,128,128,32,5,2,2,1,16,8,16,80,1024,205529088,6679429120,0.967221,197.901,6905.8
1,CUTLASS,conv2d,cutlass_tensorop_h16816fprop_optimized_128x64_32x6_nhwc_align8,passed,success,fprop,256,56,56,64,64,1,1,56,56,0,0,1,1,1,1,f16:nhwc,f16:nhwc,f16:nhwc,cross,optimized,1,0,serial,1,none,tensorop,f16,128,64,32,6,2,2,1,16,8,16,80,1024,205529088,6679429120,0.503762,379.969,13259.1
1,CUTLASS,conv2d,cutlass_tensorop_h16816fprop_optimized_128x64_32x6_nhwc_align4,passed,success,fprop,256,56,56,64,64,1,1,56,56,0,0,1,1,1,1,f16:nhwc,f16:nhwc,f16:nhwc,cross,optimized,1,0,serial,1,none,tensorop,f16,128,64,32,6,2,2,1,16,8,16,80,1024,205529088,6679429120,0.520099,368.034,12842.6
1,CUTLASS,conv2d,cutlass_tensorop_h16816fprop_optimized_128x64_32x6_nhwc_align2,passed,success,fprop,256,56,56,64,64,1,1,56,56,0,0,1,1,1,1,f16:nhwc,f16:nhwc,f16:nhwc,cross,optimized,1,0,serial,1,none,tensorop,f16,128,64,32,6,2,2,1,16,8,16,80,1024,205529088,6679429120,0.812257,235.657,8223.3
1,CUTLASS,conv2d,cutlass_tensorop_h16816fprop_optimized_64x128_32x6_nhwc_align8,passed,success,fprop,256,56,56,64,64,1,1,56,56,0,0,1,1,1,1,f16:nhwc,f16:nhwc,f16:nhwc,cross,optimized,1,0,serial,1,none,tensorop,f16,64,128,32,6,2,2,1,16,8,16,80,1024,205529088,6679429120,0.680835,281.146,9810.65
1,CUTLASS,conv2d,cutlass_tensorop_h16816fprop_optimized_64x128_32x6_nhwc_align4,passed,success,fprop,256,56,56,64,64,1,1,56,56,0,0,1,1,1,1,f16:nhwc,f16:nhwc,f16:nhwc,cross,optimized,1,0,serial,1,none,tensorop,f16,64,128,32,6,2,2,1,16,8,16,80,1024,205529088,6679429120,0.899255,212.858,7427.74
1,CUTLASS,conv2d,cutlass_tensorop_h16816fprop_optimized_64x128_32x6_nhwc_align2,passed,success,fprop,256,56,56,64,64,1,1,56,56,0,0,1,1,1,1,f16:nhwc,f16:nhwc,f16:nhwc,cross,optimized,1,0,serial,1,none,tensorop,f16,64,128,32,6,2,2,1,16,8,16,80,1024,205529088,6679429120,1.43316,133.561,4660.63
1,CUTLASS,conv2d,cutlass_tensorop_h16816fprop_optimized_64x64_32x10_nhwc_align8,passed,success,fprop,256,56,56,64,64,1,1,56,56,0,0,1,1,1,1,f16:nhwc,f16:nhwc,f16:nhwc,cross,optimized,1,0,serial,1,none,tensorop,f16,64,64,32,10,2,2,1,16,8,16,80,1024,205529088,6679429120,0.590268,324.283,11315.9
1,CUTLASS,conv2d,cutlass_tensorop_h16816fprop_optimized_64x64_32x10_nhwc_align4,passed,success,fprop,256,56,56,64,64,1,1,56,56,0,0,1,1,1,1,f16:nhwc,f16:nhwc,f16:nhwc,cross,optimized,1,0,serial,1,none,tensorop,f16,64,64,32,10,2,2,1,16,8,16,80,1024,205529088,6679429120,0.861766,222.118,7750.86
1,CUTLASS,conv2d,cutlass_tensorop_h16816fprop_optimized_64x64_32x10_nhwc_align2,passed,success,fprop,256,56,56,64,64,1,1,56,56,0,0,1,1,1,1,f16:nhwc,f16:nhwc,f16:nhwc,cross,optimized,1,0,serial,1,none,tensorop,f16,64,64,32,10,2,2,1,16,8,16,80,1024,205529088,6679429120,1.38058,138.647,4838.12
1,CUTLASS,conv2d,cutlass_tensorop_h1688fprop_optimized_256x128_32x2_nhwc_align8,passed,success,fprop,256,56,56,64,64,3,3,56,56,1,1,1,1,1,1,f16:nhwc,f16:nhwc,f16:nhwc,cross,optimized,1,0,serial,1,none,tensorop,f16,256,128,32,2,4,2,1,16,8,8,75,1024,1027678208,59292778496,1.7905,534.545,33115.3
1,CUTLASS,conv2d,cutlass_tensorop_h1688fprop_optimized_256x128_32x2_nhwc_align4,passed,success,fprop,256,56,56,64,64,3,3,56,56,1,1,1,1,1,1,f16:nhwc,f16:nhwc,f16:nhwc,cross,optimized,1,0,serial,1,none,tensorop,f16,256,128,32,2,4,2,1,16,8,8,75,1024,1027678208,59292778496,1.89013,506.368,31369.7
1,CUTLASS,conv2d,cutlass_tensorop_h1688fprop_optimized_256x128_32x2_nhwc_align2,passed,success,fprop,256,56,56,64,64,3,3,56,56,1,1,1,1,1,1,f16:nhwc,f16:nhwc,f16:nhwc,cross,optimized,1,0,serial,1,none,tensorop,f16,256,128,32,2,4,2,1,16,8,8,75,1024,1027678208,59292778496,2.28329,419.175,25968.1
1,CUTLASS,conv2d,cutlass_tensorop_h1688fprop_optimized_256x128_32x2_nhwc_align1,passed,success,fprop,256,56,56,64,64,3,3,56,56,1,1,1,1,1,1,f16:nhwc,f16:nhwc,f16:nhwc,cross,optimized,1,0,serial,1,none,tensorop,f16,256,128,32,2,4,2,1,16,8,8,75,1024,1027678208,59292778496,3.31033,289.125,17911.4
1,CUTLASS,conv2d,cutlass_tensorop_h1688fprop_optimized_128x256_32x2_nhwc_align8,passed,success,fprop,256,56,56,64,64,3,3,56,56,1,1,1,1,1,1,f16:nhwc,f16:nhwc,f16:nhwc,cross,optimized,1,0,serial,1,none,tensorop,f16,128,256,32,2,2,4,1,16,8,8,75,1024,1027678208,59292778496,3.31757,288.494,17872.3
1,CUTLASS,conv2d,cutlass_tensorop_h1688fprop_optimized_128x256_32x2_nhwc_align4,passed,success,fprop,256,56,56,64,64,3,3,56,56,1,1,1,1,1,1,f16:nhwc,f16:nhwc,f16:nhwc,cross,optimized,1,0,serial,1,none,tensorop,f16,128,256,32,2,2,4,1,16,8,8,75,1024,1027678208,59292778496,3.46358,276.333,17118.9
1,CUTLASS,conv2d,cutlass_tensorop_h1688fprop_optimized_128x256_32x2_nhwc_align2,passed,success,fprop,256,56,56,64,64,3,3,56,56,1,1,1,1,1,1,f16:nhwc,f16:nhwc,f16:nhwc,cross,optimized,1,0,serial,1,none,tensorop,f16,128,256,32,2,2,4,1,16,8,8,75,1024,1027678208,59292778496,3.74087,255.85,15850
1,CUTLASS,conv2d,cutlass_tensorop_h1688fprop_optimized_128x256_32x2_nhwc_align1,passed,success,fprop,256,56,56,64,64,3,3,56,56,1,1,1,1,1,1,f16:nhwc,f16:nhwc,f16:nhwc,cross,optimized,1,0,serial,1,none,tensorop,f16,128,256,32,2,2,4,1,16,8,8,75,1024,1027678208,59292778496,4.86544,196.714,12186.5
1,CUTLASS,conv2d,cutlass_tensorop_h1688fprop_optimized_128x128_32x2_nhwc_align8,passed,success,fprop,256,56,56,64,64,3,3,56,56,1,1,1,1,1,1,f16:nhwc,f16:nhwc,f16:nhwc,cross,optimized,1,0,serial,1,none,tensorop,f16,128,128,32,2,2,2,1,16,8,8,75,1024,1027678208,59292778496,1.55758,614.48,38067.3
1,CUTLASS,conv2d,cutlass_tensorop_h1688fprop_optimized_128x128_32x2_nhwc_align4,passed,success,fprop,256,56,56,64,64,3,3,56,56,1,1,1,1,1,1,f16:nhwc,f16:nhwc,f16:nhwc,cross,optimized,1,0,serial,1,none,tensorop,f16,128,128,32,2,2,2,1,16,8,8,75,1024,1027678208,59292778496,1.63155,586.62,36341.4
1,CUTLASS,conv2d,cutlass_tensorop_h1688fprop_optimized_128x128_32x2_nhwc_align2,passed,success,fprop,256,56,56,64,64,3,3,56,56,1,1,1,1,1,1,f16:nhwc,f16:nhwc,f16:nhwc,cross,optimized,1,0,serial,1,none,tensorop,f16,128,128,32,2,2,2,1,16,8,8,75,1024,1027678208,59292778496,2.00207,478.056,29615.8
1,CUTLASS,conv2d,cutlass_tensorop_h1688fprop_optimized_128x128_32x2_nhwc_align1,passed,success,fprop,256,56,56,64,64,3,3,56,56,1,1,1,1,1,1,f16:nhwc,f16:nhwc,f16:nhwc,cross,optimized,1,0,serial,1,none,tensorop,f16,128,128,32,2,2,2,1,16,8,8,75,1024,1027678208,59292778496,3.26829,292.845,18141.9
1,CUTLASS,conv2d,cutlass_tensorop_h1688fprop_optimized_64x128_32x2_nhwc_align8,passed,success,fprop,256,56,56,64,64,3,3,56,56,1,1,1,1,1,1,f16:nhwc,f16:nhwc,f16:nhwc,cross,optimized,1,0,serial,1,none,tensorop,f16,64,128,32,2,2,2,1,16,8,8,75,1024,1027678208,59292778496,1.73514,551.598,34171.7
1,CUTLASS,conv2d,cutlass_tensorop_h1688fprop_optimized_64x128_32x2_nhwc_align4,passed,success,fprop,256,56,56,64,64,3,3,56,56,1,1,1,1,1,1,f16:nhwc,f16:nhwc,f16:nhwc,cross,optimized,1,0,serial,1,none,tensorop,f16,64,128,32,2,2,2,1,16,8,8,75,1024,1027678208,59292778496,1.88772,507.014,31409.8
1,CUTLASS,conv2d,cutlass_tensorop_h1688fprop_optimized_64x128_32x2_nhwc_align2,passed,success,fprop,256,56,56,64,64,3,3,56,56,1,1,1,1,1,1,f16:nhwc,f16:nhwc,f16:nhwc,cross,optimized,1,0,serial,1,none,tensorop,f16,64,128,32,2,2,2,1,16,8,8,75,1024,1027678208,59292778496,2.44478,391.488,24252.8
1,CUTLASS,conv2d,cutlass_tensorop_h1688fprop_optimized_64x128_32x2_nhwc_align1,passed,success,fprop,256,56,56,64,64,3,3,56,56,1,1,1,1,1,1,f16:nhwc,f16:nhwc,f16:nhwc,cross,optimized,1,0,serial,1,none,tensorop,f16,64,128,32,2,2,2,1,16,8,8,75,1024,1027678208,59292778496,3.96931,241.125,14937.8
1,CUTLASS,conv2d,cutlass_tensorop_h1688fprop_optimized_128x64_32x2_nhwc_align8,passed,success,fprop,256,56,56,64,64,3,3,56,56,1,1,1,1,1,1,f16:nhwc,f16:nhwc,f16:nhwc,cross,optimized,1,0,serial,1,none,tensorop,f16,128,64,32,2,2,2,1,16,8,8,75,1024,1027678208,59292778496,0.994296,962.591,59632.9
1,CUTLASS,conv2d,cutlass_tensorop_h1688fprop_optimized_128x64_32x2_nhwc_align4,passed,success,fprop,256,56,56,64,64,3,3,56,56,1,1,1,1,1,1,f16:nhwc,f16:nhwc,f16:nhwc,cross,optimized,1,0,serial,1,none,tensorop,f16,128,64,32,2,2,2,1,16,8,8,75,1024,1027678208,59292778496,1.14549,835.541,51762.1
1,CUTLASS,conv2d,cutlass_tensorop_h1688fprop_optimized_128x64_32x2_nhwc_align2,passed,success,fprop,256,56,56,64,64,3,3,56,56,1,1,1,1,1,1,f16:nhwc,f16:nhwc,f16:nhwc,cross,optimized,1,0,serial,1,none,tensorop,f16,128,64,32,2,2,2,1,16,8,8,75,1024,1027678208,59292778496,1.57806,606.506,37573.3
1,CUTLASS,conv2d,cutlass_tensorop_h1688fprop_optimized_128x64_32x2_nhwc_align1,passed,success,fprop,256,56,56,64,64,3,3,56,56,1,1,1,1,1,1,f16:nhwc,f16:nhwc,f16:nhwc,cross,optimized,1,0,serial,1,none,tensorop,f16,128,64,32,2,2,2,1,16,8,8,75,1024,1027678208,59292778496,2.74101,349.178,21631.7
1,CUTLASS,conv2d,cutlass_tensorop_h1688fprop_optimized_64x64_32x2_nhwc_align8,passed,success,fprop,256,56,56,64,64,3,3,56,56,1,1,1,1,1,1,f16:nhwc,f16:nhwc,f16:nhwc,cross,optimized,1,0,serial,1,none,tensorop,f16,64,64,32,2,2,2,1,16,8,8,75,1024,1027678208,59292778496,1.26565,756.214,46847.8
1,CUTLASS,conv2d,cutlass_tensorop_h1688fprop_optimized_64x64_32x2_nhwc_align4,passed,success,fprop,256,56,56,64,64,3,3,56,56,1,1,1,1,1,1,f16:nhwc,f16:nhwc,f16:nhwc,cross,optimized,1,0,serial,1,none,tensorop,f16,64,64,32,2,2,2,1,16,8,8,75,1024,1027678208,59292778496,1.46428,653.63,40492.7
1,CUTLASS,conv2d,cutlass_tensorop_h1688fprop_optimized_64x64_32x2_nhwc_align2,passed,success,fprop,256,56,56,64,64,3,3,56,56,1,1,1,1,1,1,f16:nhwc,f16:nhwc,f16:nhwc,cross,optimized,1,0,serial,1,none,tensorop,f16,64,64,32,2,2,2,1,16,8,8,75,1024,1027678208,59292778496,2.04777,467.387,28954.8
1,CUTLASS,conv2d,cutlass_tensorop_h1688fprop_optimized_64x64_32x2_nhwc_align1,passed,success,fprop,256,56,56,64,64,3,3,56,56,1,1,1,1,1,1,f16:nhwc,f16:nhwc,f16:nhwc,cross,optimized,1,0,serial,1,none,tensorop,f16,64,64,32,2,2,2,1,16,8,8,75,1024,1027678208,59292778496,3.38135,283.052,17535.2
1,CUTLASS,conv2d,cutlass_tensorop_h1688fprop_optimized_64x128_64x2_nhwc_align8,passed,success,fprop,256,56,56,64,64,3,3,56,56,1,1,1,1,1,1,f16:nhwc,f16:nhwc,f16:nhwc,cross,optimized,1,0,serial,1,none,tensorop,f16,64,128,64,2,1,2,2,16,8,8,75,1024,1027678208,59292778496,1.81866,526.265,32602.4
1,CUTLASS,conv2d,cutlass_tensorop_h1688fprop_optimized_64x128_64x2_nhwc_align4,passed,success,fprop,256,56,56,64,64,3,3,56,56,1,1,1,1,1,1,f16:nhwc,f16:nhwc,f16:nhwc,cross,optimized,1,0,serial,1,none,tensorop,f16,64,128,64,2,1,2,2,16,8,8,75,1024,1027678208,59292778496,2.03237,470.928,29174.2
1,CUTLASS,conv2d,cutlass_tensorop_h1688fprop_optimized_64x128_64x2_nhwc_align2,passed,success,fprop,256,56,56,64,64,3,3,56,56,1,1,1,1,1,1,f16:nhwc,f16:nhwc,f16:nhwc,cross,optimized,1,0,serial,1,none,tensorop,f16,64,128,64,2,1,2,2,16,8,8,75,1024,1027678208,59292778496,2.20185,434.68,26928.6
1,CUTLASS,conv2d,cutlass_tensorop_h1688fprop_optimized_64x128_64x2_nhwc_align1,passed,success,fprop,256,56,56,64,64,3,3,56,56,1,1,1,1,1,1,f16:nhwc,f16:nhwc,f16:nhwc,cross,optimized,1,0,serial,1,none,tensorop,f16,64,128,64,2,1,2,2,16,8,8,75,1024,1027678208,59292778496,6.14832,155.669,9643.74
1,CUTLASS,conv2d,cutlass_tensorop_h16816fprop_optimized_256x128_32x3_nhwc_align8,passed,success,fprop,256,56,56,64,64,3,3,56,56,1,1,1,1,1,1,f16:nhwc,f16:nhwc,f16:nhwc,cross,optimized,1,0,serial,1,none,tensorop,f16,256,128,32,3,4,2,1,16,8,16,80,1024,1027678208,59292778496,1.66535,574.713,35603.7
1,CUTLASS,conv2d,cutlass_tensorop_h16816fprop_optimized_256x128_32x3_nhwc_align4,passed,success,fprop,256,56,56,64,64,3,3,56,56,1,1,1,1,1,1,f16:nhwc,f16:nhwc,f16:nhwc,cross,optimized,1,0,serial,1,none,tensorop,f16,256,128,32,3,4,2,1,16,8,16,80,1024,1027678208,59292778496,1.9537,489.891,30349
1,CUTLASS,conv2d,cutlass_tensorop_h16816fprop_optimized_256x128_32x3_nhwc_align2,passed,success,fprop,256,56,56,64,64,3,3,56,56,1,1,1,1,1,1,f16:nhwc,f16:nhwc,f16:nhwc,cross,optimized,1,0,serial,1,none,tensorop,f16,256,128,32,3,4,2,1,16,8,16,80,1024,1027678208,59292778496,2.17112,440.832,27309.8
1,CUTLASS,conv2d,cutlass_tensorop_h16816fprop_optimized_128x256_32x3_nhwc_align8,passed,success,fprop,256,56,56,64,64,3,3,56,56,1,1,1,1,1,1,f16:nhwc,f16:nhwc,f16:nhwc,cross,optimized,1,0,serial,1,none,tensorop,f16,128,256,32,3,2,4,1,16,8,16,80,1024,1027678208,59292778496,3.17458,301.489,18677.4
1,CUTLASS,conv2d,cutlass_tensorop_h16816fprop_optimized_128x256_32x3_nhwc_align4,passed,success,fprop,256,56,56,64,64,3,3,56,56,1,1,1,1,1,1,f16:nhwc,f16:nhwc,f16:nhwc,cross,optimized,1,0,serial,1,none,tensorop,f16,128,256,32,3,2,4,1,16,8,16,80,1024,1027678208,59292778496,3.30631,289.477,17933.2
1,CUTLASS,conv2d,cutlass_tensorop_h16816fprop_optimized_128x256_32x3_nhwc_align2,passed,success,fprop,256,56,56,64,64,3,3,56,56,1,1,1,1,1,1,f16:nhwc,f16:nhwc,f16:nhwc,cross,optimized,1,0,serial,1,none,tensorop,f16,128,256,32,3,2,4,1,16,8,16,80,1024,1027678208,59292778496,3.88115,246.602,15277.1
1,CUTLASS,conv2d,cutlass_tensorop_h16816fprop_optimized_256x64_32x4_nhwc_align8,passed,success,fprop,256,56,56,64,64,3,3,56,56,1,1,1,1,1,1,f16:nhwc,f16:nhwc,f16:nhwc,cross,optimized,1,0,serial,1,none,tensorop,f16,256,64,32,4,4,1,1,16,8,16,80,1024,1027678208,59292778496,1.19515,800.823,49611.4
1,CUTLASS,conv2d,cutlass_tensorop_h16816fprop_optimized_256x64_32x4_nhwc_align4,passed,success,fprop,256,56,56,64,64,3,3,56,56,1,1,1,1,1,1,f16:nhwc,f16:nhwc,f16:nhwc,cross,optimized,1,0,serial,1,none,tensorop,f16,256,64,32,4,4,1,1,16,8,16,80,1024,1027678208,59292778496,1.44944,660.322,40907.3
1,CUTLASS,conv2d,cutlass_tensorop_h16816fprop_optimized_256x64_32x4_nhwc_align2,passed,success,fprop,256,56,56,64,64,3,3,56,56,1,1,1,1,1,1,f16:nhwc,f16:nhwc,f16:nhwc,cross,optimized,1,0,serial,1,none,tensorop,f16,256,64,32,4,4,1,1,16,8,16,80,1024,1027678208,59292778496,5.31659,180.021,11152.4
1,CUTLASS,conv2d,cutlass_tensorop_h16816fprop_optimized_64x256_32x4_nhwc_align8,passed,success,fprop,256,56,56,64,64,3,3,56,56,1,1,1,1,1,1,f16:nhwc,f16:nhwc,f16:nhwc,cross,optimized,1,0,serial,1,none,tensorop,f16,64,256,32,4,1,4,1,16,8,16,80,1024,1027678208,59292778496,3.39304,282.077,17474.8
1,CUTLASS,conv2d,cutlass_tensorop_h16816fprop_optimized_64x256_32x4_nhwc_align4,passed,success,fprop,256,56,56,64,64,3,3,56,56,1,1,1,1,1,1,f16:nhwc,f16:nhwc,f16:nhwc,cross,optimized,1,0,serial,1,none,tensorop,f16,64,256,32,4,1,4,1,16,8,16,80,1024,1027678208,59292778496,3.72439,256.982,15920.1
1,CUTLASS,conv2d,cutlass_tensorop_h16816fprop_optimized_64x256_32x4_nhwc_align2,passed,success,fprop,256,56,56,64,64,3,3,56,56,1,1,1,1,1,1,f16:nhwc,f16:nhwc,f16:nhwc,cross,optimized,1,0,serial,1,none,tensorop,f16,64,256,32,4,1,4,1,16,8,16,80,1024,1027678208,59292778496,5.90659,162.039,10038.4
1,CUTLASS,conv2d,cutlass_tensorop_h16816fprop_optimized_128x128_32x3_nhwc_align8,passed,success,fprop,256,56,56,64,64,3,3,56,56,1,1,1,1,1,1,f16:nhwc,f16:nhwc,f16:nhwc,cross,optimized,1,0,serial,1,none,tensorop,f16,128,128,32,3,2,2,1,16,8,16,80,1024,1027678208,59292778496,1.50288,636.843,39452.7
1,CUTLASS,conv2d,cutlass_tensorop_h16816fprop_optimized_128x128_32x3_nhwc_align4,passed,success,fprop,256,56,56,64,64,3,3,56,56,1,1,1,1,1,1,f16:nhwc,f16:nhwc,f16:nhwc,cross,optimized,1,0,serial,1,none,tensorop,f16,128,128,32,3,2,2,1,16,8,16,80,1024,1027678208,59292778496,1.65738,577.478,35775
1,CUTLASS,conv2d,cutlass_tensorop_h16816fprop_optimized_128x128_32x3_nhwc_align2,passed,success,fprop,256,56,56,64,64,3,3,56,56,1,1,1,1,1,1,f16:nhwc,f16:nhwc,f16:nhwc,cross,optimized,1,0,serial,1,none,tensorop,f16,128,128,32,3,2,2,1,16,8,16,80,1024,1027678208,59292778496,2.39122,400.256,24796
1,CUTLASS,conv2d,cutlass_tensorop_h16816fprop_optimized_128x128_32x4_nhwc_align8,passed,success,fprop,256,56,56,64,64,3,3,56,56,1,1,1,1,1,1,f16:nhwc,f16:nhwc,f16:nhwc,cross,optimized,1,0,serial,1,none,tensorop,f16,128,128,32,4,2,2,1,16,8,16,80,1024,1027678208,59292778496,1.73465,551.753,34181.3
1,CUTLASS,conv2d,cutlass_tensorop_h16816fprop_optimized_128x128_32x4_nhwc_align4,passed,success,fprop,256,56,56,64,64,3,3,56,56,1,1,1,1,1,1,f16:nhwc,f16:nhwc,f16:nhwc,cross,optimized,1,0,serial,1,none,tensorop,f16,128,128,32,4,2,2,1,16,8,16,80,1024,1027678208,59292778496,1.85738,515.295,31922.8
1,CUTLASS,conv2d,cutlass_tensorop_h16816fprop_optimized_128x128_32x4_nhwc_align2,passed,success,fprop,256,56,56,64,64,3,3,56,56,1,1,1,1,1,1,f16:nhwc,f16:nhwc,f16:nhwc,cross,optimized,1,0,serial,1,none,tensorop,f16,128,128,32,4,2,2,1,16,8,16,80,1024,1027678208,59292778496,2.75041,347.985,21557.8
1,CUTLASS,conv2d,cutlass_tensorop_h16816fprop_optimized_128x128_32x5_nhwc_align8,passed,success,fprop,256,56,56,64,64,3,3,56,56,1,1,1,1,1,1,f16:nhwc,f16:nhwc,f16:nhwc,cross,optimized,1,0,serial,1,none,tensorop,f16,128,128,32,5,2,2,1,16,8,16,80,1024,1027678208,59292778496,1.73976,550.132,34080.9
1,CUTLASS,conv2d,cutlass_tensorop_h16816fprop_optimized_128x128_32x5_nhwc_align4,passed,success,fprop,256,56,56,64,64,3,3,56,56,1,1,1,1,1,1,f16:nhwc,f16:nhwc,f16:nhwc,cross,optimized,1,0,serial,1,none,tensorop,f16,128,128,32,5,2,2,1,16,8,16,80,1024,1027678208,59292778496,1.9151,499.764,30960.6
1,CUTLASS,conv2d,cutlass_tensorop_h16816fprop_optimized_128x128_32x5_nhwc_align2,passed,success,fprop,256,56,56,64,64,3,3,56,56,1,1,1,1,1,1,f16:nhwc,f16:nhwc,f16:nhwc,cross,optimized,1,0,serial,1,none,tensorop,f16,128,128,32,5,2,2,1,16,8,16,80,1024,1027678208,59292778496,2.87088,333.383,20653.2
1,CUTLASS,conv2d,cutlass_tensorop_h16816fprop_optimized_128x64_32x6_nhwc_align8,passed,success,fprop,256,56,56,64,64,3,3,56,56,1,1,1,1,1,1,f16:nhwc,f16:nhwc,f16:nhwc,cross,optimized,1,0,serial,1,none,tensorop,f16,128,64,32,6,2,2,1,16,8,16,80,1024,1027678208,59292778496,1.12316,852.147,52790.9
1,CUTLASS,conv2d,cutlass_tensorop_h16816fprop_optimized_128x64_32x6_nhwc_align4,passed,success,fprop,256,56,56,64,64,3,3,56,56,1,1,1,1,1,1,f16:nhwc,f16:nhwc,f16:nhwc,cross,optimized,1,0,serial,1,none,tensorop,f16,128,64,32,6,2,2,1,16,8,16,80,1024,1027678208,59292778496,1.4239,672.17,41641.2
1,CUTLASS,conv2d,cutlass_tensorop_h16816fprop_optimized_128x64_32x6_nhwc_align2,passed,success,fprop,256,56,56,64,64,3,3,56,56,1,1,1,1,1,1,f16:nhwc,f16:nhwc,f16:nhwc,cross,optimized,1,0,serial,1,none,tensorop,f16,128,64,32,6,2,2,1,16,8,16,80,1024,1027678208,59292778496,2.21215,432.656,26803.2
1,CUTLASS,conv2d,cutlass_tensorop_h16816fprop_optimized_64x128_32x6_nhwc_align8,passed,success,fprop,256,56,56,64,64,3,3,56,56,1,1,1,1,1,1,f16:nhwc,f16:nhwc,f16:nhwc,cross,optimized,1,0,serial,1,none,tensorop,f16,64,128,32,6,2,2,1,16,8,16,80,1024,1027678208,59292778496,2.09046,457.841,28363.5
1,CUTLASS,conv2d,cutlass_tensorop_h16816fprop_optimized_64x128_32x6_nhwc_align4,passed,success,fprop,256,56,56,64,64,3,3,56,56,1,1,1,1,1,1,f16:nhwc,f16:nhwc,f16:nhwc,cross,optimized,1,0,serial,1,none,tensorop,f16,64,128,32,6,2,2,1,16,8,16,80,1024,1027678208,59292778496,2.59461,368.881,22852.3
1,CUTLASS,conv2d,cutlass_tensorop_h16816fprop_optimized_64x128_32x6_nhwc_align2,passed,success,fprop,256,56,56,64,64,3,3,56,56,1,1,1,1,1,1,f16:nhwc,f16:nhwc,f16:nhwc,cross,optimized,1,0,serial,1,none,tensorop,f16,64,128,32,6,2,2,1,16,8,16,80,1024,1027678208,59292778496,4.10536,233.134,14442.8
1,CUTLASS,conv2d,cutlass_tensorop_h16816fprop_optimized_64x64_32x10_nhwc_align8,passed,success,fprop,256,56,56,64,64,3,3,56,56,1,1,1,1,1,1,f16:nhwc,f16:nhwc,f16:nhwc,cross,optimized,1,0,serial,1,none,tensorop,f16,64,64,32,10,2,2,1,16,8,16,80,1024,1027678208,59292778496,1.48071,646.378,40043.4
1,CUTLASS,conv2d,cutlass_tensorop_h16816fprop_optimized_64x64_32x10_nhwc_align4,passed,success,fprop,256,56,56,64,64,3,3,56,56,1,1,1,1,1,1,f16:nhwc,f16:nhwc,f16:nhwc,cross,optimized,1,0,serial,1,none,tensorop,f16,64,64,32,10,2,2,1,16,8,16,80,1024,1027678208,59292778496,2.12782,449.802,27865.5
1,CUTLASS,conv2d,cutlass_tensorop_h16816fprop_optimized_64x64_32x10_nhwc_align2,passed,success,fprop,256,56,56,64,64,3,3,56,56,1,1,1,1,1,1,f16:nhwc,f16:nhwc,f16:nhwc,cross,optimized,1,0,serial,1,none,tensorop,f16,64,64,32,10,2,2,1,16,8,16,80,1024,1027678208,59292778496,3.30989,289.164,17913.8
1,CUTLASS,conv2d,cutlass_tensorop_h1688fprop_optimized_256x128_32x2_nhwc_align8,passed,success,fprop,256,56,56,256,64,1,1,56,56,0,0,1,1,1,1,f16:nhwc,f16:nhwc,f16:nhwc,cross,optimized,1,0,serial,1,none,tensorop,f16,256,128,32,2,4,2,1,16,8,8,75,1024,513835008,26409435136,1.25408,381.591,21058.8
1,CUTLASS,conv2d,cutlass_tensorop_h1688fprop_optimized_256x128_32x2_nhwc_align4,passed,success,fprop,256,56,56,256,64,1,1,56,56,0,0,1,1,1,1,f16:nhwc,f16:nhwc,f16:nhwc,cross,optimized,1,0,serial,1,none,tensorop,f16,256,128,32,2,4,2,1,16,8,8,75,1024,513835008,26409435136,1.25787,380.443,20995.4
1,CUTLASS,conv2d,cutlass_tensorop_h1688fprop_optimized_256x128_32x2_nhwc_align2,passed,success,fprop,256,56,56,256,64,1,1,56,56,0,0,1,1,1,1,f16:nhwc,f16:nhwc,f16:nhwc,cross,optimized,1,0,serial,1,none,tensorop,f16,256,128,32,2,4,2,1,16,8,8,75,1024,513835008,26409435136,1.79692,266.314,14697
1,CUTLASS,conv2d,cutlass_tensorop_h1688fprop_optimized_256x128_32x2_nhwc_align1,passed,success,fprop,256,56,56,256,64,1,1,56,56,0,0,1,1,1,1,f16:nhwc,f16:nhwc,f16:nhwc,cross,optimized,1,0,serial,1,none,tensorop,f16,256,128,32,2,4,2,1,16,8,8,75,1024,513835008,26409435136,1.90266,251.515,13880.3
1,CUTLASS,conv2d,cutlass_tensorop_h1688fprop_optimized_128x256_32x2_nhwc_align8,passed,success,fprop,256,56,56,256,64,1,1,56,56,0,0,1,1,1,1,f16:nhwc,f16:nhwc,f16:nhwc,cross,optimized,1,0,serial,1,none,tensorop,f16,128,256,32,2,2,4,1,16,8,8,75,1024,513835008,26409435136,1.74202,274.708,15160.3
1,CUTLASS,conv2d,cutlass_tensorop_h1688fprop_optimized_128x256_32x2_nhwc_align4,passed,success,fprop,256,56,56,256,64,1,1,56,56,0,0,1,1,1,1,f16:nhwc,f16:nhwc,f16:nhwc,cross,optimized,1,0,serial,1,none,tensorop,f16,128,256,32,2,2,4,1,16,8,8,75,1024,513835008,26409435136,1.92814,248.19,13696.8
1,CUTLASS,conv2d,cutlass_tensorop_h1688fprop_optimized_128x256_32x2_nhwc_align2,passed,success,fprop,256,56,56,256,64,1,1,56,56,0,0,1,1,1,1,f16:nhwc,f16:nhwc,f16:nhwc,cross,optimized,1,0,serial,1,none,tensorop,f16,128,256,32,2,2,4,1,16,8,8,75,1024,513835008,26409435136,2.17514,220.007,12141.5
1,CUTLASS,conv2d,cutlass_tensorop_h1688fprop_optimized_128x256_32x2_nhwc_align1,passed,success,fprop,256,56,56,256,64,1,1,56,56,0,0,1,1,1,1,f16:nhwc,f16:nhwc,f16:nhwc,cross,optimized,1,0,serial,1,none,tensorop,f16,128,256,32,2,2,4,1,16,8,8,75,1024,513835008,26409435136,2.91065,164.412,9073.38
1,CUTLASS,conv2d,cutlass_tensorop_h1688fprop_optimized_128x128_32x2_nhwc_align8,passed,success,fprop,256,56,56,256,64,1,1,56,56,0,0,1,1,1,1,f16:nhwc,f16:nhwc,f16:nhwc,cross,optimized,1,0,serial,1,none,tensorop,f16,128,128,32,2,2,2,1,16,8,8,75,1024,513835008,26409435136,1.2414,385.49,21274
1,CUTLASS,conv2d,cutlass_tensorop_h1688fprop_optimized_128x128_32x2_nhwc_align4,passed,success,fprop,256,56,56,256,64,1,1,56,56,0,0,1,1,1,1,f16:nhwc,f16:nhwc,f16:nhwc,cross,optimized,1,0,serial,1,none,tensorop,f16,128,128,32,2,2,2,1,16,8,8,75,1024,513835008,26409435136,1.24164,385.414,21269.8
1,CUTLASS,conv2d,cutlass_tensorop_h1688fprop_optimized_128x128_32x2_nhwc_align2,passed,success,fprop,256,56,56,256,64,1,1,56,56,0,0,1,1,1,1,f16:nhwc,f16:nhwc,f16:nhwc,cross,optimized,1,0,serial,1,none,tensorop,f16,128,128,32,2,2,2,1,16,8,8,75,1024,513835008,26409435136,1.34159,356.7,19685.1
1,CUTLASS,conv2d,cutlass_tensorop_h1688fprop_optimized_128x128_32x2_nhwc_align1,passed,success,fprop,256,56,56,256,64,1,1,56,56,0,0,1,1,1,1,f16:nhwc,f16:nhwc,f16:nhwc,cross,optimized,1,0,serial,1,none,tensorop,f16,128,128,32,2,2,2,1,16,8,8,75,1024,513835008,26409435136,1.81204,264.093,14574.4
1,CUTLASS,conv2d,cutlass_tensorop_h1688fprop_optimized_64x128_32x2_nhwc_align8,passed,success,fprop,256,56,56,256,64,1,1,56,56,0,0,1,1,1,1,f16:nhwc,f16:nhwc,f16:nhwc,cross,optimized,1,0,serial,1,none,tensorop,f16,64,128,32,2,2,2,1,16,8,8,75,1024,513835008,26409435136,1.24052,385.762,21289
1,CUTLASS,conv2d,cutlass_tensorop_h1688fprop_optimized_64x128_32x2_nhwc_align4,passed,success,fprop,256,56,56,256,64,1,1,56,56,0,0,1,1,1,1,f16:nhwc,f16:nhwc,f16:nhwc,cross,optimized,1,0,serial,1,none,tensorop,f16,64,128,32,2,2,2,1,16,8,8,75,1024,513835008,26409435136,1.24131,385.517,21275.4
1,CUTLASS,conv2d,cutlass_tensorop_h1688fprop_optimized_64x128_32x2_nhwc_align2,passed,success,fprop,256,56,56,256,64,1,1,56,56,0,0,1,1,1,1,f16:nhwc,f16:nhwc,f16:nhwc,cross,optimized,1,0,serial,1,none,tensorop,f16,64,128,32,2,2,2,1,16,8,8,75,1024,513835008,26409435136,1.27885,374.201,20651
1,CUTLASS,conv2d,cutlass_tensorop_h1688fprop_optimized_64x128_32x2_nhwc_align1,passed,success,fprop,256,56,56,256,64,1,1,56,56,0,0,1,1,1,1,f16:nhwc,f16:nhwc,f16:nhwc,cross,optimized,1,0,serial,1,none,tensorop,f16,64,128,32,2,2,2,1,16,8,8,75,1024,513835008,26409435136,2.02385,236.453,13049.1
1,CUTLASS,conv2d,cutlass_tensorop_h1688fprop_optimized_128x64_32x2_nhwc_align8,passed,success,fprop,256,56,56,256,64,1,1,56,56,0,0,1,1,1,1,f16:nhwc,f16:nhwc,f16:nhwc,cross,optimized,1,0,serial,1,none,tensorop,f16,128,64,32,2,2,2,1,16,8,8,75,1024,513835008,26409435136,1.23869,386.334,21320.5
1,CUTLASS,conv2d,cutlass_tensorop_h1688fprop_optimized_128x64_32x2_nhwc_align4,passed,success,fprop,256,56,56,256,64,1,1,56,56,0,0,1,1,1,1,f16:nhwc,f16:nhwc,f16:nhwc,cross,optimized,1,0,serial,1,none,tensorop,f16,128,64,32,2,2,2,1,16,8,8,75,1024,513835008,26409435136,1.23928,386.148,21310.3
1,CUTLASS,conv2d,cutlass_tensorop_h1688fprop_optimized_128x64_32x2_nhwc_align2,passed,success,fprop,256,56,56,256,64,1,1,56,56,0,0,1,1,1,1,f16:nhwc,f16:nhwc,f16:nhwc,cross,optimized,1,0,serial,1,none,tensorop,f16,128,64,32,2,2,2,1,16,8,8,75,1024,513835008,26409435136,1.24471,384.464,21217.3
1,CUTLASS,conv2d,cutlass_tensorop_h1688fprop_optimized_128x64_32x2_nhwc_align1,passed,success,fprop,256,56,56,256,64,1,1,56,56,0,0,1,1,1,1,f16:nhwc,f16:nhwc,f16:nhwc,cross,optimized,1,0,serial,1,none,tensorop,f16,128,64,32,2,2,2,1,16,8,8,75,1024,513835008,26409435136,1.407,340.118,18770
1,CUTLASS,conv2d,cutlass_tensorop_h1688fprop_optimized_64x64_32x2_nhwc_align8,passed,success,fprop,256,56,56,256,64,1,1,56,56,0,0,1,1,1,1,f16:nhwc,f16:nhwc,f16:nhwc,cross,optimized,1,0,serial,1,none,tensorop,f16,64,64,32,2,2,2,1,16,8,8,75,1024,513835008,26409435136,1.23865,386.346,21321.2
1,CUTLASS,conv2d,cutlass_tensorop_h1688fprop_optimized_64x64_32x2_nhwc_align4,passed,success,fprop,256,56,56,256,64,1,1,56,56,0,0,1,1,1,1,f16:nhwc,f16:nhwc,f16:nhwc,cross,optimized,1,0,serial,1,none,tensorop,f16,64,64,32,2,2,2,1,16,8,8,75,1024,513835008,26409435136,1.23935,386.126,21309.1
1,CUTLASS,conv2d,cutlass_tensorop_h1688fprop_optimized_64x64_32x2_nhwc_align2,passed,success,fprop,256,56,56,256,64,1,1,56,56,0,0,1,1,1,1,f16:nhwc,f16:nhwc,f16:nhwc,cross,optimized,1,0,serial,1,none,tensorop,f16,64,64,32,2,2,2,1,16,8,8,75,1024,513835008,26409435136,1.23982,385.98,21301
1,CUTLASS,conv2d,cutlass_tensorop_h1688fprop_optimized_64x64_32x2_nhwc_align1,passed,success,fprop,256,56,56,256,64,1,1,56,56,0,0,1,1,1,1,f16:nhwc,f16:nhwc,f16:nhwc,cross,optimized,1,0,serial,1,none,tensorop,f16,64,64,32,2,2,2,1,16,8,8,75,1024,513835008,26409435136,1.63129,293.354,16189.3
1,CUTLASS,conv2d,cutlass_tensorop_h1688fprop_optimized_64x128_64x2_nhwc_align8,passed,success,fprop,256,56,56,256,64,1,1,56,56,0,0,1,1,1,1,f16:nhwc,f16:nhwc,f16:nhwc,cross,optimized,1,0,serial,1,none,tensorop,f16,64,128,64,2,1,2,2,16,8,8,75,1024,513835008,26409435136,1.2416,385.426,21270.4
1,CUTLASS,conv2d,cutlass_tensorop_h1688fprop_optimized_64x128_64x2_nhwc_align4,passed,success,fprop,256,56,56,256,64,1,1,56,56,0,0,1,1,1,1,f16:nhwc,f16:nhwc,f16:nhwc,cross,optimized,1,0,serial,1,none,tensorop,f16,64,128,64,2,1,2,2,16,8,8,75,1024,513835008,26409435136,1.2806,373.688,20622.6
1,CUTLASS,conv2d,cutlass_tensorop_h1688fprop_optimized_64x128_64x2_nhwc_align2,passed,success,fprop,256,56,56,256,64,1,1,56,56,0,0,1,1,1,1,f16:nhwc,f16:nhwc,f16:nhwc,cross,optimized,1,0,serial,1,none,tensorop,f16,64,128,64,2,1,2,2,16,8,8,75,1024,513835008,26409435136,1.3493,354.663,19572.7
1,CUTLASS,conv2d,cutlass_tensorop_h1688fprop_optimized_64x128_64x2_nhwc_align1,passed,success,fprop,256,56,56,256,64,1,1,56,56,0,0,1,1,1,1,f16:nhwc,f16:nhwc,f16:nhwc,cross,optimized,1,0,serial,1,none,tensorop,f16,64,128,64,2,1,2,2,16,8,8,75,1024,513835008,26409435136,3.42755,139.617,7705.04
1,CUTLASS,conv2d,cutlass_tensorop_h16816fprop_optimized_256x128_32x3_nhwc_align8,passed,success,fprop,256,56,56,256,64,1,1,56,56,0,0,1,1,1,1,f16:nhwc,f16:nhwc,f16:nhwc,cross,optimized,1,0,serial,1,none,tensorop,f16,256,128,32,3,4,2,1,16,8,16,80,1024,513835008,26409435136,1.2465,383.912,21186.9
1,CUTLASS,conv2d,cutlass_tensorop_h16816fprop_optimized_256x128_32x3_nhwc_align4,passed,success,fprop,256,56,56,256,64,1,1,56,56,0,0,1,1,1,1,f16:nhwc,f16:nhwc,f16:nhwc,cross,optimized,1,0,serial,1,none,tensorop,f16,256,128,32,3,4,2,1,16,8,16,80,1024,513835008,26409435136,1.24883,383.196,21147.4
1,CUTLASS,conv2d,cutlass_tensorop_h16816fprop_optimized_256x128_32x3_nhwc_align2,passed,success,fprop,256,56,56,256,64,1,1,56,56,0,0,1,1,1,1,f16:nhwc,f16:nhwc,f16:nhwc,cross,optimized,1,0,serial,1,none,tensorop,f16,256,128,32,3,4,2,1,16,8,16,80,1024,513835008,26409435136,1.28295,373.005,20585
1,CUTLASS,conv2d,cutlass_tensorop_h16816fprop_optimized_128x256_32x3_nhwc_align8,passed,success,fprop,256,56,56,256,64,1,1,56,56,0,0,1,1,1,1,f16:nhwc,f16:nhwc,f16:nhwc,cross,optimized,1,0,serial,1,none,tensorop,f16,128,256,32,3,2,4,1,16,8,16,80,1024,513835008,26409435136,1.66518,287.383,15859.8
1,CUTLASS,conv2d,cutlass_tensorop_h16816fprop_optimized_128x256_32x3_nhwc_align4,passed,success,fprop,256,56,56,256,64,1,1,56,56,0,0,1,1,1,1,f16:nhwc,f16:nhwc,f16:nhwc,cross,optimized,1,0,serial,1,none,tensorop,f16,128,256,32,3,2,4,1,16,8,16,80,1024,513835008,26409435136,1.75,273.455,15091.1
1,CUTLASS,conv2d,cutlass_tensorop_h16816fprop_optimized_128x256_32x3_nhwc_align2,passed,success,fprop,256,56,56,256,64,1,1,56,56,0,0,1,1,1,1,f16:nhwc,f16:nhwc,f16:nhwc,cross,optimized,1,0,serial,1,none,tensorop,f16,128,256,32,3,2,4,1,16,8,16,80,1024,513835008,26409435136,2.14124,223.49,12333.7
1,CUTLASS,conv2d,cutlass_tensorop_h16816fprop_optimized_256x64_32x4_nhwc_align8,passed,success,fprop,256,56,56,256,64,1,1,56,56,0,0,1,1,1,1,f16:nhwc,f16:nhwc,f16:nhwc,cross,optimized,1,0,serial,1,none,tensorop,f16,256,64,32,4,4,1,1,16,8,16,80,1024,513835008,26409435136,1.24556,384.201,21202.8
1,CUTLASS,conv2d,cutlass_tensorop_h16816fprop_optimized_256x64_32x4_nhwc_align4,passed,success,fprop,256,56,56,256,64,1,1,56,56,0,0,1,1,1,1,f16:nhwc,f16:nhwc,f16:nhwc,cross,optimized,1,0,serial,1,none,tensorop,f16,256,64,32,4,4,1,1,16,8,16,80,1024,513835008,26409435136,1.24791,383.478,21162.9
1,CUTLASS,conv2d,cutlass_tensorop_h16816fprop_optimized_256x64_32x4_nhwc_align2,passed,success,fprop,256,56,56,256,64,1,1,56,56,0,0,1,1,1,1,f16:nhwc,f16:nhwc,f16:nhwc,cross,optimized,1,0,serial,1,none,tensorop,f16,256,64,32,4,4,1,1,16,8,16,80,1024,513835008,26409435136,3.95428,121.02,6678.69
1,CUTLASS,conv2d,cutlass_tensorop_h16816fprop_optimized_64x256_32x4_nhwc_align8,passed,success,fprop,256,56,56,256,64,1,1,56,56,0,0,1,1,1,1,f16:nhwc,f16:nhwc,f16:nhwc,cross,optimized,1,0,serial,1,none,tensorop,f16,64,256,32,4,1,4,1,16,8,16,80,1024,513835008,26409435136,1.8708,255.798,14116.7
1,CUTLASS,conv2d,cutlass_tensorop_h16816fprop_optimized_64x256_32x4_nhwc_align4,passed,success,fprop,256,56,56,256,64,1,1,56,56,0,0,1,1,1,1,f16:nhwc,f16:nhwc,f16:nhwc,cross,optimized,1,0,serial,1,none,tensorop,f16,64,256,32,4,1,4,1,16,8,16,80,1024,513835008,26409435136,2.1777,219.749,12127.2
1,CUTLASS,conv2d,cutlass_tensorop_h16816fprop_optimized_64x256_32x4_nhwc_align2,passed,success,fprop,256,56,56,256,64,1,1,56,56,0,0,1,1,1,1,f16:nhwc,f16:nhwc,f16:nhwc,cross,optimized,1,0,serial,1,none,tensorop,f16,64,256,32,4,1,4,1,16,8,16,80,1024,513835008,26409435136,3.33197,143.623,7926.08
1,CUTLASS,conv2d,cutlass_tensorop_h16816fprop_optimized_128x128_32x3_nhwc_align8,passed,success,fprop,256,56,56,256,64,1,1,56,56,0,0,1,1,1,1,f16:nhwc,f16:nhwc,f16:nhwc,cross,optimized,1,0,serial,1,none,tensorop,f16,128,128,32,3,2,2,1,16,8,16,80,1024,513835008,26409435136,1.24,385.925,21298
1,CUTLASS,conv2d,cutlass_tensorop_h16816fprop_optimized_128x128_32x3_nhwc_align4,passed,success,fprop,256,56,56,256,64,1,1,56,56,0,0,1,1,1,1,f16:nhwc,f16:nhwc,f16:nhwc,cross,optimized,1,0,serial,1,none,tensorop,f16,128,128,32,3,2,2,1,16,8,16,80,1024,513835008,26409435136,1.24238,385.185,21257.1
1,CUTLASS,conv2d,cutlass_tensorop_h16816fprop_optimized_128x128_32x3_nhwc_align2,passed,success,fprop,256,56,56,256,64,1,1,56,56,0,0,1,1,1,1,f16:nhwc,f16:nhwc,f16:nhwc,cross,optimized,1,0,serial,1,none,tensorop,f16,128,128,32,3,2,2,1,16,8,16,80,1024,513835008,26409435136,1.28963,371.071,20478.2
