conv2d/resnet50_cutlass_profiler_result_int8.csv
Problem,Provider,OperationKind,Operation,Disposition,Status,conv_kind,n,h,w,c,k,r,s,p,q,pad_h,pad_w,stride_h,stride_w,dilation_h,dilation_w,Activation,Filter,Output,conv_mode,iterator_algorithm,alpha,beta,split_k_mode,split_k_slices,eq_gemm_provider,op_class,accum,cta_m,cta_n,cta_k,stages,warps_m,warps_n,warps_k,inst_m,inst_n,inst_k,min_cc,max_cc,Bytes,Flops,Flops/Byte,Runtime,GB/s,GFLOPs
1,CUTLASS,conv2d,cutlass_tensorop_i8816fprop_optimized_s8_256x128_64x2_nhwc_align16,passed,success,fprop,256,56,56,64,256,1,1,56,56,0,0,1,1,1,1,s8:nhwc,s8:nhwc,s32:nhwc,cross,optimized,1,0,serial,1,none,tensorop,s32,256,128,64,2,4,2,1,8,8,16,75,1024,873480192,26717716480,30,2.17375,374.235,12291.1
1,CUTLASS,conv2d,cutlass_tensorop_i8816fprop_optimized_s8_128x256_64x2_nhwc_align16,passed,success,fprop,256,56,56,64,256,1,1,56,56,0,0,1,1,1,1,s8:nhwc,s8:nhwc,s32:nhwc,cross,optimized,1,0,serial,1,none,tensorop,s32,128,256,64,2,2,4,1,8,8,16,75,1024,873480192,26717716480,30,2.17087,374.731,12307.4
1,CUTLASS,conv2d,cutlass_tensorop_i8816fprop_optimized_s8_128x128_64x2_nhwc_align16,passed,success,fprop,256,56,56,64,256,1,1,56,56,0,0,1,1,1,1,s8:nhwc,s8:nhwc,s32:nhwc,cross,optimized,1,0,serial,1,none,tensorop,s32,128,128,64,2,2,2,1,8,8,16,75,1024,873480192,26717716480,30,2.17317,374.334,12294.3
1,CUTLASS,conv2d,cutlass_tensorop_i8816fprop_optimized_s8_64x256_64x2_nhwc_align16,passed,success,fprop,256,56,56,64,256,1,1,56,56,0,0,1,1,1,1,s8:nhwc,s8:nhwc,s32:nhwc,cross,optimized,1,0,serial,1,none,tensorop,s32,64,256,64,2,1,4,1,8,8,16,75,1024,873480192,26717716480,30,2.17228,374.487,12299.4
1,CUTLASS,conv2d,cutlass_tensorop_i8816fprop_optimized_s8_256x64_64x2_nhwc_align16,passed,success,fprop,256,56,56,64,256,1,1,56,56,0,0,1,1,1,1,s8:nhwc,s8:nhwc,s32:nhwc,cross,optimized,1,0,serial,1,none,tensorop,s32,256,64,64,2,4,1,1,8,8,16,75,1024,873480192,26717716480,30,2.1719,374.552,12301.5
1,CUTLASS,conv2d,cutlass_tensorop_i8816fprop_optimized_s8_256x128_64x2_nhwc_align16,passed,success,fprop,256,56,56,64,256,1,1,56,56,0,0,1,1,1,1,s8:nhwc,s8:nhwc,s32:nhwc,cross,optimized,1,0,serial,1,none,tensorop,s32,256,128,64,2,4,2,1,8,8,16,75,1024,873480192,26717716480,30,2.17293,374.376,12295.7
1,CUTLASS,conv2d,cutlass_tensorop_i8816fprop_optimized_s8_128x256_64x2_nhwc_align16,passed,success,fprop,256,56,56,64,256,1,1,56,56,0,0,1,1,1,1,s8:nhwc,s8:nhwc,s32:nhwc,cross,optimized,1,0,serial,1,none,tensorop,s32,128,256,64,2,2,4,1,8,8,16,75,1024,873480192,26717716480,30,2.17433,374.134,12287.8
1,CUTLASS,conv2d,cutlass_tensorop_i8816fprop_optimized_s8_128x128_64x2_nhwc_align16,passed,success,fprop,256,56,56,64,256,1,1,56,56,0,0,1,1,1,1,s8:nhwc,s8:nhwc,s32:nhwc,cross,optimized,1,0,serial,1,none,tensorop,s32,128,128,64,2,2,2,1,8,8,16,75,1024,873480192,26717716480,30,2.17061,374.775,12308.8
1,CUTLASS,conv2d,cutlass_tensorop_i8816fprop_optimized_s8_64x256_64x2_nhwc_align16,passed,success,fprop,256,56,56,64,256,1,1,56,56,0,0,1,1,1,1,s8:nhwc,s8:nhwc,s32:nhwc,cross,optimized,1,0,serial,1,none,tensorop,s32,64,256,64,2,1,4,1,8,8,16,75,1024,873480192,26717716480,30,2.17255,374.441,12297.9
1,CUTLASS,conv2d,cutlass_tensorop_i8816fprop_optimized_s8_256x64_64x2_nhwc_align16,passed,success,fprop,256,56,56,64,256,1,1,56,56,0,0,1,1,1,1,s8:nhwc,s8:nhwc,s32:nhwc,cross,optimized,1,0,serial,1,none,tensorop,s32,256,64,64,2,4,1,1,8,8,16,75,1024,873480192,26717716480,30,2.17187,374.558,12301.7
1,CUTLASS,conv2d,cutlass_tensorop_i8816fprop_optimized_s8_64x128_64x2_nhwc_align16,passed,success,fprop,256,56,56,64,256,1,1,56,56,0,0,1,1,1,1,s8:nhwc,s8:nhwc,s32:nhwc,cross,optimized,1,0,serial,1,none,tensorop,s32,64,128,64,2,2,2,1,8,8,16,75,1024,873480192,26717716480,30,2.16993,374.894,12312.7
1,CUTLASS,conv2d,cutlass_tensorop_i8816fprop_optimized_s8_128x64_64x2_nhwc_align16,passed,success,fprop,256,56,56,64,256,1,1,56,56,0,0,1,1,1,1,s8:nhwc,s8:nhwc,s32:nhwc,cross,optimized,1,0,serial,1,none,tensorop,s32,128,64,64,2,2,2,1,8,8,16,75,1024,873480192,26717716480,30,2.16984,374.908,12313.2
1,CUTLASS,conv2d,cutlass_tensorop_i8816fprop_optimized_s8_64x64_64x2_nhwc_align16,passed,success,fprop,256,56,56,64,256,1,1,56,56,0,0,1,1,1,1,s8:nhwc,s8:nhwc,s32:nhwc,cross,optimized,1,0,serial,1,none,tensorop,s32,64,64,64,2,2,2,1,8,8,16,75,1024,873480192,26717716480,30,2.16884,375.081,12318.9
1,CUTLASS,conv2d,cutlass_tensorop_i16832fprop_optimized_s8_256x128_64x3_nhwc_align16,passed,success,fprop,256,56,56,64,256,1,1,56,56,0,0,1,1,1,1,s8:nhwc,s8:nhwc,s32:nhwc,cross,optimized,1,0,serial,1,none,tensorop,s32,256,128,64,3,4,2,1,16,8,32,80,1024,873480192,26717716480,30,2.17367,374.249,12291.6
1,CUTLASS,conv2d,cutlass_tensorop_i16832fprop_optimized_s8_128x256_64x3_nhwc_align16,passed,success,fprop,256,56,56,64,256,1,1,56,56,0,0,1,1,1,1,s8:nhwc,s8:nhwc,s32:nhwc,cross,optimized,1,0,serial,1,none,tensorop,s32,128,256,64,3,2,4,1,16,8,32,80,1024,873480192,26717716480,30,2.17257,374.438,12297.7
1,CUTLASS,conv2d,cutlass_tensorop_i16832fprop_optimized_s8_256x64_64x4_nhwc_align16,passed,success,fprop,256,56,56,64,256,1,1,56,56,0,0,1,1,1,1,s8:nhwc,s8:nhwc,s32:nhwc,cross,optimized,1,0,serial,1,none,tensorop,s32,256,64,64,4,4,1,1,16,8,32,80,1024,873480192,26717716480,30,2.16737,375.336,12327.3
1,CUTLASS,conv2d,cutlass_tensorop_i16832fprop_optimized_s8_64x256_64x4_nhwc_align16,passed,success,fprop,256,56,56,64,256,1,1,56,56,0,0,1,1,1,1,s8:nhwc,s8:nhwc,s32:nhwc,cross,optimized,1,0,serial,1,none,tensorop,s32,64,256,64,4,1,4,1,16,8,32,80,1024,873480192,26717716480,30,2.16977,374.92,12313.6
1,CUTLASS,conv2d,cutlass_tensorop_i16832fprop_optimized_s8_128x128_64x5_nhwc_align16,passed,success,fprop,256,56,56,64,256,1,1,56,56,0,0,1,1,1,1,s8:nhwc,s8:nhwc,s32:nhwc,cross,optimized,1,0,serial,1,none,tensorop,s32,128,128,64,5,2,2,1,16,8,32,80,1024,873480192,26717716480,30,2.16934,374.994,12316
1,CUTLASS,conv2d,cutlass_tensorop_i16832fprop_optimized_s8_128x64_64x6_nhwc_align16,passed,success,fprop,256,56,56,64,256,1,1,56,56,0,0,1,1,1,1,s8:nhwc,s8:nhwc,s32:nhwc,cross,optimized,1,0,serial,1,none,tensorop,s32,128,64,64,6,2,2,1,16,8,32,80,1024,873480192,26717716480,30,2.16579,375.61,12336.2
1,CUTLASS,conv2d,cutlass_tensorop_i16832fprop_optimized_s8_64x128_64x6_nhwc_align16,passed,success,fprop,256,56,56,64,256,1,1,56,56,0,0,1,1,1,1,s8:nhwc,s8:nhwc,s32:nhwc,cross,optimized,1,0,serial,1,none,tensorop,s32,64,128,64,6,2,2,1,16,8,32,80,1024,873480192,26717716480,30,2.16643,375.5,12332.6
1,CUTLASS,conv2d,cutlass_tensorop_i16832fprop_optimized_s8_64x64_64x10_nhwc_align16,passed,success,fprop,256,56,56,64,256,1,1,56,56,0,0,1,1,1,1,s8:nhwc,s8:nhwc,s32:nhwc,cross,optimized,1,0,serial,1,none,tensorop,s32,64,64,64,10,2,2,1,16,8,32,80,1024,873480192,26717716480,30,2.50216,325.115,10677.8
1,CUTLASS,conv2d,cutlass_tensorop_i16832fprop_optimized_s8_128x64_128x3_nhwc_align16,passed,success,fprop,256,56,56,64,256,1,1,56,56,0,0,1,1,1,1,s8:nhwc,s8:nhwc,s32:nhwc,cross,optimized,1,0,serial,1,none,tensorop,s32,128,64,128,3,2,2,1,16,8,32,80,1024,873480192,26717716480,30,2.17996,373.168,12256
1,CUTLASS,conv2d,cutlass_tensorop_i16832fprop_optimized_s8_64x128_128x3_nhwc_align16,passed,success,fprop,256,56,56,64,256,1,1,56,56,0,0,1,1,1,1,s8:nhwc,s8:nhwc,s32:nhwc,cross,optimized,1,0,serial,1,none,tensorop,s32,64,128,128,3,2,2,1,16,8,32,80,1024,873480192,26717716480,30,2.16709,375.384,12328.8
1,CUTLASS,conv2d,cutlass_tensorop_i16832fprop_optimized_s8_64x64_128x5_nhwc_align16,passed,success,fprop,256,56,56,64,256,1,1,56,56,0,0,1,1,1,1,s8:nhwc,s8:nhwc,s32:nhwc,cross,optimized,1,0,serial,1,none,tensorop,s32,64,64,128,5,2,2,1,16,8,32,80,1024,873480192,26717716480,30,2.80479,290.037,9525.76
1,CUTLASS,conv2d,cutlass_tensorop_i8816fprop_optimized_s8_256x128_64x2_nhwc_align16,passed,success,fprop,256,56,56,64,64,1,1,56,56,0,0,1,1,1,1,s8:nhwc,s8:nhwc,s32:nhwc,cross,optimized,1,0,serial,1,none,tensorop,s32,256,128,64,2,4,2,1,8,8,16,75,1024,256905216,6679429120,25,0.643021,372.09,10387.6
1,CUTLASS,conv2d,cutlass_tensorop_i8816fprop_optimized_s8_128x256_64x2_nhwc_align16,passed,success,fprop,256,56,56,64,64,1,1,56,56,0,0,1,1,1,1,s8:nhwc,s8:nhwc,s32:nhwc,cross,optimized,1,0,serial,1,none,tensorop,s32,128,256,64,2,2,4,1,8,8,16,75,1024,256905216,6679429120,25,0.714424,334.901,9349.39
1,CUTLASS,conv2d,cutlass_tensorop_i8816fprop_optimized_s8_128x128_64x2_nhwc_align16,passed,success,fprop,256,56,56,64,64,1,1,56,56,0,0,1,1,1,1,s8:nhwc,s8:nhwc,s32:nhwc,cross,optimized,1,0,serial,1,none,tensorop,s32,128,128,64,2,2,2,1,8,8,16,75,1024,256905216,6679429120,25,0.640788,373.386,10423.8
1,CUTLASS,conv2d,cutlass_tensorop_i8816fprop_optimized_s8_64x256_64x2_nhwc_align16,passed,success,fprop,256,56,56,64,64,1,1,56,56,0,0,1,1,1,1,s8:nhwc,s8:nhwc,s32:nhwc,cross,optimized,1,0,serial,1,none,tensorop,s32,64,256,64,2,1,4,1,8,8,16,75,1024,256905216,6679429120,25,0.644342,371.327,10366.3
1,CUTLASS,conv2d,cutlass_tensorop_i8816fprop_optimized_s8_256x64_64x2_nhwc_align16,passed,success,fprop,256,56,56,64,64,1,1,56,56,0,0,1,1,1,1,s8:nhwc,s8:nhwc,s32:nhwc,cross,optimized,1,0,serial,1,none,tensorop,s32,256,64,64,2,4,1,1,8,8,16,75,1024,256905216,6679429120,25,0.640891,373.327,10422.1
1,CUTLASS,conv2d,cutlass_tensorop_i8816fprop_optimized_s8_64x128_64x2_nhwc_align16,passed,success,fprop,256,56,56,64,64,1,1,56,56,0,0,1,1,1,1,s8:nhwc,s8:nhwc,s32:nhwc,cross,optimized,1,0,serial,1,none,tensorop,s32,64,128,64,2,2,2,1,8,8,16,75,1024,256905216,6679429120,25,0.641372,373.047,10414.3
1,CUTLASS,conv2d,cutlass_tensorop_i8816fprop_optimized_s8_128x64_64x2_nhwc_align16,passed,success,fprop,256,56,56,64,64,1,1,56,56,0,0,1,1,1,1,s8:nhwc,s8:nhwc,s32:nhwc,cross,optimized,1,0,serial,1,none,tensorop,s32,128,64,64,2,2,2,1,8,8,16,75,1024,256905216,6679429120,25,0.640358,373.637,10430.8
1,CUTLASS,conv2d,cutlass_tensorop_i8816fprop_optimized_s8_64x64_64x2_nhwc_align16,passed,success,fprop,256,56,56,64,64,1,1,56,56,0,0,1,1,1,1,s8:nhwc,s8:nhwc,s32:nhwc,cross,optimized,1,0,serial,1,none,tensorop,s32,64,64,64,2,2,2,1,8,8,16,75,1024,256905216,6679429120,25,0.64087,373.339,10422.4
1,CUTLASS,conv2d,cutlass_tensorop_i16832fprop_optimized_s8_256x128_64x3_nhwc_align16,passed,success,fprop,256,56,56,64,64,1,1,56,56,0,0,1,1,1,1,s8:nhwc,s8:nhwc,s32:nhwc,cross,optimized,1,0,serial,1,none,tensorop,s32,256,128,64,3,4,2,1,16,8,32,80,1024,256905216,6679429120,25,0.644209,371.404,10368.4
1,CUTLASS,conv2d,cutlass_tensorop_i16832fprop_optimized_s8_128x256_64x3_nhwc_align16,passed,success,fprop,256,56,56,64,64,1,1,56,56,0,0,1,1,1,1,s8:nhwc,s8:nhwc,s32:nhwc,cross,optimized,1,0,serial,1,none,tensorop,s32,128,256,64,3,2,4,1,16,8,32,80,1024,256905216,6679429120,25,0.758866,315.288,8801.86
1,CUTLASS,conv2d,cutlass_tensorop_i16832fprop_optimized_s8_256x64_64x4_nhwc_align16,passed,success,fprop,256,56,56,64,64,1,1,56,56,0,0,1,1,1,1,s8:nhwc,s8:nhwc,s32:nhwc,cross,optimized,1,0,serial,1,none,tensorop,s32,256,64,64,4,4,1,1,16,8,32,80,1024,256905216,6679429120,25,0.642529,372.375,10395.5
1,CUTLASS,conv2d,cutlass_tensorop_i16832fprop_optimized_s8_64x256_64x4_nhwc_align16,passed,success,fprop,256,56,56,64,64,1,1,56,56,0,0,1,1,1,1,s8:nhwc,s8:nhwc,s32:nhwc,cross,optimized,1,0,serial,1,none,tensorop,s32,64,256,64,4,1,4,1,16,8,32,80,1024,256905216,6679429120,25,0.939509,254.667,7109.49
1,CUTLASS,conv2d,cutlass_tensorop_i16832fprop_optimized_s8_128x128_64x5_nhwc_align16,passed,success,fprop,256,56,56,64,64,1,1,56,56,0,0,1,1,1,1,s8:nhwc,s8:nhwc,s32:nhwc,cross,optimized,1,0,serial,1,none,tensorop,s32,128,128,64,5,2,2,1,16,8,32,80,1024,256905216,6679429120,25,0.643502,371.812,10379.8
1,CUTLASS,conv2d,cutlass_tensorop_i16832fprop_optimized_s8_128x64_64x6_nhwc_align16,passed,success,fprop,256,56,56,64,64,1,1,56,56,0,0,1,1,1,1,s8:nhwc,s8:nhwc,s32:nhwc,cross,optimized,1,0,serial,1,none,tensorop,s32,128,64,64,6,2,2,1,16,8,32,80,1024,256905216,6679429120,25,0.642898,372.161,10389.6
1,CUTLASS,conv2d,cutlass_tensorop_i16832fprop_optimized_s8_64x128_64x6_nhwc_align16,passed,success,fprop,256,56,56,64,64,1,1,56,56,0,0,1,1,1,1,s8:nhwc,s8:nhwc,s32:nhwc,cross,optimized,1,0,serial,1,none,tensorop,s32,64,128,64,6,2,2,1,16,8,32,80,1024,256905216,6679429120,25,0.776479,308.137,8602.2
1,CUTLASS,conv2d,cutlass_tensorop_i16832fprop_optimized_s8_64x64_64x10_nhwc_align16,passed,success,fprop,256,56,56,64,64,1,1,56,56,0,0,1,1,1,1,s8:nhwc,s8:nhwc,s32:nhwc,cross,optimized,1,0,serial,1,none,tensorop,s32,64,64,64,10,2,2,1,16,8,32,80,1024,256905216,6679429120,25,0.670874,356.642,9956.32
1,CUTLASS,conv2d,cutlass_tensorop_i16832fprop_optimized_s8_128x64_128x3_nhwc_align16,passed,success,fprop,256,56,56,64,64,1,1,56,56,0,0,1,1,1,1,s8:nhwc,s8:nhwc,s32:nhwc,cross,optimized,1,0,serial,1,none,tensorop,s32,128,64,128,3,2,2,1,16,8,32,80,1024,256905216,6679429120,25,0.643318,371.918,10382.8
1,CUTLASS,conv2d,cutlass_tensorop_i16832fprop_optimized_s8_64x128_128x3_nhwc_align16,passed,success,fprop,256,56,56,64,64,1,1,56,56,0,0,1,1,1,1,s8:nhwc,s8:nhwc,s32:nhwc,cross,optimized,1,0,serial,1,none,tensorop,s32,64,128,128,3,2,2,1,16,8,32,80,1024,256905216,6679429120,25,0.862075,277.542,7748.08
1,CUTLASS,conv2d,cutlass_tensorop_i16832fprop_optimized_s8_64x64_128x5_nhwc_align16,passed,success,fprop,256,56,56,64,64,1,1,56,56,0,0,1,1,1,1,s8:nhwc,s8:nhwc,s32:nhwc,cross,optimized,1,0,serial,1,none,tensorop,s32,64,64,128,5,2,2,1,16,8,32,80,1024,256905216,6679429120,25,0.751974,318.178,8882.52
1,CUTLASS,conv2d,cutlass_tensorop_i8816fprop_optimized_s8_256x128_64x2_nhwc_align16,passed,success,fprop,256,56,56,64,64,3,3,56,56,1,1,1,1,1,1,s8:nhwc,s8:nhwc,s32:nhwc,cross,optimized,1,0,serial,1,none,tensorop,s32,256,128,64,2,4,2,1,8,8,16,75,1024,667979776,59292778496,88,1.19338,521.297,49684.8
1,CUTLASS,conv2d,cutlass_tensorop_i8816fprop_optimized_s8_128x256_64x2_nhwc_align16,passed,success,fprop,256,56,56,64,64,3,3,56,56,1,1,1,1,1,1,s8:nhwc,s8:nhwc,s32:nhwc,cross,optimized,1,0,serial,1,none,tensorop,s32,128,256,64,2,2,4,1,8,8,16,75,1024,667979776,59292778496,88,1.97665,314.727,29996.6
1,CUTLASS,conv2d,cutlass_tensorop_i8816fprop_optimized_s8_128x128_64x2_nhwc_align16,passed,success,fprop,256,56,56,64,64,3,3,56,56,1,1,1,1,1,1,s8:nhwc,s8:nhwc,s32:nhwc,cross,optimized,1,0,serial,1,none,tensorop,s32,128,128,64,2,2,2,1,8,8,16,75,1024,667979776,59292778496,88,1.1433,544.133,51861.3
1,CUTLASS,conv2d,cutlass_tensorop_i8816fprop_optimized_s8_64x256_64x2_nhwc_align16,passed,success,fprop,256,56,56,64,64,3,3,56,56,1,1,1,1,1,1,s8:nhwc,s8:nhwc,s32:nhwc,cross,optimized,1,0,serial,1,none,tensorop,s32,64,256,64,2,1,4,1,8,8,16,75,1024,667979776,59292778496,88,1.73071,359.45,34259.1
1,CUTLASS,conv2d,cutlass_tensorop_i8816fprop_optimized_s8_256x64_64x2_nhwc_align16,passed,success,fprop,256,56,56,64,64,3,3,56,56,1,1,1,1,1,1,s8:nhwc,s8:nhwc,s32:nhwc,cross,optimized,1,0,serial,1,none,tensorop,s32,256,64,64,2,4,1,1,8,8,16,75,1024,667979776,59292778496,88,0.857047,725.87,69182.6
1,CUTLASS,conv2d,cutlass_tensorop_i8816fprop_optimized_s8_64x128_64x2_nhwc_align16,passed,success,fprop,256,56,56,64,64,3,3,56,56,1,1,1,1,1,1,s8:nhwc,s8:nhwc,s32:nhwc,cross,optimized,1,0,serial,1,none,tensorop,s32,64,128,64,2,2,2,1,8,8,16,75,1024,667979776,59292778496,88,0.99458,625.495,59615.9
1,CUTLASS,conv2d,cutlass_tensorop_i8816fprop_optimized_s8_128x64_64x2_nhwc_align16,passed,success,fprop,256,56,56,64,64,3,3,56,56,1,1,1,1,1,1,s8:nhwc,s8:nhwc,s32:nhwc,cross,optimized,1,0,serial,1,none,tensorop,s32,128,64,64,2,2,2,1,8,8,16,75,1024,667979776,59292778496,88,0.829727,749.771,71460.6
1,CUTLASS,conv2d,cutlass_tensorop_i8816fprop_optimized_s8_64x64_64x2_nhwc_align16,passed,success,fprop,256,56,56,64,64,3,3,56,56,1,1,1,1,1,1,s8:nhwc,s8:nhwc,s32:nhwc,cross,optimized,1,0,serial,1,none,tensorop,s32,64,64,64,2,2,2,1,8,8,16,75,1024,667979776,59292778496,88,0.879923,706.999,67384
1,CUTLASS,conv2d,cutlass_tensorop_i16832fprop_optimized_s8_256x128_64x3_nhwc_align16,passed,success,fprop,256,56,56,64,64,3,3,56,56,1,1,1,1,1,1,s8:nhwc,s8:nhwc,s32:nhwc,cross,optimized,1,0,serial,1,none,tensorop,s32,256,128,64,3,4,2,1,16,8,32,80,1024,667979776,59292778496,88,1.045,595.314,56739.4
1,CUTLASS,conv2d,cutlass_tensorop_i16832fprop_optimized_s8_128x256_64x3_nhwc_align16,passed,success,fprop,256,56,56,64,64,3,3,56,56,1,1,1,1,1,1,s8:nhwc,s8:nhwc,s32:nhwc,cross,optimized,1,0,serial,1,none,tensorop,s32,128,256,64,3,2,4,1,16,8,32,80,1024,667979776,59292778496,88,1.96038,317.338,30245.5
1,CUTLASS,conv2d,cutlass_tensorop_i16832fprop_optimized_s8_256x64_64x4_nhwc_align16,passed,success,fprop,256,56,56,64,64,3,3,56,56,1,1,1,1,1,1,s8:nhwc,s8:nhwc,s32:nhwc,cross,optimized,1,0,serial,1,none,tensorop,s32,256,64,64,4,4,1,1,16,8,32,80,1024,667979776,59292778496,88,0.709521,876.796,83567.4
1,CUTLASS,conv2d,cutlass_tensorop_i16832fprop_optimized_s8_64x256_64x4_nhwc_align16,passed,success,fprop,256,56,56,64,64,3,3,56,56,1,1,1,1,1,1,s8:nhwc,s8:nhwc,s32:nhwc,cross,optimized,1,0,serial,1,none,tensorop,s32,64,256,64,4,1,4,1,16,8,32,80,1024,667979776,59292778496,88,2.1468,289.783,27619.2
1,CUTLASS,conv2d,cutlass_tensorop_i16832fprop_optimized_s8_128x128_64x5_nhwc_align16,passed,success,fprop,256,56,56,64,64,3,3,56,56,1,1,1,1,1,1,s8:nhwc,s8:nhwc,s32:nhwc,cross,optimized,1,0,serial,1,none,tensorop,s32,128,128,64,5,2,2,1,16,8,32,80,1024,667979776,59292778496,88,1.18796,523.674,49911.3
1,CUTLASS,conv2d,cutlass_tensorop_i16832fprop_optimized_s8_128x64_64x6_nhwc_align16,passed,success,fprop,256,56,56,64,64,3,3,56,56,1,1,1,1,1,1,s8:nhwc,s8:nhwc,s32:nhwc,cross,optimized,1,0,serial,1,none,tensorop,s32,128,64,64,6,2,2,1,16,8,32,80,1024,667979776,59292778496,88,0.845929,735.41,70091.9
1,CUTLASS,conv2d,cutlass_tensorop_i16832fprop_optimized_s8_64x128_64x6_nhwc_align16,passed,success,fprop,256,56,56,64,64,3,3,56,56,1,1,1,1,1,1,s8:nhwc,s8:nhwc,s32:nhwc,cross,optimized,1,0,serial,1,none,tensorop,s32,64,128,64,6,2,2,1,16,8,32,80,1024,667979776,59292778496,88,1.44979,429.1,40897.5
1,CUTLASS,conv2d,cutlass_tensorop_i16832fprop_optimized_s8_64x64_64x10_nhwc_align16,passed,success,fprop,256,56,56,64,64,3,3,56,56,1,1,1,1,1,1,s8:nhwc,s8:nhwc,s32:nhwc,cross,optimized,1,0,serial,1,none,tensorop,s32,64,64,64,10,2,2,1,16,8,32,80,1024,667979776,59292778496,88,1.12865,551.193,52534.2
1,CUTLASS,conv2d,cutlass_tensorop_i16832fprop_optimized_s8_128x64_128x3_nhwc_align16,passed,success,fprop,256,56,56,64,64,3,3,56,56,1,1,1,1,1,1,s8:nhwc,s8:nhwc,s32:nhwc,cross,optimized,1,0,serial,1,none,tensorop,s32,128,64,128,3,2,2,1,16,8,32,80,1024,667979776,59292778496,88,1.17772,528.227,50345.3
1,CUTLASS,conv2d,cutlass_tensorop_i16832fprop_optimized_s8_64x128_128x3_nhwc_align16,passed,success,fprop,256,56,56,64,64,3,3,56,56,1,1,1,1,1,1,s8:nhwc,s8:nhwc,s32:nhwc,cross,optimized,1,0,serial,1,none,tensorop,s32,64,128,128,3,2,2,1,16,8,32,80,1024,667979776,59292778496,88,2.09411,297.074,28314.1
1,CUTLASS,conv2d,cutlass_tensorop_i16832fprop_optimized_s8_64x64_128x5_nhwc_align16,passed,success,fprop,256,56,56,64,64,3,3,56,56,1,1,1,1,1,1,s8:nhwc,s8:nhwc,s32:nhwc,cross,optimized,1,0,serial,1,none,tensorop,s32,64,64,128,5,2,2,1,16,8,32,80,1024,667979776,59292778496,88,1.50251,414.045,39462.6
1,CUTLASS,conv2d,cutlass_tensorop_i8816fprop_optimized_s8_256x128_64x2_nhwc_align16,passed,success,fprop,256,56,56,256,64,1,1,56,56,0,0,1,1,1,1,s8:nhwc,s8:nhwc,s32:nhwc,cross,optimized,1,0,serial,1,none,tensorop,s32,256,128,64,2,4,2,1,8,8,16,75,1024,411058176,26409435136,64,1.01903,375.677,25916.2
1,CUTLASS,conv2d,cutlass_tensorop_i8816fprop_optimized_s8_128x256_64x2_nhwc_align16,passed,success,fprop,256,56,56,256,64,1,1,56,56,0,0,1,1,1,1,s8:nhwc,s8:nhwc,s32:nhwc,cross,optimized,1,0,serial,1,none,tensorop,s32,128,256,64,2,2,4,1,8,8,16,75,1024,411058176,26409435136,64,1.32908,288.04,19870.5
1,CUTLASS,conv2d,cutlass_tensorop_i8816fprop_optimized_s8_128x128_64x2_nhwc_align16,passed,success,fprop,256,56,56,256,64,1,1,56,56,0,0,1,1,1,1,s8:nhwc,s8:nhwc,s32:nhwc,cross,optimized,1,0,serial,1,none,tensorop,s32,128,128,64,2,2,2,1,8,8,16,75,1024,411058176,26409435136,64,1.00855,379.583,26185.6
1,CUTLASS,conv2d,cutlass_tensorop_i8816fprop_optimized_s8_64x256_64x2_nhwc_align16,passed,success,fprop,256,56,56,256,64,1,1,56,56,0,0,1,1,1,1,s8:nhwc,s8:nhwc,s32:nhwc,cross,optimized,1,0,serial,1,none,tensorop,s32,64,256,64,2,1,4,1,8,8,16,75,1024,411058176,26409435136,64,1.21338,315.506,21765.2
1,CUTLASS,conv2d,cutlass_tensorop_i8816fprop_optimized_s8_256x64_64x2_nhwc_align16,passed,success,fprop,256,56,56,256,64,1,1,56,56,0,0,1,1,1,1,s8:nhwc,s8:nhwc,s32:nhwc,cross,optimized,1,0,serial,1,none,tensorop,s32,256,64,64,2,4,1,1,8,8,16,75,1024,411058176,26409435136,64,1.00574,380.642,26258.7
1,CUTLASS,conv2d,cutlass_tensorop_i8816fprop_optimized_s8_64x128_64x2_nhwc_align16,passed,success,fprop,256,56,56,256,64,1,1,56,56,0,0,1,1,1,1,s8:nhwc,s8:nhwc,s32:nhwc,cross,optimized,1,0,serial,1,none,tensorop,s32,64,128,64,2,2,2,1,8,8,16,75,1024,411058176,26409435136,64,1.00519,380.851,26273.1
1,CUTLASS,conv2d,cutlass_tensorop_i8816fprop_optimized_s8_128x64_64x2_nhwc_align16,passed,success,fprop,256,56,56,256,64,1,1,56,56,0,0,1,1,1,1,s8:nhwc,s8:nhwc,s32:nhwc,cross,optimized,1,0,serial,1,none,tensorop,s32,128,64,64,2,2,2,1,8,8,16,75,1024,411058176,26409435136,64,1.00524,380.832,26271.8
1,CUTLASS,conv2d,cutlass_tensorop_i8816fprop_optimized_s8_64x64_64x2_nhwc_align16,passed,success,fprop,256,56,56,256,64,1,1,56,56,0,0,1,1,1,1,s8:nhwc,s8:nhwc,s32:nhwc,cross,optimized,1,0,serial,1,none,tensorop,s32,64,64,64,2,2,2,1,8,8,16,75,1024,411058176,26409435136,64,1.00348,381.501,26317.9
1,CUTLASS,conv2d,cutlass_tensorop_i16832fprop_optimized_s8_256x128_64x3_nhwc_align16,passed,success,fprop,256,56,56,256,64,1,1,56,56,0,0,1,1,1,1,s8:nhwc,s8:nhwc,s32:nhwc,cross,optimized,1,0,serial,1,none,tensorop,s32,256,128,64,3,4,2,1,16,8,32,80,1024,411058176,26409435136,64,1.0418,367.469,25349.9
1,CUTLASS,conv2d,cutlass_tensorop_i16832fprop_optimized_s8_128x256_64x3_nhwc_align16,passed,success,fprop,256,56,56,256,64,1,1,56,56,0,0,1,1,1,1,s8:nhwc,s8:nhwc,s32:nhwc,cross,optimized,1,0,serial,1,none,tensorop,s32,128,256,64,3,2,4,1,16,8,32,80,1024,411058176,26409435136,64,1.16955,327.329,22580.8
1,CUTLASS,conv2d,cutlass_tensorop_i16832fprop_optimized_s8_256x64_64x4_nhwc_align16,passed,success,fprop,256,56,56,256,64,1,1,56,56,0,0,1,1,1,1,s8:nhwc,s8:nhwc,s32:nhwc,cross,optimized,1,0,serial,1,none,tensorop,s32,256,64,64,4,4,1,1,16,8,32,80,1024,411058176,26409435136,64,1.05291,363.591,25082.4
1,CUTLASS,conv2d,cutlass_tensorop_i16832fprop_optimized_s8_64x256_64x4_nhwc_align16,passed,success,fprop,256,56,56,256,64,1,1,56,56,0,0,1,1,1,1,s8:nhwc,s8:nhwc,s32:nhwc,cross,optimized,1,0,serial,1,none,tensorop,s32,64,256,64,4,1,4,1,16,8,32,80,1024,411058176,26409435136,64,1.38487,276.436,19070
1,CUTLASS,conv2d,cutlass_tensorop_i16832fprop_optimized_s8_128x128_64x5_nhwc_align16,passed,success,fprop,256,56,56,256,64,1,1,56,56,0,0,1,1,1,1,s8:nhwc,s8:nhwc,s32:nhwc,cross,optimized,1,0,serial,1,none,tensorop,s32,128,128,64,5,2,2,1,16,8,32,80,1024,411058176,26409435136,64,1.0268,372.837,25720.2
1,CUTLASS,conv2d,cutlass_tensorop_i16832fprop_optimized_s8_128x64_64x6_nhwc_align16,passed,success,fprop,256,56,56,256,64,1,1,56,56,0,0,1,1,1,1,s8:nhwc,s8:nhwc,s32:nhwc,cross,optimized,1,0,serial,1,none,tensorop,s32,128,64,64,6,2,2,1,16,8,32,80,1024,411058176,26409435136,64,1.02526,373.396,25758.8
1,CUTLASS,conv2d,cutlass_tensorop_i16832fprop_optimized_s8_64x128_64x6_nhwc_align16,passed,success,fprop,256,56,56,256,64,1,1,56,56,0,0,1,1,1,1,s8:nhwc,s8:nhwc,s32:nhwc,cross,optimized,1,0,serial,1,none,tensorop,s32,64,128,64,6,2,2,1,16,8,32,80,1024,411058176,26409435136,64,1.0406,367.892,25379.1
1,CUTLASS,conv2d,cutlass_tensorop_i16832fprop_optimized_s8_64x64_64x10_nhwc_align16,passed,success,fprop,256,56,56,256,64,1,1,56,56,0,0,1,1,1,1,s8:nhwc,s8:nhwc,s32:nhwc,cross,optimized,1,0,serial,1,none,tensorop,s32,64,64,64,10,2,2,1,16,8,32,80,1024,411058176,26409435136,64,1.01328,377.811,26063.3
1,CUTLASS,conv2d,cutlass_tensorop_i16832fprop_optimized_s8_128x64_128x3_nhwc_align16,passed,success,fprop,256,56,56,256,64,1,1,56,56,0,0,1,1,1,1,s8:nhwc,s8:nhwc,s32:nhwc,cross,optimized,1,0,serial,1,none,tensorop,s32,128,64,128,3,2,2,1,16,8,32,80,1024,411058176,26409435136,64,1.0227,374.331,25823.3
1,CUTLASS,conv2d,cutlass_tensorop_i16832fprop_optimized_s8_64x128_128x3_nhwc_align16,passed,success,fprop,256,56,56,256,64,1,1,56,56,0,0,1,1,1,1,s8:nhwc,s8:nhwc,s32:nhwc,cross,optimized,1,0,serial,1,none,tensorop,s32,64,128,128,3,2,2,1,16,8,32,80,1024,411058176,26409435136,64,1.02813,372.353,25686.9
1,CUTLASS,conv2d,cutlass_tensorop_i16832fprop_optimized_s8_64x64_128x5_nhwc_align16,passed,success,fprop,256,56,56,256,64,1,1,56,56,0,0,1,1,1,1,s8:nhwc,s8:nhwc,s32:nhwc,cross,optimized,1,0,serial,1,none,tensorop,s32,64,64,128,5,2,2,1,16,8,32,80,1024,411058176,26409435136,64,1.01682,376.494,25972.5
1,CUTLASS,conv2d,cutlass_tensorop_i8816fprop_optimized_s8_256x128_64x2_nhwc_align16,passed,success,fprop,256,56,56,256,512,1,1,28,28,0,0,2,2,1,1,s8:nhwc,s8:nhwc,s32:nhwc,cross,optimized,1,0,serial,1,none,tensorop,s32,256,128,64,2,4,2,1,8,8,16,75,1024,462553088,52818870272,114,1.39927,307.866,37747.6
1,CUTLASS,conv2d,cutlass_tensorop_i8816fprop_optimized_s8_128x256_64x2_nhwc_align16,passed,success,fprop,256,56,56,256,512,1,1,28,28,0,0,2,2,1,1,s8:nhwc,s8:nhwc,s32:nhwc,cross,optimized,1,0,serial,1,none,tensorop,s32,128,256,64,2,2,4,1,8,8,16,75,1024,462553088,52818870272,114,1.38513,311.007,38132.7
1,CUTLASS,conv2d,cutlass_tensorop_i8816fprop_optimized_s8_128x128_64x2_nhwc_align16,passed,success,fprop,256,56,56,256,512,1,1,28,28,0,0,2,2,1,1,s8:nhwc,s8:nhwc,s32:nhwc,cross,optimized,1,0,serial,1,none,tensorop,s32,128,128,64,2,2,2,1,8,8,16,75,1024,462553088,52818870272,114,1.32084,326.146,39988.9
1,CUTLASS,conv2d,cutlass_tensorop_i8816fprop_optimized_s8_64x256_64x2_nhwc_align16,passed,success,fprop,256,56,56,256,512,1,1,28,28,0,0,2,2,1,1,s8:nhwc,s8:nhwc,s32:nhwc,cross,optimized,1,0,serial,1,none,tensorop,s32,64,256,64,2,1,4,1,8,8,16,75,1024,462553088,52818870272,114,1.34328,320.698,39321
1,CUTLASS,conv2d,cutlass_tensorop_i8816fprop_optimized_s8_256x64_64x2_nhwc_align16,passed,success,fprop,256,56,56,256,512,1,1,28,28,0,0,2,2,1,1,s8:nhwc,s8:nhwc,s32:nhwc,cross,optimized,1,0,serial,1,none,tensorop,s32,256,64,64,2,4,1,1,8,8,16,75,1024,462553088,52818870272,114,1.44007,299.142,36677.9
1,CUTLASS,conv2d,cutlass_tensorop_i8816fprop_optimized_s8_64x128_64x2_nhwc_align16,passed,success,fprop,256,56,56,256,512,1,1,28,28,0,0,2,2,1,1,s8:nhwc,s8:nhwc,s32:nhwc,cross,optimized,1,0,serial,1,none,tensorop,s32,64,128,64,2,2,2,1,8,8,16,75,1024,462553088,52818870272,114,1.34481,320.333,39276.1
1,CUTLASS,conv2d,cutlass_tensorop_i8816fprop_optimized_s8_128x64_64x2_nhwc_align16,passed,success,fprop,256,56,56,256,512,1,1,28,28,0,0,2,2,1,1,s8:nhwc,s8:nhwc,s32:nhwc,cross,optimized,1,0,serial,1,none,tensorop,s32,128,64,64,2,2,2,1,8,8,16,75,1024,462553088,52818870272,114,1.35478,317.974,38987
1,CUTLASS,conv2d,cutlass_tensorop_i8816fprop_optimized_s8_64x64_64x2_nhwc_align16,passed,success,fprop,256,56,56,256,512,1,1,28,28,0,0,2,2,1,1,s8:nhwc,s8:nhwc,s32:nhwc,cross,optimized,1,0,serial,1,none,tensorop,s32,64,64,64,2,2,2,1,8,8,16,75,1024,462553088,52818870272,114,1.36242,316.191,38768.4
1,CUTLASS,conv2d,cutlass_tensorop_i16832fprop_optimized_s8_256x128_64x3_nhwc_align16,passed,success,fprop,256,56,56,256,512,1,1,28,28,0,0,2,2,1,1,s8:nhwc,s8:nhwc,s32:nhwc,cross,optimized,1,0,serial,1,none,tensorop,s32,256,128,64,3,4,2,1,16,8,32,80,1024,462553088,52818870272,114,1.29044,333.828,40930.7
1,CUTLASS,conv2d,cutlass_tensorop_i16832fprop_optimized_s8_128x256_64x3_nhwc_align16,passed,success,fprop,256,56,56,256,512,1,1,28,28,0,0,2,2,1,1,s8:nhwc,s8:nhwc,s32:nhwc,cross,optimized,1,0,serial,1,none,tensorop,s32,128,256,64,3,2,4,1,16,8,32,80,1024,462553088,52818870272,114,1.18838,362.498,44446
1,CUTLASS,conv2d,cutlass_tensorop_i16832fprop_optimized_s8_256x64_64x4_nhwc_align16,passed,success,fprop,256,56,56,256,512,1,1,28,28,0,0,2,2,1,1,s8:nhwc,s8:nhwc,s32:nhwc,cross,optimized,1,0,serial,1,none,tensorop,s32,256,64,64,4,4,1,1,16,8,32,80,1024,462553088,52818870272,114,1.65445,260.38,31925.2
1,CUTLASS,conv2d,cutlass_tensorop_i16832fprop_optimized_s8_64x256_64x4_nhwc_align16,passed,success,fprop,256,56,56,256,512,1,1,28,28,0,0,2,2,1,1,s8:nhwc,s8:nhwc,s32:nhwc,cross,optimized,1,0,serial,1,none,tensorop,s32,64,256,64,4,1,4,1,16,8,32,80,1024,462553088,52818870272,114,1.16777,368.897,45230.6
1,CUTLASS,conv2d,cutlass_tensorop_i16832fprop_optimized_s8_128x128_64x5_nhwc_align16,passed,success,fprop,256,56,56,256,512,1,1,28,28,0,0,2,2,1,1,s8:nhwc,s8:nhwc,s32:nhwc,cross,optimized,1,0,serial,1,none,tensorop,s32,128,128,64,5,2,2,1,16,8,32,80,1024,462553088,52818870272,114,1.17323,367.18,45020.1
1,CUTLASS,conv2d,cutlass_tensorop_i16832fprop_optimized_s8_128x64_64x6_nhwc_align16,passed,success,fprop,256,56,56,256,512,1,1,28,28,0,0,2,2,1,1,s8:nhwc,s8:nhwc,s32:nhwc,cross,optimized,1,0,serial,1,none,tensorop,s32,128,64,64,6,2,2,1,16,8,32,80,1024,462553088,52818870272,114,1.65105,260.917,31991.1
1,CUTLASS,conv2d,cutlass_tensorop_i16832fprop_optimized_s8_64x128_64x6_nhwc_align16,passed,success,fprop,256,56,56,256,512,1,1,28,28,0,0,2,2,1,1,s8:nhwc,s8:nhwc,s32:nhwc,cross,optimized,1,0,serial,1,none,tensorop,s32,64,128,64,6,2,2,1,16,8,32,80,1024,462553088,52818870272,114,1.17176,367.639,45076.4
1,CUTLASS,conv2d,cutlass_tensorop_i16832fprop_optimized_s8_64x64_64x10_nhwc_align16,passed,success,fprop,256,56,56,256,512,1,1,28,28,0,0,2,2,1,1,s8:nhwc,s8:nhwc,s32:nhwc,cross,optimized,1,0,serial,1,none,tensorop,s32,64,64,64,10,2,2,1,16,8,32,80,1024,462553088,52818870272,114,1.6973,253.807,31119.3
1,CUTLASS,conv2d,cutlass_tensorop_i16832fprop_optimized_s8_128x64_128x3_nhwc_align16,passed,success,fprop,256,56,56,256,512,1,1,28,28,0,0,2,2,1,1,s8:nhwc,s8:nhwc,s32:nhwc,cross,optimized,1,0,serial,1,none,tensorop,s32,128,64,128,3,2,2,1,16,8,32,80,1024,462553088,52818870272,114,1.60354,268.646,32938.9
1,CUTLASS,conv2d,cutlass_tensorop_i16832fprop_optimized_s8_64x128_128x3_nhwc_align16,passed,success,fprop,256,56,56,256,512,1,1,28,28,0,0,2,2,1,1,s8:nhwc,s8:nhwc,s32:nhwc,cross,optimized,1,0,serial,1,none,tensorop,s32,64,128,128,3,2,2,1,16,8,32,80,1024,462553088,52818870272,114,1.16364,370.205,45391
1,CUTLASS,conv2d,cutlass_tensorop_i16832fprop_optimized_s8_64x64_128x5_nhwc_align16,passed,success,fprop,256,56,56,256,512,1,1,28,28,0,0,2,2,1,1,s8:nhwc,s8:nhwc,s32:nhwc,cross,optimized,1,0,serial,1,none,tensorop,s32,64,64,128,5,2,2,1,16,8,32,80,1024,462553088,52818870272,114,1.69035,254.85,31247.3
1,CUTLASS,conv2d,cutlass_tensorop_i8816fprop_optimized_s8_256x128_64x2_nhwc_align16,passed,success,fprop,256,56,56,256,128,1,1,28,28,0,0,2,2,1,1,s8:nhwc,s8:nhwc,s32:nhwc,cross,optimized,1,0,serial,1,none,tensorop,s32,256,128,64,2,4,2,1,8,8,16,75,1024,154173440,13204717568,85,0.391649,366.617,33715.7
1,CUTLASS,conv2d,cutlass_tensorop_i8816fprop_optimized_s8_128x256_64x2_nhwc_align16,passed,success,fprop,256,56,56,256,128,1,1,28,28,0,0,2,2,1,1,s8:nhwc,s8:nhwc,s32:nhwc,cross,optimized,1,0,serial,1,none,tensorop,s32,128,256,64,2,2,4,1,8,8,16,75,1024,154173440,13204717568,85,0.462367,310.544,28559
1,CUTLASS,conv2d,cutlass_tensorop_i8816fprop_optimized_s8_128x128_64x2_nhwc_align16,passed,success,fprop,256,56,56,256,128,1,1,28,28,0,0,2,2,1,1,s8:nhwc,s8:nhwc,s32:nhwc,cross,optimized,1,0,serial,1,none,tensorop,s32,128,128,64,2,2,2,1,8,8,16,75,1024,154173440,13204717568,85,0.386028,371.956,34206.7
1,CUTLASS,conv2d,cutlass_tensorop_i8816fprop_optimized_s8_64x256_64x2_nhwc_align16,passed,success,fprop,256,56,56,256,128,1,1,28,28,0,0,2,2,1,1,s8:nhwc,s8:nhwc,s32:nhwc,cross,optimized,1,0,serial,1,none,tensorop,s32,64,256,64,2,1,4,1,8,8,16,75,1024,154173440,13204717568,85,0.440975,325.608,29944.3
1,CUTLASS,conv2d,cutlass_tensorop_i8816fprop_optimized_s8_256x64_64x2_nhwc_align16,passed,success,fprop,256,56,56,256,128,1,1,28,28,0,0,2,2,1,1,s8:nhwc,s8:nhwc,s32:nhwc,cross,optimized,1,0,serial,1,none,tensorop,s32,256,64,64,2,4,1,1,8,8,16,75,1024,154173440,13204717568,85,0.399649,359.279,33040.8
1,CUTLASS,conv2d,cutlass_tensorop_i8816fprop_optimized_s8_64x128_64x2_nhwc_align16,passed,success,fprop,256,56,56,256,128,1,1,28,28,0,0,2,2,1,1,s8:nhwc,s8:nhwc,s32:nhwc,cross,optimized,1,0,serial,1,none,tensorop,s32,64,128,64,2,2,2,1,8,8,16,75,1024,154173440,13204717568,85,0.387543,370.501,34072.9
1,CUTLASS,conv2d,cutlass_tensorop_i8816fprop_optimized_s8_128x64_64x2_nhwc_align16,passed,success,fprop,256,56,56,256,128,1,1,28,28,0,0,2,2,1,1,s8:nhwc,s8:nhwc,s32:nhwc,cross,optimized,1,0,serial,1,none,tensorop,s32,128,64,64,2,2,2,1,8,8,16,75,1024,154173440,13204717568,85,0.388947,369.164,33949.9
1,CUTLASS,conv2d,cutlass_tensorop_i8816fprop_optimized_s8_64x64_64x2_nhwc_align16,passed,success,fprop,256,56,56,256,128,1,1,28,28,0,0,2,2,1,1,s8:nhwc,s8:nhwc,s32:nhwc,cross,optimized,1,0,serial,1,none,tensorop,s32,64,64,64,2,2,2,1,8,8,16,75,1024,154173440,13204717568,85,0.389786,368.37,33876.9
1,CUTLASS,conv2d,cutlass_tensorop_i16832fprop_optimized_s8_256x128_64x3_nhwc_align16,passed,success,fprop,256,56,56,256,128,1,1,28,28,0,0,2,2,1,1,s8:nhwc,s8:nhwc,s32:nhwc,cross,optimized,1,0,serial,1,none,tensorop,s32,256,128,64,3,4,2,1,16,8,32,80,1024,154173440,13204717568,85,0.393892,364.53,33523.7
1,CUTLASS,conv2d,cutlass_tensorop_i16832fprop_optimized_s8_128x256_64x3_nhwc_align16,passed,success,fprop,256,56,56,256,128,1,1,28,28,0,0,2,2,1,1,s8:nhwc,s8:nhwc,s32:nhwc,cross,optimized,1,0,serial,1,none,tensorop,s32,128,256,64,3,2,4,1,16,8,32,80,1024,154173440,13204717568,85,0.398715,360.12,33118.2
1,CUTLASS,conv2d,cutlass_tensorop_i16832fprop_optimized_s8_256x64_64x4_nhwc_align16,passed,success,fprop,256,56,56,256,128,1,1,28,28,0,0,2,2,1,1,s8:nhwc,s8:nhwc,s32:nhwc,cross,optimized,1,0,serial,1,none,tensorop,s32,256,64,64,4,4,1,1,16,8,32,80,1024,154173440,13204717568,85,0.457544,313.817,28860
1,CUTLASS,conv2d,cutlass_tensorop_i16832fprop_optimized_s8_64x256_64x4_nhwc_align16,passed,success,fprop,256,56,56,256,128,1,1,28,28,0,0,2,2,1,1,s8:nhwc,s8:nhwc,s32:nhwc,cross,optimized,1,0,serial,1,none,tensorop,s32,64,256,64,4,1,4,1,16,8,32,80,1024,154173440,13204717568,85,0.40148,357.64,32890.1
1,CUTLASS,conv2d,cutlass_tensorop_i16832fprop_optimized_s8_128x128_64x5_nhwc_align16,passed,success,fprop,256,56,56,256,128,1,1,28,28,0,0,2,2,1,1,s8:nhwc,s8:nhwc,s32:nhwc,cross,optimized,1,0,serial,1,none,tensorop,s32,128,128,64,5,2,2,1,16,8,32,80,1024,154173440,13204717568,85,0.392817,365.527,33615.5
1,CUTLASS,conv2d,cutlass_tensorop_i16832fprop_optimized_s8_128x64_64x6_nhwc_align16,passed,success,fprop,256,56,56,256,128,1,1,28,28,0,0,2,2,1,1,s8:nhwc,s8:nhwc,s32:nhwc,cross,optimized,1,0,serial,1,none,tensorop,s32,128,64,64,6,2,2,1,16,8,32,80,1024,154173440,13204717568,85,0.393021,365.337,33598
1,CUTLASS,conv2d,cutlass_tensorop_i16832fprop_optimized_s8_64x128_64x6_nhwc_align16,passed,success,fprop,256,56,56,256,128,1,1,28,28,0,0,2,2,1,1,s8:nhwc,s8:nhwc,s32:nhwc,cross,optimized,1,0,serial,1,none,tensorop,s32,64,128,64,6,2,2,1,16,8,32,80,1024,154173440,13204717568,85,0.386519,371.483,34163.2
1,CUTLASS,conv2d,cutlass_tensorop_i16832fprop_optimized_s8_64x64_64x10_nhwc_align16,passed,success,fprop,256,56,56,256,128,1,1,28,28,0,0,2,2,1,1,s8:nhwc,s8:nhwc,s32:nhwc,cross,optimized,1,0,serial,1,none,tensorop,s32,64,64,64,10,2,2,1,16,8,32,80,1024,154173440,13204717568,85,0.431145,333.032,30627.1
1,CUTLASS,conv2d,cutlass_tensorop_i16832fprop_optimized_s8_128x64_128x3_nhwc_align16,passed,success,fprop,256,56,56,256,128,1,1,28,28,0,0,2,2,1,1,s8:nhwc,s8:nhwc,s32:nhwc,cross,optimized,1,0,serial,1,none,tensorop,s32,128,64,128,3,2,2,1,16,8,32,80,1024,154173440,13204717568,85,0.389386,368.747,33911.6
1,CUTLASS,conv2d,cutlass_tensorop_i16832fprop_optimized_s8_64x128_128x3_nhwc_align16,passed,success,fprop,256,56,56,256,128,1,1,28,28,0,0,2,2,1,1,s8:nhwc,s8:nhwc,s32:nhwc,cross,optimized,1,0,serial,1,none,tensorop,s32,64,128,128,3,2,2,1,16,8,32,80,1024,154173440,13204717568,85,0.386967,371.053,34123.6
1,CUTLASS,conv2d,cutlass_tensorop_i16832fprop_optimized_s8_64x64_128x5_nhwc_align16,passed,success,fprop,256,56,56,256,128,1,1,28,28,0,0,2,2,1,1,s8:nhwc,s8:nhwc,s32:nhwc,cross,optimized,1,0,serial,1,none,tensorop,s32,64,64,128,5,2,2,1,16,8,32,80,1024,154173440,13204717568,85,0.429609,334.223,30736.6
1,CUTLASS,conv2d,cutlass_tensorop_i8816fprop_optimized_s8_256x128_64x2_nhwc_align16,passed,success,fprop,256,28,28,128,128,3,3,28,28,1,1,1,1,1,1,s8:nhwc,s8:nhwc,s32:nhwc,cross,optimized,1,0,serial,1,none,tensorop,s32,256,128,64,2,4,2,1,8,8,16,75,1024,334118912,59241398272,177,0.649114,479.381,91265.1
1,CUTLASS,conv2d,cutlass_tensorop_i8816fprop_optimized_s8_128x256_64x2_nhwc_align16,passed,success,fprop,256,28,28,128,128,3,3,28,28,1,1,1,1,1,1,s8:nhwc,s8:nhwc,s32:nhwc,cross,optimized,1,0,serial,1,none,tensorop,s32,128,256,64,2,2,4,1,8,8,16,75,1024,334118912,59241398272,177,0.988477,314.8,59932
1,CUTLASS,conv2d,cutlass_tensorop_i8816fprop_optimized_s8_128x128_64x2_nhwc_align16,passed,success,fprop,256,28,28,128,128,3,3,28,28,1,1,1,1,1,1,s8:nhwc,s8:nhwc,s32:nhwc,cross,optimized,1,0,serial,1,none,tensorop,s32,128,128,64,2,2,2,1,8,8,16,75,1024,334118912,59241398272,177,0.651315,477.76,90956.6
1,CUTLASS,conv2d,cutlass_tensorop_i8816fprop_optimized_s8_64x256_64x2_nhwc_align16,passed,success,fprop,256,28,28,128,128,3,3,28,28,1,1,1,1,1,1,s8:nhwc,s8:nhwc,s32:nhwc,cross,optimized,1,0,serial,1,none,tensorop,s32,64,256,64,2,1,4,1,8,8,16,75,1024,334118912,59241398272,177,0.909363,342.187,65146
1,CUTLASS,conv2d,cutlass_tensorop_i8816fprop_optimized_s8_256x64_64x2_nhwc_align16,passed,success,fprop,256,28,28,128,128,3,3,28,28,1,1,1,1,1,1,s8:nhwc,s8:nhwc,s32:nhwc,cross,optimized,1,0,serial,1,none,tensorop,s32,256,64,64,2,4,1,1,8,8,16,75,1024,334118912,59241398272,177,0.66475,468.104,89118.3
1,CUTLASS,conv2d,cutlass_tensorop_i8816fprop_optimized_s8_64x128_64x2_nhwc_align16,passed,success,fprop,256,28,28,128,128,3,3,28,28,1,1,1,1,1,1,s8:nhwc,s8:nhwc,s32:nhwc,cross,optimized,1,0,serial,1,none,tensorop,s32,64,128,64,2,2,2,1,8,8,16,75,1024,334118912,59241398272,177,0.554261,561.418,106883
1,CUTLASS,conv2d,cutlass_tensorop_i8816fprop_optimized_s8_128x64_64x2_nhwc_align16,passed,success,fprop,256,28,28,128,128,3,3,28,28,1,1,1,1,1,1,s8:nhwc,s8:nhwc,s32:nhwc,cross,optimized,1,0,serial,1,none,tensorop,s32,128,64,64,2,2,2,1,8,8,16,75,1024,334118912,59241398272,177,0.576748,539.53,102716
1,CUTLASS,conv2d,cutlass_tensorop_i8816fprop_optimized_s8_64x64_64x2_nhwc_align16,passed,success,fprop,256,28,28,128,128,3,3,28,28,1,1,1,1,1,1,s8:nhwc,s8:nhwc,s32:nhwc,cross,optimized,1,0,serial,1,none,tensorop,s32,64,64,64,2,2,2,1,8,8,16,75,1024,334118912,59241398272,177,0.627763,495.684,94369
1,CUTLASS,conv2d,cutlass_tensorop_i16832fprop_optimized_s8_256x128_64x3_nhwc_align16,passed,success,fprop,256,28,28,128,128,3,3,28,28,1,1,1,1,1,1,s8:nhwc,s8:nhwc,s32:nhwc,cross,optimized,1,0,serial,1,none,tensorop,s32,256,128,64,3,4,2,1,16,8,32,80,1024,334118912,59241398272,177,0.579031,537.402,102311
1,CUTLASS,conv2d,cutlass_tensorop_i16832fprop_optimized_s8_128x256_64x3_nhwc_align16,passed,success,fprop,256,28,28,128,128,3,3,28,28,1,1,1,1,1,1,s8:nhwc,s8:nhwc,s32:nhwc,cross,optimized,1,0,serial,1,none,tensorop,s32,128,256,64,3,2,4,1,16,8,32,80,1024,334118912,59241398272,177,0.867297,358.784,68305.8
1,CUTLASS,conv2d,cutlass_tensorop_i16832fprop_optimized_s8_256x64_64x4_nhwc_align16,passed,success,fprop,256,28,28,128,128,3,3,28,28,1,1,1,1,1,1,s8:nhwc,s8:nhwc,s32:nhwc,cross,optimized,1,0,serial,1,none,tensorop,s32,256,64,64,4,4,1,1,16,8,32,80,1024,334118912,59241398272,177,0.712817,436.539,83108.9
1,CUTLASS,conv2d,cutlass_tensorop_i16832fprop_optimized_s8_64x256_64x4_nhwc_align16,passed,success,fprop,256,28,28,128,128,3,3,28,28,1,1,1,1,1,1,s8:nhwc,s8:nhwc,s32:nhwc,cross,optimized,1,0,serial,1,none,tensorop,s32,64,256,64,4,1,4,1,16,8,32,80,1024,334118912,59241398272,177,0.93959,331.179,63050.3
1,CUTLASS,conv2d,cutlass_tensorop_i16832fprop_optimized_s8_128x128_64x5_nhwc_align16,passed,success,fprop,256,28,28,128,128,3,3,28,28,1,1,1,1,1,1,s8:nhwc,s8:nhwc,s32:nhwc,cross,optimized,1,0,serial,1,none,tensorop,s32,128,128,64,5,2,2,1,16,8,32,80,1024,334118912,59241398272,177,0.510484,609.563,116049
1,CUTLASS,conv2d,cutlass_tensorop_i16832fprop_optimized_s8_128x64_64x6_nhwc_align16,passed,success,fprop,256,28,28,128,128,3,3,28,28,1,1,1,1,1,1,s8:nhwc,s8:nhwc,s32:nhwc,cross,optimized,1,0,serial,1,none,tensorop,s32,128,64,64,6,2,2,1,16,8,32,80,1024,334118912,59241398272,177,0.639293,486.744,92667
1,CUTLASS,conv2d,cutlass_tensorop_i16832fprop_optimized_s8_64x128_64x6_nhwc_align16,passed,success,fprop,256,28,28,128,128,3,3,28,28,1,1,1,1,1,1,s8:nhwc,s8:nhwc,s32:nhwc,cross,optimized,1,0,serial,1,none,tensorop,s32,64,128,64,6,2,2,1,16,8,32,80,1024,334118912,59241398272,177,0.590254,527.184,100366
1,CUTLASS,conv2d,cutlass_tensorop_i16832fprop_optimized_s8_64x64_64x10_nhwc_align16,passed,success,fprop,256,28,28,128,128,3,3,28,28,1,1,1,1,1,1,s8:nhwc,s8:nhwc,s32:nhwc,cross,optimized,1,0,serial,1,none,tensorop,s32,64,64,64,10,2,2,1,16,8,32,80,1024,334118912,59241398272,177,0.832479,373.79,71162.7
1,CUTLASS,conv2d,cutlass_tensorop_i16832fprop_optimized_s8_128x64_128x3_nhwc_align16,passed,success,fprop,256,28,28,128,128,3,3,28,28,1,1,1,1,1,1,s8:nhwc,s8:nhwc,s32:nhwc,cross,optimized,1,0,serial,1,none,tensorop,s32,128,64,128,3,2,2,1,16,8,32,80,1024,334118912,59241398272,177,0.609048,510.916,97268.8
1,CUTLASS,conv2d,cutlass_tensorop_i16832fprop_optimized_s8_64x128_128x3_nhwc_align16,passed,success,fprop,256,28,28,128,128,3,3,28,28,1,1,1,1,1,1,s8:nhwc,s8:nhwc,s32:nhwc,cross,optimized,1,0,serial,1,none,tensorop,s32,64,128,128,3,2,2,1,16,8,32,80,1024,334118912,59241398272,177,0.57769,538.65,102549
1,CUTLASS,conv2d,cutlass_tensorop_i16832fprop_optimized_s8_64x64_128x5_nhwc_align16,passed,success,fprop,256,28,28,128,128,3,3,28,28,1,1,1,1,1,1,s8:nhwc,s8:nhwc,s32:nhwc,cross,optimized,1,0,serial,1,none,tensorop,s32,64,64,128,5,2,2,1,16,8,32,80,1024,334118912,59241398272,177,0.768041,405.151,77133.1
1,CUTLASS,conv2d,cutlass_tensorop_i8816fprop_optimized_s8_256x128_64x2_nhwc_align16,passed,success,fprop,256,28,28,128,512,1,1,28,28,0,0,1,1,1,1,s8:nhwc,s8:nhwc,s32:nhwc,cross,optimized,1,0,serial,1,none,tensorop,s32,256,128,64,2,4,2,1,8,8,16,75,1024,436797440,26512195584,60,1.10711,367.443,23947.3
1,CUTLASS,conv2d,cutlass_tensorop_i8816fprop_optimized_s8_128x256_64x2_nhwc_align16,passed,success,fprop,256,28,28,128,512,1,1,28,28,0,0,1,1,1,1,s8:nhwc,s8:nhwc,s32:nhwc,cross,optimized,1,0,serial,1,none,tensorop,s32,128,256,64,2,2,4,1,8,8,16,75,1024,436797440,26512195584,60,1.10915,366.768,23903.3
1,CUTLASS,conv2d,cutlass_tensorop_i8816fprop_optimized_s8_128x128_64x2_nhwc_align16,passed,success,fprop,256,28,28,128,512,1,1,28,28,0,0,1,1,1,1,s8:nhwc,s8:nhwc,s32:nhwc,cross,optimized,1,0,serial,1,none,tensorop,s32,128,128,64,2,2,2,1,8,8,16,75,1024,436797440,26512195584,60,1.09154,372.684,24288.8
1,CUTLASS,conv2d,cutlass_tensorop_i8816fprop_optimized_s8_64x256_64x2_nhwc_align16,passed,success,fprop,256,28,28,128,512,1,1,28,28,0,0,1,1,1,1,s8:nhwc,s8:nhwc,s32:nhwc,cross,optimized,1,0,serial,1,none,tensorop,s32,64,256,64,2,1,4,1,8,8,16,75,1024,436797440,26512195584,60,1.09156,372.676,24288.3
1,CUTLASS,conv2d,cutlass_tensorop_i8816fprop_optimized_s8_256x64_64x2_nhwc_align16,passed,success,fprop,256,28,28,128,512,1,1,28,28,0,0,1,1,1,1,s8:nhwc,s8:nhwc,s32:nhwc,cross,optimized,1,0,serial,1,none,tensorop,s32,256,64,64,2,4,1,1,8,8,16,75,1024,436797440,26512195584,60,1.15966,350.792,22862.1
1,CUTLASS,conv2d,cutlass_tensorop_i8816fprop_optimized_s8_64x128_64x2_nhwc_align16,passed,success,fprop,256,28,28,128,512,1,1,28,28,0,0,1,1,1,1,s8:nhwc,s8:nhwc,s32:nhwc,cross,optimized,1,0,serial,1,none,tensorop,s32,64,128,64,2,2,2,1,8,8,16,75,1024,436797440,26512195584,60,1.08985,373.261,24326.4
1,CUTLASS,conv2d,cutlass_tensorop_i8816fprop_optimized_s8_128x64_64x2_nhwc_align16,passed,success,fprop,256,28,28,128,512,1,1,28,28,0,0,1,1,1,1,s8:nhwc,s8:nhwc,s32:nhwc,cross,optimized,1,0,serial,1,none,tensorop,s32,128,64,64,2,2,2,1,8,8,16,75,1024,436797440,26512195584,60,1.15567,352.004,22941.1
1,CUTLASS,conv2d,cutlass_tensorop_i8816fprop_optimized_s8_64x64_64x2_nhwc_align16,passed,success,fprop,256,28,28,128,512,1,1,28,28,0,0,1,1,1,1,s8:nhwc,s8:nhwc,s32:nhwc,cross,optimized,1,0,serial,1,none,tensorop,s32,64,64,64,2,2,2,1,8,8,16,75,1024,436797440,26512195584,60,1.15454,352.348,22963.4
1,CUTLASS,conv2d,cutlass_tensorop_i16832fprop_optimized_s8_256x128_64x3_nhwc_align16,passed,success,fprop,256,28,28,128,512,1,1,28,28,0,0,1,1,1,1,s8:nhwc,s8:nhwc,s32:nhwc,cross,optimized,1,0,serial,1,none,tensorop,s32,256,128,64,3,4,2,1,16,8,32,80,1024,436797440,26512195584,60,1.10143,369.336,24070.6
1,CUTLASS,conv2d,cutlass_tensorop_i16832fprop_optimized_s8_128x256_64x3_nhwc_align16,passed,success,fprop,256,28,28,128,512,1,1,28,28,0,0,1,1,1,1,s8:nhwc,s8:nhwc,s32:nhwc,cross,optimized,1,0,serial,1,none,tensorop,s32,128,256,64,3,2,4,1,16,8,32,80,1024,436797440,26512195584,60,1.09447,371.686,24223.7
1,CUTLASS,conv2d,cutlass_tensorop_i16832fprop_optimized_s8_256x64_64x4_nhwc_align16,passed,success,fprop,256,28,28,128,512,1,1,28,28,0,0,1,1,1,1,s8:nhwc,s8:nhwc,s32:nhwc,cross,optimized,1,0,serial,1,none,tensorop,s32,256,64,64,4,4,1,1,16,8,32,80,1024,436797440,26512195584,60,1.21646,334.411,21794.5
1,CUTLASS,conv2d,cutlass_tensorop_i16832fprop_optimized_s8_64x256_64x4_nhwc_align16,passed,success,fprop,256,28,28,128,512,1,1,28,28,0,0,1,1,1,1,s8:nhwc,s8:nhwc,s32:nhwc,cross,optimized,1,0,serial,1,none,tensorop,s32,64,256,64,4,1,4,1,16,8,32,80,1024,436797440,26512195584,60,1.08836,373.773,24359.8
1,CUTLASS,conv2d,cutlass_tensorop_i16832fprop_optimized_s8_128x128_64x5_nhwc_align16,passed,success,fprop,256,28,28,128,512,1,1,28,28,0,0,1,1,1,1,s8:nhwc,s8:nhwc,s32:nhwc,cross,optimized,1,0,serial,1,none,tensorop,s32,128,128,64,5,2,2,1,16,8,32,80,1024,436797440,26512195584,60,1.08809,373.865,24365.8
1,CUTLASS,conv2d,cutlass_tensorop_i16832fprop_optimized_s8_128x64_64x6_nhwc_align16,passed,success,fprop,256,28,28,128,512,1,1,28,28,0,0,1,1,1,1,s8:nhwc,s8:nhwc,s32:nhwc,cross,optimized,1,0,serial,1,none,tensorop,s32,128,64,64,6,2,2,1,16,8,32,80,1024,436797440,26512195584,60,1.15379,352.576,22978.3
1,CUTLASS,conv2d,cutlass_tensorop_i16832fprop_optimized_s8_64x128_64x6_nhwc_align16,passed,success,fprop,256,28,28,128,512,1,1,28,28,0,0,1,1,1,1,s8:nhwc,s8:nhwc,s32:nhwc,cross,optimized,1,0,serial,1,none,tensorop,s32,64,128,64,6,2,2,1,16,8,32,80,1024,436797440,26512195584,60,1.08451,375.1,24446.3
1,CUTLASS,conv2d,cutlass_tensorop_i16832fprop_optimized_s8_64x64_64x10_nhwc_align16,passed,success,fprop,256,28,28,128,512,1,1,28,28,0,0,1,1,1,1,s8:nhwc,s8:nhwc,s32:nhwc,cross,optimized,1,0,serial,1,none,tensorop,s32,64,64,64,10,2,2,1,16,8,32,80,1024,436797440,26512195584,60,1.39968,290.637,18941.6
1,CUTLASS,conv2d,cutlass_tensorop_i16832fprop_optimized_s8_128x64_128x3_nhwc_align16,passed,success,fprop,256,28,28,128,512,1,1,28,28,0,0,1,1,1,1,s8:nhwc,s8:nhwc,s32:nhwc,cross,optimized,1,0,serial,1,none,tensorop,s32,128,64,128,3,2,2,1,16,8,32,80,1024,436797440,26512195584,60,1.15309,352.792,22992.4
1,CUTLASS,conv2d,cutlass_tensorop_i16832fprop_optimized_s8_64x128_128x3_nhwc_align16,passed,success,fprop,256,28,28,128,512,1,1,28,28,0,0,1,1,1,1,s8:nhwc,s8:nhwc,s32:nhwc,cross,optimized,1,0,serial,1,none,tensorop,s32,64,128,128,3,2,2,1,16,8,32,80,1024,436797440,26512195584,60,1.08493,374.955,24436.8
1,CUTLASS,conv2d,cutlass_tensorop_i16832fprop_optimized_s8_64x64_128x5_nhwc_align16,passed,success,fprop,256,28,28,128,512,1,1,28,28,0,0,1,1,1,1,s8:nhwc,s8:nhwc,s32:nhwc,cross,optimized,1,0,serial,1,none,tensorop,s32,64,64,128,5,2,2,1,16,8,32,80,1024,436797440,26512195584,60,1.47775,275.282,17940.9
1,CUTLASS,conv2d,cutlass_tensorop_i8816fprop_optimized_s8_256x128_64x2_nhwc_align16,passed,success,fprop,256,28,28,512,128,1,1,28,28,0,0,1,1,1,1,s8:nhwc,s8:nhwc,s32:nhwc,cross,optimized,1,0,serial,1,none,tensorop,s32,256,128,64,2,4,2,1,8,8,16,75,1024,205586432,26358054912,128,0.515338,371.537,51147.1
1,CUTLASS,conv2d,cutlass_tensorop_i8816fprop_optimized_s8_128x256_64x2_nhwc_align16,passed,success,fprop,256,28,28,512,128,1,1,28,28,0,0,1,1,1,1,s8:nhwc,s8:nhwc,s32:nhwc,cross,optimized,1,0,serial,1,none,tensorop,s32,128,256,64,2,2,4,1,8,8,16,75,1024,205586432,26358054912,128,0.611379,313.173,43112.4
1,CUTLASS,conv2d,cutlass_tensorop_i8816fprop_optimized_s8_128x128_64x2_nhwc_align16,passed,success,fprop,256,28,28,512,128,1,1,28,28,0,0,1,1,1,1,s8:nhwc,s8:nhwc,s32:nhwc,cross,optimized,1,0,serial,1,none,tensorop,s32,128,128,64,2,2,2,1,8,8,16,75,1024,205586432,26358054912,128,0.516598,370.631,51022.4
1,CUTLASS,conv2d,cutlass_tensorop_i8816fprop_optimized_s8_64x256_64x2_nhwc_align16,passed,success,fprop,256,28,28,512,128,1,1,28,28,0,0,1,1,1,1,s8:nhwc,s8:nhwc,s32:nhwc,cross,optimized,1,0,serial,1,none,tensorop,s32,64,256,64,2,1,4,1,8,8,16,75,1024,205586432,26358054912,128,0.546591,350.294,48222.7
1,CUTLASS,conv2d,cutlass_tensorop_i8816fprop_optimized_s8_256x64_64x2_nhwc_align16,passed,success,fprop,256,28,28,512,128,1,1,28,28,0,0,1,1,1,1,s8:nhwc,s8:nhwc,s32:nhwc,cross,optimized,1,0,serial,1,none,tensorop,s32,256,64,64,2,4,1,1,8,8,16,75,1024,205586432,26358054912,128,0.529439,361.642,49784.9
1,CUTLASS,conv2d,cutlass_tensorop_i8816fprop_optimized_s8_64x128_64x2_nhwc_align16,passed,success,fprop,256,28,28,512,128,1,1,28,28,0,0,1,1,1,1,s8:nhwc,s8:nhwc,s32:nhwc,cross,optimized,1,0,serial,1,none,tensorop,s32,64,128,64,2,2,2,1,8,8,16,75,1024,205586432,26358054912,128,0.509215,376.005,51762.2
1,CUTLASS,conv2d,cutlass_tensorop_i8816fprop_optimized_s8_128x64_64x2_nhwc_align16,passed,success,fprop,256,28,28,512,128,1,1,28,28,0,0,1,1,1,1,s8:nhwc,s8:nhwc,s32:nhwc,cross,optimized,1,0,serial,1,none,tensorop,s32,128,64,64,2,2,2,1,8,8,16,75,1024,205586432,26358054912,128,0.510433,375.107,51638.6
1,CUTLASS,conv2d,cutlass_tensorop_i8816fprop_optimized_s8_64x64_64x2_nhwc_align16,passed,success,fprop,256,28,28,512,128,1,1,28,28,0,0,1,1,1,1,s8:nhwc,s8:nhwc,s32:nhwc,cross,optimized,1,0,serial,1,none,tensorop,s32,64,64,64,2,2,2,1,8,8,16,75,1024,205586432,26358054912,128,0.517632,369.891,50920.5
1,CUTLASS,conv2d,cutlass_tensorop_i16832fprop_optimized_s8_256x128_64x3_nhwc_align16,passed,success,fprop,256,28,28,512,128,1,1,28,28,0,0,1,1,1,1,s8:nhwc,s8:nhwc,s32:nhwc,cross,optimized,1,0,serial,1,none,tensorop,s32,256,128,64,3,4,2,1,16,8,32,80,1024,205586432,26358054912,128,0.521165,367.383,50575.3
1,CUTLASS,conv2d,cutlass_tensorop_i16832fprop_optimized_s8_128x256_64x3_nhwc_align16,passed,success,fprop,256,28,28,512,128,1,1,28,28,0,0,1,1,1,1,s8:nhwc,s8:nhwc,s32:nhwc,cross,optimized,1,0,serial,1,none,tensorop,s32,128,256,64,3,2,4,1,16,8,32,80,1024,205586432,26358054912,128,0.523203,365.953,50378.3
1,CUTLASS,conv2d,cutlass_tensorop_i16832fprop_optimized_s8_256x64_64x4_nhwc_align16,passed,success,fprop,256,28,28,512,128,1,1,28,28,0,0,1,1,1,1,s8:nhwc,s8:nhwc,s32:nhwc,cross,optimized,1,0,serial,1,none,tensorop,s32,256,64,64,4,4,1,1,16,8,32,80,1024,205586432,26358054912,128,0.583987,327.862,45134.6
1,CUTLASS,conv2d,cutlass_tensorop_i16832fprop_optimized_s8_64x256_64x4_nhwc_align16,passed,success,fprop,256,28,28,512,128,1,1,28,28,0,0,1,1,1,1,s8:nhwc,s8:nhwc,s32:nhwc,cross,optimized,1,0,serial,1,none,tensorop,s32,64,256,64,4,1,4,1,16,8,32,80,1024,205586432,26358054912,128,0.545669,350.885,48304.1
1,CUTLASS,conv2d,cutlass_tensorop_i16832fprop_optimized_s8_128x128_64x5_nhwc_align16,passed,success,fprop,256,28,28,512,128,1,1,28,28,0,0,1,1,1,1,s8:nhwc,s8:nhwc,s32:nhwc,cross,optimized,1,0,serial,1,none,tensorop,s32,128,128,64,5,2,2,1,16,8,32,80,1024,205586432,26358054912,128,0.516352,370.808,51046.7
1,CUTLASS,conv2d,cutlass_tensorop_i16832fprop_optimized_s8_128x64_64x6_nhwc_align16,passed,success,fprop,256,28,28,512,128,1,1,28,28,0,0,1,1,1,1,s8:nhwc,s8:nhwc,s32:nhwc,cross,optimized,1,0,serial,1,none,tensorop,s32,128,64,64,6,2,2,1,16,8,32,80,1024,205586432,26358054912,128,0.516147,370.955,51066.9
1,CUTLASS,conv2d,cutlass_tensorop_i16832fprop_optimized_s8_64x128_64x6_nhwc_align16,passed,success,fprop,256,28,28,512,128,1,1,28,28,0,0,1,1,1,1,s8:nhwc,s8:nhwc,s32:nhwc,cross,optimized,1,0,serial,1,none,tensorop,s32,64,128,64,6,2,2,1,16,8,32,80,1024,205586432,26358054912,128,0.509601,375.72,51722.9
1,CUTLASS,conv2d,cutlass_tensorop_i16832fprop_optimized_s8_64x64_64x10_nhwc_align16,passed,success,fprop,256,28,28,512,128,1,1,28,28,0,0,1,1,1,1,s8:nhwc,s8:nhwc,s32:nhwc,cross,optimized,1,0,serial,1,none,tensorop,s32,64,64,64,10,2,2,1,16,8,32,80,1024,205586432,26358054912,128,0.541409,353.646,48684.2
1,CUTLASS,conv2d,cutlass_tensorop_i16832fprop_optimized_s8_128x64_128x3_nhwc_align16,passed,success,fprop,256,28,28,512,128,1,1,28,28,0,0,1,1,1,1,s8:nhwc,s8:nhwc,s32:nhwc,cross,optimized,1,0,serial,1,none,tensorop,s32,128,64,128,3,2,2,1,16,8,32,80,1024,205586432,26358054912,128,0.506808,377.79,52007.9
1,CUTLASS,conv2d,cutlass_tensorop_i16832fprop_optimized_s8_64x128_128x3_nhwc_align16,passed,success,fprop,256,28,28,512,128,1,1,28,28,0,0,1,1,1,1,s8:nhwc,s8:nhwc,s32:nhwc,cross,optimized,1,0,serial,1,none,tensorop,s32,64,128,128,3,2,2,1,16,8,32,80,1024,205586432,26358054912,128,0.508447,376.573,51840.3
1,CUTLASS,conv2d,cutlass_tensorop_i16832fprop_optimized_s8_64x64_128x5_nhwc_align16,passed,success,fprop,256,28,28,512,128,1,1,28,28,0,0,1,1,1,1,s8:nhwc,s8:nhwc,s32:nhwc,cross,optimized,1,0,serial,1,none,tensorop,s32,64,64,128,5,2,2,1,16,8,32,80,1024,205586432,26358054912,128,0.528538,362.259,49869.8
1,CUTLASS,conv2d,cutlass_tensorop_i8816fprop_optimized_s8_256x128_64x2_nhwc_align16,passed,success,fprop,256,28,28,512,1024,1,1,14,14,0,0,2,2,1,1,s8:nhwc,s8:nhwc,s32:nhwc,cross,optimized,1,0,serial,1,none,tensorop,s32,256,128,64,2,4,2,1,8,8,16,75,1024,231735296,52716109824,227,0.873738,247.008,60334
1,CUTLASS,conv2d,cutlass_tensorop_i8816fprop_optimized_s8_128x256_64x2_nhwc_align16,passed,success,fprop,256,28,28,512,1024,1,1,14,14,0,0,2,2,1,1,s8:nhwc,s8:nhwc,s32:nhwc,cross,optimized,1,0,serial,1,none,tensorop,s32,128,256,64,2,2,4,1,8,8,16,75,1024,231735296,52716109824,227,0.865157,249.458,60932.4
1,CUTLASS,conv2d,cutlass_tensorop_i8816fprop_optimized_s8_128x128_64x2_nhwc_align16,passed,success,fprop,256,28,28,512,1024,1,1,14,14,0,0,2,2,1,1,s8:nhwc,s8:nhwc,s32:nhwc,cross,optimized,1,0,serial,1,none,tensorop,s32,128,128,64,2,2,2,1,8,8,16,75,1024,231735296,52716109824,227,0.813601,265.266,64793.6
1,CUTLASS,conv2d,cutlass_tensorop_i8816fprop_optimized_s8_64x256_64x2_nhwc_align16,passed,success,fprop,256,28,28,512,1024,1,1,14,14,0,0,2,2,1,1,s8:nhwc,s8:nhwc,s32:nhwc,cross,optimized,1,0,serial,1,none,tensorop,s32,64,256,64,2,1,4,1,8,8,16,75,1024,231735296,52716109824,227,0.794993,271.475,66310.2
1,CUTLASS,conv2d,cutlass_tensorop_i8816fprop_optimized_s8_256x64_64x2_nhwc_align16,passed,success,fprop,256,28,28,512,1024,1,1,14,14,0,0,2,2,1,1,s8:nhwc,s8:nhwc,s32:nhwc,cross,optimized,1,0,serial,1,none,tensorop,s32,256,64,64,2,4,1,1,8,8,16,75,1024,231735296,52716109824,227,0.921456,234.217,57209.6
1,CUTLASS,conv2d,cutlass_tensorop_i8816fprop_optimized_s8_64x128_64x2_nhwc_align16,passed,success,fprop,256,28,28,512,1024,1,1,14,14,0,0,2,2,1,1,s8:nhwc,s8:nhwc,s32:nhwc,cross,optimized,1,0,serial,1,none,tensorop,s32,64,128,64,2,2,2,1,8,8,16,75,1024,231735296,52716109824,227,0.787456,274.073,66944.8
1,CUTLASS,conv2d,cutlass_tensorop_i8816fprop_optimized_s8_128x64_64x2_nhwc_align16,passed,success,fprop,256,28,28,512,1024,1,1,14,14,0,0,2,2,1,1,s8:nhwc,s8:nhwc,s32:nhwc,cross,optimized,1,0,serial,1,none,tensorop,s32,128,64,64,2,2,2,1,8,8,16,75,1024,231735296,52716109824,227,0.864133,249.754,61004.6
1,CUTLASS,conv2d,cutlass_tensorop_i8816fprop_optimized_s8_64x64_64x2_nhwc_align16,passed,success,fprop,256,28,28,512,1024,1,1,14,14,0,0,2,2,1,1,s8:nhwc,s8:nhwc,s32:nhwc,cross,optimized,1,0,serial,1,none,tensorop,s32,64,64,64,2,2,2,1,8,8,16,75,1024,231735296,52716109824,227,0.909824,237.211,57941
1,CUTLASS,conv2d,cutlass_tensorop_i16832fprop_optimized_s8_256x128_64x3_nhwc_align16,passed,success,fprop,256,28,28,512,1024,1,1,14,14,0,0,2,2,1,1,s8:nhwc,s8:nhwc,s32:nhwc,cross,optimized,1,0,serial,1,none,tensorop,s32,256,128,64,3,4,2,1,16,8,32,80,1024,231735296,52716109824,227,0.891679,242.038,59120.1
1,CUTLASS,conv2d,cutlass_tensorop_i16832fprop_optimized_s8_128x256_64x3_nhwc_align16,passed,success,fprop,256,28,28,512,1024,1,1,14,14,0,0,2,2,1,1,s8:nhwc,s8:nhwc,s32:nhwc,cross,optimized,1,0,serial,1,none,tensorop,s32,128,256,64,3,2,4,1,16,8,32,80,1024,231735296,52716109824,227,0.731996,294.838,72016.9
1,CUTLASS,conv2d,cutlass_tensorop_i16832fprop_optimized_s8_256x64_64x4_nhwc_align16,passed,success,fprop,256,28,28,512,1024,1,1,14,14,0,0,2,2,1,1,s8:nhwc,s8:nhwc,s32:nhwc,cross,optimized,1,0,serial,1,none,tensorop,s32,256,64,64,4,4,1,1,16,8,32,80,1024,231735296,52716109824,227,1.01684,212.246,51843
1,CUTLASS,conv2d,cutlass_tensorop_i16832fprop_optimized_s8_64x256_64x4_nhwc_align16,passed,success,fprop,256,28,28,512,1024,1,1,14,14,0,0,2,2,1,1,s8:nhwc,s8:nhwc,s32:nhwc,cross,optimized,1,0,serial,1,none,tensorop,s32,64,256,64,4,1,4,1,16,8,32,80,1024,231735296,52716109824,227,0.678644,318.017,77678.6
1,CUTLASS,conv2d,cutlass_tensorop_i16832fprop_optimized_s8_128x128_64x5_nhwc_align16,passed,success,fprop,256,28,28,512,1024,1,1,14,14,0,0,2,2,1,1,s8:nhwc,s8:nhwc,s32:nhwc,cross,optimized,1,0,serial,1,none,tensorop,s32,128,128,64,5,2,2,1,16,8,32,80,1024,231735296,52716109824,227,0.945091,228.359,55778.9
1,CUTLASS,conv2d,cutlass_tensorop_i16832fprop_optimized_s8_128x64_64x6_nhwc_align16,passed,success,fprop,256,28,28,512,1024,1,1,14,14,0,0,2,2,1,1,s8:nhwc,s8:nhwc,s32:nhwc,cross,optimized,1,0,serial,1,none,tensorop,s32,128,64,64,6,2,2,1,16,8,32,80,1024,231735296,52716109824,227,1.10937,194.543,47518.9
1,CUTLASS,conv2d,cutlass_tensorop_i16832fprop_optimized_s8_64x128_64x6_nhwc_align16,passed,success,fprop,256,28,28,512,1024,1,1,14,14,0,0,2,2,1,1,s8:nhwc,s8:nhwc,s32:nhwc,cross,optimized,1,0,serial,1,none,tensorop,s32,64,128,64,6,2,2,1,16,8,32,80,1024,231735296,52716109824,227,0.775905,278.153,67941.4
1,CUTLASS,conv2d,cutlass_tensorop_i16832fprop_optimized_s8_64x64_64x10_nhwc_align16,passed,success,fprop,256,28,28,512,1024,1,1,14,14,0,0,2,2,1,1,s8:nhwc,s8:nhwc,s32:nhwc,cross,optimized,1,0,serial,1,none,tensorop,s32,64,64,64,10,2,2,1,16,8,32,80,1024,231735296,52716109824,227,1.09155,197.719,48294.6
1,CUTLASS,conv2d,cutlass_tensorop_i16832fprop_optimized_s8_128x64_128x3_nhwc_align16,passed,success,fprop,256,28,28,512,1024,1,1,14,14,0,0,2,2,1,1,s8:nhwc,s8:nhwc,s32:nhwc,cross,optimized,1,0,serial,1,none,tensorop,s32,128,64,128,3,2,2,1,16,8,32,80,1024,231735296,52716109824,227,0.993004,217.341,53087.5
1,CUTLASS,conv2d,cutlass_tensorop_i16832fprop_optimized_s8_64x128_128x3_nhwc_align16,passed,success,fprop,256,28,28,512,1024,1,1,14,14,0,0,2,2,1,1,s8:nhwc,s8:nhwc,s32:nhwc,cross,optimized,1,0,serial,1,none,tensorop,s32,64,128,128,3,2,2,1,16,8,32,80,1024,231735296,52716109824,227,0.885015,243.861,59565.2
1,CUTLASS,conv2d,cutlass_tensorop_i16832fprop_optimized_s8_64x64_128x5_nhwc_align16,passed,success,fprop,256,28,28,512,1024,1,1,14,14,0,0,2,2,1,1,s8:nhwc,s8:nhwc,s32:nhwc,cross,optimized,1,0,serial,1,none,tensorop,s32,64,64,128,5,2,2,1,16,8,32,80,1024,231735296,52716109824,227,1.04209,207.103,50586.7
1,CUTLASS,conv2d,cutlass_tensorop_i8816fprop_optimized_s8_256x128_64x2_nhwc_align16,passed,success,fprop,256,28,28,512,256,1,1,14,14,0,0,2,2,1,1,s8:nhwc,s8:nhwc,s32:nhwc,cross,optimized,1,0,serial,1,none,tensorop,s32,256,128,64,2,4,2,1,8,8,16,75,1024,77201408,13179027456,170,0.231977,309.942,56811.8
1,CUTLASS,conv2d,cutlass_tensorop_i8816fprop_optimized_s8_128x256_64x2_nhwc_align16,passed,success,fprop,256,28,28,512,256,1,1,14,14,0,0,2,2,1,1,s8:nhwc,s8:nhwc,s32:nhwc,cross,optimized,1,0,serial,1,none,tensorop,s32,128,256,64,2,2,4,1,8,8,16,75,1024,77201408,13179027456,170,0.229899,312.744,57325.3
1,CUTLASS,conv2d,cutlass_tensorop_i8816fprop_optimized_s8_128x128_64x2_nhwc_align16,passed,success,fprop,256,28,28,512,256,1,1,14,14,0,0,2,2,1,1,s8:nhwc,s8:nhwc,s32:nhwc,cross,optimized,1,0,serial,1,none,tensorop,s32,128,128,64,2,2,2,1,8,8,16,75,1024,77201408,13179027456,170,0.221555,324.521,59484.2
1,CUTLASS,conv2d,cutlass_tensorop_i8816fprop_optimized_s8_64x256_64x2_nhwc_align16,passed,success,fprop,256,28,28,512,256,1,1,14,14,0,0,2,2,1,1,s8:nhwc,s8:nhwc,s32:nhwc,cross,optimized,1,0,serial,1,none,tensorop,s32,64,256,64,2,1,4,1,8,8,16,75,1024,77201408,13179027456,170,0.231977,309.942,56811.8
1,CUTLASS,conv2d,cutlass_tensorop_i8816fprop_optimized_s8_256x64_64x2_nhwc_align16,passed,success,fprop,256,28,28,512,256,1,1,14,14,0,0,2,2,1,1,s8:nhwc,s8:nhwc,s32:nhwc,cross,optimized,1,0,serial,1,none,tensorop,s32,256,64,64,2,4,1,1,8,8,16,75,1024,77201408,13179027456,170,0.232888,308.729,56589.5
1,CUTLASS,conv2d,cutlass_tensorop_i8816fprop_optimized_s8_64x128_64x2_nhwc_align16,passed,success,fprop,256,28,28,512,256,1,1,14,14,0,0,2,2,1,1,s8:nhwc,s8:nhwc,s32:nhwc,cross,optimized,1,0,serial,1,none,tensorop,s32,64,128,64,2,2,2,1,8,8,16,75,1024,77201408,13179027456,170,0.225513,318.827,58440.3
1,CUTLASS,conv2d,cutlass_tensorop_i8816fprop_optimized_s8_128x64_64x2_nhwc_align16,passed,success,fprop,256,28,28,512,256,1,1,14,14,0,0,2,2,1,1,s8:nhwc,s8:nhwc,s32:nhwc,cross,optimized,1,0,serial,1,none,tensorop,s32,128,64,64,2,2,2,1,8,8,16,75,1024,77201408,13179027456,170,0.221541,324.542,59488
1,CUTLASS,conv2d,cutlass_tensorop_i8816fprop_optimized_s8_64x64_64x2_nhwc_align16,passed,success,fprop,256,28,28,512,256,1,1,14,14,0,0,2,2,1,1,s8:nhwc,s8:nhwc,s32:nhwc,cross,optimized,1,0,serial,1,none,tensorop,s32,64,64,64,2,2,2,1,8,8,16,75,1024,77201408,13179027456,170,0.224645,320.058,58666
1,CUTLASS,conv2d,cutlass_tensorop_i16832fprop_optimized_s8_256x128_64x3_nhwc_align16,passed,success,fprop,256,28,28,512,256,1,1,14,14,0,0,2,2,1,1,s8:nhwc,s8:nhwc,s32:nhwc,cross,optimized,1,0,serial,1,none,tensorop,s32,256,128,64,3,4,2,1,16,8,32,80,1024,77201408,13179027456,170,0.229315,313.541,57471.4
1,CUTLASS,conv2d,cutlass_tensorop_i16832fprop_optimized_s8_128x256_64x3_nhwc_align16,passed,success,fprop,256,28,28,512,256,1,1,14,14,0,0,2,2,1,1,s8:nhwc,s8:nhwc,s32:nhwc,cross,optimized,1,0,serial,1,none,tensorop,s32,128,256,64,3,2,4,1,16,8,32,80,1024,77201408,13179027456,170,0.217252,330.949,60662.3
1,CUTLASS,conv2d,cutlass_tensorop_i16832fprop_optimized_s8_256x64_64x4_nhwc_align16,passed,success,fprop,256,28,28,512,256,1,1,14,14,0,0,2,2,1,1,s8:nhwc,s8:nhwc,s32:nhwc,cross,optimized,1,0,serial,1,none,tensorop,s32,256,64,64,4,4,1,1,16,8,32,80,1024,77201408,13179027456,170,0.260557,275.945,50580.2
1,CUTLASS,conv2d,cutlass_tensorop_i16832fprop_optimized_s8_64x256_64x4_nhwc_align16,passed,success,fprop,256,28,28,512,256,1,1,14,14,0,0,2,2,1,1,s8:nhwc,s8:nhwc,s32:nhwc,cross,optimized,1,0,serial,1,none,tensorop,s32,64,256,64,4,1,4,1,16,8,32,80,1024,77201408,13179027456,170,0.23082,311.496,57096.6
1,CUTLASS,conv2d,cutlass_tensorop_i16832fprop_optimized_s8_128x128_64x5_nhwc_align16,passed,success,fprop,256,28,28,512,256,1,1,14,14,0,0,2,2,1,1,s8:nhwc,s8:nhwc,s32:nhwc,cross,optimized,1,0,serial,1,none,tensorop,s32,128,128,64,5,2,2,1,16,8,32,80,1024,77201408,13179027456,170,0.254044,283.019,51876.9
1,CUTLASS,conv2d,cutlass_tensorop_i16832fprop_optimized_s8_128x64_64x6_nhwc_align16,passed,success,fprop,256,28,28,512,256,1,1,14,14,0,0,2,2,1,1,s8:nhwc,s8:nhwc,s32:nhwc,cross,optimized,1,0,serial,1,none,tensorop,s32,128,64,64,6,2,2,1,16,8,32,80,1024,77201408,13179027456,170,0.261816,274.618,50336.9
1,CUTLASS,conv2d,cutlass_tensorop_i16832fprop_optimized_s8_64x128_64x6_nhwc_align16,passed,success,fprop,256,28,28,512,256,1,1,14,14,0,0,2,2,1,1,s8:nhwc,s8:nhwc,s32:nhwc,cross,optimized,1,0,serial,1,none,tensorop,s32,64,128,64,6,2,2,1,16,8,32,80,1024,77201408,13179027456,170,0.204073,352.322,64580
1,CUTLASS,conv2d,cutlass_tensorop_i16832fprop_optimized_s8_64x64_64x10_nhwc_align16,passed,success,fprop,256,28,28,512,256,1,1,14,14,0,0,2,2,1,1,s8:nhwc,s8:nhwc,s32:nhwc,cross,optimized,1,0,serial,1,none,tensorop,s32,64,64,64,10,2,2,1,16,8,32,80,1024,77201408,13179027456,170,0.269496,266.792,48902.4
1,CUTLASS,conv2d,cutlass_tensorop_i16832fprop_optimized_s8_128x64_128x3_nhwc_align16,passed,success,fprop,256,28,28,512,256,1,1,14,14,0,0,2,2,1,1,s8:nhwc,s8:nhwc,s32:nhwc,cross,optimized,1,0,serial,1,none,tensorop,s32,128,64,128,3,2,2,1,16,8,32,80,1024,77201408,13179027456,170,0.238746,301.155,55201.1
