bert/logs/bert.log
{"input": ["cuda -keys=cuda,gpu -max_num_threads=1024 -thread_warp_size=32", "batch_matmul_tensorcore.cuda", [["TENSOR", [128, 128, 64], "float16"], ["TENSOR", [128, 128, 64], "float16"], [128, 128, 128], "float16", 0, 1], {}], "config": {"index": 14760, "code_hash": null, "entity": [["block_row_warps", "ot", 1], ["block_col_warps", "ot", 1], ["warp_row_tiles", "ot", 4], ["warp_col_tiles", "ot", 1], ["chunk", "ot", 4], ["offset", "ot", 8], ["offsetCS", "ot", 0], ["vec", "ot", 8], ["wmma_m", "ot", 8]]}, "result": [[2.099613451932346e-05], 0, 1.6944310665130615, 1632117739.815516], "version": 0.2, "tvm_version": "0.8.dev0"}
{"input": ["cuda -keys=cuda,gpu -max_num_threads=1024 -thread_warp_size=32", "batch_matmul.cuda", [["TENSOR", [128, 128, 64], "float16"], ["TENSOR", [128, 128, 64], "float16"], [128, 128, 128], null, 0, 1], {}], "config": {"index": 4344, "code_hash": null, "entity": [["tile_y", "sp", [-1, 8, 8]], ["tile_x", "sp", [-1, 16, 2]], ["tile_k", "sp", [-1, 8]], ["auto_unroll_max_step", "ot", 8], ["unroll_explicit", "ot", 0]]}, "result": [[5.424768873239436e-05], 0, 1.0465314388275146, 1632118733.771991], "version": 0.2, "tvm_version": "0.8.dev0"}
{"input": ["cuda -keys=cuda,gpu -max_num_threads=1024 -thread_warp_size=32", "batch_matmul_tensorcore.cuda", [["TENSOR", [128, 128, 128], "float16"], ["TENSOR", [128, 64, 128], "float16"], [128, 128, 64], "float16", 0, 1], {}], "config": {"index": 8946, "code_hash": null, "entity": [["block_row_warps", "ot", 1], ["block_col_warps", "ot", 1], ["warp_row_tiles", "ot", 2], ["warp_col_tiles", "ot", 2], ["chunk", "ot", 4], ["offset", "ot", 8], ["offsetCS", "ot", 8], ["vec", "ot", 4], ["wmma_m", "ot", 16]]}, "result": [[2.244076612903226e-05], 0, 1.7408266067504883, 1632118905.7064037], "version": 0.2, "tvm_version": "0.8.dev0"}
{"input": ["cuda -keys=cuda,gpu -max_num_threads=1024 -thread_warp_size=32", "batch_matmul.cuda", [["TENSOR", [128, 128, 128], "float16"], ["TENSOR", [128, 64, 128], "float16"], [128, 128, 64], null, 0, 1], {}], "config": {"index": 26809, "code_hash": null, "entity": [["tile_y", "sp", [-1, 16, 8]], ["tile_x", "sp", [-1, 8, 4]], ["tile_k", "sp", [-1, 4]], ["auto_unroll_max_step", "ot", 64], ["unroll_explicit", "ot", 0]]}, "result": [[5.314041748251748e-05], 0, 1.1353423595428467, 1632119443.2703953], "version": 0.2, "tvm_version": "0.8.dev0"}
{"input": ["cuda -keys=cuda,gpu -max_num_threads=1024 -thread_warp_size=32", "dense_large_batch.gpu", [["TENSOR", [1024, 1024], "float16"], ["TENSOR", [1024, 1024], "float16"], null, "float16"], {}], "config": {"index": 57841, "code_hash": null, "entity": [["tile_x", "sp", [-1, 8, 1, 2]], ["tile_y", "sp", [-1, 1, 1, 16]], ["tile_k", "sp", [-1, 1, 1]]]}, "result": [[0.00511153003125], 0, 1.678696870803833, 1632120523.332266], "version": 0.2, "tvm_version": "0.8.dev0"}
{"input": ["cuda -keys=cuda,gpu -max_num_threads=1024 -thread_warp_size=32", "dense_tensorcore.cuda", [["TENSOR", [1024, 1024], "float16"], ["TENSOR", [1024, 1024], "float16"], null, "float16"], {}], "config": {"index": 10273, "code_hash": null, "entity": [["block_row_warps", "ot", 2], ["block_col_warps", "ot", 2], ["warp_row_tiles", "ot", 2], ["warp_col_tiles", "ot", 4], ["chunk", "ot", 4], ["offset", "ot", 8], ["offsetCS", "ot", 8], ["vec", "ot", 8], ["wmma_m", "ot", 16]]}, "result": [[4.219780098855359e-05], 0, 1.2943518161773682, 1632120931.7648084], "version": 0.2, "tvm_version": "0.8.dev0"}
{"input": ["cuda -keys=cuda,gpu -max_num_threads=1024 -thread_warp_size=32", "dense_small_batch.gpu", [["TENSOR", [1024, 1024], "float16"], ["TENSOR", [1024, 1024], "float16"], null, "float16"], {}], "config": {"index": 5, "code_hash": null, "entity": [["tile_k", "sp", [-1, 32]]]}, "result": [[0.0018278733411764706], 0, 1.050224781036377, 1632121197.7260196], "version": 0.2, "tvm_version": "0.8.dev0"}
{"input": ["cuda -keys=cuda,gpu -max_num_threads=1024 -thread_warp_size=32", "dense_large_batch.gpu", [["TENSOR", [1024, 1024], "float16"], ["TENSOR", [4096, 1024], "float16"], null, "float16"], {}], "config": {"index": 1621373, "code_hash": null, "entity": [["tile_x", "sp", [-1, 2, 16, 1]], ["tile_y", "sp", [-1, 4, 16, 4]], ["tile_k", "sp", [-1, 2, 2]]]}, "result": [[0.00513802740625], 0, 1.342094898223877, 1632121510.0477734], "version": 0.2, "tvm_version": "0.8.dev0"}
{"input": ["cuda -keys=cuda,gpu -max_num_threads=1024 -thread_warp_size=32", "dense_tensorcore.cuda", [["TENSOR", [1024, 1024], "float16"], ["TENSOR", [4096, 1024], "float16"], null, "float16"], {}], "config": {"index": 10255, "code_hash": null, "entity": [["block_row_warps", "ot", 2], ["block_col_warps", "ot", 2], ["warp_row_tiles", "ot", 4], ["warp_col_tiles", "ot", 2], ["chunk", "ot", 4], ["offset", "ot", 8], ["offsetCS", "ot", 8], ["vec", "ot", 8], ["wmma_m", "ot", 16]]}, "result": [[0.0001515133522617902], 0, 1.346707820892334, 1632122493.2463343], "version": 0.2, "tvm_version": "0.8.dev0"}
{"input": ["cuda -keys=cuda,gpu -max_num_threads=1024 -thread_warp_size=32", "dense_small_batch.gpu", [["TENSOR", [1024, 1024], "float16"], ["TENSOR", [4096, 1024], "float16"], null, "float16"], {}], "config": {"index": 7, "code_hash": null, "entity": [["tile_k", "sp", [-1, 128]]]}, "result": [[0.020346816349999998], 0, 1.9325993061065674, 1632122811.256673], "version": 0.2, "tvm_version": "0.8.dev0"}
{"input": ["cuda -keys=cuda,gpu -max_num_threads=1024 -thread_warp_size=32", "dense_large_batch.gpu", [["TENSOR", [1024, 4096], "float16"], ["TENSOR", [1024, 4096], "float16"], null, "float16"], {}], "config": {"index": 333500, "code_hash": null, "entity": [["tile_x", "sp", [-1, 8, 4, 1]], ["tile_y", "sp", [-1, 2, 4, 1]], ["tile_k", "sp", [-1, 16, 1]]]}, "result": [[0.0031986455208333335], 0, 1.544501781463623, 1632123414.0154383], "version": 0.2, "tvm_version": "0.8.dev0"}
{"input": ["cuda -keys=cuda,gpu -max_num_threads=1024 -thread_warp_size=32", "dense_tensorcore.cuda", [["TENSOR", [1024, 4096], "float16"], ["TENSOR", [1024, 4096], "float16"], null, "float16"], {}], "config": {"index": 14789, "code_hash": null, "entity": [["block_row_warps", "ot", 4], ["block_col_warps", "ot", 1], ["warp_row_tiles", "ot", 4], ["warp_col_tiles", "ot", 2], ["chunk", "ot", 4], ["offset", "ot", 8], ["offsetCS", "ot", 0], ["vec", "ot", 8], ["wmma_m", "ot", 8]]}, "result": [[0.00015324950784856878], 0, 1.429161548614502, 1632123885.0081089], "version": 0.2, "tvm_version": "0.8.dev0"}
{"input": ["cuda -keys=cuda,gpu -max_num_threads=1024 -thread_warp_size=32", "dense_small_batch.gpu", [["TENSOR", [1024, 4096], "float16"], ["TENSOR", [1024, 4096], "float16"], null, "float16"], {}], "config": {"index": 9, "code_hash": null, "entity": [["tile_k", "sp", [-1, 512]]]}, "result": [[0.020309598800000002], 0, 1.9079806804656982, 1632124181.3816786], "version": 0.2, "tvm_version": "0.8.dev0"}
{"input": ["cuda -keys=cuda,gpu -max_num_threads=1024 -thread_warp_size=32", "dense_tensorcore.cuda", [["TENSOR", [8, 1024], "float16"], ["TENSOR", [1024, 1024], "float16"], null, "float16"], {}], "config": {"index": 4455, "code_hash": null, "entity": [["block_row_warps", "ot", 1], ["block_col_warps", "ot", 1], ["warp_row_tiles", "ot", 1], ["warp_col_tiles", "ot", 1], ["chunk", "ot", 8], ["offset", "ot", 8], ["offsetCS", "ot", 0], ["vec", "ot", 8], ["wmma_m", "ot", 8]]}, "result": [[6.574593696714789e-06], 0, 1.5390303134918213, 1632124404.860592], "version": 0.2, "tvm_version": "0.8.dev0"}
{"input": ["cuda -keys=cuda,gpu -max_num_threads=1024 -thread_warp_size=32", "dense_small_batch.gpu", [["TENSOR", [8, 1024], "float16"], ["TENSOR", [1024, 1024], "float16"], null, "float16"], {}], "config": {"index": 5, "code_hash": null, "entity": [["tile_k", "sp", [-1, 32]]]}, "result": [[1.5903189587426324e-05], 0, 1.3922069072723389, 1632124668.748402], "version": 0.2, "tvm_version": "0.8.dev0"}
{"input": ["cuda -keys=cuda,gpu -max_num_threads=1024 -thread_warp_size=32", "dense_small_batch.gpu", [["TENSOR", [8, 1024], "float16"], ["TENSOR", [2, 1024], "float16"], null, "float16"], {}], "config": {"index": 7, "code_hash": null, "entity": [["tile_k", "sp", [-1, 128]]]}, "result": [[1.8147806838969932e-06], 0, 1.1677181720733643, 1632124681.1865916], "version": 0.2, "tvm_version": "0.8.dev0"}
